ffff8802f9496cc0 2877736822 S Ci:1:002:0 s 80 06 0100 0000 0012 18 <
ffff8802f9496cc0 2877737620 C Ci:1:002:0 0 18 = 12010002 ffffff40 e3054201 02030000 0001
ffff8802f9496cc0 2877737682 S Ci:1:002:0 s 80 06 0200 0000 0009 9 <
ffff8802f9496cc0 2877737981 C Ci:1:002:0 0 9 = 09022700 010100c0 05
ffff8802f9496cc0 2877738022 S Ci:1:002:0 s 80 06 0200 0000 0027 39 <
ffff8802f9496cc0 2877738356 C Ci:1:002:0 0 39 = 09022700 010100c0 05090400 0003ffff ff000705 81020002 00070502 02000200
ffff880307c1d5c0 2888841489 S Co:1:001:0 s 23 03 0004 0002 0000 0
ffff880307c1d5c0 2888841506 C Co:1:001:0 0 0
ffff880307c1d5c0 2888896090 S Ci:1:001:0 s a3 00 0000 0002 0004 4 <
ffff880307c1d5c0 2888896124 C Ci:1:001:0 0 4 = 03051000
ffff880307c1d5c0 2888952128 S Co:1:001:0 s 23 01 0014 0002 0000 0
ffff880307c1d5c0 2888952137 C Co:1:001:0 0 0
ffff880307c1d5c0 2888952157 S Ci:1:000:0 s 80 06 0100 0000 0040 64 <
ffff880307c1d5c0 2888953012 C Ci:1:000:0 0 18 = 12010002 ffffff40 e3054201 02030000 0001
ffff880307c1d5c0 2888953026 S Co:1:001:0 s 23 03 0004 0002 0000 0
ffff880307c1d5c0 2888953037 C Co:1:001:0 0 0
ffff880307c1d1c0 2889008103 S Ci:1:001:0 s a3 00 0000 0002 0004 4 <
ffff880307c1d1c0 2889008164 C Ci:1:001:0 0 4 = 03051000
ffff880307c1d1c0 2889064097 S Co:1:001:0 s 23 01 0014 0002 0000 0
ffff880307c1d1c0 2889064109 C Co:1:001:0 0 0
ffff880307c1d1c0 2889064112 S Co:1:000:0 s 00 05 0002 0000 0000 0
ffff880307c1d1c0 2889064495 C Co:1:000:0 0 0
ffff880307c1d1c0 2889084103 S Ci:1:002:0 s 80 06 0100 0000 0012 18 <
ffff880307c1d1c0 2889085128 C Ci:1:002:0 0 18 = 12010002 ffffff40 e3054201 02030000 0001
ffff880307c1d1c0 2889085187 S Ci:1:002:0 s 80 06 0200 0000 0027 39 <
ffff880307c1d1c0 2889085490 C Ci:1:002:0 0 39 = 09022700 010100c0 05090400 0003ffff ff000705 81020002 00070502 02000200
ffff880307c1d1c0 2889085507 S Co:1:002:0 s 00 09 0001 0000 0000 0
ffff880307c1d1c0 2889085864 C Co:1:002:0 0 0
ffff880307c1d5c0 2889937615 S Ci:1:002:0 s 80 06 0100 0000 0040 64 <
ffff880307c1d5c0 2889938472 C Ci:1:002:0 0 18 = 12010002 ffffff40 e3054201 02030000 0001
ffff880307c1d5c0 2890251534 S Ci:1:002:0 s 80 06 0100 0000 0012 18 <
ffff880307c1d5c0 2890252399 C Ci:1:002:0 0 18 = 12010002 ffffff40 e3054201 02030000 0001
ffff880307c1d5c0 2890254587 S Ci:1:002:0 s 80 06 0200 0000 0009 9 <
ffff880307c1d5c0 2890255294 C Ci:1:002:0 0 9 = 09022700 010100c0 05
ffff880307c1d5c0 2890257620 S Ci:1:002:0 s 80 06 0200 0000 00ff 255 <
ffff880307c1d5c0 2890258171 C Ci:1:002:0 0 39 = 09022700 010100c0 05090400 0003ffff ff000705 81020002 00070502 02000200
ffff880307c1d5c0 2890278213 S Ci:1:002:0 s 80 06 0100 0000 0012 18 <
ffff880307c1d5c0 2890279602 C Ci:1:002:0 0 18 = 12010002 ffffff40 e3054201 02030000 0001
ffff880307c1d5c0 2890287240 S Ci:1:002:0 s 80 06 0200 0000 0009 9 <
ffff880307c1d5c0 2890287794 C Ci:1:002:0 0 9 = 09022700 010100c0 05
ffff880307c1d5c0 2890290271 S Ci:1:002:0 s 80 06 0200 0000 0027 39 <
ffff880307c1d5c0 2890290674 C Ci:1:002:0 0 39 = 09022700 010100c0 05090400 0003ffff ff000705 81020002 00070502 02000200
ffff88030995f0c0 2904310300 S Co:1:002:0 s 02 01 0000 0081 0000 0
ffff88030995f0c0 2904310535 C Co:1:002:0 0 0
ffff88030995f0c0 2904312218 S Co:1:002:0 s 02 01 0000 0002 0000 0
ffff88030995f0c0 2904312660 C Co:1:002:0 0 0
ffff88030995f0c0 2904314157 S Co:1:002:0 s 02 01 0000 0083 0000 0
ffff88030995f0c0 2904314795 C Co:1:002:0 0 0
ffff880309d93dc0 2905319747 S Co:1:001:0 s 23 03 0004 0002 0000 0
ffff880309d93dc0 2905319756 C Co:1:001:0 0 0
ffff880309d93dc0 2905372115 S Ci:1:001:0 s a3 00 0000 0002 0004 4 <
ffff880309d93dc0 2905372155 C Ci:1:001:0 0 4 = 03051000
ffff88030995f0c0 2905428083 S Co:1:001:0 s 23 01 0014 0002 0000 0
ffff88030995f0c0 2905428097 C Co:1:001:0 0 0
ffff88030995f0c0 2905428111 S Ci:1:000:0 s 80 06 0100 0000 0040 64 <
ffff88030995f0c0 2905428911 C Ci:1:000:0 0 18 = 12010002 ffffff40 e3054201 02030000 0001
ffff88030995f0c0 2905428931 S Co:1:001:0 s 23 03 0004 0002 0000 0
ffff88030995f0c0 2905428934 C Co:1:001:0 0 0
ffff88030995f0c0 2905484101 S Ci:1:001:0 s a3 00 0000 0002 0004 4 <
ffff88030995f0c0 2905484154 C Ci:1:001:0 0 4 = 03051000
ffff88030995f0c0 2905540112 S Co:1:001:0 s 23 01 0014 0002 0000 0
ffff88030995f0c0 2905540119 C Co:1:001:0 0 0
ffff88030995f0c0 2905540122 S Co:1:000:0 s 00 05 0002 0000 0000 0
ffff88030995f0c0 2905540512 C Co:1:000:0 0 0
ffff88030995f0c0 2905560110 S Ci:1:002:0 s 80 06 0100 0000 0012 18 <
ffff88030995f0c0 2905561146 C Ci:1:002:0 0 18 = 12010002 ffffff40 e3054201 02030000 0001
ffff88030995f0c0 2905561168 S Ci:1:002:0 s 80 06 0200 0000 0027 39 <
ffff88030995f0c0 2905561506 C Ci:1:002:0 0 39 = 09022700 010100c0 05090400 0003ffff ff000705 81020002 00070502 02000200
ffff88030995f0c0 2905561511 S Co:1:002:0 s 00 09 0001 0000 0000 0
ffff88030995f0c0 2905561881 C Co:1:002:0 0 0
