ffff88004c3e5c80 1788806960 S Co:2:013:0 s 40 0c 0088 7f90 0001 1 = ff
ffff88004c3e5c80 1788807397 C Co:2:013:0 0 1 >
ffff88004c3e5c80 1788810786 S Co:2:013:0 s 40 0c 0088 7f90 0001 1 = aa
ffff88004c3e5c80 1788811278 C Co:2:013:0 0 1 >
ffff88004c3e5c80 1788813682 S Co:2:013:0 s 40 0c 0088 7f90 0001 1 = 55
ffff88004c3e5c80 1788814152 C Co:2:013:0 0 1 >
ffff88004c3e5c80 1788816714 S Co:2:013:0 s 40 0c 0088 7f90 0001 1 = 00
ffff88004c3e5c80 1788817151 C Co:2:013:0 0 1 >
ffff88004c3e5c80 1788819752 S Co:2:013:0 s 40 0c 0088 7f90 0001 1 = ff
ffff88004c3e5c80 1788820154 C Co:2:013:0 0 1 >
ffff88004c3e5c80 1788822814 S Co:2:013:0 s 40 0c 0088 7f90 0001 1 = 87
ffff88004c3e5c80 1788823333 C Co:2:013:0 0 1 >
ffff88004c3e5c80 1788825736 S Co:2:013:0 s 40 0c 0088 7f90 0001 1 = 78
ffff88004c3e5c80 1788826163 C Co:2:013:0 0 1 >
ffff88004c3e5c80 1788828727 S Co:2:013:0 s 40 0c 0088 7f90 0001 1 = e0
ffff88004c3e5c80 1788829158 C Co:2:013:0 0 1 >
ffff88004c3e5c80 1788831763 S Co:2:013:0 s 40 0c 0087 7f90 0001 1 = 05
ffff88004c3e5c80 1788832159 C Co:2:013:0 0 1 >
ffff88004c3e5c80 1788834806 S Co:2:013:0 s 40 0c 0087 7f90 0001 1 = 04
ffff88004c3e5c80 1788835285 C Co:2:013:0 0 1 >
ffff88004c3e5c80 1788837683 S Co:2:013:0 s 40 0c 0088 7f90 0001 1 = ff
ffff88004c3e5c80 1788838159 C Co:2:013:0 0 1 >
ffff88004c3e5c80 1788840718 S Co:2:013:0 s 40 0c 0085 0088 0001 1 = 00
ffff88004c3e5c80 1788841184 C Co:2:013:0 0 1 >
ffff88004c3e5c80 1788843758 S Co:2:013:0 s 40 0c 0085 0088 0001 1 = 00
ffff88004c3e5c80 1788844184 C Co:2:013:0 0 1 >
ffff88004c3e5c80 1788846791 S Co:2:013:0 s 40 0c 0085 0088 0001 1 = 00
ffff88004c3e5c80 1788847309 C Co:2:013:0 0 1 >
ffff88004c3e5c80 1788849689 S Co:2:013:0 s 40 0c 0085 0088 0001 1 = 00
ffff88004c3e5c80 1788850185 C Co:2:013:0 0 1 >
ffff88004c3e5c80 1788852734 S Co:2:013:0 s 40 0c 0085 0088 0001 1 = 00
ffff88004c3e5c80 1788853185 C Co:2:013:0 0 1 >
ffff88004c3e5c80 1788855775 S Co:2:013:0 s 40 0c 0085 0088 0001 1 = 00
ffff88004c3e5c80 1788856164 C Co:2:013:0 0 1 >
ffff88004c3e5c80 1788857805 S Ci:2:013:0 s c0 0c 0084 0006 0001 1 <
ffff88004c3e5c80 1788858284 C Ci:2:013:0 0 1 = 03
ffff88004c3e5c80 1788860764 S Ci:2:013:0 s c0 0c 0084 0006 0001 1 <
ffff88004c3e5c80 1788861051 C Ci:2:013:0 0 1 = 00
ffff88004c3e5c80 1788999762 S Co:2:013:0 s 40 0c 0088 0001 0001 1 = ff
ffff88004c3e5c80 1789000164 C Co:2:013:0 0 1 >
ffff88004c3e5c80 1789002793 S Co:2:013:0 s 40 0c 0088 0001 0001 1 = aa
ffff88004c3e5c80 1789003290 C Co:2:013:0 0 1 >
ffff88004c3e5c80 1789005681 S Co:2:013:0 s 40 0c 0088 0001 0001 1 = 55
ffff88004c3e5c80 1789006189 C Co:2:013:0 0 1 >
ffff88004c3e5c80 1789008715 S Co:2:013:0 s 40 0c 0088 0001 0001 1 = 00
ffff88004c3e5c80 1789009191 C Co:2:013:0 0 1 >
ffff88004c3e5c80 1789011748 S Co:2:013:0 s 40 0c 0088 0001 0001 1 = ff
ffff88004c3e5c80 1789012164 C Co:2:013:0 0 1 >
ffff88004c3e5c80 1789014781 S Co:2:013:0 s 40 0c 0088 0001 0001 1 = 87
ffff88004c3e5c80 1789015165 C Co:2:013:0 0 1 >
ffff88004c3e5c80 1789017682 S Co:2:013:0 s 40 0c 0088 0001 0001 1 = 78
ffff88004c3e5c80 1789018165 C Co:2:013:0 0 1 >
ffff88004c3e5c80 1789020719 S Co:2:013:0 s 40 0c 0088 0001 0001 1 = e0
ffff88004c3e5c80 1789021164 C Co:2:013:0 0 1 >
ffff88004c3e5c80 1789023760 S Co:2:013:0 s 40 0c 0087 0001 0001 1 = 05
ffff88004c3e5c80 1789024170 C Co:2:013:0 0 1 >
ffff88004c3e5c80 1789026786 S Co:2:013:0 s 40 0c 0087 0001 0001 1 = 04
ffff88004c3e5c80 1789027316 C Co:2:013:0 0 1 >
ffff88004c3e5c80 1789029685 S Co:2:013:0 s 40 0c 0088 0001 0001 1 = ff
ffff88004c3e5c80 1789030170 C Co:2:013:0 0 1 >
ffff88004c3e5c80 1789032719 S Co:2:013:0 s 40 0c 0085 0088 0001 1 = dd
ffff88004c3e5c80 1789033167 C Co:2:013:0 0 1 >
ffff88004c3e5c80 1789035759 S Co:2:013:0 s 40 0c 0085 0088 0001 1 = 00
ffff88004c3e5c80 1789036191 C Co:2:013:0 0 1 >
ffff88004c3e5c80 1789038795 S Co:2:013:0 s 40 0c 0085 0088 0001 1 = 00
ffff88004c3e5c80 1789039318 C Co:2:013:0 0 1 >
ffff88004c3e5c80 1789041685 S Co:2:013:0 s 40 0c 0085 0088 0001 1 = 00
ffff88004c3e5c80 1789042191 C Co:2:013:0 0 1 >
ffff88004c3e5c80 1789044726 S Co:2:013:0 s 40 0c 0085 0088 0001 1 = 0c
ffff88004c3e5c80 1789045166 C Co:2:013:0 0 1 >
ffff88004c3e5c80 1789047766 S Co:2:013:0 s 40 0c 0085 0088 0001 1 = 00
ffff88004c3e5c80 1789048194 C Co:2:013:0 0 1 >
ffff88004c3e5c80 1789049829 S Ci:2:013:0 s c0 0c 0084 0006 0001 1 <
ffff88004c3e5c80 1789050190 C Ci:2:013:0 0 1 = 01
ffff88004c3e5c80 1789053689 S Co:2:013:0 s 40 04 0082 1694 0008 8 = 00000000 0c000000
ffff88004c3e5c80 1789054046 C Co:2:013:0 0 8 >
ffff88004c3e5c80 1789055780 S Bi:2:013:1 -115 512 <
ffff88004c3e5c80 1789055915 C Bi:2:013:1 0 12 = 000000ff f0000500 004e0000
ffff88004c3e5c80 1789058735 S Ci:2:013:0 s c0 0c 0084 48c8 0001 1 <
ffff88004c3e5c80 1789059320 C Ci:2:013:0 0 1 = 03
ffff88004c3e5c80 1789061815 S Ci:2:013:0 s c0 0c 0084 48c8 0001 1 <
ffff88004c3e5c80 1789062045 C Ci:2:013:0 0 1 = 00
ffff88004c3e5c80 1789065685 S Co:2:013:0 s 40 0c 0088 82ef 0001 1 = ff
ffff88004c3e5c80 1789066192 C Co:2:013:0 0 1 >
ffff88004c3e5c80 1789068720 S Co:2:013:0 s 40 0c 0088 82ef 0001 1 = aa
ffff88004c3e5c80 1789069135 C Co:2:013:0 0 1 >
ffff88004c3e5c80 1789071780 S Co:2:013:0 s 40 0c 0088 82ef 0001 1 = 55
ffff88004c3e5c80 1789072303 C Co:2:013:0 0 1 >
ffff88004c3e5c80 1789074816 S Co:2:013:0 s 40 0c 0088 82ef 0001 1 = 00
ffff88004c3e5c80 1789075344 C Co:2:013:0 0 1 >
ffff88004c3e5c80 1789077707 S Co:2:013:0 s 40 0c 0088 82ef 0001 1 = ff
ffff88004c3e5c80 1789078208 C Co:2:013:0 0 1 >
ffff88004c3e5c80 1789080712 S Co:2:013:0 s 40 0c 0088 82ef 0001 1 = 87
ffff88004c3e5c80 1789081167 C Co:2:013:0 0 1 >
ffff88004c3e5c80 1789083743 S Co:2:013:0 s 40 0c 0088 82ef 0001 1 = 78
ffff88004c3e5c80 1789084166 C Co:2:013:0 0 1 >
ffff88004c3e5c80 1789086770 S Co:2:013:0 s 40 0c 0088 82ef 0001 1 = e0
ffff88004c3e5c80 1789087324 C Co:2:013:0 0 1 >
ffff88004c3e5c80 1789089734 S Co:2:013:0 s 40 0c 0087 82ef 0001 1 = 05
ffff88004c3e5c80 1789090216 C Co:2:013:0 0 1 >
ffff88004c3e5c80 1789092721 S Co:2:013:0 s 40 0c 0087 82ef 0001 1 = 04
ffff88004c3e5c80 1789093167 C Co:2:013:0 0 1 >
ffff88004c3e5c80 1789095754 S Co:2:013:0 s 40 0c 0088 82ef 0001 1 = ff
ffff88004c3e5c80 1789096167 C Co:2:013:0 0 1 >
ffff88004c3e5c80 1789098788 S Co:2:013:0 s 40 0c 0085 0088 0001 1 = 00
ffff88004c3e5c80 1789099172 C Co:2:013:0 0 1 >
ffff88004c3e5c80 1789101681 S Co:2:013:0 s 40 0c 0085 0088 0001 1 = 00
ffff88004c3e5c80 1789102047 C Co:2:013:0 0 1 >
ffff8801417a9540 1789104726 S Co:2:013:0 s 40 0c 0085 0088 0001 1 = 00
ffff8801417a9540 1789105130 C Co:2:013:0 0 1 >
ffff8801417a9540 1789107771 S Co:2:013:0 s 40 0c 0085 0088 0001 1 = 00
ffff8801417a9540 1789108129 C Co:2:013:0 0 1 >
ffff8801417a9540 1789110799 S Co:2:013:0 s 40 0c 0085 0088 0001 1 = 00
ffff8801417a9540 1789111130 C Co:2:013:0 0 1 >
ffff8801417a9540 1789113704 S Co:2:013:0 s 40 0c 0085 0088 0001 1 = 00
ffff8801417a9540 1789114131 C Co:2:013:0 0 1 >
ffff8801417a9540 1789115816 S Ci:2:013:0 s c0 0c 0084 0006 0001 1 <
ffff8801417a9540 1789116130 C Ci:2:013:0 0 1 = 03
ffff8801417a9540 1789118792 S Ci:2:013:0 s c0 0c 0084 0006 0001 1 <
ffff8801417a9540 1789119029 C Ci:2:013:0 0 1 = 00
ffff8801417a9480 1789257682 S Co:2:013:0 s 40 0c 0088 0001 0001 1 = ff
ffff8801417a9480 1789258174 C Co:2:013:0 0 1 >
ffff8801417a9480 1789260705 S Co:2:013:0 s 40 0c 0088 0001 0001 1 = aa
ffff8801417a9480 1789261172 C Co:2:013:0 0 1 >
ffff8801417a9480 1789263728 S Co:2:013:0 s 40 0c 0088 0001 0001 1 = 55
ffff8801417a9480 1789264182 C Co:2:013:0 0 1 >
ffff8801417a9480 1789266754 S Co:2:013:0 s 40 0c 0088 0001 0001 1 = 00
ffff8801417a9480 1789267178 C Co:2:013:0 0 1 >
ffff8801417a9480 1789269719 S Co:2:013:0 s 40 0c 0088 0001 0001 1 = ff
ffff8801417a9480 1789270138 C Co:2:013:0 0 1 >
ffff8801417a9480 1789272720 S Co:2:013:0 s 40 0c 0088 0001 0001 1 = 87
ffff8801417a9480 1789273172 C Co:2:013:0 0 1 >
ffff8801417a9480 1789275753 S Co:2:013:0 s 40 0c 0088 0001 0001 1 = 78
ffff8801417a9480 1789276173 C Co:2:013:0 0 1 >
ffff8801417a9480 1789278790 S Co:2:013:0 s 40 0c 0088 0001 0001 1 = e0
ffff8801417a9480 1789279174 C Co:2:013:0 0 1 >
ffff8801417a9480 1789281682 S Co:2:013:0 s 40 0c 0087 0001 0001 1 = 05
ffff8801417a9480 1789282174 C Co:2:013:0 0 1 >
ffff8801417a9480 1789284714 S Co:2:013:0 s 40 0c 0087 0001 0001 1 = 04
ffff8801417a9480 1789285159 C Co:2:013:0 0 1 >
ffff8801417a9480 1789287745 S Co:2:013:0 s 40 0c 0088 0001 0001 1 = ff
ffff8801417a9480 1789288198 C Co:2:013:0 0 1 >
ffff8801417a9480 1789290782 S Co:2:013:0 s 40 0c 0085 0088 0001 1 = dd
ffff8801417a9480 1789291197 C Co:2:013:0 0 1 >
ffff8801417a9480 1789293686 S Co:2:013:0 s 40 0c 0085 0088 0001 1 = 00
ffff8801417a9480 1789294199 C Co:2:013:0 0 1 >
ffff8801417a9480 1789296720 S Co:2:013:0 s 40 0c 0085 0088 0001 1 = 00
ffff8801417a9480 1789297200 C Co:2:013:0 0 1 >
ffff8801417a9480 1789299756 S Co:2:013:0 s 40 0c 0085 0088 0001 1 = 00
ffff8801417a9480 1789300198 C Co:2:013:0 0 1 >
ffff8801417a9540 1789302851 S Co:2:013:0 s 40 0c 0085 0088 0001 1 = 0c
ffff8801417a9540 1789303299 C Co:2:013:0 0 1 >
ffff8801417a9540 1789305703 S Co:2:013:0 s 40 0c 0085 0088 0001 1 = 00
ffff8801417a9540 1789306138 C Co:2:013:0 0 1 >
ffff8801417a9540 1789307827 S Ci:2:013:0 s c0 0c 0084 0006 0001 1 <
ffff8801417a9540 1789308140 C Ci:2:013:0 0 1 = 01
ffff8801417a9540 1789311754 S Co:2:013:0 s 40 04 0082 1694 0008 8 = 00000000 0c000000
ffff8801417a9540 1789312138 C Co:2:013:0 0 8 >
ffff8801417a9540 1789313816 S Bi:2:013:1 -115 512 <
ffff8801417a9540 1789313888 C Bi:2:013:1 0 12 = 000000ff f0000500 004e0000
ffff8801417a9540 1789316675 S Ci:2:013:0 s c0 0c 0084 48c8 0001 1 <
ffff8801417a9540 1789316925 C Ci:2:013:0 0 1 = 03
ffff8801417a9540 1789319775 S Ci:2:013:0 s c0 0c 0084 48c8 0001 1 <
ffff8801417a9540 1789320050 C Ci:2:013:0 0 1 = 00
ffff8801417a9540 1789333584 S Co:2:013:0 s 40 0c 0088 0001 0001 1 = ff
ffff8801417a9540 1789334051 C Co:2:013:0 0 1 >
ffff8801417a9540 1789336597 S Co:2:013:0 s 40 0c 0088 0001 0001 1 = aa
ffff8801417a9540 1789337050 C Co:2:013:0 0 1 >
ffff8801417a9540 1789339623 S Co:2:013:0 s 40 0c 0088 0001 0001 1 = 55
ffff8801417a9540 1789340044 C Co:2:013:0 0 1 >
ffff8801417a9540 1789342531 S Co:2:013:0 s 40 0c 0088 0001 0001 1 = 00
ffff8801417a9540 1789342921 C Co:2:013:0 0 1 >
ffff8801417a9540 1789345566 S Co:2:013:0 s 40 0c 0088 0001 0001 1 = ff
ffff8801417a9540 1789346056 C Co:2:013:0 0 1 >
ffff8801417a9540 1789348601 S Co:2:013:0 s 40 0c 0088 0001 0001 1 = 87
ffff8801417a9540 1789349054 C Co:2:013:0 0 1 >
ffff8801417a9540 1789351648 S Co:2:013:0 s 40 0c 0088 0001 0001 1 = 78
ffff8801417a9540 1789352016 C Co:2:013:0 0 1 >
ffff8801417a9540 1789354530 S Co:2:013:0 s 40 0c 0088 0001 0001 1 = e0
ffff8801417a9540 1789354887 C Co:2:013:0 0 1 >
ffff8801417a9540 1789357562 S Co:2:013:0 s 40 0c 0087 0001 0001 1 = 05
ffff8801417a9540 1789358014 C Co:2:013:0 0 1 >
ffff8801417a9540 1789360594 S Co:2:013:0 s 40 0c 0087 0001 0001 1 = 04
ffff8801417a9540 1789361038 C Co:2:013:0 0 1 >
ffff8801417a9540 1789363631 S Co:2:013:0 s 40 0c 0088 0001 0001 1 = ff
ffff8801417a9540 1789364036 C Co:2:013:0 0 1 >
ffff8801417a9540 1789366533 S Co:2:013:0 s 40 0c 0085 0088 0001 1 = 00
ffff8801417a9540 1789366886 C Co:2:013:0 0 1 >
ffff8801417a9540 1789369585 S Co:2:013:0 s 40 0c 0085 0088 0001 1 = 00
ffff8801417a9540 1789370015 C Co:2:013:0 0 1 >
ffff8801417a9540 1789372605 S Co:2:013:0 s 40 0c 0085 0088 0001 1 = 00
ffff8801417a9540 1789373053 C Co:2:013:0 0 1 >
ffff8801417a9540 1789375676 S Co:2:013:0 s 40 0c 0085 0088 0001 1 = 00
ffff8801417a9540 1789376044 C Co:2:013:0 0 1 >
ffff8801417a9540 1789378553 S Co:2:013:0 s 40 0c 0085 0088 0001 1 = 00
ffff8801417a9540 1789379014 C Co:2:013:0 0 1 >
ffff8801417a9540 1789381622 S Co:2:013:0 s 40 0c 0085 0088 0001 1 = 00
ffff8801417a9540 1789382099 C Co:2:013:0 0 1 >
ffff8801417a9540 1789383603 S Ci:2:013:0 s c0 0c 0084 0006 0001 1 <
ffff8801417a9540 1789384178 C Ci:2:013:0 0 1 = 03
ffff8801417a9540 1789386635 S Ci:2:013:0 s c0 0c 0084 0006 0001 1 <
ffff8801417a9540 1789386914 C Ci:2:013:0 0 1 = 00
ffff880142f5d740 1789525627 S Co:2:013:0 s 40 0c 0088 0001 0001 1 = ff
ffff880142f5d740 1789526106 C Co:2:013:0 0 1 >
ffff880142f5d740 1789528614 S Co:2:013:0 s 40 0c 0088 0001 0001 1 = aa
ffff880142f5d740 1789529021 C Co:2:013:0 0 1 >
ffff880142f5d740 1789531647 S Co:2:013:0 s 40 0c 0088 0001 0001 1 = 55
ffff880142f5d740 1789532056 C Co:2:013:0 0 1 >
ffff880142f5d740 1789534533 S Co:2:013:0 s 40 0c 0088 0001 0001 1 = 00
ffff880142f5d740 1789534939 C Co:2:013:0 0 1 >
ffff880142f5d740 1789537572 S Co:2:013:0 s 40 0c 0088 0001 0001 1 = ff
ffff880142f5d740 1789538023 C Co:2:013:0 0 1 >
ffff880142f5d740 1789540604 S Co:2:013:0 s 40 0c 0088 0001 0001 1 = 87
ffff880142f5d740 1789541081 C Co:2:013:0 0 1 >
ffff880142f5d740 1789543642 S Co:2:013:0 s 40 0c 0088 0001 0001 1 = 78
ffff880142f5d740 1789544057 C Co:2:013:0 0 1 >
ffff880142f5d740 1789546546 S Co:2:013:0 s 40 0c 0088 0001 0001 1 = e0
ffff880142f5d740 1789547070 C Co:2:013:0 0 1 >
ffff880142f5d740 1789549569 S Co:2:013:0 s 40 0c 0087 0001 0001 1 = 05
ffff880142f5d740 1789550019 C Co:2:013:0 0 1 >
ffff880142f5d740 1789552609 S Co:2:013:0 s 40 0c 0087 0001 0001 1 = 04
ffff880142f5d740 1789553083 C Co:2:013:0 0 1 >
ffff880142f5d740 1789555643 S Co:2:013:0 s 40 0c 0088 0001 0001 1 = ff
ffff880142f5d740 1789556058 C Co:2:013:0 0 1 >
ffff880142f5d740 1789558543 S Co:2:013:0 s 40 0c 0085 0088 0001 1 = dd
ffff880142f5d740 1789558895 C Co:2:013:0 0 1 >
ffff880142f5d740 1789561582 S Co:2:013:0 s 40 0c 0085 0088 0001 1 = 00
ffff880142f5d740 1789562083 C Co:2:013:0 0 1 >
ffff880142f5d740 1789564614 S Co:2:013:0 s 40 0c 0085 0088 0001 1 = 00
ffff880142f5d740 1789565083 C Co:2:013:0 0 1 >
ffff880142f5d740 1789567646 S Co:2:013:0 s 40 0c 0085 0088 0001 1 = 00
ffff880142f5d740 1789568023 C Co:2:013:0 0 1 >
ffff880142f5d740 1789570536 S Co:2:013:0 s 40 0c 0085 0088 0001 1 = 0c
ffff880142f5d740 1789570944 C Co:2:013:0 0 1 >
ffff880142f5d740 1789573567 S Co:2:013:0 s 40 0c 0085 0088 0001 1 = 00
ffff880142f5d740 1789573898 C Co:2:013:0 0 1 >
ffff880142f5d740 1789575665 S Ci:2:013:0 s c0 0c 0084 0006 0001 1 <
ffff880142f5d740 1789575895 C Ci:2:013:0 0 1 = 01
ffff880142f5d740 1789579629 S Co:2:013:0 s 40 04 0082 1694 0008 8 = 00000000 0c000000
ffff880142f5d740 1789580019 C Co:2:013:0 0 8 >
ffff880142f5d740 1789581574 S Bi:2:013:1 -115 512 <
ffff880142f5d740 1789581650 C Bi:2:013:1 0 12 = 000000ff f0000500 004e0000
ffff880142f5d740 1789584566 S Ci:2:013:0 s c0 0c 0084 48c8 0001 1 <
ffff880142f5d740 1789585178 C Ci:2:013:0 0 1 = 03
ffff880142f5d740 1789587594 S Ci:2:013:0 s c0 0c 0084 48c8 0001 1 <
ffff880142f5d740 1789587896 C Ci:2:013:0 0 1 = 00
ffff880142f5d740 1789591684 S Co:2:013:0 s 40 0c 0088 82eb 0001 1 = ff
ffff880142f5d740 1789592238 C Co:2:013:0 0 1 >
ffff880142f5d740 1789594587 S Co:2:013:0 s 40 0c 0088 82eb 0001 1 = aa
ffff880142f5d740 1789595083 C Co:2:013:0 0 1 >
ffff880142f5d740 1789597617 S Co:2:013:0 s 40 0c 0088 82eb 0001 1 = 55
ffff880142f5d740 1789598021 C Co:2:013:0 0 1 >
ffff880142f5d740 1789600602 S Co:2:013:0 s 40 0c 0088 82eb 0001 1 = 00
ffff880142f5d740 1789601084 C Co:2:013:0 0 1 >
ffff880142f5d740 1789603643 S Co:2:013:0 s 40 0c 0088 82eb 0001 1 = ff
ffff880142f5d740 1789604059 C Co:2:013:0 0 1 >
ffff880142f5d740 1789606542 S Co:2:013:0 s 40 0c 0088 82eb 0001 1 = 87
ffff880142f5d740 1789607035 C Co:2:013:0 0 1 >
ffff880142f5d740 1789609579 S Co:2:013:0 s 40 0c 0088 82eb 0001 1 = 78
ffff880142f5d740 1789610020 C Co:2:013:0 0 1 >
ffff880142f5d740 1789612618 S Co:2:013:0 s 40 0c 0088 82eb 0001 1 = e0
ffff880142f5d740 1789613057 C Co:2:013:0 0 1 >
ffff880142f5d740 1789615650 S Co:2:013:0 s 40 0c 0087 82eb 0001 1 = 05
ffff880142f5d740 1789616060 C Co:2:013:0 0 1 >
ffff880142f5d740 1789618539 S Co:2:013:0 s 40 0c 0087 82eb 0001 1 = 04
ffff880142f5d740 1789618897 C Co:2:013:0 0 1 >
ffff880142f5d740 1789621604 S Co:2:013:0 s 40 0c 0088 82eb 0001 1 = ff
ffff880142f5d740 1789622084 C Co:2:013:0 0 1 >
ffff880142f5d740 1789624617 S Co:2:013:0 s 40 0c 0085 0088 0001 1 = 00
ffff880142f5d740 1789625084 C Co:2:013:0 0 1 >
ffff880142f5d740 1789627655 S Co:2:013:0 s 40 0c 0085 0088 0001 1 = 00
ffff880142f5d740 1789628025 C Co:2:013:0 0 1 >
ffff880142f5d740 1789630535 S Co:2:013:0 s 40 0c 0085 0088 0001 1 = 00
ffff880142f5d740 1789630946 C Co:2:013:0 0 1 >
ffff880142f5d740 1789633571 S Co:2:013:0 s 40 0c 0085 0088 0001 1 = 00
ffff880142f5d740 1789634085 C Co:2:013:0 0 1 >
ffff880142f5d740 1789636603 S Co:2:013:0 s 40 0c 0085 0088 0001 1 = 00
ffff880142f5d740 1789637070 C Co:2:013:0 0 1 >
ffff880142f5d740 1789639633 S Co:2:013:0 s 40 0c 0085 0088 0001 1 = 00
ffff880142f5d740 1789640022 C Co:2:013:0 0 1 >
ffff880142f5d740 1789641529 S Ci:2:013:0 s c0 0c 0084 0006 0001 1 <
ffff880142f5d740 1789641818 C Ci:2:013:0 0 1 = 03
ffff880142f5d740 1789644563 S Ci:2:013:0 s c0 0c 0084 0006 0001 1 <
ffff880142f5d740 1789644809 C Ci:2:013:0 0 1 = 00
ffff880142f5d740 1789783650 S Co:2:013:0 s 40 0c 0088 0001 0001 1 = ff
ffff880142f5d740 1789784066 C Co:2:013:0 0 1 >
ffff880142f5d740 1789786535 S Co:2:013:0 s 40 0c 0088 0001 0001 1 = aa
ffff880142f5d740 1789786905 C Co:2:013:0 0 1 >
ffff880142f5d740 1789789570 S Co:2:013:0 s 40 0c 0088 0001 0001 1 = 55
ffff880142f5d740 1789790090 C Co:2:013:0 0 1 >
ffff880142f5d740 1789792604 S Co:2:013:0 s 40 0c 0088 0001 0001 1 = 00
ffff880142f5d740 1789793092 C Co:2:013:0 0 1 >
ffff880142f5d740 1789795634 S Co:2:013:0 s 40 0c 0088 0001 0001 1 = ff
ffff880142f5d740 1789796065 C Co:2:013:0 0 1 >
ffff880142f5d740 1789798541 S Co:2:013:0 s 40 0c 0088 0001 0001 1 = 87
ffff880142f5d740 1789798947 C Co:2:013:0 0 1 >
ffff880142f5d740 1789801572 S Co:2:013:0 s 40 0c 0088 0001 0001 1 = 78
ffff880142f5d740 1789802057 C Co:2:013:0 0 1 >
ffff880142f5d740 1789804598 S Co:2:013:0 s 40 0c 0088 0001 0001 1 = e0
ffff880142f5d740 1789805092 C Co:2:013:0 0 1 >
ffff880142f5d740 1789807649 S Co:2:013:0 s 40 0c 0087 0001 0001 1 = 05
ffff880142f5d740 1789808066 C Co:2:013:0 0 1 >
ffff880142f5d740 1789810538 S Co:2:013:0 s 40 0c 0087 0001 0001 1 = 04
ffff880142f5d740 1789810946 C Co:2:013:0 0 1 >
ffff880142f5d740 1789813576 S Co:2:013:0 s 40 0c 0088 0001 0001 1 = ff
ffff880142f5d740 1789814066 C Co:2:013:0 0 1 >
ffff880142f5d740 1789816609 S Co:2:013:0 s 40 0c 0085 0088 0001 1 = dd
ffff880142f5d740 1789817067 C Co:2:013:0 0 1 >
ffff880142f5d740 1789819641 S Co:2:013:0 s 40 0c 0085 0088 0001 1 = 00
ffff880142f5d740 1789820067 C Co:2:013:0 0 1 >
ffff880142f5d740 1789822540 S Co:2:013:0 s 40 0c 0085 0088 0001 1 = 00
ffff880142f5d740 1789822947 C Co:2:013:0 0 1 >
ffff880142f5d740 1789825566 S Co:2:013:0 s 40 0c 0085 0088 0001 1 = 00
ffff880142f5d740 1789825947 C Co:2:013:0 0 1 >
ffff880142f5d740 1789828597 S Co:2:013:0 s 40 0c 0085 0088 0001 1 = 0c
ffff880142f5d740 1789829093 C Co:2:013:0 0 1 >
ffff880142f5d740 1789831645 S Co:2:013:0 s 40 0c 0085 0088 0001 1 = 00
ffff880142f5d740 1789832113 C Co:2:013:0 0 1 >
ffff880142f5d740 1789833729 S Ci:2:013:0 s c0 0c 0084 0006 0001 1 <
ffff880142f5d740 1789834114 C Ci:2:013:0 0 1 = 01
ffff880142f5d740 1789837589 S Co:2:013:0 s 40 04 0082 1694 0008 8 = 00000000 0c000000
ffff880142f5d740 1789837946 C Co:2:013:0 0 8 >
ffff880142f5d740 1789839706 S Bi:2:013:1 -115 512 <
ffff880142f5d740 1789839782 C Bi:2:013:1 0 12 = 000000ff f0000500 004e0000
ffff880142f5d740 1789842625 S Ci:2:013:0 s c0 0c 0084 48c8 0001 1 <
ffff880142f5d740 1789842952 C Ci:2:013:0 0 1 = 03
ffff880142f5d740 1789845564 S Ci:2:013:0 s c0 0c 0084 48c8 0001 1 <
ffff880142f5d740 1789845818 C Ci:2:013:0 0 1 = 00
ffff880142f5d740 1789850183 S Co:2:013:0 s 40 0c 0088 b7d5 0001 1 = ff
ffff880142f5d740 1789850564 C Co:2:013:0 0 1 >
ffff880142f5d740 1789853221 S Co:2:013:0 s 40 0c 0088 b7d5 0001 1 = aa
ffff880142f5d740 1789853724 C Co:2:013:0 0 1 >
ffff880142f5d740 1789856107 S Co:2:013:0 s 40 0c 0088 b7d5 0001 1 = 55
ffff880142f5d740 1789856592 C Co:2:013:0 0 1 >
ffff880142f5d740 1789859143 S Co:2:013:0 s 40 0c 0088 b7d5 0001 1 = 00
ffff880142f5d740 1789859560 C Co:2:013:0 0 1 >
ffff880142f5d740 1789862185 S Co:2:013:0 s 40 0c 0088 b7d5 0001 1 = ff
ffff880142f5d740 1789862719 C Co:2:013:0 0 1 >
ffff880142f5d740 1789865220 S Co:2:013:0 s 40 0c 0088 b7d5 0001 1 = 87
ffff880142f5d740 1789865693 C Co:2:013:0 0 1 >
ffff880142f5d740 1789868111 S Co:2:013:0 s 40 0c 0088 b7d5 0001 1 = 78
ffff880142f5d740 1789868592 C Co:2:013:0 0 1 >
ffff880142f5d740 1789871151 S Co:2:013:0 s 40 0c 0088 b7d5 0001 1 = e0
ffff880142f5d740 1789871718 C Co:2:013:0 0 1 >
ffff880142f5d740 1789874184 S Co:2:013:0 s 40 0c 0087 b7d5 0001 1 = 05
ffff880142f5d740 1789874718 C Co:2:013:0 0 1 >
ffff880142f5d740 1789877218 S Co:2:013:0 s 40 0c 0087 b7d5 0001 1 = 04
ffff880142f5d740 1789877718 C Co:2:013:0 0 1 >
ffff880142f5d740 1789880107 S Co:2:013:0 s 40 0c 0088 b7d5 0001 1 = ff
ffff880142f5d740 1789880569 C Co:2:013:0 0 1 >
ffff880142f5d740 1789883148 S Co:2:013:0 s 40 0c 0085 0088 0001 1 = 00
ffff880142f5d740 1789883593 C Co:2:013:0 0 1 >
ffff880142f5d740 1789886184 S Co:2:013:0 s 40 0c 0085 0088 0001 1 = 00
ffff880142f5d740 1789886594 C Co:2:013:0 0 1 >
ffff880142f5d740 1789889219 S Co:2:013:0 s 40 0c 0085 0088 0001 1 = 00
ffff880142f5d740 1789889705 C Co:2:013:0 0 1 >
ffff880142f5d740 1789892108 S Co:2:013:0 s 40 0c 0085 0088 0001 1 = 00
ffff880142f5d740 1789892594 C Co:2:013:0 0 1 >
ffff880142f5d740 1789895140 S Co:2:013:0 s 40 0c 0085 0088 0001 1 = 00
ffff880142f5d740 1789895593 C Co:2:013:0 0 1 >
ffff880142f5d740 1789898181 S Co:2:013:0 s 40 0c 0085 0088 0001 1 = 00
ffff880142f5d740 1789898570 C Co:2:013:0 0 1 >
ffff880142f5d740 1789900204 S Ci:2:013:0 s c0 0c 0084 0006 0001 1 <
ffff880142f5d740 1789900409 C Ci:2:013:0 0 1 = 03
ffff880142f5d740 1789903186 S Ci:2:013:0 s c0 0c 0084 0006 0001 1 <
ffff880142f5d740 1789903444 C Ci:2:013:0 0 1 = 00
ffff880142f5d740 1789907144 S Co:2:013:0 s 40 0c 0088 0000 0001 1 = ff
ffff880142f5d740 1789907535 C Co:2:013:0 0 1 >
ffff880142f5d740 1789910203 S Co:2:013:0 s 40 0c 0088 0000 0001 1 = aa
ffff880142f5d740 1789910745 C Co:2:013:0 0 1 >
ffff880142f5d740 1789913213 S Co:2:013:0 s 40 0c 0088 0000 0001 1 = 55
ffff880142f5d740 1789913678 C Co:2:013:0 0 1 >
ffff880142f5d740 1789916109 S Co:2:013:0 s 40 0c 0088 0000 0001 1 = 00
ffff880142f5d740 1789916554 C Co:2:013:0 0 1 >
ffff880142f5d740 1789919141 S Co:2:013:0 s 40 0c 0088 0000 0001 1 = ff
ffff880142f5d740 1789919552 C Co:2:013:0 0 1 >
ffff880142f5d740 1789922174 S Co:2:013:0 s 40 0c 0088 0000 0001 1 = 87
ffff880142f5d740 1789922553 C Co:2:013:0 0 1 >
ffff880142f5d740 1789925207 S Co:2:013:0 s 40 0c 0088 0000 0001 1 = 78
ffff880142f5d740 1789925695 C Co:2:013:0 0 1 >
ffff880142f5d740 1789928107 S Co:2:013:0 s 40 0c 0088 0000 0001 1 = e0
ffff880142f5d740 1789928594 C Co:2:013:0 0 1 >
ffff880142f5d740 1789931141 S Co:2:013:0 s 40 0c 0087 0000 0001 1 = 05
ffff880142f5d740 1789931571 C Co:2:013:0 0 1 >
ffff880142f5d740 1789934175 S Co:2:013:0 s 40 0c 0087 0000 0001 1 = 04
ffff880142f5d740 1789934569 C Co:2:013:0 0 1 >
ffff880142f5d740 1789937214 S Co:2:013:0 s 40 0c 0088 0000 0001 1 = ff
ffff880142f5d740 1789937695 C Co:2:013:0 0 1 >
ffff880142f5d740 1789940107 S Co:2:013:0 s 40 0c 0085 0088 0001 1 = e2
ffff880142f5d740 1789940568 C Co:2:013:0 0 1 >
ffff880142f5d740 1789943145 S Co:2:013:0 s 40 0c 0085 0088 0001 1 = 00
ffff880142f5d740 1789943575 C Co:2:013:0 0 1 >
ffff880142f5d740 1789946177 S Co:2:013:0 s 40 0c 0085 0088 0001 1 = 00
ffff880142f5d740 1789946595 C Co:2:013:0 0 1 >
ffff880142f5d740 1789949210 S Co:2:013:0 s 40 0c 0085 0088 0001 1 = 00
ffff880142f5d740 1789949706 C Co:2:013:0 0 1 >
ffff880142f5d740 1789952106 S Co:2:013:0 s 40 0c 0085 0088 0001 1 = 01
ffff880142f5d740 1789952596 C Co:2:013:0 0 1 >
ffff880142f5d740 1789955143 S Co:2:013:0 s 40 0c 0085 0088 0001 1 = 00
ffff880142f5d740 1789955595 C Co:2:013:0 0 1 >
ffff880142f5d740 1789957218 S Ci:2:013:0 s c0 0c 0084 0006 0001 1 <
ffff880142f5d740 1789957447 C Ci:2:013:0 0 1 = 01
ffff880142f5d740 1789961219 S Co:2:013:0 s 40 04 0082 1694 0008 8 = 00000000 01000000
ffff880142f5d740 1789961575 C Co:2:013:0 0 8 >
ffff880142f5d740 1789963332 S Bi:2:013:1 -115 512 <
ffff880142f5d740 1792632710 C Bi:2:013:1 0 1 = 02
ffff880142f5d740 1792640315 S Ci:2:013:0 s c0 0c 0084 48c8 0001 1 <
ffff880142f5d740 1792640624 C Ci:2:013:0 0 1 = 03
ffff880142f5d740 1792643260 S Ci:2:013:0 s c0 0c 0084 48c8 0001 1 <
ffff880142f5d740 1792643535 C Ci:2:013:0 0 1 = 00
ffff880142f5d740 1792702795 S Co:2:013:0 s 40 0c 0088 3b50 0001 1 = ff
ffff880142f5d740 1792703251 C Co:2:013:0 0 1 >
ffff880142f5d740 1792705826 S Co:2:013:0 s 40 0c 0088 3b50 0001 1 = aa
ffff880142f5d740 1792706248 C Co:2:013:0 0 1 >
ffff880142f5d740 1792708846 S Co:2:013:0 s 40 0c 0088 3b50 0001 1 = 55
ffff880142f5d740 1792709249 C Co:2:013:0 0 1 >
ffff880142f5d740 1792711873 S Co:2:013:0 s 40 0c 0088 3b50 0001 1 = 00
ffff880142f5d740 1792712247 C Co:2:013:0 0 1 >
ffff880142f5d740 1792714772 S Co:2:013:0 s 40 0c 0088 3b50 0001 1 = ff
ffff880142f5d740 1792715246 C Co:2:013:0 0 1 >
ffff880142f5d740 1792717805 S Co:2:013:0 s 40 0c 0088 3b50 0001 1 = 87
ffff880142f5d740 1792718246 C Co:2:013:0 0 1 >
ffff880142f5d740 1792720847 S Co:2:013:0 s 40 0c 0088 3b50 0001 1 = 78
ffff880142f5d740 1792721289 C Co:2:013:0 0 1 >
ffff880142f5d740 1792723742 S Co:2:013:0 s 40 0c 0088 3b50 0001 1 = e0
ffff880142f5d740 1792724125 C Co:2:013:0 0 1 >
ffff880142f5d740 1792726771 S Co:2:013:0 s 40 0c 0087 3b50 0001 1 = 05
ffff880142f5d740 1792727122 C Co:2:013:0 0 1 >
ffff880142f5d740 1792729808 S Co:2:013:0 s 40 0c 0087 3b50 0001 1 = 04
ffff880142f5d740 1792730252 C Co:2:013:0 0 1 >
ffff880142f5d740 1792732848 S Co:2:013:0 s 40 0c 0088 3b50 0001 1 = ff
ffff880142f5d740 1792733288 C Co:2:013:0 0 1 >
ffff880142f5d740 1792735879 S Co:2:013:0 s 40 0c 0085 0088 0001 1 = 00
ffff880142f5d740 1792736284 C Co:2:013:0 0 1 >
ffff880142f5d740 1792738772 S Co:2:013:0 s 40 0c 0085 0088 0001 1 = 00
ffff880142f5d740 1796339411 C Co:2:013:0 0 1 >
ffff880142f5d740 1796356847 S Co:2:013:0 s 40 0c 0085 0088 0001 1 = 00
ffff880142f5d740 1796357308 C Co:2:013:0 0 1 >
ffff880142f5d740 1796359739 S Co:2:013:0 s 40 0c 0085 0088 0001 1 = 00
ffff880142f5d740 1796360185 C Co:2:013:0 0 1 >
ffff880142f5d740 1796362782 S Co:2:013:0 s 40 0c 0085 0088 0001 1 = 00
ffff880142f5d740 1796363312 C Co:2:013:0 0 1 >
ffff880142f5d740 1796365815 S Co:2:013:0 s 40 0c 0085 0088 0001 1 = 00
ffff880142f5d740 1796366309 C Co:2:013:0 0 1 >
ffff880142f5d740 1796367834 S Ci:2:013:0 s c0 0c 0084 0006 0001 1 <
ffff880142f5d740 1796368163 C Ci:2:013:0 0 1 = 03
ffff880142f5d740 1796370868 S Ci:2:013:0 s c0 0c 0084 0006 0001 1 <
ffff880142f5d740 1796371155 C Ci:2:013:0 0 1 = 00
ffff880142f5d740 1796509817 S Co:2:013:0 s 40 0c 0088 0001 0001 1 = ff
ffff880142f5d740 1796510313 C Co:2:013:0 0 1 >
ffff880142f5d740 1796512845 S Co:2:013:0 s 40 0c 0088 0001 0001 1 = aa
ffff880142f5d740 1796513313 C Co:2:013:0 0 1 >
ffff880142f5d740 1796515930 S Co:2:013:0 s 40 0c 0088 0001 0001 1 = 55
ffff880142f5d740 1796516397 C Co:2:013:0 0 1 >
ffff880142f5d740 1796518778 S Co:2:013:0 s 40 0c 0088 0001 0001 1 = 00
ffff880142f5d740 1796519339 C Co:2:013:0 0 1 >
ffff880142f5d740 1796521855 S Co:2:013:0 s 40 0c 0088 0001 0001 1 = ff
ffff880142f5d740 1796522330 C Co:2:013:0 0 1 >
ffff880142f5d740 1796524837 S Co:2:013:0 s 40 0c 0088 0001 0001 1 = 87
ffff880142f5d740 1796525288 C Co:2:013:0 0 1 >
ffff880142f5d740 1796527873 S Co:2:013:0 s 40 0c 0088 0001 0001 1 = 78
ffff880142f5d740 1796528289 C Co:2:013:0 0 1 >
ffff880142f5d740 1796530782 S Co:2:013:0 s 40 0c 0088 0001 0001 1 = e0
ffff880142f5d740 1796531189 C Co:2:013:0 0 1 >
ffff880142f5d740 1796533817 S Co:2:013:0 s 40 0c 0087 0001 0001 1 = 05
ffff880142f5d740 1796534297 C Co:2:013:0 0 1 >
ffff880142f5d740 1796536865 S Co:2:013:0 s 40 0c 0087 0001 0001 1 = 04
ffff880142f5d740 1796537302 C Co:2:013:0 0 1 >
ffff880142f5d740 1796539884 S Co:2:013:0 s 40 0c 0088 0001 0001 1 = ff
ffff880142f5d740 1796540274 C Co:2:013:0 0 1 >
ffff880142f5d740 1796542783 S Co:2:013:0 s 40 0c 0085 0088 0001 1 = dd
ffff880142f5d740 1796543140 C Co:2:013:0 0 1 >
ffff880142f5d740 1796545815 S Co:2:013:0 s 40 0c 0085 0088 0001 1 = 00
ffff880142f5d740 1796546298 C Co:2:013:0 0 1 >
ffff880094133d80 1796548855 S Co:2:013:0 s 40 0c 0085 0088 0001 1 = 00
ffff880094133d80 1796549298 C Co:2:013:0 0 1 >
ffff880094133d80 1796551742 S Co:2:013:0 s 40 0c 0085 0088 0001 1 = 00
ffff880094133d80 1796552164 C Co:2:013:0 0 1 >
ffff880094133d80 1796554774 S Co:2:013:0 s 40 0c 0085 0088 0001 1 = 0c
ffff880094133d80 1796555164 C Co:2:013:0 0 1 >
ffff880094133d80 1796557810 S Co:2:013:0 s 40 0c 0085 0088 0001 1 = 00
ffff880094133d80 1796558163 C Co:2:013:0 0 1 >
ffff880094133d80 1796559901 S Ci:2:013:0 s c0 0c 0084 0006 0001 1 <
ffff880094133d80 1796560538 C Ci:2:013:0 0 1 = 01
ffff880094133d80 1796563875 S Co:2:013:0 s 40 04 0082 1694 0008 8 = 00000000 0c000000
ffff880094133d80 1796564290 C Co:2:013:0 0 8 >
ffff880094133d80 1796565804 S Bi:2:013:1 -115 512 <
ffff880094133d80 1796565879 C Bi:2:013:1 0 12 = 000000ff f0000500 004e0000
ffff880094133d80 1796568798 S Ci:2:013:0 s c0 0c 0084 48c8 0001 1 <
ffff880094133d80 1796569190 C Ci:2:013:0 0 1 = 03
ffff880094133d80 1796571900 S Ci:2:013:0 s c0 0c 0084 48c8 0001 1 <
ffff880094133d80 1796572164 C Ci:2:013:0 0 1 = 00
ffff880094133d80 1796577785 S Co:2:013:0 s 40 0c 0088 f954 0001 1 = ff
ffff880094133d80 1796578293 C Co:2:013:0 0 1 >
ffff880094133d80 1796580802 S Co:2:013:0 s 40 0c 0088 f954 0001 1 = aa
ffff880094133d80 1796581301 C Co:2:013:0 0 1 >
ffff880094133d80 1796583833 S Co:2:013:0 s 40 0c 0088 f954 0001 1 = 55
ffff880094133d80 1796584314 C Co:2:013:0 0 1 >
ffff880094133d80 1796586868 S Co:2:013:0 s 40 0c 0088 f954 0001 1 = 00
ffff880094133d80 1796587301 C Co:2:013:0 0 1 >
ffff880094133d80 1796589773 S Co:2:013:0 s 40 0c 0088 f954 0001 1 = ff
ffff880094133d80 1796590315 C Co:2:013:0 0 1 >
ffff880094133d80 1796592817 S Co:2:013:0 s 40 0c 0088 f954 0001 1 = 87
ffff880094133d80 1796593315 C Co:2:013:0 0 1 >
ffff880094133d80 1796595863 S Co:2:013:0 s 40 0c 0088 f954 0001 1 = 78
ffff880094133d80 1796596318 C Co:2:013:0 0 1 >
ffff880094133d80 1796598904 S Co:2:013:0 s 40 0c 0088 f954 0001 1 = e0
ffff880094133d80 1796599443 C Co:2:013:0 0 1 >
ffff880094133d80 1796601768 S Co:2:013:0 s 40 0c 0087 f954 0001 1 = 05
ffff880094133d80 1796602171 C Co:2:013:0 0 1 >
ffff880094133d80 1796604801 S Co:2:013:0 s 40 0c 0087 f954 0001 1 = 04
ffff880094133d80 1796605317 C Co:2:013:0 0 1 >
ffff880094133d80 1796607830 S Co:2:013:0 s 40 0c 0088 f954 0001 1 = ff
ffff880094133d80 1796608317 C Co:2:013:0 0 1 >
ffff880094133d80 1796610880 S Co:2:013:0 s 40 0c 0085 0088 0001 1 = 00
ffff880094133d80 1796611304 C Co:2:013:0 0 1 >
ffff880094133d80 1796613786 S Co:2:013:0 s 40 0c 0085 0088 0001 1 = 00
ffff880094133d80 1796614129 C Co:2:013:0 0 1 >
ffff880094133d80 1796616782 S Co:2:013:0 s 40 0c 0085 0088 0001 1 = 00
ffff880094133d80 1796617165 C Co:2:013:0 0 1 >
ffff880094133d80 1796619807 S Co:2:013:0 s 40 0c 0085 0088 0001 1 = 00
ffff880094133d80 1796620166 C Co:2:013:0 0 1 >
ffff880094133d80 1796622832 S Co:2:013:0 s 40 0c 0085 0088 0001 1 = 00
ffff880094133d80 1796623340 C Co:2:013:0 0 1 >
ffff880094133d80 1796625815 S Co:2:013:0 s 40 0c 0085 0088 0001 1 = 00
ffff880094133d80 1796626341 C Co:2:013:0 0 1 >
ffff880094133d80 1796627790 S Ci:2:013:0 s c0 0c 0084 0006 0001 1 <
ffff880094133d80 1796628046 C Ci:2:013:0 0 1 = 03
ffff880094133d80 1796630822 S Ci:2:013:0 s c0 0c 0084 0006 0001 1 <
ffff880094133d80 1796631006 C Ci:2:013:0 0 1 = 00
ffff880094133d80 1796634868 S Co:2:013:0 s 40 0c 0088 0001 0001 1 = ff
ffff880094133d80 1796635256 C Co:2:013:0 0 1 >
ffff880094133d80 1796637794 S Co:2:013:0 s 40 0c 0088 0001 0001 1 = aa
ffff880094133d80 1796638256 C Co:2:013:0 0 1 >
ffff880094133d80 1796640803 S Co:2:013:0 s 40 0c 0088 0001 0001 1 = 55
ffff880094133d80 1796641253 C Co:2:013:0 0 1 >
ffff880094133d80 1796643841 S Co:2:013:0 s 40 0c 0088 0001 0001 1 = 00
ffff880094133d80 1796644255 C Co:2:013:0 0 1 >
ffff880094133d80 1796646875 S Co:2:013:0 s 40 0c 0088 0001 0001 1 = ff
ffff880094133d80 1796647305 C Co:2:013:0 0 1 >
ffff880094133d80 1796649824 S Co:2:013:0 s 40 0c 0088 0001 0001 1 = 87
ffff880094133d80 1796650304 C Co:2:013:0 0 1 >
ffff880094133d80 1796652805 S Co:2:013:0 s 40 0c 0088 0001 0001 1 = 78
ffff880094133d80 1796653255 C Co:2:013:0 0 1 >
ffff880094133d80 1796655857 S Co:2:013:0 s 40 0c 0088 0001 0001 1 = e0
ffff880094133d80 1796656303 C Co:2:013:0 0 1 >
ffff880094133d80 1796658871 S Co:2:013:0 s 40 0c 0087 0001 0001 1 = 05
ffff880094133d80 1796659305 C Co:2:013:0 0 1 >
ffff880094133d80 1796661824 S Co:2:013:0 s 40 0c 0087 0001 0001 1 = 04
ffff880094133d80 1796662304 C Co:2:013:0 0 1 >
ffff880094133d80 1796664798 S Co:2:013:0 s 40 0c 0088 0001 0001 1 = ff
ffff880094133d80 1796665255 C Co:2:013:0 0 1 >
ffff880094133d80 1796667837 S Co:2:013:0 s 40 0c 0085 0088 0001 1 = 0a
ffff880094133d80 1796668302 C Co:2:013:0 0 1 >
ffff880094133d80 1796670875 S Co:2:013:0 s 40 0c 0085 0088 0001 1 = 00
ffff880094133d80 1796671304 C Co:2:013:0 0 1 >
ffff880094133d80 1796673822 S Co:2:013:0 s 40 0c 0085 0088 0001 1 = 00
ffff880094133d80 1796674304 C Co:2:013:0 0 1 >
ffff880094133d80 1796676799 S Co:2:013:0 s 40 0c 0085 0088 0001 1 = 00
ffff880094133d80 1796677130 C Co:2:013:0 0 1 >
ffff880094133d80 1796679835 S Co:2:013:0 s 40 0c 0085 0088 0001 1 = 08
ffff880094133d80 1796680283 C Co:2:013:0 0 1 >
ffff880094133d80 1796682875 S Co:2:013:0 s 40 0c 0085 0088 0001 1 = 00
ffff880094133d80 1796683304 C Co:2:013:0 0 1 >
ffff880094133d80 1796684900 S Ci:2:013:0 s c0 0c 0084 0006 0001 1 <
ffff880094133d80 1796685181 C Ci:2:013:0 0 1 = 00
ffff880094133d80 1796688808 S Co:2:013:0 s 40 0c 0085 f8d8 0001 1 = 13
ffff880094133d80 1796689131 C Co:2:013:0 0 1 >
ffff880094133d80 1796691867 S Co:2:013:0 s 40 0c 0085 f8d8 0001 1 = 00
ffff880094133d80 1796692279 C Co:2:013:0 0 1 >
ffff880094133d80 1796694876 S Co:2:013:0 s 40 0c 0085 f8d8 0001 1 = 04
ffff880094133d80 1796695305 C Co:2:013:0 0 1 >
ffff880094133d80 1796697823 S Co:2:013:0 s 40 0c 0085 f8d8 0001 1 = 00
ffff880094133d80 1796698287 C Co:2:013:0 0 1 >
ffff880094133d80 1796700798 S Co:2:013:0 s 40 0c 0085 f8d8 0001 1 = 02
ffff880094133d80 1796701132 C Co:2:013:0 0 1 >
ffff880094133d80 1796703832 S Co:2:013:0 s 40 0c 0085 f8d8 0001 1 = 00
ffff880094133d80 1796704277 C Co:2:013:0 0 1 >
ffff880094133d80 1796706865 S Co:2:013:0 s 40 0c 0085 f8d8 0001 1 = 64
ffff880094133d80 1796707305 C Co:2:013:0 0 1 >
ffff880094133d80 1796709822 S Co:2:013:0 s 40 0c 0085 f8d8 0001 1 = 00
ffff880094133d80 1796710306 C Co:2:013:0 0 1 >
ffff880094133d80 1796711795 S Ci:2:013:0 s c0 0c 0084 0008 0001 1 <
ffff880094133d80 1796712007 C Ci:2:013:0 0 1 = 03
ffff880094133d80 1796714874 S Ci:2:013:0 s c0 0c 0084 0008 0001 1 <
ffff880094133d80 1796715169 C Ci:2:013:0 0 1 = 00
ffff880094133d80 1796718867 S Co:2:013:0 s 40 0c 0088 0084 0001 1 = ff
ffff880094133d80 1796719300 C Co:2:013:0 0 1 >
ffff880094133d80 1796721772 S Co:2:013:0 s 40 0c 0088 0084 0001 1 = aa
ffff880094133d80 1796722344 C Co:2:013:0 0 1 >
ffff880094133d80 1796724800 S Co:2:013:0 s 40 0c 0088 0084 0001 1 = 55
ffff880094133d80 1796725319 C Co:2:013:0 0 1 >
ffff880094133d80 1796727833 S Co:2:013:0 s 40 0c 0088 0084 0001 1 = 00
ffff880094133d80 1796728320 C Co:2:013:0 0 1 >
ffff880094133d80 1796730866 S Co:2:013:0 s 40 0c 0088 0084 0001 1 = ff
ffff880094133d80 1796731259 C Co:2:013:0 0 1 >
ffff880094133d80 1796733789 S Co:2:013:0 s 40 0c 0088 0084 0001 1 = 87
ffff880094133d80 1796734132 C Co:2:013:0 0 1 >
ffff880094133d80 1796736798 S Co:2:013:0 s 40 0c 0088 0084 0001 1 = 78
ffff880094133d80 1796737259 C Co:2:013:0 0 1 >
ffff880094133d80 1796739835 S Co:2:013:0 s 40 0c 0088 0084 0001 1 = e0
ffff880094133d80 1796740261 C Co:2:013:0 0 1 >
ffff880094133d80 1796742870 S Co:2:013:0 s 40 0c 0087 0084 0001 1 = 05
ffff880094133d80 1796743260 C Co:2:013:0 0 1 >
ffff880094133d80 1796745794 S Co:2:013:0 s 40 0c 0087 0084 0001 1 = 04
ffff880094133d80 1796746135 C Co:2:013:0 0 1 >
ffff880094133d80 1796748799 S Co:2:013:0 s 40 0c 0088 0084 0001 1 = ff
ffff880094133d80 1796749279 C Co:2:013:0 0 1 >
ffff880094133d80 1796751834 S Co:2:013:0 s 40 0c 0085 0088 0001 1 = 0a
ffff880094133d80 1796752296 C Co:2:013:0 0 1 >
ffff880094133d80 1796754868 S Co:2:013:0 s 40 0c 0085 0088 0001 1 = 00
ffff880094133d80 1796755261 C Co:2:013:0 0 1 >
ffff880094133d80 1796757822 S Co:2:013:0 s 40 0c 0085 0088 0001 1 = 00
ffff880094133d80 1796758261 C Co:2:013:0 0 1 >
ffff880094133d80 1796760803 S Co:2:013:0 s 40 0c 0085 0088 0001 1 = 00
ffff880094133d80 1796761133 C Co:2:013:0 0 1 >
ffff880094133d80 1796763835 S Co:2:013:0 s 40 0c 0085 0088 0001 1 = 08
ffff880094133d80 1796764258 C Co:2:013:0 0 1 >
ffff880094133d80 1796766876 S Co:2:013:0 s 40 0c 0085 0088 0001 1 = 00
ffff880094133d80 1796767260 C Co:2:013:0 0 1 >
ffff880094133d80 1796768898 S Ci:2:013:0 s c0 0c 0084 0006 0001 1 <
ffff880094133d80 1796769182 C Ci:2:013:0 0 1 = 00
ffff880094133d80 1796772803 S Co:2:013:0 s 40 0c 0085 f8d8 0001 1 = 13
ffff880094133d80 1796773133 C Co:2:013:0 0 1 >
ffff880094133d80 1796775837 S Co:2:013:0 s 40 0c 0085 f8d8 0001 1 = 00
ffff880094133d80 1796776260 C Co:2:013:0 0 1 >
ffff880094133d80 1796778873 S Co:2:013:0 s 40 0c 0085 f8d8 0001 1 = 04
ffff880094133d80 1796779261 C Co:2:013:0 0 1 >
ffff880094133d80 1796781778 S Co:2:013:0 s 40 0c 0085 f8d8 0001 1 = 00
ffff880094133d80 1796782133 C Co:2:013:0 0 1 >
ffff880094133d80 1796784798 S Co:2:013:0 s 40 0c 0085 f8d8 0001 1 = 04
ffff880094133d80 1796785133 C Co:2:013:0 0 1 >
ffff880094133d80 1796787830 S Co:2:013:0 s 40 0c 0085 f8d8 0001 1 = 00
ffff880094133d80 1796788297 C Co:2:013:0 0 1 >
ffff880094133d80 1796790868 S Co:2:013:0 s 40 0c 0085 f8d8 0001 1 = 64
ffff880094133d80 1796791319 C Co:2:013:0 0 1 >
ffff880094133d80 1796793796 S Co:2:013:0 s 40 0c 0085 f8d8 0001 1 = 00
ffff880094133d80 1796794179 C Co:2:013:0 0 1 >
ffff880094133d80 1796795799 S Ci:2:013:0 s c0 0c 0084 0008 0001 1 <
ffff880094133d80 1796796047 C Ci:2:013:0 0 1 = 03
ffff880094133d80 1796798839 S Ci:2:013:0 s c0 0c 0084 0008 0001 1 <
ffff880094133d80 1796799172 C Ci:2:013:0 0 1 = 00
ffff880094133d80 1796802867 S Co:2:013:0 s 40 0c 0088 0084 0001 1 = ff
ffff880094133d80 1796803293 C Co:2:013:0 0 1 >
ffff880094133d80 1796805824 S Co:2:013:0 s 40 0c 0088 0084 0001 1 = aa
ffff880094133d80 1796806309 C Co:2:013:0 0 1 >
ffff880094133d80 1796808806 S Co:2:013:0 s 40 0c 0088 0084 0001 1 = 55
ffff880094133d80 1796809261 C Co:2:013:0 0 1 >
ffff880094133d80 1796811836 S Co:2:013:0 s 40 0c 0088 0084 0001 1 = 00
ffff880094133d80 1796812301 C Co:2:013:0 0 1 >
ffff880094133d80 1796814923 S Co:2:013:0 s 40 0c 0088 0084 0001 1 = ff
ffff880094133d80 1796815409 C Co:2:013:0 0 1 >
ffff880094133d80 1796817766 S Co:2:013:0 s 40 0c 0088 0084 0001 1 = 87
ffff880094133d80 1796818159 C Co:2:013:0 0 1 >
ffff8801417a96c0 1796820810 S Co:2:013:0 s 40 0c 0088 0084 0001 1 = 78
ffff8801417a96c0 1796821260 C Co:2:013:0 0 1 >
ffff8801417a96c0 1796823838 S Co:2:013:0 s 40 0c 0088 0084 0001 1 = e0
ffff8801417a96c0 1796824285 C Co:2:013:0 0 1 >
ffff8801417a96c0 1796826872 S Co:2:013:0 s 40 0c 0087 0084 0001 1 = 05
ffff8801417a96c0 1796827298 C Co:2:013:0 0 1 >
ffff8801417a96c0 1796829761 S Co:2:013:0 s 40 0c 0087 0084 0001 1 = 04
ffff8801417a96c0 1796830203 C Co:2:013:0 0 1 >
ffff8801417a96c0 1796832802 S Co:2:013:0 s 40 0c 0088 0084 0001 1 = ff
ffff8801417a96c0 1796833323 C Co:2:013:0 0 1 >
ffff8801417a96c0 1796835834 S Co:2:013:0 s 40 0c 0085 0088 0001 1 = 0a
ffff8801417a96c0 1796836305 C Co:2:013:0 0 1 >
ffff8801417a96c0 1796838871 S Co:2:013:0 s 40 0c 0085 0088 0001 1 = 00
ffff8801417a96c0 1796839324 C Co:2:013:0 0 1 >
ffff8801417a96c0 1796841766 S Co:2:013:0 s 40 0c 0085 0088 0001 1 = 00
ffff8801417a96c0 1796842174 C Co:2:013:0 0 1 >
ffff8801417a96c0 1796844797 S Co:2:013:0 s 40 0c 0085 0088 0001 1 = 00
ffff8801417a96c0 1796845174 C Co:2:013:0 0 1 >
ffff8801417a96c0 1796847828 S Co:2:013:0 s 40 0c 0085 0088 0001 1 = 08
ffff8801417a96c0 1796848299 C Co:2:013:0 0 1 >
ffff8801417a96c0 1796850872 S Co:2:013:0 s 40 0c 0085 0088 0001 1 = 00
ffff8801417a96c0 1796851326 C Co:2:013:0 0 1 >
ffff8801417a96c0 1796852942 S Ci:2:013:0 s c0 0c 0084 0006 0001 1 <
ffff8801417a96c0 1796853177 C Ci:2:013:0 0 1 = 00
ffff8801417a96c0 1796856796 S Co:2:013:0 s 40 0c 0085 f8d8 0001 1 = 13
ffff8801417a96c0 1796857174 C Co:2:013:0 0 1 >
ffff8801417a96c0 1796859835 S Co:2:013:0 s 40 0c 0085 f8d8 0001 1 = 00
ffff8801417a96c0 1796860299 C Co:2:013:0 0 1 >
ffff8801417a96c0 1796862870 S Co:2:013:0 s 40 0c 0085 f8d8 0001 1 = 04
ffff8801417a96c0 1796863300 C Co:2:013:0 0 1 >
ffff8801417a96c0 1796865761 S Co:2:013:0 s 40 0c 0085 f8d8 0001 1 = 00
ffff8801417a96c0 1796866175 C Co:2:013:0 0 1 >
ffff8801417a96c0 1796868795 S Co:2:013:0 s 40 0c 0085 f8d8 0001 1 = 08
ffff8801417a96c0 1796869199 C Co:2:013:0 0 1 >
ffff8801417a96c0 1796871829 S Co:2:013:0 s 40 0c 0085 f8d8 0001 1 = 00
ffff8801417a96c0 1796872324 C Co:2:013:0 0 1 >
ffff8801417a96c0 1796874864 S Co:2:013:0 s 40 0c 0085 f8d8 0001 1 = 64
ffff8801417a96c0 1796875309 C Co:2:013:0 0 1 >
ffff8801417a96c0 1796877761 S Co:2:013:0 s 40 0c 0085 f8d8 0001 1 = 00
ffff8801417a96c0 1796878175 C Co:2:013:0 0 1 >
ffff8801417a96c0 1796879854 S Ci:2:013:0 s c0 0c 0084 0008 0001 1 <
ffff8801417a96c0 1796880175 C Ci:2:013:0 0 1 = 03
ffff8801417a96c0 1796882904 S Ci:2:013:0 s c0 0c 0084 0008 0001 1 <
ffff8801417a96c0 1796883175 C Ci:2:013:0 0 1 = 00
ffff8801417a96c0 1796886883 S Co:2:013:0 s 40 0c 0088 48c8 0001 1 = ff
ffff8801417a96c0 1796887266 C Co:2:013:0 0 1 >
ffff8801417a96c0 1796889817 S Co:2:013:0 s 40 0c 0088 48c8 0001 1 = aa
ffff8801417a96c0 1796890264 C Co:2:013:0 0 1 >
ffff8801417a96c0 1796892795 S Co:2:013:0 s 40 0c 0088 48c8 0001 1 = 55
ffff8801417a96c0 1796893262 C Co:2:013:0 0 1 >
ffff8801417a96c0 1796895830 S Co:2:013:0 s 40 0c 0088 48c8 0001 1 = 00
ffff8801417a96c0 1796896263 C Co:2:013:0 0 1 >
ffff8801417a96c0 1796898864 S Co:2:013:0 s 40 0c 0088 48c8 0001 1 = ff
ffff8801417a96c0 1796899265 C Co:2:013:0 0 1 >
ffff8801417a96c0 1796901761 S Co:2:013:0 s 40 0c 0088 48c8 0001 1 = 87
ffff8801417a96c0 1796902187 C Co:2:013:0 0 1 >
ffff8801417a96c0 1796904797 S Co:2:013:0 s 40 0c 0088 48c8 0001 1 = 78
ffff8801417a96c0 1796905138 C Co:2:013:0 0 1 >
ffff8801417a96c0 1796907828 S Co:2:013:0 s 40 0c 0088 48c8 0001 1 = e0
ffff8801417a96c0 1796908308 C Co:2:013:0 0 1 >
ffff8801417a96c0 1796910868 S Co:2:013:0 s 40 0c 0087 48c8 0001 1 = 05
ffff8801417a96c0 1796911312 C Co:2:013:0 0 1 >
ffff8801417a96c0 1796913765 S Co:2:013:0 s 40 0c 0087 48c8 0001 1 = 04
ffff8801417a96c0 1796914186 C Co:2:013:0 0 1 >
ffff8801417a96c0 1796916800 S Co:2:013:0 s 40 0c 0088 48c8 0001 1 = ff
ffff8801417a96c0 1796917264 C Co:2:013:0 0 1 >
ffff8801417a96c0 1796919846 S Co:2:013:0 s 40 0c 0085 0088 0001 1 = 0a
ffff8801417a96c0 1796920310 C Co:2:013:0 0 1 >
ffff8801417a96c0 1796922877 S Co:2:013:0 s 40 0c 0085 0088 0001 1 = 00
ffff8801417a96c0 1796923312 C Co:2:013:0 0 1 >
ffff8801417a96c0 1796925800 S Co:2:013:0 s 40 0c 0085 0088 0001 1 = 00
ffff8801417a96c0 1796926162 C Co:2:013:0 0 1 >
ffff8801417a96c0 1796928794 S Co:2:013:0 s 40 0c 0085 0088 0001 1 = 00
ffff8801417a96c0 1796929139 C Co:2:013:0 0 1 >
ffff8801417a96c0 1796931826 S Co:2:013:0 s 40 0c 0085 0088 0001 1 = 08
ffff8801417a96c0 1796932140 C Co:2:013:0 0 1 >
ffff8801417a96c0 1796934860 S Co:2:013:0 s 40 0c 0085 0088 0001 1 = 00
ffff8801417a96c0 1796935265 C Co:2:013:0 0 1 >
ffff8801417a96c0 1796936765 S Ci:2:013:0 s c0 0c 0084 0006 0001 1 <
ffff8801417a96c0 1796937013 C Ci:2:013:0 0 1 = 00
ffff8801417a96c0 1796940801 S Co:2:013:0 s 40 0c 0085 f8d4 0001 1 = 14
ffff8801417a96c0 1796941141 C Co:2:013:0 0 1 >
ffff8801417a96c0 1796943850 S Co:2:013:0 s 40 0c 0085 f8d4 0001 1 = 00
ffff8801417a96c0 1796944267 C Co:2:013:0 0 1 >
ffff8801417a96c0 1796946919 S Co:2:013:0 s 40 0c 0085 f8d4 0001 1 = 04
ffff8801417a96c0 1796947268 C Co:2:013:0 0 1 >
ffff8801417a96c0 1796949793 S Co:2:013:0 s 40 0c 0085 f8d4 0001 1 = 00
ffff8801417a96c0 1796950142 C Co:2:013:0 0 1 >
ffff8801417a96c0 1796952848 S Co:2:013:0 s 40 0c 0085 f8d4 0001 1 = 02
ffff8801417a96c0 1796953264 C Co:2:013:0 0 1 >
ffff8801417a96c0 1796955904 S Co:2:013:0 s 40 0c 0085 f8d4 0001 1 = 00
ffff8801417a96c0 1796956264 C Co:2:013:0 0 1 >
ffff8801417a96c0 1796958953 S Co:2:013:0 s 40 0c 0085 f8d4 0001 1 = 64
ffff8801417a96c0 1796959268 C Co:2:013:0 0 1 >
ffff8801417a96c0 1796961742 S Co:2:013:0 s 40 0c 0085 f8d4 0001 1 = 00
ffff8801417a96c0 1796962143 C Co:2:013:0 0 1 >
ffff8801417a96c0 1796963761 S Ci:2:013:0 s c0 0c 0084 0008 0001 1 <
ffff8801417a96c0 1796964015 C Ci:2:013:0 0 1 = 03
ffff8801417a96c0 1796966773 S Ci:2:013:0 s c0 0c 0084 0008 0001 1 <
ffff8801417a96c0 1796967019 C Ci:2:013:0 0 1 = 00
ffff8801417a96c0 1796970798 S Co:2:013:0 s 40 0c 0088 0084 0001 1 = ff
ffff8801417a96c0 1796971142 C Co:2:013:0 0 1 >
ffff8801417a96c0 1796973766 S Co:2:013:0 s 40 0c 0088 0084 0001 1 = aa
ffff8801417a96c0 1796974142 C Co:2:013:0 0 1 >
ffff8801417a96c0 1796976800 S Co:2:013:0 s 40 0c 0088 0084 0001 1 = 55
ffff8801417a96c0 1796977265 C Co:2:013:0 0 1 >
ffff8801417a96c0 1796979836 S Co:2:013:0 s 40 0c 0088 0084 0001 1 = 00
ffff8801417a96c0 1796980265 C Co:2:013:0 0 1 >
ffff8801417a96c0 1796982871 S Co:2:013:0 s 40 0c 0088 0084 0001 1 = ff
ffff8801417a96c0 1796983268 C Co:2:013:0 0 1 >
ffff8801417a96c0 1796985822 S Co:2:013:0 s 40 0c 0088 0084 0001 1 = 87
ffff8801417a96c0 1796986267 C Co:2:013:0 0 1 >
ffff8801417a96c0 1796988795 S Co:2:013:0 s 40 0c 0088 0084 0001 1 = 78
ffff8801417a96c0 1796989140 C Co:2:013:0 0 1 >
ffff8801417a96c0 1796991831 S Co:2:013:0 s 40 0c 0088 0084 0001 1 = e0
ffff8801417a96c0 1796992295 C Co:2:013:0 0 1 >
ffff8801417a96c0 1796994869 S Co:2:013:0 s 40 0c 0087 0084 0001 1 = 05
ffff8801417a96c0 1796995304 C Co:2:013:0 0 1 >
ffff8801417a96c0 1796997770 S Co:2:013:0 s 40 0c 0087 0084 0001 1 = 04
ffff8801417a96c0 1796998179 C Co:2:013:0 0 1 >
ffff8801417a96c0 1797000810 S Co:2:013:0 s 40 0c 0088 0084 0001 1 = ff
ffff8801417a96c0 1797001329 C Co:2:013:0 0 1 >
ffff8801417a96c0 1797003850 S Co:2:013:0 s 40 0c 0085 0088 0001 1 = 0a
ffff8801417a96c0 1797004304 C Co:2:013:0 0 1 >
ffff8801417a96c0 1797006890 S Co:2:013:0 s 40 0c 0085 0088 0001 1 = 00
ffff8801417a96c0 1797007329 C Co:2:013:0 0 1 >
ffff8801417a96c0 1797009763 S Co:2:013:0 s 40 0c 0085 0088 0001 1 = 00
ffff8801417a96c0 1797010175 C Co:2:013:0 0 1 >
ffff8801417a96c0 1797012806 S Co:2:013:0 s 40 0c 0085 0088 0001 1 = 00
ffff8801417a96c0 1797013187 C Co:2:013:0 0 1 >
ffff8801417a96c0 1797015843 S Co:2:013:0 s 40 0c 0085 0088 0001 1 = 08
ffff8801417a96c0 1797016330 C Co:2:013:0 0 1 >
ffff8801417a96c0 1797018875 S Co:2:013:0 s 40 0c 0085 0088 0001 1 = 00
ffff8801417a96c0 1797019316 C Co:2:013:0 0 1 >
ffff8801417a96c0 1797020964 S Ci:2:013:0 s c0 0c 0084 0006 0001 1 <
ffff8801417a96c0 1797021357 C Ci:2:013:0 0 1 = 00
ffff8801417a96c0 1797024790 S Co:2:013:0 s 40 0c 0085 f8d4 0001 1 = 14
ffff8801417a96c0 1797025142 C Co:2:013:0 0 1 >
ffff8801417a96c0 1797027819 S Co:2:013:0 s 40 0c 0085 f8d4 0001 1 = 00
ffff8801417a96c0 1797028166 C Co:2:013:0 0 1 >
ffff8801417a96c0 1797030851 S Co:2:013:0 s 40 0c 0085 f8d4 0001 1 = 04
ffff8801417a96c0 1797031303 C Co:2:013:0 0 1 >
ffff8801417a96c0 1797033760 S Co:2:013:0 s 40 0c 0085 f8d4 0001 1 = 00
ffff8801417a96c0 1797034191 C Co:2:013:0 0 1 >
ffff8801417a96c0 1797036795 S Co:2:013:0 s 40 0c 0085 f8d4 0001 1 = 04
ffff8801417a96c0 1797037143 C Co:2:013:0 0 1 >
ffff8801417a96c0 1797039837 S Co:2:013:0 s 40 0c 0085 f8d4 0001 1 = 00
ffff8801417a96c0 1797040316 C Co:2:013:0 0 1 >
ffff8801417a96c0 1797042870 S Co:2:013:0 s 40 0c 0085 f8d4 0001 1 = 64
ffff8801417a96c0 1797043320 C Co:2:013:0 0 1 >
ffff8801417a96c0 1797045823 S Co:2:013:0 s 40 0c 0085 f8d4 0001 1 = 00
ffff8801417a96c0 1797046316 C Co:2:013:0 0 1 >
ffff8801417a96c0 1797047797 S Ci:2:013:0 s c0 0c 0084 0008 0001 1 <
ffff8801417a96c0 1797048018 C Ci:2:013:0 0 1 = 03
ffff8801417a96c0 1797050831 S Ci:2:013:0 s c0 0c 0084 0008 0001 1 <
ffff8801417a96c0 1797051022 C Ci:2:013:0 0 1 = 00
ffff8801417a96c0 1797054888 S Co:2:013:0 s 40 0c 0088 0084 0001 1 = ff
ffff8801417a96c0 1797055271 C Co:2:013:0 0 1 >
ffff8801417a96c0 1797057761 S Co:2:013:0 s 40 0c 0088 0084 0001 1 = aa
ffff8801417a96c0 1797058146 C Co:2:013:0 0 1 >
ffff8801417a96c0 1797060798 S Co:2:013:0 s 40 0c 0088 0084 0001 1 = 55
ffff8801417a96c0 1797061267 C Co:2:013:0 0 1 >
ffff8801417a96c0 1797063841 S Co:2:013:0 s 40 0c 0088 0084 0001 1 = 00
ffff8801417a96c0 1797064269 C Co:2:013:0 0 1 >
ffff8801417a96c0 1797066888 S Co:2:013:0 s 40 0c 0088 0084 0001 1 = ff
ffff8801417a96c0 1797067273 C Co:2:013:0 0 1 >
ffff8801417a96c0 1797069770 S Co:2:013:0 s 40 0c 0088 0084 0001 1 = 87
ffff8801417a96c0 1797070193 C Co:2:013:0 0 1 >
ffff8801417a96c0 1797072798 S Co:2:013:0 s 40 0c 0088 0084 0001 1 = 78
ffff8801417a96c0 1797073144 C Co:2:013:0 0 1 >
ffff8801417a96c0 1797075838 S Co:2:013:0 s 40 0c 0088 0084 0001 1 = e0
ffff8801417a96c0 1797076317 C Co:2:013:0 0 1 >
ffff8801417a96c0 1797078868 S Co:2:013:0 s 40 0c 0087 0084 0001 1 = 05
ffff8801417a96c0 1797079317 C Co:2:013:0 0 1 >
ffff8801417a96c0 1797081824 S Co:2:013:0 s 40 0c 0087 0084 0001 1 = 04
ffff8801417a96c0 1797082319 C Co:2:013:0 0 1 >
ffff8801417a96c0 1797084794 S Co:2:013:0 s 40 0c 0088 0084 0001 1 = ff
ffff8801417a96c0 1797085145 C Co:2:013:0 0 1 >
ffff8801417a96c0 1797087834 S Co:2:013:0 s 40 0c 0085 0088 0001 1 = 0a
ffff8801417a96c0 1797088165 C Co:2:013:0 0 1 >
ffff8801417a96c0 1797090889 S Co:2:013:0 s 40 0c 0085 0088 0001 1 = 00
ffff8801417a96c0 1797091293 C Co:2:013:0 0 1 >
ffff88004c3e5c80 1797093818 S Co:2:013:0 s 40 0c 0085 0088 0001 1 = 00
ffff88004c3e5c80 1797094148 C Co:2:013:0 0 1 >
ffff88004c3e5c80 1797096803 S Co:2:013:0 s 40 0c 0085 0088 0001 1 = 00
ffff88004c3e5c80 1797097145 C Co:2:013:0 0 1 >
ffff88004c3e5c80 1797099839 S Co:2:013:0 s 40 0c 0085 0088 0001 1 = 08
ffff88004c3e5c80 1797100271 C Co:2:013:0 0 1 >
ffff88004c3e5c80 1797102879 S Co:2:013:0 s 40 0c 0085 0088 0001 1 = 00
ffff88004c3e5c80 1797103269 C Co:2:013:0 0 1 >
ffff88004c3e5c80 1797104790 S Ci:2:013:0 s c0 0c 0084 0006 0001 1 <
ffff88004c3e5c80 1797105021 C Ci:2:013:0 0 1 = 00
ffff88004c3e5c80 1797108794 S Co:2:013:0 s 40 0c 0085 f8d4 0001 1 = 14
ffff88004c3e5c80 1797109145 C Co:2:013:0 0 1 >
ffff88004c3e5c80 1797111827 S Co:2:013:0 s 40 0c 0085 f8d4 0001 1 = 00
ffff88004c3e5c80 1797112145 C Co:2:013:0 0 1 >
ffff88004c3e5c80 1797114862 S Co:2:013:0 s 40 0c 0085 f8d4 0001 1 = 04
ffff88004c3e5c80 1797115271 C Co:2:013:0 0 1 >
ffff88004c3e5c80 1797117766 S Co:2:013:0 s 40 0c 0085 f8d4 0001 1 = 00
ffff88004c3e5c80 1797118146 C Co:2:013:0 0 1 >
ffff88004c3e5c80 1797120798 S Co:2:013:0 s 40 0c 0085 f8d4 0001 1 = 08
ffff88004c3e5c80 1797121146 C Co:2:013:0 0 1 >
ffff88004c3e5c80 1797123834 S Co:2:013:0 s 40 0c 0085 f8d4 0001 1 = 00
ffff88004c3e5c80 1797124269 C Co:2:013:0 0 1 >
ffff88004c3e5c80 1797127582 S Co:2:013:0 s 40 0c 0085 f8d4 0001 1 = 64
ffff88004c3e5c80 1797128024 C Co:2:013:0 0 1 >
ffff88004c3e5c80 1797130609 S Co:2:013:0 s 40 0c 0085 f8d4 0001 1 = 00
ffff88004c3e5c80 1797131021 C Co:2:013:0 0 1 >
ffff88004c3e5c80 1797132635 S Ci:2:013:0 s c0 0c 0084 0008 0001 1 <
ffff88004c3e5c80 1797133271 C Ci:2:013:0 0 1 = 03
ffff88004c3e5c80 1797135668 S Ci:2:013:0 s c0 0c 0084 0008 0001 1 <
ffff88004c3e5c80 1797136021 C Ci:2:013:0 0 1 = 00
ffff88004c3e5c80 1797141603 S Co:2:013:0 s 40 0c 0088 d8ef 0001 1 = ff
ffff88004c3e5c80 1797142023 C Co:2:013:0 0 1 >
ffff88004c3e5c80 1797144630 S Co:2:013:0 s 40 0c 0088 d8ef 0001 1 = aa
ffff88004c3e5c80 1797145021 C Co:2:013:0 0 1 >
ffff88004c3e5c80 1797147670 S Co:2:013:0 s 40 0c 0088 d8ef 0001 1 = 55
ffff88004c3e5c80 1797148058 C Co:2:013:0 0 1 >
ffff88004c3e5c80 1797150724 S Co:2:013:0 s 40 0c 0088 d8ef 0001 1 = 00
ffff88004c3e5c80 1797151209 C Co:2:013:0 0 1 >
ffff88004c3e5c80 1797153628 S Co:2:013:0 s 40 0c 0088 d8ef 0001 1 = ff
ffff88004c3e5c80 1797154072 C Co:2:013:0 0 1 >
ffff88004c3e5c80 1797156645 S Co:2:013:0 s 40 0c 0088 d8ef 0001 1 = 87
ffff88004c3e5c80 1797157021 C Co:2:013:0 0 1 >
ffff88004c3e5c80 1797159681 S Co:2:013:0 s 40 0c 0088 d8ef 0001 1 = 78
ffff88004c3e5c80 1797160183 C Co:2:013:0 0 1 >
ffff88004c3e5c80 1797162721 S Co:2:013:0 s 40 0c 0088 d8ef 0001 1 = e0
ffff88004c3e5c80 1797163185 C Co:2:013:0 0 1 >
ffff88004c3e5c80 1797165625 S Co:2:013:0 s 40 0c 0087 d8ef 0001 1 = 05
ffff88004c3e5c80 1797166086 C Co:2:013:0 0 1 >
ffff88004c3e5c80 1797168642 S Co:2:013:0 s 40 0c 0087 d8ef 0001 1 = 04
ffff88004c3e5c80 1797169025 C Co:2:013:0 0 1 >
ffff88004c3e5c80 1797171674 S Co:2:013:0 s 40 0c 0088 d8ef 0001 1 = ff
ffff88004c3e5c80 1797172146 C Co:2:013:0 0 1 >
ffff88004c3e5c80 1797174711 S Co:2:013:0 s 40 0c 0085 0088 0001 1 = 0a
ffff88004c3e5c80 1797175212 C Co:2:013:0 0 1 >
ffff88004c3e5c80 1797177602 S Co:2:013:0 s 40 0c 0085 0088 0001 1 = 00
ffff88004c3e5c80 1797178060 C Co:2:013:0 0 1 >
ffff88004c3e5c80 1797180641 S Co:2:013:0 s 40 0c 0085 0088 0001 1 = 00
ffff88004c3e5c80 1797181025 C Co:2:013:0 0 1 >
ffff88004c3e5c80 1797183670 S Co:2:013:0 s 40 0c 0085 0088 0001 1 = 00
ffff88004c3e5c80 1797184022 C Co:2:013:0 0 1 >
ffff88004c3e5c80 1797186710 S Co:2:013:0 s 40 0c 0085 0088 0001 1 = 0e
ffff88004c3e5c80 1797187210 C Co:2:013:0 0 1 >
ffff88004c3e5c80 1797189601 S Co:2:013:0 s 40 0c 0085 0088 0001 1 = 00
ffff88004c3e5c80 1797190049 C Co:2:013:0 0 1 >
ffff88004c3e5c80 1797191640 S Ci:2:013:0 s c0 0c 0084 0006 0001 1 <
ffff88004c3e5c80 1797191922 C Ci:2:013:0 0 1 = 00
ffff88004c3e5c80 1797195678 S Co:2:013:0 s 40 0c 0085 f848 0001 1 = 12
ffff88004c3e5c80 1797196023 C Co:2:013:0 0 1 >
ffff88004c3e5c80 1797198721 S Co:2:013:0 s 40 0c 0085 f848 0001 1 = 00
ffff88004c3e5c80 1797199210 C Co:2:013:0 0 1 >
ffff88004c3e5c80 1797201600 S Co:2:013:0 s 40 0c 0085 f848 0001 1 = 0a
ffff88004c3e5c80 1797202088 C Co:2:013:0 0 1 >
ffff88004c3e5c80 1797204642 S Co:2:013:0 s 40 0c 0085 f848 0001 1 = 00
ffff88004c3e5c80 1797205074 C Co:2:013:0 0 1 >
ffff88004c3e5c80 1797207670 S Co:2:013:0 s 40 0c 0085 f848 0001 1 = 80
ffff88004c3e5c80 1797208023 C Co:2:013:0 0 1 >
ffff88004c3e5c80 1797210708 S Co:2:013:0 s 40 0c 0085 f848 0001 1 = 00
ffff88004c3e5c80 1797211211 C Co:2:013:0 0 1 >
ffff88004c3e5c80 1797213597 S Co:2:013:0 s 40 0c 0085 f848 0001 1 = 00
ffff88004c3e5c80 1797214086 C Co:2:013:0 0 1 >
ffff88004c3e5c80 1797216644 S Co:2:013:0 s 40 0c 0085 f848 0001 1 = 00
ffff88004c3e5c80 1797217086 C Co:2:013:0 0 1 >
ffff88004c3e5c80 1797219673 S Co:2:013:0 s 40 0c 0085 f848 0001 1 = 00
ffff88004c3e5c80 1797220024 C Co:2:013:0 0 1 >
ffff88004c3e5c80 1797222707 S Co:2:013:0 s 40 0c 0085 f848 0001 1 = 00
ffff88004c3e5c80 1797223061 C Co:2:013:0 0 1 >
ffff88004c3e5c80 1797225604 S Co:2:013:0 s 40 0c 0085 f848 0001 1 = 18
ffff88004c3e5c80 1797226087 C Co:2:013:0 0 1 >
ffff88004c3e5c80 1797228641 S Co:2:013:0 s 40 0c 0085 f848 0001 1 = 1d
ffff88004c3e5c80 1797229072 C Co:2:013:0 0 1 >
ffff88004c3e5c80 1797231676 S Co:2:013:0 s 40 0c 0085 f848 0001 1 = d5
ffff88004c3e5c80 1797232025 C Co:2:013:0 0 1 >
ffff88004c3e5c80 1797234712 S Co:2:013:0 s 40 0c 0085 f848 0001 1 = 1c
ffff88004c3e5c80 1797235214 C Co:2:013:0 0 1 >
ffff88004c3e5c80 1797236670 S Ci:2:013:0 s c0 0c 0084 000e 0001 1 <
ffff88004c3e5c80 1797236937 C Ci:2:013:0 0 1 = 03
ffff88004c3e5c80 1797239632 S Ci:2:013:0 s c0 0c 0084 000e 0001 1 <
ffff88004c3e5c80 1797239946 C Ci:2:013:0 0 1 = 00
ffff88004c3e5c80 1797243679 S Co:2:013:0 s 40 0c 0088 f8eb 0001 1 = ff
ffff88004c3e5c80 1797244027 C Co:2:013:0 0 1 >
ffff88004c3e5c80 1797246711 S Co:2:013:0 s 40 0c 0088 f8eb 0001 1 = aa
ffff88004c3e5c80 1797247197 C Co:2:013:0 0 1 >
ffff88004c3e5c80 1797249599 S Co:2:013:0 s 40 0c 0088 f8eb 0001 1 = 55
ffff88004c3e5c80 1797250058 C Co:2:013:0 0 1 >
ffff88004c3e5c80 1797252641 S Co:2:013:0 s 40 0c 0088 f8eb 0001 1 = 00
ffff88004c3e5c80 1797253085 C Co:2:013:0 0 1 >
ffff88004c3e5c80 1797255672 S Co:2:013:0 s 40 0c 0088 f8eb 0001 1 = ff
ffff88004c3e5c80 1797256027 C Co:2:013:0 0 1 >
ffff88004c3e5c80 1797258707 S Co:2:013:0 s 40 0c 0088 f8eb 0001 1 = 87
ffff88004c3e5c80 1797259188 C Co:2:013:0 0 1 >
ffff88004c3e5c80 1797261599 S Co:2:013:0 s 40 0c 0088 f8eb 0001 1 = 78
ffff88004c3e5c80 1797262063 C Co:2:013:0 0 1 >
ffff88004c3e5c80 1797264635 S Co:2:013:0 s 40 0c 0088 f8eb 0001 1 = e0
ffff88004c3e5c80 1797265088 C Co:2:013:0 0 1 >
ffff88004c3e5c80 1797267675 S Co:2:013:0 s 40 0c 0087 f8eb 0001 1 = 05
ffff88004c3e5c80 1797268029 C Co:2:013:0 0 1 >
ffff88004c3e5c80 1797270702 S Co:2:013:0 s 40 0c 0087 f8eb 0001 1 = 04
ffff88004c3e5c80 1797271181 C Co:2:013:0 0 1 >
ffff88004c3e5c80 1797273597 S Co:2:013:0 s 40 0c 0088 f8eb 0001 1 = ff
ffff88004c3e5c80 1797274062 C Co:2:013:0 0 1 >
ffff88004c3e5c80 1797276635 S Co:2:013:0 s 40 0c 0085 0088 0001 1 = 0a
ffff88004c3e5c80 1797277063 C Co:2:013:0 0 1 >
ffff88004c3e5c80 1797279666 S Co:2:013:0 s 40 0c 0085 0088 0001 1 = 00
ffff88004c3e5c80 1797280029 C Co:2:013:0 0 1 >
ffff88004c3e5c80 1797282701 S Co:2:013:0 s 40 0c 0085 0088 0001 1 = 00
ffff88004c3e5c80 1797283150 C Co:2:013:0 0 1 >
ffff88004c3e5c80 1797285605 S Co:2:013:0 s 40 0c 0085 0088 0001 1 = 00
ffff88004c3e5c80 1797286064 C Co:2:013:0 0 1 >
ffff88004c3e5c80 1797288642 S Co:2:013:0 s 40 0c 0085 0088 0001 1 = 06
ffff88004c3e5c80 1797289089 C Co:2:013:0 0 1 >
ffff88004c3e5c80 1797291676 S Co:2:013:0 s 40 0c 0085 0088 0001 1 = 00
ffff88004c3e5c80 1797292076 C Co:2:013:0 0 1 >
ffff88004c3e5c80 1797293704 S Ci:2:013:0 s c0 0c 0084 0006 0001 1 <
ffff88004c3e5c80 1797293901 C Ci:2:013:0 0 1 = 00
ffff88004c3e5c80 1797297706 S Co:2:013:0 s 40 0c 0085 f8f0 0001 1 = 17
ffff88004c3e5c80 1797298028 C Co:2:013:0 0 1 >
ffff88004c3e5c80 1797300637 S Co:2:013:0 s 40 0c 0085 f8f0 0001 1 = 00
ffff88004c3e5c80 1797301064 C Co:2:013:0 0 1 >
ffff88004c3e5c80 1797303678 S Co:2:013:0 s 40 0c 0085 f8f0 0001 1 = 02
ffff88004c3e5c80 1797304089 C Co:2:013:0 0 1 >
ffff88004c3e5c80 1797306710 S Co:2:013:0 s 40 0c 0085 f8f0 0001 1 = 00
ffff88004c3e5c80 1797307200 C Co:2:013:0 0 1 >
ffff88004c3e5c80 1797309600 S Co:2:013:0 s 40 0c 0085 f8f0 0001 1 = 01
ffff88004c3e5c80 1797310089 C Co:2:013:0 0 1 >
ffff88004c3e5c80 1797312644 S Co:2:013:0 s 40 0c 0085 f8f0 0001 1 = 00
ffff88004c3e5c80 1797313090 C Co:2:013:0 0 1 >
ffff88004c3e5c80 1797314668 S Ci:2:013:0 s c0 0c 0084 0006 0001 1 <
ffff88004c3e5c80 1797315091 C Ci:2:013:0 0 1 = 03
ffff88004c3e5c80 1797317707 S Ci:2:013:0 s c0 0c 0084 0006 0001 1 <
ffff88004c3e5c80 1797317940 C Ci:2:013:0 0 1 = 00
ffff88004c3e5c80 1797321601 S Co:2:013:0 s 40 0c 0088 0001 0001 1 = ff
ffff88004c3e5c80 1797322089 C Co:2:013:0 0 1 >
ffff88004c3e5c80 1797324641 S Co:2:013:0 s 40 0c 0088 0001 0001 1 = aa
ffff88004c3e5c80 1797325093 C Co:2:013:0 0 1 >
ffff88004c3e5c80 1797327677 S Co:2:013:0 s 40 0c 0088 0001 0001 1 = 55
ffff88004c3e5c80 1797328215 C Co:2:013:0 0 1 >
ffff88004c3e5c80 1797330711 S Co:2:013:0 s 40 0c 0088 0001 0001 1 = 00
ffff88004c3e5c80 1797331214 C Co:2:013:0 0 1 >
ffff8801480598c0 1797333648 S Co:2:013:0 s 40 0c 0088 0001 0001 1 = ff
ffff8801480598c0 1797334031 C Co:2:013:0 0 1 >
ffff8801480598c0 1797336633 S Co:2:013:0 s 40 0c 0088 0001 0001 1 = 87
ffff8801480598c0 1797337029 C Co:2:013:0 0 1 >
ffff8801480598c0 1797339667 S Co:2:013:0 s 40 0c 0088 0001 0001 1 = 78
ffff8801480598c0 1797340028 C Co:2:013:0 0 1 >
ffff8801480598c0 1797342704 S Co:2:013:0 s 40 0c 0088 0001 0001 1 = e0
ffff8801480598c0 1797343153 C Co:2:013:0 0 1 >
ffff8801480598c0 1797345597 S Co:2:013:0 s 40 0c 0087 0001 0001 1 = 05
ffff8801480598c0 1797346027 C Co:2:013:0 0 1 >
ffff8801480598c0 1797348633 S Co:2:013:0 s 40 0c 0087 0001 0001 1 = 04
ffff8801480598c0 1797349027 C Co:2:013:0 0 1 >
ffff8801480598c0 1797351667 S Co:2:013:0 s 40 0c 0088 0001 0001 1 = ff
ffff8801480598c0 1797352028 C Co:2:013:0 0 1 >
ffff8801480598c0 1797354699 S Co:2:013:0 s 40 0c 0085 0088 0001 1 = d7
ffff8801480598c0 1797355028 C Co:2:013:0 0 1 >
ffff8801480598c0 1797357605 S Co:2:013:0 s 40 0c 0085 0088 0001 1 = 00
ffff8801480598c0 1797358029 C Co:2:013:0 0 1 >
ffff8801480598c0 1797360642 S Co:2:013:0 s 40 0c 0085 0088 0001 1 = 00
ffff8801480598c0 1797361028 C Co:2:013:0 0 1 >
ffff8801480598c0 1797363680 S Co:2:013:0 s 40 0c 0085 0088 0001 1 = 00
ffff8801480598c0 1797364028 C Co:2:013:0 0 1 >
ffff8801480598c0 1797366717 S Co:2:013:0 s 40 0c 0085 0088 0001 1 = 67
ffff8801480598c0 1797367153 C Co:2:013:0 0 1 >
ffff8801480598c0 1797369601 S Co:2:013:0 s 40 0c 0085 0088 0001 1 = 00
ffff8801480598c0 1797370028 C Co:2:013:0 0 1 >
ffff8801480598c0 1797371627 S Ci:2:013:0 s c0 0c 0084 0006 0001 1 <
ffff8801480598c0 1797372029 C Ci:2:013:0 0 1 = 01
ffff8801480598c0 1797375664 S Co:2:013:0 s 40 04 0082 1694 0008 8 = 00000000 67000000
ffff8801480598c0 1797376029 C Co:2:013:0 0 8 >
ffff8801480598c0 1797377729 S Bi:2:013:1 -115 512 <
ffff8801480598c0 1797380153 C Bi:2:013:1 0 103 = 00000000 00000000 00000000 00000000 00000000 00000000 00000000 00000000
ffff8801480598c0 1797382617 S Ci:2:013:0 s c0 0c 0084 48c8 0001 1 <
ffff8801480598c0 1797382905 C Ci:2:013:0 0 1 = 03
ffff8801480598c0 1797385686 S Ci:2:013:0 s c0 0c 0084 48c8 0001 1 <
ffff8801480598c0 1797386030 C Ci:2:013:0 0 1 = 00
ffff8801480598c0 1797390440 S Co:2:013:0 s 40 0c 0088 0001 0001 1 = ff
ffff8801480598c0 1797390905 C Co:2:013:0 0 1 >
ffff8801480598c0 1797393329 S Co:2:013:0 s 40 0c 0088 0001 0001 1 = aa
ffff8801480598c0 1797393784 C Co:2:013:0 0 1 >
ffff8801480598c0 1797396364 S Co:2:013:0 s 40 0c 0088 0001 0001 1 = 55
ffff8801480598c0 1797396780 C Co:2:013:0 0 1 >
ffff8801480598c0 1797399395 S Co:2:013:0 s 40 0c 0088 0001 0001 1 = 00
ffff8801480598c0 1797399779 C Co:2:013:0 0 1 >
ffff8801480598c0 1797402431 S Co:2:013:0 s 40 0c 0088 0001 0001 1 = ff
ffff8801480598c0 1797402779 C Co:2:013:0 0 1 >
ffff8801480598c0 1797405333 S Co:2:013:0 s 40 0c 0088 0001 0001 1 = 87
ffff8801480598c0 1797405780 C Co:2:013:0 0 1 >
ffff8801480598c0 1797408367 S Co:2:013:0 s 40 0c 0088 0001 0001 1 = 78
ffff8801480598c0 1797408780 C Co:2:013:0 0 1 >
ffff8801480598c0 1797411404 S Co:2:013:0 s 40 0c 0088 0001 0001 1 = e0
ffff8801480598c0 1797411780 C Co:2:013:0 0 1 >
ffff8801480598c0 1797414439 S Co:2:013:0 s 40 0c 0087 0001 0001 1 = 05
ffff8801480598c0 1797414780 C Co:2:013:0 0 1 >
ffff8801480598c0 1797417378 S Co:2:013:0 s 40 0c 0087 0001 0001 1 = 04
ffff8801480598c0 1797417780 C Co:2:013:0 0 1 >
ffff8801480598c0 1797420366 S Co:2:013:0 s 40 0c 0088 0001 0001 1 = ff
ffff8801480598c0 1797420781 C Co:2:013:0 0 1 >
ffff8801480598c0 1797423405 S Co:2:013:0 s 40 0c 0085 0088 0001 1 = dc
ffff8801480598c0 1797423780 C Co:2:013:0 0 1 >
ffff8801480598c0 1797426440 S Co:2:013:0 s 40 0c 0085 0088 0001 1 = 00
ffff8801480598c0 1797426781 C Co:2:013:0 0 1 >
ffff8801480598c0 1797429328 S Co:2:013:0 s 40 0c 0085 0088 0001 1 = 00
ffff8801480598c0 1797429655 C Co:2:013:0 0 1 >
ffff8801480598c0 1797432366 S Co:2:013:0 s 40 0c 0085 0088 0001 1 = 00
ffff8801480598c0 1797432780 C Co:2:013:0 0 1 >
ffff8801480598c0 1797435401 S Co:2:013:0 s 40 0c 0085 0088 0001 1 = 1d
ffff8801480598c0 1797435781 C Co:2:013:0 0 1 >
ffff8801480598c0 1797438436 S Co:2:013:0 s 40 0c 0085 0088 0001 1 = 00
ffff8801480598c0 1797438781 C Co:2:013:0 0 1 >
ffff8801480598c0 1797440390 S Ci:2:013:0 s c0 0c 0084 0006 0001 1 <
ffff8801480598c0 1797440657 C Ci:2:013:0 0 1 = 00
ffff8801480598c0 1797444367 S Co:2:013:0 s 40 0c 0085 f6ec 0001 1 = c4
ffff8801480598c0 1797444781 C Co:2:013:0 0 1 >
ffff8801480598c0 1797447401 S Co:2:013:0 s 40 0c 0085 f6ec 0001 1 = 24
ffff8801480598c0 1797447781 C Co:2:013:0 0 1 >
ffff8801480598c0 1797450436 S Co:2:013:0 s 40 0c 0085 f6ec 0001 1 = a6
ffff8801480598c0 1797450781 C Co:2:013:0 0 1 >
ffff8801480598c0 1797453329 S Co:2:013:0 s 40 0c 0085 f6ec 0001 1 = 18
ffff8801480598c0 1797453656 C Co:2:013:0 0 1 >
ffff8801480598c0 1797456364 S Co:2:013:0 s 40 0c 0085 f6ec 0001 1 = a6
ffff8801480598c0 1797456781 C Co:2:013:0 0 1 >
ffff8801480598c0 1797459395 S Co:2:013:0 s 40 0c 0085 f6ec 0001 1 = 18
ffff8801480598c0 1797459781 C Co:2:013:0 0 1 >
ffff8801480598c0 1797462431 S Co:2:013:0 s 40 0c 0085 f6ec 0001 1 = 51
ffff8801480598c0 1797462781 C Co:2:013:0 0 1 >
ffff8801480598c0 1797465329 S Co:2:013:0 s 40 0c 0085 f6ec 0001 1 = 4e
ffff8801480598c0 1797465657 C Co:2:013:0 0 1 >
ffff8801480598c0 1797468369 S Co:2:013:0 s 40 0c 0085 f6ec 0001 1 = 6a
ffff8801480598c0 1797468782 C Co:2:013:0 0 1 >
ffff8801480598c0 1797471405 S Co:2:013:0 s 40 0c 0085 f6ec 0001 1 = 00
ffff8801480598c0 1797471782 C Co:2:013:0 0 1 >
ffff8801480598c0 1797474445 S Co:2:013:0 s 40 0c 0085 f6ec 0001 1 = 00
ffff8801480598c0 1797474782 C Co:2:013:0 0 1 >
ffff8801480598c0 1797477329 S Co:2:013:0 s 40 0c 0085 f6ec 0001 1 = 00
ffff8801480598c0 1797477657 C Co:2:013:0 0 1 >
ffff8801480598c0 1797480362 S Co:2:013:0 s 40 0c 0085 f6ec 0001 1 = 0a
ffff8801480598c0 1797480782 C Co:2:013:0 0 1 >
ffff8801480598c0 1797483400 S Co:2:013:0 s 40 0c 0085 f6ec 0001 1 = 0a
ffff8801480598c0 1797483782 C Co:2:013:0 0 1 >
ffff8801480598c0 1797486435 S Co:2:013:0 s 40 0c 0085 f6ec 0001 1 = 0a
ffff8801480598c0 1797486782 C Co:2:013:0 0 1 >
ffff8801480598c0 1797489330 S Co:2:013:0 s 40 0c 0085 f6ec 0001 1 = 05
ffff8801480598c0 1797489658 C Co:2:013:0 0 1 >
ffff8801480598c0 1797492366 S Co:2:013:0 s 40 0c 0085 f6ec 0001 1 = 00
ffff8801480598c0 1797492782 C Co:2:013:0 0 1 >
ffff8801480598c0 1797495404 S Co:2:013:0 s 40 0c 0085 f6ec 0001 1 = 00
ffff8801480598c0 1797495783 C Co:2:013:0 0 1 >
ffff8801480598c0 1797498436 S Co:2:013:0 s 40 0c 0085 f6ec 0001 1 = 04
ffff8801480598c0 1797498783 C Co:2:013:0 0 1 >
ffff8801480598c0 1797501332 S Co:2:013:0 s 40 0c 0085 f6ec 0001 1 = 10
ffff8801480598c0 1797501658 C Co:2:013:0 0 1 >
ffff8801480598c0 1797504366 S Co:2:013:0 s 40 0c 0085 f6ec 0001 1 = 4e
ffff8801480598c0 1797504781 C Co:2:013:0 0 1 >
ffff8801480598c0 1797507405 S Co:2:013:0 s 40 0c 0085 f6ec 0001 1 = 00
ffff8801480598c0 1797507784 C Co:2:013:0 0 1 >
ffff8801480598c0 1797510435 S Co:2:013:0 s 40 0c 0085 f6ec 0001 1 = 29
ffff8801480598c0 1797510783 C Co:2:013:0 0 1 >
ffff8801480598c0 1797513331 S Co:2:013:0 s 40 0c 0085 f6ec 0001 1 = 00
ffff8801480598c0 1797513660 C Co:2:013:0 0 1 >
ffff8801480598c0 1797516364 S Co:2:013:0 s 40 0c 0085 f6ec 0001 1 = 00
ffff8801480598c0 1797516784 C Co:2:013:0 0 1 >
ffff8801480598c0 1797519395 S Co:2:013:0 s 40 0c 0085 f6ec 0001 1 = 00
ffff8801480598c0 1797519783 C Co:2:013:0 0 1 >
ffff8801480598c0 1797522430 S Co:2:013:0 s 40 0c 0085 f6ec 0001 1 = 00
ffff8801480598c0 1797522783 C Co:2:013:0 0 1 >
ffff8801480598c0 1797525333 S Co:2:013:0 s 40 0c 0085 f6ec 0001 1 = 00
ffff8801480598c0 1797525658 C Co:2:013:0 0 1 >
ffff8801480598c0 1797528369 S Co:2:013:0 s 40 0c 0085 f6ec 0001 1 = 00
ffff8801480598c0 1797528784 C Co:2:013:0 0 1 >
ffff8801480598c0 1797530392 S Ci:2:013:0 s c0 0c 0084 001d 0001 1 <
ffff8801480598c0 1797530659 C Ci:2:013:0 0 1 = 03
ffff8801480598c0 1797533428 S Ci:2:013:0 s c0 0c 0084 001d 0001 1 <
ffff8801480598c0 1797533659 C Ci:2:013:0 0 1 = 00
ffff8801480598c0 1797537331 S Co:2:013:0 s 40 0c 0088 0064 0001 1 = ff
ffff8801480598c0 1797537783 C Co:2:013:0 0 1 >
ffff8801480598c0 1797540364 S Co:2:013:0 s 40 0c 0088 0064 0001 1 = aa
ffff8801480598c0 1797540784 C Co:2:013:0 0 1 >
ffff8801480598c0 1797543400 S Co:2:013:0 s 40 0c 0088 0064 0001 1 = 55
ffff8801480598c0 1797543785 C Co:2:013:0 0 1 >
ffff8801480598c0 1797546436 S Co:2:013:0 s 40 0c 0088 0064 0001 1 = 00
ffff8801480598c0 1797546785 C Co:2:013:0 0 1 >
ffff8801480598c0 1797549331 S Co:2:013:0 s 40 0c 0088 0064 0001 1 = ff
ffff8801480598c0 1797549785 C Co:2:013:0 0 1 >
ffff8801480598c0 1797552362 S Co:2:013:0 s 40 0c 0088 0064 0001 1 = 87
ffff8801480598c0 1797552784 C Co:2:013:0 0 1 >
ffff8801480598c0 1797555394 S Co:2:013:0 s 40 0c 0088 0064 0001 1 = 78
ffff8801480598c0 1797555784 C Co:2:013:0 0 1 >
ffff8801480598c0 1797558429 S Co:2:013:0 s 40 0c 0088 0064 0001 1 = e0
ffff8801480598c0 1797558785 C Co:2:013:0 0 1 >
ffff8801480598c0 1797561333 S Co:2:013:0 s 40 0c 0087 0064 0001 1 = 05
ffff8801480598c0 1797561659 C Co:2:013:0 0 1 >
ffff8801480598c0 1797564370 S Co:2:013:0 s 40 0c 0087 0064 0001 1 = 04
ffff8801480598c0 1797564785 C Co:2:013:0 0 1 >
ffff8801480598c0 1797567408 S Co:2:013:0 s 40 0c 0088 0064 0001 1 = ff
ffff8801480598c0 1797567784 C Co:2:013:0 0 1 >
ffff8801480598c0 1797570443 S Co:2:013:0 s 40 0c 0085 0088 0001 1 = 15
ffff8801480598c0 1797570784 C Co:2:013:0 0 1 >
ffff8801480598c0 1797573331 S Co:2:013:0 s 40 0c 0085 0088 0001 1 = 00
ffff8801480598c0 1797573661 C Co:2:013:0 0 1 >
ffff8801480598c0 1797576364 S Co:2:013:0 s 40 0c 0085 0088 0001 1 = 00
ffff8801480598c0 1797576786 C Co:2:013:0 0 1 >
ffff8801480598c0 1797579395 S Co:2:013:0 s 40 0c 0085 0088 0001 1 = 00
ffff8801480598c0 1797579786 C Co:2:013:0 0 1 >
ffff8801480598c0 1797582429 S Co:2:013:0 s 40 0c 0085 0088 0001 1 = 10
ffff8801480598c0 1797582785 C Co:2:013:0 0 1 >
ffff8801480598c0 1797585333 S Co:2:013:0 s 40 0c 0085 0088 0001 1 = 00
ffff8801480598c0 1797585661 C Co:2:013:0 0 1 >
ffff8801480598c0 1797587357 S Ci:2:013:0 s c0 0c 0084 0006 0001 1 <
ffff8801480598c0 1797587535 C Ci:2:013:0 0 1 = 00
ffff8801480598c0 1797591406 S Co:2:013:0 s 40 0c 0085 f8e0 0001 1 = 00
ffff8801480598c0 1797591786 C Co:2:013:0 0 1 >
ffff8801480598c0 1797594442 S Co:2:013:0 s 40 0c 0085 f8e0 0001 1 = 0f
ffff8801480598c0 1797594786 C Co:2:013:0 0 1 >
ffff8801480598c0 1797597332 S Co:2:013:0 s 40 0c 0085 f8e0 0001 1 = 71
ffff8801480598c0 1797597662 C Co:2:013:0 0 1 >
ffff8801480598c0 1797600363 S Co:2:013:0 s 40 0c 0085 f8e0 0001 1 = 02
ffff8801480598c0 1797600786 C Co:2:013:0 0 1 >
ffff8801480598c0 1797603401 S Co:2:013:0 s 40 0c 0085 f8e0 0001 1 = 80
ffff8801480598c0 1797603786 C Co:2:013:0 0 1 >
ffff8801480598c0 1797606435 S Co:2:013:0 s 40 0c 0085 f8e0 0001 1 = 20
ffff8801480598c0 1797606786 C Co:2:013:0 0 1 >
ffff8801480598c0 1797609332 S Co:2:013:0 s 40 0c 0085 f8e0 0001 1 = 04
ffff8801480598c0 1797609661 C Co:2:013:0 0 1 >
ffff8801480598c0 1797612368 S Co:2:013:0 s 40 0c 0085 f8e0 0001 1 = 00
ffff8801480598c0 1797612787 C Co:2:013:0 0 1 >
ffff8801480598c0 1797615420 S Co:2:013:0 s 40 0c 0085 f8e0 0001 1 = 01
ffff8801480598c0 1797615788 C Co:2:013:0 0 1 >
ffff8801480598c0 1797618452 S Co:2:013:0 s 40 0c 0085 f8e0 0001 1 = 0a
ffff8801480598c0 1797618785 C Co:2:013:0 0 1 >
ffff8801480598c0 1797621348 S Co:2:013:0 s 40 0c 0085 f8e0 0001 1 = 00
ffff8801480598c0 1797621661 C Co:2:013:0 0 1 >
ffff8801480598c0 1797624362 S Co:2:013:0 s 40 0c 0085 f8e0 0001 1 = 00
ffff8801480598c0 1797624824 C Co:2:013:0 0 1 >
ffff8801480598c0 1797627394 S Co:2:013:0 s 40 0c 0085 f8e0 0001 1 = 00
ffff8801480598c0 1797627824 C Co:2:013:0 0 1 >
ffff8801480598c0 1797630429 S Co:2:013:0 s 40 0c 0085 f8e0 0001 1 = 80
ffff8801480598c0 1797630787 C Co:2:013:0 0 1 >
ffff8801480598c0 1797633328 S Co:2:013:0 s 40 0c 0085 f8e0 0001 1 = 10
ffff8801480598c0 1797633661 C Co:2:013:0 0 1 >
ffff8801480598c0 1797636364 S Co:2:013:0 s 40 0c 0085 f8e0 0001 1 = 00
ffff8801480598c0 1797636850 C Co:2:013:0 0 1 >
ffff8801480598c0 1797638462 S Ci:2:013:0 s c0 0c 0084 0010 0001 1 <
ffff8801480598c0 1797638701 C Ci:2:013:0 0 1 = 03
ffff8801480598c0 1797641466 S Ci:2:013:0 s c0 0c 0084 0010 0001 1 <
ffff8801480598c0 1797641686 C Ci:2:013:0 0 1 = 00
ffff8801480598c0 1797645543 S Co:2:013:0 s 40 0c 0088 f900 0001 1 = ff
ffff8801480598c0 1797645912 C Co:2:013:0 0 1 >
ffff8801480598c0 1797648369 S Co:2:013:0 s 40 0c 0088 f900 0001 1 = aa
ffff8801480598c0 1797648787 C Co:2:013:0 0 1 >
ffff8801480598c0 1797651404 S Co:2:013:0 s 40 0c 0088 f900 0001 1 = 55
ffff8801480598c0 1797651825 C Co:2:013:0 0 1 >
ffff8801480598c0 1797654439 S Co:2:013:0 s 40 0c 0088 f900 0001 1 = 00
ffff8801480598c0 1797654793 C Co:2:013:0 0 1 >
ffff8801480598c0 1797657331 S Co:2:013:0 s 40 0c 0088 f900 0001 1 = ff
ffff8801480598c0 1797657826 C Co:2:013:0 0 1 >
ffff8801480598c0 1797660368 S Co:2:013:0 s 40 0c 0088 f900 0001 1 = 87
ffff8801480598c0 1797660820 C Co:2:013:0 0 1 >
ffff8801480598c0 1797663407 S Co:2:013:0 s 40 0c 0088 f900 0001 1 = 78
ffff8801480598c0 1797663849 C Co:2:013:0 0 1 >
ffff8801480598c0 1797666438 S Co:2:013:0 s 40 0c 0088 f900 0001 1 = e0
ffff8801480598c0 1797666956 C Co:2:013:0 0 1 >
ffff8801480598c0 1797669349 S Co:2:013:0 s 40 0c 0087 f900 0001 1 = 05
ffff8801480598c0 1797669826 C Co:2:013:0 0 1 >
ffff8801480598c0 1797672371 S Co:2:013:0 s 40 0c 0087 f900 0001 1 = 04
ffff8801480598c0 1797672851 C Co:2:013:0 0 1 >
ffff8801480598c0 1797675411 S Co:2:013:0 s 40 0c 0088 f900 0001 1 = ff
ffff8801480598c0 1797675976 C Co:2:013:0 0 1 >
ffff8801480598c0 1797678447 S Co:2:013:0 s 40 0c 0085 0088 0001 1 = 00
ffff8801480598c0 1797678825 C Co:2:013:0 0 1 >
ffff8801480598c0 1797681336 S Co:2:013:0 s 40 0c 0085 0088 0001 1 = 00
ffff8801480598c0 1797681852 C Co:2:013:0 0 1 >
ffff8801480598c0 1797684364 S Co:2:013:0 s 40 0c 0085 0088 0001 1 = 00
ffff8801480598c0 1797684851 C Co:2:013:0 0 1 >
ffff8801480598c0 1797687409 S Co:2:013:0 s 40 0c 0085 0088 0001 1 = 00
ffff8801480598c0 1797687852 C Co:2:013:0 0 1 >
ffff8801480598c0 1797690435 S Co:2:013:0 s 40 0c 0085 0088 0001 1 = 00
ffff8801480598c0 1797690852 C Co:2:013:0 0 1 >
ffff8801480598c0 1797693337 S Co:2:013:0 s 40 0c 0085 0088 0001 1 = 00
ffff8801480598c0 1797693851 C Co:2:013:0 0 1 >
ffff8801480598c0 1797695353 S Ci:2:013:0 s c0 0c 0084 0006 0001 1 <
ffff8801480598c0 1797695546 C Ci:2:013:0 0 1 = 03
ffff8801480598c0 1797698384 S Ci:2:013:0 s c0 0c 0084 0006 0001 1 <
ffff8801480598c0 1797698707 C Ci:2:013:0 0 1 = 00
ffff8801480598c0 1797702434 S Co:2:013:0 s 40 0c 0088 0001 0001 1 = ff
ffff8801480598c0 1797702956 C Co:2:013:0 0 1 >
ffff8801480598c0 1797705337 S Co:2:013:0 s 40 0c 0088 0001 0001 1 = aa
ffff8801480598c0 1797705852 C Co:2:013:0 0 1 >
ffff8801480598c0 1797708380 S Co:2:013:0 s 40 0c 0088 0001 0001 1 = 55
ffff8801480598c0 1797708852 C Co:2:013:0 0 1 >
ffff8801480598c0 1797711415 S Co:2:013:0 s 40 0c 0088 0001 0001 1 = 00
ffff8801480598c0 1797711851 C Co:2:013:0 0 1 >
ffff8801480598c0 1797714451 S Co:2:013:0 s 40 0c 0088 0001 0001 1 = ff
ffff8801480598c0 1797714957 C Co:2:013:0 0 1 >
ffff8801480598c0 1797717337 S Co:2:013:0 s 40 0c 0088 0001 0001 1 = 87
ffff8801480598c0 1797717854 C Co:2:013:0 0 1 >
ffff8801480598c0 1797720369 S Co:2:013:0 s 40 0c 0088 0001 0001 1 = 78
ffff8801480598c0 1797720854 C Co:2:013:0 0 1 >
ffff8801480598c0 1797723402 S Co:2:013:0 s 40 0c 0088 0001 0001 1 = e0
ffff8801480598c0 1797723855 C Co:2:013:0 0 1 >
ffff8801480598c0 1797726443 S Co:2:013:0 s 40 0c 0087 0001 0001 1 = 05
ffff8801480598c0 1797726834 C Co:2:013:0 0 1 >
ffff8801480598c0 1797729336 S Co:2:013:0 s 40 0c 0087 0001 0001 1 = 04
ffff8801480598c0 1797729854 C Co:2:013:0 0 1 >
ffff8801480598c0 1797732372 S Co:2:013:0 s 40 0c 0088 0001 0001 1 = ff
ffff8801480598c0 1797732840 C Co:2:013:0 0 1 >
ffff8801480598c0 1797735412 S Co:2:013:0 s 40 0c 0085 0088 0001 1 = d1
ffff8801480598c0 1797735854 C Co:2:013:0 0 1 >
ffff8801480598c0 1797738456 S Co:2:013:0 s 40 0c 0085 0088 0001 1 = 00
ffff8801480598c0 1797738829 C Co:2:013:0 0 1 >
ffff8801480598c0 1797741324 S Co:2:013:0 s 40 0c 0085 0088 0001 1 = 00
ffff8801480598c0 1797741702 C Co:2:013:0 0 1 >
ffff8801480598c0 1797744363 S Co:2:013:0 s 40 0c 0085 0088 0001 1 = 00
ffff8801480598c0 1797744828 C Co:2:013:0 0 1 >
ffff8801480598c0 1797747391 S Co:2:013:0 s 40 0c 0085 0088 0001 1 = 04
ffff8801480598c0 1797747879 C Co:2:013:0 0 1 >
ffff8801480598c0 1797750464 S Co:2:013:0 s 40 0c 0085 0088 0001 1 = 00
ffff8801480598c0 1797750953 C Co:2:013:0 0 1 >
ffff8801480598c0 1797752508 S Ci:2:013:0 s c0 0c 0084 0006 0001 1 <
ffff8801480598c0 1797752874 C Ci:2:013:0 0 1 = 00
ffff8801480598c0 1797756361 S Co:2:013:0 s 40 0c 0085 f8e4 0001 1 = 10
ffff8801480598c0 1797756814 C Co:2:013:0 0 1 >
ffff8801480598c0 1797759392 S Co:2:013:0 s 40 0c 0085 f8e4 0001 1 = 73
ffff8801480598c0 1797759829 C Co:2:013:0 0 1 >
ffff8801480598c0 1797762427 S Co:2:013:0 s 40 0c 0085 f8e4 0001 1 = 00
ffff8801480598c0 1797762829 C Co:2:013:0 0 1 >
ffff8801480598c0 1797765329 S Co:2:013:0 s 40 0c 0085 f8e4 0001 1 = 00
ffff8801480598c0 1797765706 C Co:2:013:0 0 1 >
ffff8801480598c0 1797767419 S Ci:2:013:0 s c0 0c 0084 0004 0001 1 <
ffff8801480598c0 1797767703 C Ci:2:013:0 0 1 = 03
ffff8801480598c0 1797770467 S Ci:2:013:0 s c0 0c 0084 0004 0001 1 <
ffff8801480598c0 1797770703 C Ci:2:013:0 0 1 = 00
ffff880094133a80 1798309378 S Co:2:013:0 s 40 0c 0088 0000 0001 1 = ff
ffff880094133a80 1798309813 C Co:2:013:0 0 1 >
ffff880094133a80 1798312402 S Co:2:013:0 s 40 0c 0088 0000 0001 1 = aa
ffff880094133a80 1798312811 C Co:2:013:0 0 1 >
ffff880094133a80 1798315430 S Co:2:013:0 s 40 0c 0088 0000 0001 1 = 55
ffff880094133a80 1798315810 C Co:2:013:0 0 1 >
ffff880094133a80 1798318344 S Co:2:013:0 s 40 0c 0088 0000 0001 1 = 00
ffff880094133a80 1798318809 C Co:2:013:0 0 1 >
ffff880094133a80 1798321383 S Co:2:013:0 s 40 0c 0088 0000 0001 1 = ff
ffff880094133a80 1798321810 C Co:2:013:0 0 1 >
ffff880094133a80 1798324415 S Co:2:013:0 s 40 0c 0088 0000 0001 1 = 87
ffff880094133a80 1798324811 C Co:2:013:0 0 1 >
ffff880094133a80 1798327447 S Co:2:013:0 s 40 0c 0088 0000 0001 1 = 78
ffff880094133a80 1798327810 C Co:2:013:0 0 1 >
ffff880094133a80 1798330341 S Co:2:013:0 s 40 0c 0088 0000 0001 1 = e0
ffff880094133a80 1798330685 C Co:2:013:0 0 1 >
ffff880094133a80 1798333376 S Co:2:013:0 s 40 0c 0087 0000 0001 1 = 05
ffff880094133a80 1798333810 C Co:2:013:0 0 1 >
ffff880094133a80 1798336410 S Co:2:013:0 s 40 0c 0087 0000 0001 1 = 04
ffff880094133a80 1798336810 C Co:2:013:0 0 1 >
ffff880094133a80 1798339440 S Co:2:013:0 s 40 0c 0088 0000 0001 1 = ff
ffff880094133a80 1798339812 C Co:2:013:0 0 1 >
ffff880094133a80 1798342345 S Co:2:013:0 s 40 0c 0085 0088 0001 1 = 00
ffff880094133a80 1798342686 C Co:2:013:0 0 1 >
ffff880094133a80 1798345375 S Co:2:013:0 s 40 0c 0085 0088 0001 1 = 00
ffff880094133a80 1798345811 C Co:2:013:0 0 1 >
ffff880094133a80 1798348415 S Co:2:013:0 s 40 0c 0085 0088 0001 1 = 00
ffff880094133a80 1798348811 C Co:2:013:0 0 1 >
ffff880094133a80 1798351442 S Co:2:013:0 s 40 0c 0085 0088 0001 1 = 00
ffff880094133a80 1798351811 C Co:2:013:0 0 1 >
ffff880094133a80 1798354340 S Co:2:013:0 s 40 0c 0085 0088 0001 1 = 00
ffff880094133a80 1798354687 C Co:2:013:0 0 1 >
ffff880094133a80 1798357370 S Co:2:013:0 s 40 0c 0085 0088 0001 1 = 00
ffff880094133a80 1798357687 C Co:2:013:0 0 1 >
ffff880094133a80 1798359400 S Ci:2:013:0 s c0 0c 0084 0006 0001 1 <
ffff880094133a80 1798359686 C Ci:2:013:0 0 1 = 03
ffff880094133a80 1798362428 S Ci:2:013:0 s c0 0c 0084 0006 0001 1 <
ffff880094133a80 1798362686 C Ci:2:013:0 0 1 = 00
ffff880094133a80 1798366345 S Co:2:013:0 s 40 0c 0088 969e 0001 1 = ff
ffff880094133a80 1798366686 C Co:2:013:0 0 1 >
ffff880094133a80 1798369381 S Co:2:013:0 s 40 0c 0088 969e 0001 1 = aa
ffff880094133a80 1798369813 C Co:2:013:0 0 1 >
ffff880094133a80 1798372417 S Co:2:013:0 s 40 0c 0088 969e 0001 1 = 55
ffff880094133a80 1798372813 C Co:2:013:0 0 1 >
ffff880094133a80 1798375443 S Co:2:013:0 s 40 0c 0088 969e 0001 1 = 00
ffff880094133a80 1798375812 C Co:2:013:0 0 1 >
ffff880094133a80 1798378343 S Co:2:013:0 s 40 0c 0088 969e 0001 1 = ff
ffff880094133a80 1798378688 C Co:2:013:0 0 1 >
ffff880094133a80 1798381378 S Co:2:013:0 s 40 0c 0088 969e 0001 1 = 87
ffff880094133a80 1798381811 C Co:2:013:0 0 1 >
ffff880094133a80 1798384412 S Co:2:013:0 s 40 0c 0088 969e 0001 1 = 78
ffff880094133a80 1798384812 C Co:2:013:0 0 1 >
ffff880094133a80 1798387437 S Co:2:013:0 s 40 0c 0088 969e 0001 1 = e0
ffff880094133a80 1798387812 C Co:2:013:0 0 1 >
ffff880094133a80 1798390343 S Co:2:013:0 s 40 0c 0087 969e 0001 1 = 05
ffff880094133a80 1798390688 C Co:2:013:0 0 1 >
ffff880094133a80 1798393378 S Co:2:013:0 s 40 0c 0087 969e 0001 1 = 04
ffff880094133a80 1798393812 C Co:2:013:0 0 1 >
ffff880094133a80 1798396413 S Co:2:013:0 s 40 0c 0088 969e 0001 1 = ff
ffff880094133a80 1798396812 C Co:2:013:0 0 1 >
ffff880094133a80 1798399440 S Co:2:013:0 s 40 0c 0085 0088 0001 1 = 1b
ffff880094133a80 1798399812 C Co:2:013:0 0 1 >
ffff880094133a80 1798402344 S Co:2:013:0 s 40 0c 0085 0088 0001 1 = 00
ffff880094133a80 1798402688 C Co:2:013:0 0 1 >
ffff880094133a80 1798405379 S Co:2:013:0 s 40 0c 0085 0088 0001 1 = 00
ffff880094133a80 1798405814 C Co:2:013:0 0 1 >
ffff880094133a80 1798408415 S Co:2:013:0 s 40 0c 0085 0088 0001 1 = 00
ffff880094133a80 1798408812 C Co:2:013:0 0 1 >
ffff880094133a80 1798411444 S Co:2:013:0 s 40 0c 0085 0088 0001 1 = 01
ffff880094133a80 1798411812 C Co:2:013:0 0 1 >
ffff880094133a80 1798414341 S Co:2:013:0 s 40 0c 0085 0088 0001 1 = 00
ffff880094133a80 1798414688 C Co:2:013:0 0 1 >
ffff880094133a80 1798416409 S Ci:2:013:0 s c0 0c 0084 0006 0001 1 <
ffff880094133a80 1798416689 C Ci:2:013:0 0 1 = 03
ffff880094133a80 1798419657 S Ci:2:013:0 s c0 0c 0084 0006 0001 1 <
ffff880094133a80 1798419939 C Ci:2:013:0 0 1 = 00
ffff880094133a80 1798423440 S Co:2:013:0 s 40 0c 0088 0cc8 0001 1 = ff
ffff880094133a80 1798423813 C Co:2:013:0 0 1 >
ffff880094133a80 1798426345 S Co:2:013:0 s 40 0c 0088 0cc8 0001 1 = aa
ffff880094133a80 1798426688 C Co:2:013:0 0 1 >
ffff880094133a80 1798429375 S Co:2:013:0 s 40 0c 0088 0cc8 0001 1 = 55
ffff880094133a80 1798429814 C Co:2:013:0 0 1 >
ffff880094133a80 1798432410 S Co:2:013:0 s 40 0c 0088 0cc8 0001 1 = 00
ffff880094133a80 1798432814 C Co:2:013:0 0 1 >
ffff880094133a80 1798435440 S Co:2:013:0 s 40 0c 0088 0cc8 0001 1 = ff
ffff880094133a80 1798435814 C Co:2:013:0 0 1 >
ffff880094133a80 1798438340 S Co:2:013:0 s 40 0c 0088 0cc8 0001 1 = 87
ffff880094133a80 1798438813 C Co:2:013:0 0 1 >
ffff880094133a80 1798441380 S Co:2:013:0 s 40 0c 0088 0cc8 0001 1 = 78
ffff880094133a80 1798441815 C Co:2:013:0 0 1 >
ffff880094133a80 1798444410 S Co:2:013:0 s 40 0c 0088 0cc8 0001 1 = e0
ffff880094133a80 1798444814 C Co:2:013:0 0 1 >
ffff880094133a80 1798447441 S Co:2:013:0 s 40 0c 0087 0cc8 0001 1 = 05
ffff880094133a80 1798447815 C Co:2:013:0 0 1 >
ffff880094133a80 1798450341 S Co:2:013:0 s 40 0c 0087 0cc8 0001 1 = 04
ffff880094133a80 1798450690 C Co:2:013:0 0 1 >
ffff880094133a80 1798453378 S Co:2:013:0 s 40 0c 0088 0cc8 0001 1 = ff
ffff880094133a80 1798453815 C Co:2:013:0 0 1 >
ffff880094133a80 1798456409 S Co:2:013:0 s 40 0c 0085 0088 0001 1 = 18
ffff880094133a80 1798456815 C Co:2:013:0 0 1 >
ffff880094133a80 1798459440 S Co:2:013:0 s 40 0c 0085 0088 0001 1 = 00
ffff880094133a80 1798459815 C Co:2:013:0 0 1 >
ffff880094133a80 1798462339 S Co:2:013:0 s 40 0c 0085 0088 0001 1 = 00
ffff880094133a80 1798462690 C Co:2:013:0 0 1 >
ffff880094133a80 1798465374 S Co:2:013:0 s 40 0c 0085 0088 0001 1 = 1d
ffff880094133a80 1798465691 C Co:2:013:0 0 1 >
ffff880094133a80 1798468410 S Co:2:013:0 s 40 0c 0085 0088 0001 1 = 1a
ffff880094133a80 1798468816 C Co:2:013:0 0 1 >
ffff880094133a80 1798471439 S Co:2:013:0 s 40 0c 0085 0088 0001 1 = 00
ffff880094133a80 1798471815 C Co:2:013:0 0 1 >
ffff880094133a80 1798473370 S Ci:2:013:0 s c0 0c 0084 0006 0001 1 <
ffff880094133a80 1798473565 C Ci:2:013:0 0 1 = 03
ffff880094133a80 1798476397 S Ci:2:013:0 s c0 0c 0084 0006 0001 1 <
ffff880094133a80 1798476941 C Ci:2:013:0 0 1 = 08
ffff8801417a9480 1799975371 S Co:2:013:0 s 40 0c 0088 ffff 0001 1 = ff
ffff8801417a9480 1799975930 C Co:2:013:0 0 1 >
ffff8801417a9480 1799978394 S Co:2:013:0 s 40 0c 0088 ffff 0001 1 = aa
ffff8801417a9480 1799978777 C Co:2:013:0 0 1 >
ffff8801417a9480 1799981439 S Co:2:013:0 s 40 0c 0088 ffff 0001 1 = 55
ffff8801417a9480 1799981930 C Co:2:013:0 0 1 >
ffff8801417a9480 1799984318 S Co:2:013:0 s 40 0c 0088 ffff 0001 1 = 00
ffff8801417a9480 1799984802 C Co:2:013:0 0 1 >
ffff8801417a9480 1799987349 S Co:2:013:0 s 40 0c 0088 ffff 0001 1 = ff
ffff8801417a9480 1799987779 C Co:2:013:0 0 1 >
ffff8801417a9480 1799990383 S Co:2:013:0 s 40 0c 0088 ffff 0001 1 = 87
ffff8801417a9480 1799990785 C Co:2:013:0 0 1 >
ffff8801417a9480 1799993424 S Co:2:013:0 s 40 0c 0088 ffff 0001 1 = 78
ffff8801417a9480 1799993929 C Co:2:013:0 0 1 >
ffff8801417a9480 1799996317 S Co:2:013:0 s 40 0c 0088 ffff 0001 1 = e0
ffff8801417a9480 1799996803 C Co:2:013:0 0 1 >
ffff8801417a9480 1799999353 S Co:2:013:0 s 40 0c 0087 ffff 0001 1 = 05
ffff8801417a9480 1799999803 C Co:2:013:0 0 1 >
ffff8801417a9480 1800002391 S Co:2:013:0 s 40 0c 0087 ffff 0001 1 = 04
ffff8801417a9480 1800002785 C Co:2:013:0 0 1 >
ffff8801417a9480 1800005422 S Co:2:013:0 s 40 0c 0088 ffff 0001 1 = ff
ffff8801417a9480 1800005928 C Co:2:013:0 0 1 >
ffff8801417a9480 1800008318 S Co:2:013:0 s 40 0c 0085 0088 0001 1 = 18
ffff8801417a9480 1800008803 C Co:2:013:0 0 1 >
ffff8801417a9480 1800011349 S Co:2:013:0 s 40 0c 0085 0088 0001 1 = 00
ffff8801417a9480 1800011804 C Co:2:013:0 0 1 >
ffff8801417a9480 1800014391 S Co:2:013:0 s 40 0c 0085 0088 0001 1 = 00
ffff8801417a9480 1800014929 C Co:2:013:0 0 1 >
ffff8801417a9480 1800017415 S Co:2:013:0 s 40 0c 0085 0088 0001 1 = 1d
ffff8801417a9480 1800017929 C Co:2:013:0 0 1 >
ffff8801417a9480 1800020323 S Co:2:013:0 s 40 0c 0085 0088 0001 1 = 1a
ffff8801417a9480 1800020804 C Co:2:013:0 0 1 >
ffff8801417a9480 1800023355 S Co:2:013:0 s 40 0c 0085 0088 0001 1 = 00
ffff8801417a9480 1800023805 C Co:2:013:0 0 1 >
ffff8801417a9480 1800025426 S Ci:2:013:0 s c0 0c 0084 0006 0001 1 <
ffff8801417a9480 1800025804 C Ci:2:013:0 0 1 = 01
ffff8801417a9480 1800029435 S Co:2:013:0 s 40 04 0082 1694 0008 8 = 00000000 1a1d0000
ffff8801417a9480 1800029785 C Co:2:013:0 0 8 >
ffff8801417a9480 1800031533 S Bi:2:013:1 -115 7168 <
ffff8801417a9480 1800135786 C Bi:2:013:1 0 7168 = 70707070 70707070 00707070 70707070 00707070 70707070 00707070 70707070
ffff8801417a9480 1800148424 S Bi:2:013:1 -115 512 <
ffff8801417a9480 1800148503 C Bi:2:013:1 0 282 = 00707070 70707070 00707070 70707070 00707070 70707070 00707070 70707070
ffff8801417a9480 1800151448 S Ci:2:013:0 s c0 0c 0084 48c8 0001 1 <
ffff8801417a9480 1800151908 C Ci:2:013:0 0 1 = 03
ffff8801417a9540 1800154474 S Ci:2:013:0 s c0 0c 0084 48c8 0001 1 <
ffff8801417a9540 1800154748 C Ci:2:013:0 0 1 = 00
ffff8801417a9540 1800158393 S Co:2:013:0 s 40 0c 0088 0750 0001 1 = ff
ffff8801417a9540 1800158752 C Co:2:013:0 0 1 >
ffff8801417a9540 1800161442 S Co:2:013:0 s 40 0c 0088 0750 0001 1 = aa
ffff8801417a9540 1800161908 C Co:2:013:0 0 1 >
ffff8801417a9540 1800164318 S Co:2:013:0 s 40 0c 0088 0750 0001 1 = 55
ffff8801417a9540 1800164746 C Co:2:013:0 0 1 >
ffff8801417a9540 1800167352 S Co:2:013:0 s 40 0c 0088 0750 0001 1 = 00
ffff8801417a9540 1800167746 C Co:2:013:0 0 1 >
ffff8801417a9540 1800170385 S Co:2:013:0 s 40 0c 0088 0750 0001 1 = ff
ffff8801417a9540 1800170747 C Co:2:013:0 0 1 >
ffff8801417a9540 1800173417 S Co:2:013:0 s 40 0c 0088 0750 0001 1 = 87
ffff8801417a9540 1800173872 C Co:2:013:0 0 1 >
ffff8801417a9cc0 1800176346 S Co:2:013:0 s 40 0c 0088 0750 0001 1 = 78
ffff8801417a9cc0 1800176784 C Co:2:013:0 0 1 >
ffff8801417a9cc0 1800179351 S Co:2:013:0 s 40 0c 0088 0750 0001 1 = e0
ffff8801417a9cc0 1800179771 C Co:2:013:0 0 1 >
ffff8801417a9cc0 1800182389 S Co:2:013:0 s 40 0c 0087 0750 0001 1 = 05
ffff8801417a9cc0 1800182748 C Co:2:013:0 0 1 >
ffff8801417a9cc0 1800185423 S Co:2:013:0 s 40 0c 0087 0750 0001 1 = 04
ffff8801417a9cc0 1800185910 C Co:2:013:0 0 1 >
ffff8801417a9cc0 1800188324 S Co:2:013:0 s 40 0c 0088 0750 0001 1 = ff
ffff8801417a9cc0 1800188785 C Co:2:013:0 0 1 >
ffff8801417a9cc0 1800191356 S Co:2:013:0 s 40 0c 0085 0088 0001 1 = 0f
ffff8801417a9cc0 1800191785 C Co:2:013:0 0 1 >
ffff8801417a9cc0 1800194397 S Co:2:013:0 s 40 0c 0085 0088 0001 1 = 00
ffff8801417a9cc0 1800194793 C Co:2:013:0 0 1 >
ffff8801417a9cc0 1800197428 S Co:2:013:0 s 40 0c 0085 0088 0001 1 = 00
ffff8801417a9cc0 1800197746 C Co:2:013:0 0 1 >
ffff8801417a9cc0 1800200320 S Co:2:013:0 s 40 0c 0085 0088 0001 1 = 00
ffff8801417a9cc0 1800200660 C Co:2:013:0 0 1 >
ffff8801417a9cc0 1800203371 S Co:2:013:0 s 40 0c 0085 0088 0001 1 = 12
ffff8801417a9cc0 1800203810 C Co:2:013:0 0 1 >
ffff8801417a9cc0 1800206389 S Co:2:013:0 s 40 0c 0085 0088 0001 1 = 00
ffff8801417a9cc0 1800206818 C Co:2:013:0 0 1 >
ffff8801417a9cc0 1800208471 S Ci:2:013:0 s c0 0c 0084 0006 0001 1 <
ffff8801417a9cc0 1800208747 C Ci:2:013:0 0 1 = 01
ffff8801417a9cc0 1800212317 S Co:2:013:0 s 40 04 0082 1694 0008 8 = 00000000 12000000
ffff8801417a9cc0 1800212622 C Co:2:013:0 0 8 >
ffff8801417a9cc0 1800214413 S Bi:2:013:1 -115 512 <
ffff8801417a9cc0 1800214501 C Bi:2:013:1 0 18 = a2039a03 44070808 c44e0000 00000000 0000
ffff8801417a9cc0 1800217382 S Ci:2:013:0 s c0 0c 0084 48c8 0001 1 <
ffff8801417a9cc0 1800217671 C Ci:2:013:0 0 1 = 03
ffff8801417a9cc0 1800220444 S Ci:2:013:0 s c0 0c 0084 48c8 0001 1 <
ffff8801417a9cc0 1800220810 C Ci:2:013:0 0 1 = 00
ffff8801417a9cc0 1800237830 S Co:2:013:0 s 40 0c 0088 491c 0001 1 = ff
ffff8801417a9cc0 1800238287 C Co:2:013:0 0 1 >
ffff8801417a9cc0 1800240539 S Co:2:013:0 s 40 0c 0088 491c 0001 1 = aa
ffff8801417a9cc0 1800241036 C Co:2:013:0 0 1 >
ffff8801417a9cc0 1800243578 S Co:2:013:0 s 40 0c 0088 491c 0001 1 = 55
ffff8801417a9cc0 1800244062 C Co:2:013:0 0 1 >
ffff8801417a9cc0 1800246606 S Co:2:013:0 s 40 0c 0088 491c 0001 1 = 00
ffff8801417a9cc0 1800247029 C Co:2:013:0 0 1 >
ffff8801417a9cc0 1800249507 S Co:2:013:0 s 40 0c 0088 491c 0001 1 = ff
ffff8801417a9cc0 1800249912 C Co:2:013:0 0 1 >
ffff8801417a9cc0 1800252544 S Co:2:013:0 s 40 0c 0088 491c 0001 1 = 87
ffff8801417a9cc0 1800253063 C Co:2:013:0 0 1 >
ffff8801417a9cc0 1800255573 S Co:2:013:0 s 40 0c 0088 491c 0001 1 = 78
ffff8801417a9cc0 1800256005 C Co:2:013:0 0 1 >
ffff8801417a9cc0 1800258612 S Co:2:013:0 s 40 0c 0088 491c 0001 1 = e0
ffff8801417a9cc0 1800259036 C Co:2:013:0 0 1 >
ffff8801417a9cc0 1800261502 S Co:2:013:0 s 40 0c 0087 491c 0001 1 = 05
ffff8801417a9cc0 1800261912 C Co:2:013:0 0 1 >
ffff8801417a9cc0 1800264535 S Co:2:013:0 s 40 0c 0087 491c 0001 1 = 04
ffff8801417a9cc0 1800264912 C Co:2:013:0 0 1 >
ffff8801417a9cc0 1800267569 S Co:2:013:0 s 40 0c 0088 491c 0001 1 = ff
ffff8801417a9cc0 1800268037 C Co:2:013:0 0 1 >
ffff8801417a9cc0 1800270604 S Co:2:013:0 s 40 0c 0085 0088 0001 1 = 08
ffff8801417a9cc0 1800271029 C Co:2:013:0 0 1 >
ffff8801417a9cc0 1800273500 S Co:2:013:0 s 40 0c 0085 0088 0001 1 = 00
ffff8801417a9cc0 1800273938 C Co:2:013:0 0 1 >
ffff8801417a9cc0 1800276536 S Co:2:013:0 s 40 0c 0085 0088 0001 1 = 00
ffff8801417a9cc0 1800277063 C Co:2:013:0 0 1 >
ffff8801417a9cc0 1800279571 S Co:2:013:0 s 40 0c 0085 0088 0001 1 = 00
ffff8801417a9cc0 1800280063 C Co:2:013:0 0 1 >
ffff8801417a9cc0 1800282613 S Co:2:013:0 s 40 0c 0085 0088 0001 1 = ff
ffff8801417a9cc0 1800283030 C Co:2:013:0 0 1 >
ffff8801417a9cc0 1800285500 S Co:2:013:0 s 40 0c 0085 0088 0001 1 = 00
ffff8801417a9cc0 1800285913 C Co:2:013:0 0 1 >
ffff8801417a9cc0 1800287597 S Ci:2:013:0 s c0 0c 0084 0006 0001 1 <
ffff8801417a9cc0 1800287913 C Ci:2:013:0 0 1 = 03
ffff8801417a9cc0 1800290608 S Ci:2:013:0 s c0 0c 0084 0006 0001 1 <
ffff8801417a9cc0 1800290924 C Ci:2:013:0 0 1 = 08
ffff8801417a9cc0 1801789554 S Co:2:013:0 s 40 0c 0088 ffff 0001 1 = ff
ffff8801417a9cc0 1801789964 C Co:2:013:0 0 1 >
ffff8801417a9cc0 1801792583 S Co:2:013:0 s 40 0c 0088 ffff 0001 1 = aa
ffff8801417a9cc0 1801793112 C Co:2:013:0 0 1 >
ffff8801417a9cc0 1801795611 S Co:2:013:0 s 40 0c 0088 ffff 0001 1 = 55
ffff8801417a9cc0 1801796087 C Co:2:013:0 0 1 >
ffff8801417a9cc0 1801798545 S Co:2:013:0 s 40 0c 0088 ffff 0001 1 = 00
ffff8801417a9cc0 1801798964 C Co:2:013:0 0 1 >
ffff8801417a9cc0 1801801543 S Co:2:013:0 s 40 0c 0088 ffff 0001 1 = ff
ffff8801417a9cc0 1801801988 C Co:2:013:0 0 1 >
ffff8801417a9cc0 1801804573 S Co:2:013:0 s 40 0c 0088 ffff 0001 1 = 87
ffff8801417a9cc0 1801805113 C Co:2:013:0 0 1 >
ffff8801417a9cc0 1801807615 S Co:2:013:0 s 40 0c 0088 ffff 0001 1 = 78
ffff8801417a9cc0 1801808088 C Co:2:013:0 0 1 >
ffff8801417a9cc0 1801810517 S Co:2:013:0 s 40 0c 0088 ffff 0001 1 = e0
ffff8801417a9cc0 1801810990 C Co:2:013:0 0 1 >
ffff8801417a9cc0 1801813556 S Co:2:013:0 s 40 0c 0087 ffff 0001 1 = 05
ffff8801417a9cc0 1801813963 C Co:2:013:0 0 1 >
ffff8801417a9cc0 1801816741 S Co:2:013:0 s 40 0c 0087 ffff 0001 1 = 04
ffff8801417a9cc0 1801817215 C Co:2:013:0 0 1 >
ffff8801417a9cc0 1801819624 S Co:2:013:0 s 40 0c 0088 ffff 0001 1 = ff
ffff8801417a9cc0 1801820089 C Co:2:013:0 0 1 >
ffff8801417a9cc0 1801822510 S Co:2:013:0 s 40 0c 0085 0088 0001 1 = 08
ffff8801417a9cc0 1801822989 C Co:2:013:0 0 1 >
ffff8801417a9cc0 1801825541 S Co:2:013:0 s 40 0c 0085 0088 0001 1 = 00
ffff8801417a9cc0 1801825989 C Co:2:013:0 0 1 >
ffff8801417a9cc0 1801828574 S Co:2:013:0 s 40 0c 0085 0088 0001 1 = 00
ffff8801417a9cc0 1801828987 C Co:2:013:0 0 1 >
ffff8801417a9cc0 1801831603 S Co:2:013:0 s 40 0c 0085 0088 0001 1 = 00
ffff8801417a9cc0 1801831963 C Co:2:013:0 0 1 >
ffff8801417a9cc0 1801834551 S Co:2:013:0 s 40 0c 0085 0088 0001 1 = ff
ffff8801417a9cc0 1801834991 C Co:2:013:0 0 1 >
ffff8801417a9cc0 1801837548 S Co:2:013:0 s 40 0c 0085 0088 0001 1 = 00
ffff8801417a9cc0 1801837989 C Co:2:013:0 0 1 >
ffff8801417a9cc0 1801839664 S Ci:2:013:0 s c0 0c 0084 0006 0001 1 <
ffff8801417a9cc0 1801839964 C Ci:2:013:0 0 1 = 01
ffff8801417a9cc0 1801843612 S Co:2:013:0 s 40 04 0082 1694 0008 8 = 00000000 ba3e0700
ffff8801417a9cc0 1801843964 C Co:2:013:0 0 8 >
ffff8801417a9cc0 1801845593 S Bi:2:013:1 -115 19968 <
ffff8801417a9cc0 1801854219 C Bi:2:013:1 0 19968 = 52520402 1a02c701 10020902 21020702 1102cf01 f4011002 f8010402 fe010302
ffff8801417a9cc0 1801855655 S Bi:2:013:1 -115 16384 <
ffff8801417a9cc0 1801862471 C Bi:2:013:1 0 16384 = 83005700 67006700 c3009b00 7f009700 8300c800 9d007b00 6a00c900 7e009900
ffff8801417a9cc0 1801864586 S Bi:2:013:1 -115 16384 <
ffff8801417a9cc0 1801871517 C Bi:2:013:1 0 16384 = c4007600 7900d800 69008700 dc006200 8700c900 d4009500 5f001900 b0006400
ffff8801417a9cc0 1801873555 S Bi:2:013:1 -115 12800 <
ffff8801417a9cc0 1801879090 C Bi:2:013:1 0 12800 = 8100a600 bb00f200 7d00db00 73005c00 d1004800 9e005c00 53006400 b0001700
ffff8801417a9cc0 1801882512 S Bi:2:013:1 -115 19968 <
ffff8801417a9cc0 1801890945 C Bi:2:013:1 0 19968 = dc00a400 75005d00 34002800 9b006600 5e005c00 6b006300 d9009200 af00d000
ffff8801417a9cc0 1801892669 S Bi:2:013:1 -115 16384 <
ffff8801417a9cc0 1801900499 C Bi:2:013:1 0 16384 = 59005200 78006600 61002f00 37002700 70005d00 90006b00 80004200 48007200
ffff8801417a9cc0 1801901602 S Bi:2:013:1 -115 16384 <
ffff8801417a9cc0 1801908368 C Bi:2:013:1 0 16384 = 4c008400 a5008500 95003600 55009500 4e008b00 7100bf00 69005000 c3009400
ffff8801417a9cc0 1801910580 S Bi:2:013:1 -115 12800 <
ffff8801417a9cc0 1801916007 C Bi:2:013:1 0 12800 = 50000b00 67008600 6d005a00 66009c00 c3004d00 50009b00 48002f00 4c007700
ffff8801417a9cc0 1801919529 S Bi:2:013:1 -115 19968 <
ffff8801417a9cc0 1801928259 C Bi:2:013:1 0 19968 = 6100bb00 96008400 be008700 99008800 9200c000 9800b000 3500d300 3800f400
ffff8801417a9cc0 1801929536 S Bi:2:013:1 -115 16384 <
ffff8801417a9cc0 1801936727 C Bi:2:013:1 0 16384 = 8d002c00 41007b00 a5007d00 ab006600 5d008400 9c005b00 4e008400 87007c00
ffff8801417a9cc0 1801938591 S Bi:2:013:1 -115 16384 <
ffff8801417a9cc0 1801945848 C Bi:2:013:1 0 16384 = 9b005000 78008500 80006e00 64003b00 a0001900 75007b00 6900d900 b800ba00
ffff8801417a9cc0 1801947571 S Bi:2:013:1 -115 12800 <
ffff8801417a9cc0 1801953257 C Bi:2:013:1 0 12800 = 97008e00 85005900 6500c000 1a008300 bd00a500 c000a500 46007c00 7a006800
ffff8801417a9cc0 1801956552 S Bi:2:013:1 -115 19968 <
ffff8801417a9cc0 1801965344 C Bi:2:013:1 0 19968 = b2008e00 a300c900 90006200 d4006b00 9600a800 4f00d600 a500ec00 a6006b00
ffff8801417a9cc0 1801966542 S Bi:2:013:1 -115 16384 <
ffff8801417a9cc0 1801973858 C Bi:2:013:1 0 16384 = 56029a01 f900fd00 1201dc00 ec000201 43023902 6502b402 57025402 2c028302
ffff8801417a9cc0 1801975594 S Bi:2:013:1 -115 16384 <
ffff8801417a9cc0 1801983349 C Bi:2:013:1 0 16384 = 7f00a800 5100a200 cf00ae00 83003b00 e700e000 83009a00 d6008f00 4f005800
ffff8801417a9cc0 1801984587 S Bi:2:013:1 -115 12800 <
ffff8801417a9cc0 1802007625 C Bi:2:013:1 0 12800 = b200a300 71005100 9c007000 86007800 cd008c00 8500a100 ba007000 5d003700
ffff8801417a9cc0 1802013507 S Bi:2:013:1 -115 19968 <
ffff8801417a9cc0 1802075466 C Bi:2:013:1 0 19968 = 0c0bcf09 e501c102 4e01bd00 9700c900 b3006f00 b7007400 3d009400 9f009500
ffff8801417a9cc0 1802081603 S Bi:2:013:1 -115 16384 <
ffff8801417a9cc0 1802128212 C Bi:2:013:1 0 16384 = d425b626 98253e25 5a245525 9f281b29 f725a322 0d235e27 5a29d325 c3273625
ffff8801417a9cc0 1802133635 S Bi:2:013:1 -115 16384 <
ffff8801417a9cc0 1802180878 C Bi:2:013:1 0 16384 = 18242325 d424d424 ca267125 fa23e724 53244727 3c232e25 cb236924 8f25cd25
ffff8801417a9cc0 1802185597 S Bi:2:013:1 -115 12800 <
ffff8801417a9cc0 1802216627 C Bi:2:013:1 0 12800 = e100c300 3501c500 a700a500 bb009700 86007e00 6f00f300 7f003c00 ad006000
ffff8801417a9cc0 1802223564 S Bi:2:013:1 -115 19968 <
ffff8801417a9cc0 1802282380 C Bi:2:013:1 0 19968 = 76007100 20005a00 9a00f300 d100a600 87007d00 8c00cd00 8a000001 72007300
ffff8801417a9cc0 1802284616 S Bi:2:013:1 -115 16384 <
ffff8801417a9cc0 1802335112 C Bi:2:013:1 0 16384 = ff271826 93240227 1a275526 1326a826 d1232626 d424d026 0825a825 a5286c25
ffff8801417a9cc0 1802336691 S Bi:2:013:1 -115 16384 <
ffff8801417a9cc0 1802387733 C Bi:2:013:1 0 16384 = bb28d228 d82af427 5a289128 90283627 8228972a 85276128 1128d528 20280827
ffff8801417a9cc0 1802388567 S Bi:2:013:1 -115 12800 <
ffff8801417a9cc0 1802427358 C Bi:2:013:1 0 12800 = 4b259f27 6e284d28 fc28c625 02264625 55267027 5a29f527 6e291628 4d281927
ffff8801417a9cc0 1802433508 S Bi:2:013:1 -115 19968 <
ffff8801417a9cc0 1802482995 C Bi:2:013:1 0 19968 = 5d0b450a 230de10e 28201d20 0d238225 5023ee23 38241b25 7d230423 3b24f425
ffff8801417a9cc0 1802485577 S Bi:2:013:1 -115 16384 <
ffff8801417a9cc0 1802535612 C Bi:2:013:1 0 16384 = 66007400 9400e300 cc006800 ae00b000 a7005b00 e700c500 bf007f00 7f006c00
ffff8801417a9cc0 1802537642 S Bi:2:013:1 -115 16384 <
ffff8801417a9cc0 1802588391 C Bi:2:013:1 0 16384 = d4268a28 2f23ef26 3725ad25 da267524 21245726 e024f625 1626f226 94246824
ffff8801417a9cc0 1802589652 S Bi:2:013:1 -115 12800 <
ffff8801417a9cc0 1802634245 C Bi:2:013:1 0 12800 = 2e26c825 4f296b28 3426622a f4285827 c229e024 ba250427 f4258b26 a4251928
ffff8801417a9cc0 1802643551 S Bi:2:013:1 -115 15872 <
ffff8801417a9cc0 1802676666 C Bi:2:013:1 0 15872 = b7297f26 1e262d27 1f29f727 47264629 4d28ac26 cf25e327 8728f328 e726c226
ffff8801417a9cc0 1802681580 S Bi:2:013:1 -115 512 <
ffff8801417a9cc0 1802681742 C Bi:2:013:1 0 186 = 4b00bf00 88008f00 ef00c700 a500a100 5a00de00 d400ab00 97009d00 4b00b000
ffff8801417a9cc0 1802684492 S Ci:2:013:0 s c0 0c 0084 48c8 0001 1 <
ffff8801417a9cc0 1802684743 C Ci:2:013:0 0 1 = 03
ffff8801417a9cc0 1802687596 S Ci:2:013:0 s c0 0c 0084 48c8 0001 1 <
ffff8801417a9cc0 1802687867 C Ci:2:013:0 0 1 = 00
ffff8801417a9cc0 1802691565 S Co:2:013:0 s 40 0c 0088 0084 0001 1 = ff
ffff8801417a9cc0 1802691992 C Co:2:013:0 0 1 >
ffff8801417a9cc0 1802698947 S Co:2:013:0 s 40 0c 0088 0084 0001 1 = aa
ffff8801417a9cc0 1802699363 C Co:2:013:0 0 1 >
ffff8801417a9cc0 1802701512 S Co:2:013:0 s 40 0c 0088 0084 0001 1 = 55
ffff8801417a9cc0 1802702018 C Co:2:013:0 0 1 >
ffff8801417a9cc0 1802704540 S Co:2:013:0 s 40 0c 0088 0084 0001 1 = 00
ffff8801417a9cc0 1802704999 C Co:2:013:0 0 1 >
ffff8801417a9cc0 1802707584 S Co:2:013:0 s 40 0c 0088 0084 0001 1 = ff
ffff8801417a9cc0 1802708037 C Co:2:013:0 0 1 >
ffff8801417a9cc0 1802710479 S Co:2:013:0 s 40 0c 0088 0084 0001 1 = 87
ffff8801417a9cc0 1802710868 C Co:2:013:0 0 1 >
ffff8801417a9cc0 1802713512 S Co:2:013:0 s 40 0c 0088 0084 0001 1 = 78
ffff8801417a9cc0 1802713993 C Co:2:013:0 0 1 >
ffff8801417a9cc0 1802716575 S Co:2:013:0 s 40 0c 0088 0084 0001 1 = e0
ffff8801417a9cc0 1802716994 C Co:2:013:0 0 1 >
ffff8801417a9cc0 1802719576 S Co:2:013:0 s 40 0c 0087 0084 0001 1 = 05
ffff8801417a9cc0 1802719994 C Co:2:013:0 0 1 >
ffff8801417a9cc0 1802722475 S Co:2:013:0 s 40 0c 0087 0084 0001 1 = 04
ffff8801417a9cc0 1802722869 C Co:2:013:0 0 1 >
ffff8801417a9cc0 1802725508 S Co:2:013:0 s 40 0c 0088 0084 0001 1 = ff
ffff8801417a9cc0 1802726019 C Co:2:013:0 0 1 >
ffff8801417a9cc0 1802728538 S Co:2:013:0 s 40 0c 0085 0088 0001 1 = 08
ffff8801417a9cc0 1802729019 C Co:2:013:0 0 1 >
ffff8801417a9cc0 1802731576 S Co:2:013:0 s 40 0c 0085 0088 0001 1 = 00
ffff8801417a9cc0 1802731995 C Co:2:013:0 0 1 >
ffff8801417a9cc0 1802734475 S Co:2:013:0 s 40 0c 0085 0088 0001 1 = 00
ffff8801417a9cc0 1802734895 C Co:2:013:0 0 1 >
ffff8801417a9cc0 1802737509 S Co:2:013:0 s 40 0c 0085 0088 0001 1 = 00
ffff8801417a9cc0 1802738019 C Co:2:013:0 0 1 >
ffff8801417a9cc0 1802740536 S Co:2:013:0 s 40 0c 0085 0088 0001 1 = ff
ffff8801417a9cc0 1802741019 C Co:2:013:0 0 1 >
ffff8801417a9cc0 1802743563 S Co:2:013:0 s 40 0c 0085 0088 0001 1 = 00
ffff8801417a9cc0 1802743994 C Co:2:013:0 0 1 >
ffff8801417a9cc0 1802745504 S Ci:2:013:0 s c0 0c 0084 0006 0001 1 <
ffff8801417a9cc0 1802745895 C Ci:2:013:0 0 1 = 01
ffff8801417a9cc0 1802749516 S Co:2:013:0 s 40 04 0082 1694 0008 8 = 00000000 ba3e0700
ffff8801417a9cc0 1802749874 C Co:2:013:0 0 8 >
ffff8801417a9cc0 1802751661 S Bi:2:013:1 -115 19968 <
ffff8801417a9cc0 1802760994 C Bi:2:013:1 0 19968 = 5252bb00 b4009100 9900a100 52005900 8d007a00 bc007200 7800c200 b4007c00
ffff8801417a9cc0 1802761533 S Bi:2:013:1 -115 16384 <
ffff8801417a9cc0 1802797149 C Bi:2:013:1 0 16384 = 1428e227 bd26e024 c0292c22 23276b25 ce28b023 4324c222 de243428 6b240625
ffff8801417a9cc0 1802797633 S Bi:2:013:1 -115 16384 <
ffff8801417a9cc0 1802849768 C Bi:2:013:1 0 16384 = 6a282029 53285829 5f29512b e52ab328 9e28b127 862a622a 8d2be728 ad28f62a
ffff8801417a9cc0 1802858513 S Bi:2:013:1 -115 12800 <
ffff8801417a9cc0 1802887418 C Bi:2:013:1 0 12800 = 6c142414 2213e614 e515d814 8a19b245 15176816 0e173d16 f8185616 b617641a
ffff8801417a9cc0 1802896540 S Bi:2:013:1 -115 19968 <
ffff8801417a9cc0 1802951424 C Bi:2:013:1 0 19968 = df24b624 db249224 a925780a 41051004 7b12d425 c8234426 52166308 5306b623
ffff8801417a9cc0 1802957590 S Bi:2:013:1 -115 16384 <
ffff8801417a9cc0 1803003992 C Bi:2:013:1 0 16384 = 7c006a00 5c007d00 6600b400 a200bd00 b4005e00 9e006500 6d00a500 a7007c00
ffff8801417a9cc0 1803009632 S Bi:2:013:1 -115 16384 <
ffff8801417a9cc0 1803056646 C Bi:2:013:1 0 16384 = 93264927 6b29e222 ab04e40c a529df22 9d14e80a 8505f303 1b054b0a 6f25d125
ffff8801417a9cc0 1803061528 S Bi:2:013:1 -115 12800 <
ffff8801417a9cc0 1803096246 C Bi:2:013:1 0 12800 = 232a9629 cc1fce04 1911bd2c dc27d32b ca232208 860d332a 9d2b202b 822e522d
ffff8801417a9cc0 1803099533 S Bi:2:013:1 -115 19968 <
ffff8801417a9cc0 1803162020 C Bi:2:013:1 0 19968 = ae291c29 7e1a9c06 ad032504 94042407 fc1fb528 30287327 f227af26 8527ed25
ffff8801417a9cc0 1803167595 S Bi:2:013:1 -115 16384 <
ffff8801417a9cc0 1803204480 C Bi:2:013:1 0 16384 = 7e006f00 78006a00 7e009800 cc007900 a9005f00 b0007f00 a9003c00 a100e300
ffff8801417a9cc0 1803206984 S Bi:2:013:1 -115 16384 <
ffff8801417a9cc0 1803257229 C Bi:2:013:1 0 16384 = c1009e00 7c00cc00 94008d00 ee006a00 a2008900 7f00a200 c500ca00 9d007700
ffff8801417a9cc0 1803258593 S Bi:2:013:1 -115 12800 <
ffff8801417a9cc0 1803303187 C Bi:2:013:1 0 12800 = 27268124 6326b523 06234522 5124e123 15276c25 7f263c26 70277224 df245425
ffff8801417a9cc0 1803312543 S Bi:2:013:1 -115 19968 <
ffff8801417a9cc0 1803362662 C Bi:2:013:1 0 19968 = 3029c428 71285b2a 36279127 112a092b 0828052b a62a3d28 bb28482c 52293f2b
ffff8801417a9cc0 1803364667 S Bi:2:013:1 -115 16384 <
ffff8801417a9cc0 1803415311 C Bi:2:013:1 0 16384 = 6f0c2f28 bb282027 c9292c28 42280827 1527b926 40289626 dc274e28 a9269927
ffff8801417a9cc0 1803416594 S Bi:2:013:1 -115 16384 <
ffff8801417a9cc0 1803466136 C Bi:2:013:1 0 16384 = 5f008500 ad004700 ad00c300 87005d00 ad00c700 80009f00 a200d700 8900c200
ffff8801417a9cc0 1803468658 S Bi:2:013:1 -115 12800 <
ffff8801417a9cc0 1803503638 C Bi:2:013:1 0 12800 = 62005600 8500c600 7c007000 b300cc00 70008600 3100e400 a800ba00 7700d500
ffff8801417a9cc0 1803506568 S Bi:2:013:1 -115 19968 <
ffff8801417a9cc0 1803571487 C Bi:2:013:1 0 19968 = e50b810b 0a03ff04 a104c800 be00d300 d000a500 cb00d500 c600c000 0c019200
ffff8801417a9cc0 1803574598 S Bi:2:013:1 -115 16384 <
ffff8801417a9cc0 1803624157 C Bi:2:013:1 0 16384 = 1808d708 2e076307 58070207 ba060206 8406b606 89075e06 8a066b06 9f06e606
ffff8801417a9cc0 1803626637 S Bi:2:013:1 -115 16384 <
ffff8801417a9cc0 1803676789 C Bi:2:013:1 0 16384 = ba6c2a71 ee704e59 fb09a32a bf28d428 c0279426 9c263e2b 0e272624 062a2526
ffff8801417a9cc0 1803678641 S Bi:2:013:1 -115 12800 <
ffff8801417a9cc0 1803712538 C Bi:2:013:1 0 12800 = d4004f00 8800af00 d000bc00 7d009600 76005c00 81007c00 6d00be00 57007900
ffff8801417a9cc0 1803716484 S Bi:2:013:1 -115 19968 <
ffff8801417a9cc0 1803778280 C Bi:2:013:1 0 19968 = 60008f00 ad008300 79006400 f400d200 d0009400 96002900 a9007800 b500b500
ffff8801417a9cc0 1803784569 S Bi:2:013:1 -115 16384 <
ffff8801417a9cc0 1803831031 C Bi:2:013:1 0 16384 = cb0adb09 100a4409 ae087908 5408f007 1308df07 81083c08 49089d08 cf080009
ffff8801417a9cc0 1803836686 S Bi:2:013:1 -115 16384 <
ffff8801417a9cc0 1803883662 C Bi:2:013:1 0 16384 = e4065407 3d07bd07 c0073007 91060106 d9061007 5f070107 7c06ce05 9f068a07
ffff8801417a9cc0 1803888560 S Bi:2:013:1 -115 12800 <
ffff8801417a9cc0 1803923178 C Bi:2:013:1 0 12800 = c6712672 0572f575 f771796f 85711f71 79109727 ce2cbd2a d1284a29 232b8027
ffff8801417a9cc0 1803926548 S Bi:2:013:1 -115 19968 <
ffff8801417a9cc0 1803978910 C Bi:2:013:1 0 19968 = bd08ae0a 8f0a6505 98045521 f11f1923 1322ff20 e8213823 1e23b321 52247321
ffff8801417a9cc0 1803987554 S Bi:2:013:1 -115 16384 <
ffff8801417a9cc0 1804031538 C Bi:2:013:1 0 16384 = 6d00b100 6200b900 95008200 b4004900 08015300 a700ec00 8b005700 9d006200
ffff8801417a9cc0 1804039648 S Bi:2:013:1 -115 16384 <
ffff8801417a9cc0 1804084170 C Bi:2:013:1 0 16384 = ce04f504 2004fb04 dc04a104 b7040704 eb036503 1c03f402 69032203 f7030903
ffff8801417a9cc0 1804091526 S Bi:2:013:1 -115 12800 <
ffff8801417a9cc0 1804130158 C Bi:2:013:1 0 12800 = 8f078306 84065606 fd061306 1d070c06 8906c406 9f063807 be061a07 d506b106
ffff8801417a9cc0 1804136470 S Bi:2:013:1 -115 15872 <
ffff8801417a9cc0 1804172420 C Bi:2:013:1 0 15872 = da0b4c0b 7c0b430b 720a8f0a 6f0af90a c70a860a e60a2d0b e90a1f0a cb0b130b
ffff8801417a9cc0 1804174506 S Bi:2:013:1 -115 512 <
ffff8801417a9cc0 1804174631 C Bi:2:013:1 0 186 = b8008700 ba006500 8c00a400 a900a100 4c009300 d200a300 a9008600 8c00b000
ffff8801417a9cc0 1804178472 S Ci:2:013:0 s c0 0c 0084 48c8 0001 1 <
ffff8801417a9cc0 1804178755 C Ci:2:013:0 0 1 = 03
ffff8801417a9cc0 1804182687 S Ci:2:013:0 s c0 0c 0084 48c8 0001 1 <
ffff8801417a9cc0 1804183047 C Ci:2:013:0 0 1 = 00
ffff8801417a9cc0 1804186517 S Co:2:013:0 s 40 0c 0088 0084 0001 1 = ff
ffff8801417a9cc0 1804186881 C Co:2:013:0 0 1 >
ffff8801417a9cc0 1804189550 S Co:2:013:0 s 40 0c 0088 0084 0001 1 = aa
ffff8801417a9cc0 1804190004 C Co:2:013:0 0 1 >
ffff8801417a9cc0 1804194980 S Co:2:013:0 s 40 0c 0088 0084 0001 1 = 55
ffff8801417a9cc0 1804195405 C Co:2:013:0 0 1 >
ffff8801417a9cc0 1804199094 S Co:2:013:0 s 40 0c 0088 0084 0001 1 = 00
ffff8801417a9cc0 1804199507 C Co:2:013:0 0 1 >
ffff8801417a9cc0 1804202136 S Co:2:013:0 s 40 0c 0088 0084 0001 1 = ff
ffff8801417a9cc0 1804202692 C Co:2:013:0 0 1 >
ffff8801417a9cc0 1804205172 S Co:2:013:0 s 40 0c 0088 0084 0001 1 = 87
ffff8801417a9cc0 1804205692 C Co:2:013:0 0 1 >
ffff8801417a9cc0 1804208081 S Co:2:013:0 s 40 0c 0088 0084 0001 1 = 78
ffff8801417a9cc0 1804208506 C Co:2:013:0 0 1 >
ffff8801417a9cc0 1804211094 S Co:2:013:0 s 40 0c 0088 0084 0001 1 = e0
ffff8801417a9cc0 1804211568 C Co:2:013:0 0 1 >
ffff8801417a9cc0 1804214135 S Co:2:013:0 s 40 0c 0087 0084 0001 1 = 05
ffff8801417a9cc0 1804214542 C Co:2:013:0 0 1 >
ffff8801417a9cc0 1804217167 S Co:2:013:0 s 40 0c 0087 0084 0001 1 = 04
ffff8801417a9cc0 1804217507 C Co:2:013:0 0 1 >
ffff8801417a9cc0 1804220061 S Co:2:013:0 s 40 0c 0088 0084 0001 1 = ff
ffff8801417a9cc0 1804220507 C Co:2:013:0 0 1 >
ffff8801417a9cc0 1804223126 S Co:2:013:0 s 40 0c 0085 0088 0001 1 = 08
ffff8801417a9cc0 1804223552 C Co:2:013:0 0 1 >
ffff8801417a9cc0 1804226129 S Co:2:013:0 s 40 0c 0085 0088 0001 1 = 00
ffff8801417a9cc0 1804226554 C Co:2:013:0 0 1 >
ffff8801417a9cc0 1804229168 S Co:2:013:0 s 40 0c 0085 0088 0001 1 = 00
ffff8801417a9cc0 1804229505 C Co:2:013:0 0 1 >
ffff8801417a9cc0 1804232061 S Co:2:013:0 s 40 0c 0085 0088 0001 1 = 00
ffff8801417a9cc0 1804232568 C Co:2:013:0 0 1 >
ffff8801417a9cc0 1804235096 S Co:2:013:0 s 40 0c 0085 0088 0001 1 = ff
ffff8801417a9cc0 1804235544 C Co:2:013:0 0 1 >
ffff8801417a9cc0 1804238136 S Co:2:013:0 s 40 0c 0085 0088 0001 1 = 00
ffff8801417a9cc0 1804238506 C Co:2:013:0 0 1 >
ffff8801417a9cc0 1804246952 S Ci:2:013:0 s c0 0c 0084 0006 0001 1 <
ffff8801417a9cc0 1804247288 C Ci:2:013:0 0 1 = 01
ffff8801417a9cc0 1804257368 S Co:2:013:0 s 40 04 0082 1694 0008 8 = 00000000 ba3e0700
ffff8801417a9cc0 1804257792 C Co:2:013:0 0 8 >
ffff8801417a9cc0 1804261381 S Bi:2:013:1 -115 19968 <
ffff8801417a9cc0 1804270051 C Bi:2:013:1 0 19968 = 52526d00 87009600 ae008300 9d00e900 8d006b00 64009400 6f005400 98007c00
ffff8801417a9cc0 1804270978 S Bi:2:013:1 -115 16384 <
ffff8801417a9cc0 1804293060 C Bi:2:013:1 0 16384 = db025103 7302d602 c3025303 4c036603 b302ab02 32034c03 8703a702 8103ed03
ffff8801417a9cc0 1804299950 S Bi:2:013:1 -115 16384 <
ffff8801417a9cc0 1804345709 C Bi:2:013:1 0 16384 = 37060107 21069506 f507f306 bd065e07 b406e606 89069c07 64075807 58070607
ffff8801417a9cc0 1804352021 S Bi:2:013:1 -115 12800 <
ffff8801417a9cc0 1804383177 C Bi:2:013:1 0 12800 = f3272625 72254425 7a25a926 a6262a26 c426fb25 4c268a27 be27f726 31292a27
ffff8801417a9cc0 1804389928 S Bi:2:013:1 -115 19968 <
ffff8801417a9cc0 1804447198 C Bi:2:013:1 0 19968 = 76221024 6423a425 51214424 dd22f823 2323e224 1b241523 90259523 1125fd20
ffff8801417a9cc0 1804450932 S Bi:2:013:1 -115 16384 <
ffff8801417a9cc0 1804499941 C Bi:2:013:1 0 16384 = 94006100 41008000 6a005100 8f007100 7b002500 86008400 96008e00 45007b00
ffff8801417a9cc0 1804502961 S Bi:2:013:1 -115 16384 <
ffff8801417a9cc0 1804552553 C Bi:2:013:1 0 16384 = 830eee0d aa0e2e10 4a0feb0c 880e980e 680fea0d 480e360f af0e0f10 370dcc0e
ffff8801417a9cc0 1804555032 S Bi:2:013:1 -115 12800 <
ffff8801417a9cc0 1804592183 C Bi:2:013:1 0 12800 = b403a002 ec03a403 40040404 de03ca03 6203b003 03048703 c203bd03 f3037203
ffff8801417a9cc0 1804599955 S Bi:2:013:1 -115 19968 <
ffff8801417a9cc0 1804657939 C Bi:2:013:1 0 19968 = b40e070c 620baa0d 000efd0b a10c500c de09850b ed0cef0c 680c800b 310b6e0d
ffff8801417a9cc0 1804660945 S Bi:2:013:1 -115 16384 <
ffff8801417a9cc0 1804700423 C Bi:2:013:1 0 16384 = 8400bb00 ba009600 a9004600 80008000 c7006700 9b006500 6c004800 9700a700
ffff8801417a9cc0 1804705925 S Bi:2:013:1 -115 16384 <
ffff8801417a9cc0 1804753197 C Bi:2:013:1 0 16384 = 6700c200 a5006300 5c008600 ea008a00 9b008b00 a600b100 56008000 66005000
ffff8801417a9cc0 1804758017 S Bi:2:013:1 -115 12800 <
ffff8801417a9cc0 1804799079 C Bi:2:013:1 0 12800 = ec029d02 b0028a02 77028602 d902f201 6e023d02 53025c02 97020302 2b022d02
ffff8801417a9cc0 1804802933 S Bi:2:013:1 -115 19968 <
ffff8801417a9cc0 1804858465 C Bi:2:013:1 0 19968 = 3b096809 600a1609 330ac909 f508c709 0d0a480a 050a470a f409d209 ce0aaa09
ffff8801417a9cc0 1804864046 S Bi:2:013:1 -115 16384 <
ffff8801417a9cc0 1804911190 C Bi:2:013:1 0 16384 = 9d3aad09 c2298128 3d262726 2e276f26 21241d29 76285226 1b279a27 0527e125
ffff8801417a9cc0 1804915875 S Bi:2:013:1 -115 16384 <
ffff8801417a9cc0 1804962096 C Bi:2:013:1 0 16384 = 2e006a00 c200bd00 60008d00 a6006400 9900b900 75009300 8b00b200 dd00d600
ffff8801417a9cc0 1804968000 S Bi:2:013:1 -115 12800 <
ffff8801417a9cc0 1804999592 C Bi:2:013:1 0 12800 = dd00bd00 c1007600 89008900 cd008f00 9b008b00 70005e00 95009700 dc003400
ffff8801417a9cc0 1805005923 S Bi:2:013:1 -115 19968 <
ffff8801417a9cc0 1805067489 C Bi:2:013:1 0 19968 = 520d880b aa067e01 0101f500 a900c000 6900e900 69008600 bd009a00 6400b000
ffff8801417a9cc0 1805074059 S Bi:2:013:1 -115 16384 <
ffff8801417a9cc0 1805120096 C Bi:2:013:1 0 16384 = f3170c19 e318c60c e30be90b 740b4a0d 640c040c f90b4b0b b80afc0b 980a0a0b
ffff8801417a9cc0 1805126014 S Bi:2:013:1 -115 16384 <
ffff8801417a9cc0 1805172874 C Bi:2:013:1 0 16384 = 5d4e414c 7d4cc74b 4441b707 9926bf26 2d27c527 aa25b626 ca251623 de261c28
ffff8801417a9cc0 1805178813 S Bi:2:013:1 -115 12800 <
ffff8801417a9cc0 1805208624 C Bi:2:013:1 0 12800 = a2009700 6f00ba00 b2008400 b100a800 63003300 e600ba00 6a00a200 73001c01
ffff8801417a9cc0 1805216661 S Bi:2:013:1 -115 19968 <
ffff8801417a9cc0 1805274342 C Bi:2:013:1 0 19968 = d9004500 64007300 af00e200 32007d00 ae009200 5f000d01 b9009f00 a4006100
ffff8801417a9cc0 1805277699 S Bi:2:013:1 -115 16384 <
ffff8801417a9cc0 1805326981 C Bi:2:013:1 0 16384 = 6322f920 77223122 66213d1f 5b20511f 371f3823 5b21fd21 5422ca1f bf20ca20
ffff8801417a9cc0 1805329765 S Bi:2:013:1 -115 16384 <
ffff8801417a9cc0 1805379673 C Bi:2:013:1 0 16384 = ad044f04 4d04ad03 bc043105 6d04d403 d103cc03 fe030204 3d04da02 5903c903
ffff8801417a9cc0 1805381765 S Bi:2:013:1 -115 12800 <
ffff8801417a9cc0 1805419377 C Bi:2:013:1 0 12800 = c14d364f 95538d50 864e4e53 b453464f af52d30b f524e829 872a7e29 1d28ea26
ffff8801417a9cc0 1805426740 S Bi:2:013:1 -115 19968 <
ffff8801417a9cc0 1805474967 C Bi:2:013:1 0 19968 = 6502c907 160cc60d 2109b51d ec23d41f 8f224f21 d7236d23 f1213722 31237a1f
ffff8801417a9cc0 1805478838 S Bi:2:013:1 -115 16384 <
ffff8801417a9cc0 1805527591 C Bi:2:013:1 0 16384 = c8009400 9d005900 7100c100 88007700 d2008b00 f300c500 c100ce00 7d007200
ffff8801417a9cc0 1805530722 S Bi:2:013:1 -115 16384 <
ffff8801417a9cc0 1805580329 C Bi:2:013:1 0 16384 = ca11e70f 83106312 77113510 7c10d311 910d110c b70c590b b80c5e0d af0ba70b
ffff8801417a9cc0 1805582747 S Bi:2:013:1 -115 12800 <
ffff8801417a9cc0 1805626117 C Bi:2:013:1 0 12800 = 4116d715 38178f15 1b196b15 d417af16 de140916 84157f1b 371d691d d41be11b
ffff8801417a9cc0 1805627709 S Bi:2:013:1 -115 15872 <
ffff8801417a9cc0 1805668600 C Bi:2:013:1 0 15872 = d7155d16 1616aa15 39168814 7d148214 fc149e15 23144c14 b0134a15 7e147e13
ffff8801417a9cc0 1805672669 S Bi:2:013:1 -115 512 <
ffff8801417a9cc0 1805672848 C Bi:2:013:1 0 186 = d9009600 7d00a300 6c00bd00 8c00ae00 ef00c400 6800b700 ba00b400 5300ab00
ffff8801417a9cc0 1805675720 S Ci:2:013:0 s c0 0c 0084 48c8 0001 1 <
ffff8801417a9cc0 1805676140 C Ci:2:013:0 0 1 = 03
ffff8801417a9cc0 1805678830 S Ci:2:013:0 s c0 0c 0084 48c8 0001 1 <
ffff8801417a9cc0 1805679249 C Ci:2:013:0 0 1 = 00
ffff8801417a9cc0 1805682797 S Co:2:013:0 s 40 0c 0088 0084 0001 1 = ff
ffff8801417a9cc0 1805683392 C Co:2:013:0 0 1 >
ffff8801417a9cc0 1805685701 S Co:2:013:0 s 40 0c 0088 0084 0001 1 = aa
ffff8801417a9cc0 1805686098 C Co:2:013:0 0 1 >
ffff8801417a9cc0 1805688715 S Co:2:013:0 s 40 0c 0088 0084 0001 1 = 55
ffff8801417a9cc0 1805689180 C Co:2:013:0 0 1 >
ffff8801417a9cc0 1805694980 S Co:2:013:0 s 40 0c 0088 0084 0001 1 = 00
ffff8801417a9cc0 1805695430 C Co:2:013:0 0 1 >
ffff8801417a9cc0 1805698934 S Co:2:013:0 s 40 0c 0088 0084 0001 1 = ff
ffff8801417a9cc0 1805699306 C Co:2:013:0 0 1 >
ffff8801417a9cc0 1805701966 S Co:2:013:0 s 40 0c 0088 0084 0001 1 = 87
ffff8801417a9cc0 1805702431 C Co:2:013:0 0 1 >
ffff8801417a9cc0 1805704995 S Co:2:013:0 s 40 0c 0088 0084 0001 1 = 78
ffff8801417a9cc0 1805705429 C Co:2:013:0 0 1 >
ffff8801417a9cc0 1805707905 S Co:2:013:0 s 40 0c 0088 0084 0001 1 = e0
ffff8801417a9cc0 1805708305 C Co:2:013:0 0 1 >
ffff8801417a9cc0 1805710960 S Co:2:013:0 s 40 0c 0087 0084 0001 1 = 05
ffff8801417a9cc0 1805711306 C Co:2:013:0 0 1 >
ffff8801417a9cc0 1805713980 S Co:2:013:0 s 40 0c 0087 0084 0001 1 = 04
ffff8801417a9cc0 1805714431 C Co:2:013:0 0 1 >
ffff8801417a9cc0 1805717014 S Co:2:013:0 s 40 0c 0088 0084 0001 1 = ff
ffff8801417a9cc0 1805717431 C Co:2:013:0 0 1 >
ffff8801417a9cc0 1805719908 S Co:2:013:0 s 40 0c 0085 0088 0001 1 = 08
ffff8801417a9cc0 1805720306 C Co:2:013:0 0 1 >
ffff8801417a9cc0 1805722950 S Co:2:013:0 s 40 0c 0085 0088 0001 1 = 00
ffff8801417a9cc0 1805723306 C Co:2:013:0 0 1 >
ffff8801417a9cc0 1805725977 S Co:2:013:0 s 40 0c 0085 0088 0001 1 = 00
ffff8801417a9cc0 1805726306 C Co:2:013:0 0 1 >
ffff8801417a9cc0 1805729012 S Co:2:013:0 s 40 0c 0085 0088 0001 1 = 00
ffff8801417a9cc0 1805729432 C Co:2:013:0 0 1 >
ffff8801417a9cc0 1805731904 S Co:2:013:0 s 40 0c 0085 0088 0001 1 = ff
ffff8801417a9cc0 1805732307 C Co:2:013:0 0 1 >
ffff8801417a9cc0 1805734945 S Co:2:013:0 s 40 0c 0085 0088 0001 1 = 00
ffff8801417a9cc0 1805735306 C Co:2:013:0 0 1 >
ffff8801417a9cc0 1805736966 S Ci:2:013:0 s c0 0c 0084 0006 0001 1 <
ffff8801417a9cc0 1805737181 C Ci:2:013:0 0 1 = 01
ffff8801417a9cc0 1805741006 S Co:2:013:0 s 40 04 0082 1694 0008 8 = 00000000 ba3e0700
ffff8801417a9cc0 1805741306 C Co:2:013:0 0 8 >
ffff8801417a9cc0 1805742963 S Bi:2:013:1 -115 19968 <
ffff8801417a9cc0 1805752098 C Bi:2:013:1 0 19968 = 52526500 bf00a300 98006700 78008c00 7c009a00 5d007300 82009100 8700bc00
ffff8801417a9cc0 1805753081 S Bi:2:013:1 -115 16384 <
ffff8801417a9cc0 1805789061 C Bi:2:013:1 0 16384 = 9e0e560e 7d0da40c 350dbe0c 7b0e1010 f30c260e e00c670d e70c530c 5b0d190d
ffff8801417a9cc0 1805794032 S Bi:2:013:1 -115 16384 <
ffff8801417a9cc0 1805841713 C Bi:2:013:1 0 16384 = 991dcb1e b71be91c 151dc01f 8b1e6a1c 651f0520 1c1edc1f b81d761e b61edc1c
ffff8801417a9cc0 1805846121 S Bi:2:013:1 -115 12800 <
ffff8801417a9cc0 1805879398 C Bi:2:013:1 0 12800 = 0526a428 4d0efb03 72216b26 f0272825 ae24c727 c025ef04 b9082128 8628e71e
ffff8801417a9cc0 1805884147 S Bi:2:013:1 -115 19968 <
ffff8801417a9cc0 1805943232 C Bi:2:013:1 0 19968 = 3c23c722 5b227023 d8249f0c ad10360c ea08b417 ca099b1a 5a1d1023 2d25af20
ffff8801417a9cc0 1805945114 S Bi:2:013:1 -115 16384 <
ffff8801417a9cc0 1805996021 C Bi:2:013:1 0 16384 = 8500bd00 71008500 6c00ad00 7d009400 2d009300 73009000 5e006700 41006c00
ffff8801417a9cc0 1805997139 S Bi:2:013:1 -115 16384 <
ffff8801417a9cc0 1806048616 C Bi:2:013:1 0 16384 = c019801a a417d41b 3919f218 1819571a 7a17ac19 55196e19 da1a6c19 0f19fd19
ffff8801417a9cc0 1806049143 S Bi:2:013:1 -115 12800 <
ffff8801417a9cc0 1806088274 C Bi:2:013:1 0 12800 = 61132c13 5e149214 2c144e13 6b13af13 df133e14 8c151614 df13ae14 8a147113
ffff8801417a9cc0 1806094016 S Bi:2:013:1 -115 19968 <
ffff8801417a9cc0 1806154016 C Bi:2:013:1 0 19968 = b910eb10 1d111610 b211c811 ba11dc0f 80119911 9f112311 1b10f111 3812d611
ffff8801417a9cc0 1806155070 S Bi:2:013:1 -115 16384 <
ffff8801417a9cc0 1806196494 C Bi:2:013:1 0 16384 = 55008a00 8e009100 b2009600 a600a500 78007500 87008e00 69007900 8a009d00
ffff8801417a9cc0 1806200014 S Bi:2:013:1 -115 16384 <
ffff8801417a9cc0 1806249122 C Bi:2:013:1 0 16384 = a0008b00 5f006500 80006800 5a009900 8200eb00 5c009200 8e00b400 8f009500
ffff8801417a9cc0 1806252095 S Bi:2:013:1 -115 12800 <
ffff8801417a9cc0 1806295123 C Bi:2:013:1 0 12800 = bd0aee0a f30a670a 360a820b 710b710a 190b9a0a 020bc50b 770aad09 830a160b
ffff8801417a9cc0 1806297002 S Bi:2:013:1 -115 19968 <
ffff8801417a9cc0 1806354479 C Bi:2:013:1 0 19968 = 872b5a2d fd2bda29 b729742c 35274c2b 952e1e2e 942b592a d32a702b 612a0d2c
ffff8801417a9cc0 1806358041 S Bi:2:013:1 -115 16384 <
ffff8801417a9cc0 1806407289 C Bi:2:013:1 0 16384 = aa415b11 ef0fe827 c1270d26 bc177419 4a19b72a 4914e702 0616642c 022ada29
ffff8801417a9cc0 1806410149 S Bi:2:013:1 -115 16384 <
ffff8801417a9cc0 1806458149 C Bi:2:013:1 0 16384 = 68007800 7c009000 85007700 b500b000 80006f00 6e00cf00 7d00d700 c9009600
ffff8801417a9cc0 1806462097 S Bi:2:013:1 -115 12800 <
ffff8801417a9cc0 1806495609 C Bi:2:013:1 0 12800 = d200f100 c000aa00 a000a100 c700e300 bb008400 73007600 7f007700 8d005500
ffff8801417a9cc0 1806499986 S Bi:2:013:1 -115 19968 <
ffff8801417a9cc0 1806563404 C Bi:2:013:1 0 19968 = 2a0c3c0b 250a9503 1c02ba01 b000a200 fd00c200 86005a00 b200b900 5d00a000
ffff8801417a9cc0 1806568081 S Bi:2:013:1 -115 16384 <
ffff8801417a9cc0 1806616170 C Bi:2:013:1 0 16384 = f3243126 9525a124 9521171f e41e6e20 1f205420 0421241f 3120c521 a11f621f
ffff8801417a9cc0 1806620193 S Bi:2:013:1 -115 16384 <
ffff8801417a9cc0 1806668737 C Bi:2:013:1 0 16384 = 763c143c 8c3a8f3d 713d711a 150d2b27 0c26b227 ae25a025 56250124 03263025
ffff8801417a9cc0 1806672051 S Bi:2:013:1 -115 12800 <
ffff8801417a9cc0 1806704528 C Bi:2:013:1 0 12800 = 7700b300 e300b000 83008d00 68006000 54005c00 b700c100 d0009f00 7b008300
ffff8801417a9cc0 1806710078 S Bi:2:013:1 -115 19968 <
ffff8801417a9cc0 1806770426 C Bi:2:013:1 0 19968 = 55004400 48009200 3b008000 6900e000 3f00ad00 57009c00 bd007900 80005900
ffff8801417a9cc0 1806778149 S Bi:2:013:1 -115 16384 <
ffff8801417a9cc0 1806823009 C Bi:2:013:1 0 16384 = b2367f35 a137ba36 2637fe2f a8317430 1d2f9f35 052f9e2e ca2fff2f 822fcd2f
ffff8801417a9cc0 1806830182 S Bi:2:013:1 -115 16384 <
ffff8801417a9cc0 1806875620 C Bi:2:013:1 0 16384 = 52083c09 3d0aaa09 6d0a2909 4c09d108 8809d608 76091a0a 760a4e08 570a8709
ffff8801417a9cc0 1806882166 S Bi:2:013:1 -115 12800 <
ffff8801417a9cc0 1806915306 C Bi:2:013:1 0 12800 = 2637df33 3a33f734 f636e935 3a36b135 4838421d eb0c7a2b 9827f528 ce262e28
ffff8801417a9cc0 1806919996 S Bi:2:013:1 -115 19968 <
ffff8801417a9cc0 1806970889 C Bi:2:013:1 0 19968 = e2029b08 2e0cf10b d509681f cc24e722 69230e25 2422ca25 32271a23 26214521
ffff8801417a9cc0 1806972073 S Bi:2:013:1 -115 16384 <
ffff8801417a9cc0 1807023541 C Bi:2:013:1 0 16384 = b4009e00 b300b000 c9007a00 b4009b00 e5006100 c600a600 48009400 8500a600
ffff8801417a9cc0 1807024115 S Bi:2:013:1 -115 16384 <
ffff8801417a9cc0 1807076140 C Bi:2:013:1 0 16384 = ac0ec30d 210efa0c fb0c130c 9b0cd40c 550e9209 7c09eb08 66099f09 2009d708
ffff8801417a9cc0 1807085101 S Bi:2:013:1 -115 12800 <
ffff8801417a9cc0 1807122187 C Bi:2:013:1 0 12800 = 5b164a18 79187619 e617c116 01188219 f217da16 cc183b18 9c1daf1d 1c1f7a1f
ffff8801417a9cc0 1807130614 S Bi:2:013:1 -115 15872 <
ffff8801417a9cc0 1807164404 C Bi:2:013:1 0 15872 = d62c4e2c 142ef32f 5a2dd62a 21263722 6d22fb20 cb22af22 fc23a221 02248d21
ffff8801417a9cc0 1807168090 S Bi:2:013:1 -115 512 <
ffff8801417a9cc0 1807168271 C Bi:2:013:1 0 186 = d4005f00 cf00ab00 9f008f00 b7008800 6e009700 9f009b00 8e006900 a5007300
ffff8801417a9cc0 1807171120 S Ci:2:013:0 s c0 0c 0084 48c8 0001 1 <
ffff8801417a9cc0 1807171421 C Ci:2:013:0 0 1 = 03
ffff8801417a9cc0 1807174134 S Ci:2:013:0 s c0 0c 0084 48c8 0001 1 <
ffff8801417a9cc0 1807174522 C Ci:2:013:0 0 1 = 00
ffff8801417a9cc0 1807178969 S Co:2:013:0 s 40 0c 0088 0084 0001 1 = ff
ffff8801417a9cc0 1807179391 C Co:2:013:0 0 1 >
ffff8801417a9cc0 1807184070 S Co:2:013:0 s 40 0c 0088 0084 0001 1 = aa
ffff8801417a9cc0 1807184477 C Co:2:013:0 0 1 >
ffff8801417a9cc0 1807186516 S Co:2:013:0 s 40 0c 0088 0084 0001 1 = 55
ffff8801417a9cc0 1807186988 C Co:2:013:0 0 1 >
ffff8801417a9cc0 1807189566 S Co:2:013:0 s 40 0c 0088 0084 0001 1 = 00
ffff8801417a9cc0 1807190017 C Co:2:013:0 0 1 >
ffff8801417a9cc0 1807193825 S Co:2:013:0 s 40 0c 0088 0084 0001 1 = ff
ffff8801417a9cc0 1807194231 C Co:2:013:0 0 1 >
ffff8801417a9cc0 1807196215 S Co:2:013:0 s 40 0c 0088 0084 0001 1 = 87
ffff8801417a9cc0 1807196606 C Co:2:013:0 0 1 >
ffff8801417a9cc0 1807199244 S Co:2:013:0 s 40 0c 0088 0084 0001 1 = 78
ffff8801417a9cc0 1807199606 C Co:2:013:0 0 1 >
ffff8801417a9cc0 1807202282 S Co:2:013:0 s 40 0c 0088 0084 0001 1 = e0
ffff8801417a9cc0 1807202730 C Co:2:013:0 0 1 >
ffff8801417a9cc0 1807205314 S Co:2:013:0 s 40 0c 0087 0084 0001 1 = 05
ffff8801417a9cc0 1807205730 C Co:2:013:0 0 1 >
ffff8801417a9cc0 1807208214 S Co:2:013:0 s 40 0c 0087 0084 0001 1 = 04
ffff8801417a9cc0 1807208606 C Co:2:013:0 0 1 >
ffff8801417a9cc0 1807211260 S Co:2:013:0 s 40 0c 0088 0084 0001 1 = ff
ffff8801417a9cc0 1807211605 C Co:2:013:0 0 1 >
ffff8801417a9cc0 1807214300 S Co:2:013:0 s 40 0c 0085 0088 0001 1 = 08
ffff8801417a9cc0 1807214730 C Co:2:013:0 0 1 >
ffff8801417a9cc0 1807217341 S Co:2:013:0 s 40 0c 0085 0088 0001 1 = 00
ffff8801417a9cc0 1807217731 C Co:2:013:0 0 1 >
ffff8801417a9cc0 1807220217 S Co:2:013:0 s 40 0c 0085 0088 0001 1 = 00
ffff8801417a9cc0 1807220606 C Co:2:013:0 0 1 >
ffff8801417a9cc0 1807223482 S Co:2:013:0 s 40 0c 0085 0088 0001 1 = 00
ffff8801417a9cc0 1807223857 C Co:2:013:0 0 1 >
ffff8801417a9cc0 1807226302 S Co:2:013:0 s 40 0c 0085 0088 0001 1 = ff
ffff8801417a9cc0 1807226731 C Co:2:013:0 0 1 >
ffff8801417a9cc0 1807229344 S Co:2:013:0 s 40 0c 0085 0088 0001 1 = 00
ffff8801417a9cc0 1807229731 C Co:2:013:0 0 1 >
ffff8801417a9cc0 1807231372 S Ci:2:013:0 s c0 0c 0084 0006 0001 1 <
ffff8801417a9cc0 1807231731 C Ci:2:013:0 0 1 = 01
ffff8801417a9cc0 1807235255 S Co:2:013:0 s 40 04 0082 1694 0008 8 = 00000000 ba3e0700
ffff8801417a9cc0 1807235606 C Co:2:013:0 0 8 >
ffff8801417a9cc0 1807237280 S Bi:2:013:1 -115 19968 <
ffff8801417a9cc0 1807246232 C Bi:2:013:1 0 19968 = 5252af00 57008a00 9e005300 7d007b00 a7008800 c9008d00 af00b900 9b009e00
ffff8801417a9cc0 1807247258 S Bi:2:013:1 -115 16384 <
ffff8801417a9cc0 1807284983 C Bi:2:013:1 0 16384 = c4071a08 4008c408 8c078907 9407df07 18073a08 ed089c07 bc077a08 9d088f09
ffff8801417a9cc0 1807285016 S Bi:2:013:1 -115 16384 <
ffff8801417a9cc0 1807350778 C Bi:2:013:1 0 16384 = 27302530 7a2da82f 7c2e6330 7930862f 1a2f2031 832d3e32 8d30c730 25314f33
ffff8801417a9cc0 1807353771 S Bi:2:013:1 -115 12800 <
ffff8801417a9cc0 1807392781 C Bi:2:013:1 0 12800 = 6f260127 4228d322 220a1805 5406eb07 fb051205 cb0d601c 3f0aa905 0005bb05
ffff8801417a9cc0 1807398715 S Bi:2:013:1 -115 19968 <
ffff8801417a9cc0 1807456802 C Bi:2:013:1 0 19968 = c925a423 a123b223 ee229b21 54241322 ab23ea14 3e19ea23 54251724 e724d723
ffff8801417a9cc0 1807459596 S Bi:2:013:1 -115 16384 <
ffff8801417a9cc0 1807509428 C Bi:2:013:1 0 16384 = 4f009500 7f009800 8b005a00 60006900 a2009100 ab006c00 8b009200 ca005400
ffff8801417a9cc0 1807511717 S Bi:2:013:1 -115 16384 <
ffff8801417a9cc0 1807562166 C Bi:2:013:1 0 16384 = 45418741 72423d41 6643a441 ae402043 c0422944 36446541 9d41a642 9640f342
ffff8801417a9cc0 1807563739 S Bi:2:013:1 -115 12800 <
ffff8801417a9cc0 1807601684 C Bi:2:013:1 0 12800 = 220af509 940af80a 3609df09 af09b40a 520a180b a70a8c0a 140ab509 320ac90a
ffff8801417a9cc0 1807608677 S Bi:2:013:1 -115 19968 <
ffff8801417a9cc0 1807667556 C Bi:2:013:1 0 19968 = 5838f236 f62a2d38 ad342d37 03387c38 46373f38 c6365c36 9d375b39 c135fe38
ffff8801417a9cc0 1807669689 S Bi:2:013:1 -115 16384 <
ffff8801417a9cc0 1807710042 C Bi:2:013:1 0 16384 = a100da00 7000b600 58008800 8c00a200 9200ac00 bb00c500 ad007e00 ab008d00
ffff8801417a9cc0 1807714664 S Bi:2:013:1 -115 16384 <
ffff8801417a9cc0 1807762669 C Bi:2:013:1 0 16384 = d800a200 76009d00 6200c300 9e00c200 7c00b600 8000a700 d8005a00 b4005000
ffff8801417a9cc0 1807766833 S Bi:2:013:1 -115 12800 <
ffff8801417a9cc0 1807808565 C Bi:2:013:1 0 12800 = cd2de12d c32bff2a 692d122c cd2a662c 632d932c 172cd12e c92c3f2b a92afb2d
ffff8801417a9cc0 1807811655 S Bi:2:013:1 -115 19968 <
ffff8801417a9cc0 1807868045 C Bi:2:013:1 0 19968 = 435b435a 6359c25b 5b57e456 5259635c b6552e5c ec56f259 6a5b215a 0659a156
ffff8801417a9cc0 1807872678 S Bi:2:013:1 -115 16384 <
ffff8801417a9cc0 1807920670 C Bi:2:013:1 0 16384 = 86246721 58053120 ca245d25 c7243d25 af245025 8825cb25 6a25e921 0425e424
ffff8801417a9cc0 1807924750 S Bi:2:013:1 -115 16384 <
ffff8801417a9cc0 1807971676 C Bi:2:013:1 0 16384 = ba00b000 8e007000 b0007400 bd00b500 9900cc00 7b00b500 a2007400 8500d600
ffff8801417a9cc0 1807976833 S Bi:2:013:1 -115 12800 <
ffff8801417a9cc0 1808009181 C Bi:2:013:1 0 12800 = 6200b000 0c01cb00 40006b00 8c008b00 5b004f00 b2007b00 9200d600 f2006e00
ffff8801417a9cc0 1808014639 S Bi:2:013:1 -115 19968 <
ffff8801417a9cc0 1808077092 C Bi:2:013:1 0 19968 = 3e0b9f0b 410b3e05 2f023104 a400ed00 a600d100 a5009900 a700bb00 9300c500
ffff8801417a9cc0 1808082745 S Bi:2:013:1 -115 16384 <
ffff8801417a9cc0 1808129642 C Bi:2:013:1 0 16384 = 6845244a b8498f46 b445b041 9a40e141 e33fd141 9e3e273f ae420042 1441a742
ffff8801417a9cc0 1808134740 S Bi:2:013:1 -115 16384 <
ffff8801417a9cc0 1808182471 C Bi:2:013:1 0 16384 = e823a523 6c249122 40232b25 2f06b119 af260f26 b7254122 79239d22 9a247725
ffff8801417a9cc0 1808186772 S Bi:2:013:1 -115 12800 <
ffff8801417a9cc0 1808218061 C Bi:2:013:1 0 12800 = 6900d700 ca00c200 bd000801 be009b00 6d00be00 e5008900 ca007e00 8100cb00
ffff8801417a9cc0 1808224714 S Bi:2:013:1 -115 19968 <
ffff8801417a9cc0 1808283808 C Bi:2:013:1 0 19968 = 9100d300 9000a100 cd00b800 cb007b00 8e00d400 88008100 c1007600 93008b00
ffff8801417a9cc0 1808285745 S Bi:2:013:1 -115 16384 <
ffff8801417a9cc0 1808336564 C Bi:2:013:1 0 16384 = 0650a851 94500d51 5a50794d c9480748 404b1248 15471047 e944d048 1349fb45
ffff8801417a9cc0 1808337805 S Bi:2:013:1 -115 16384 <
ffff8801417a9cc0 1808389189 C Bi:2:013:1 0 16384 = 7e389839 ee386436 be39b436 9d392536 3a2f752b a42c132c 122ce429 d52a602a
ffff8801417a9cc0 1808389760 S Bi:2:013:1 -115 12800 <
ffff8801417a9cc0 1808428839 C Bi:2:013:1 0 12800 = 3b200021 731f4520 9321bd20 881ffc1f 821ebd1f af08ba1d 0d2aca29 74264028
ffff8801417a9cc0 1808434637 S Bi:2:013:1 -115 19968 <
ffff8801417a9cc0 1808484434 C Bi:2:013:1 0 19968 = c2033308 5c0b200c fd065920 f622d020 6e21f322 7c244124 ae22eb24 71246820
ffff8801417a9cc0 1808486702 S Bi:2:013:1 -115 16384 <
ffff8801417a9cc0 1808537067 C Bi:2:013:1 0 16384 = ad00c900 b000a900 cd009200 d400b600 e8007700 9e002a00 8900a200 54009800
ffff8801417a9cc0 1808538731 S Bi:2:013:1 -115 16384 <
ffff8801417a9cc0 1808589858 C Bi:2:013:1 0 16384 = b6361d37 a3370e36 08340634 4c331a36 09377b2f 402c012d 862cb82c 3e2da72a
ffff8801417a9cc0 1808590664 S Bi:2:013:1 -115 12800 <
ffff8801417a9cc0 1808635732 C Bi:2:013:1 0 12800 = dd409a40 7f42f940 70423e41 df3ecc41 1340de3e a53eb53f 2440de3f 073ea43f
ffff8801417a9cc0 1808644719 S Bi:2:013:1 -115 15872 <
ffff8801417a9cc0 1808678066 C Bi:2:013:1 0 15872 = eb435143 e444cd43 7c44a041 1345f941 fb40373f db3c763b 943fa33f ce3d063e
ffff8801417a9cc0 1808682727 S Bi:2:013:1 -115 512 <
ffff8801417a9cc0 1808682780 C Bi:2:013:1 0 186 = ed008100 ce006a00 7b00aa00 c6009a00 7d00bc00 ec00cf00 ac00c900 63008d00
ffff8801417a9cc0 1808685619 S Ci:2:013:0 s c0 0c 0084 48c8 0001 1 <
ffff8801417a9cc0 1808685965 C Ci:2:013:0 0 1 = 03
ffff8801417a9cc0 1808688707 S Ci:2:013:0 s c0 0c 0084 48c8 0001 1 <
ffff8801417a9cc0 1808688943 C Ci:2:013:0 0 1 = 00
ffff8801417a9cc0 1808694976 S Co:2:013:0 s 40 0c 0088 0084 0001 1 = ff
ffff8801417a9cc0 1808695437 C Co:2:013:0 0 1 >
ffff8801417a9cc0 1808698882 S Co:2:013:0 s 40 0c 0088 0084 0001 1 = aa
ffff8801417a9cc0 1808699321 C Co:2:013:0 0 1 >
ffff8801417a9cc0 1808701921 S Co:2:013:0 s 40 0c 0088 0084 0001 1 = 55
ffff8801417a9cc0 1808702317 C Co:2:013:0 0 1 >
ffff8801417a9cc0 1808704946 S Co:2:013:0 s 40 0c 0088 0084 0001 1 = 00
ffff8801417a9cc0 1808705467 C Co:2:013:0 0 1 >
ffff8801417a9cc0 1808707851 S Co:2:013:0 s 40 0c 0088 0084 0001 1 = ff
ffff8801417a9cc0 1808708343 C Co:2:013:0 0 1 >
ffff8801417a9cc0 1808710886 S Co:2:013:0 s 40 0c 0088 0084 0001 1 = 87
ffff8801417a9cc0 1808711327 C Co:2:013:0 0 1 >
ffff8801417a9cc0 1808713925 S Co:2:013:0 s 40 0c 0088 0084 0001 1 = 78
ffff8801417a9cc0 1808714322 C Co:2:013:0 0 1 >
ffff8801417a9cc0 1808716960 S Co:2:013:0 s 40 0c 0088 0084 0001 1 = e0
ffff8801417a9cc0 1808717469 C Co:2:013:0 0 1 >
ffff8801417a9cc0 1808719851 S Co:2:013:0 s 40 0c 0087 0084 0001 1 = 05
ffff8801417a9cc0 1808720329 C Co:2:013:0 0 1 >
ffff8801417a9cc0 1808722893 S Co:2:013:0 s 40 0c 0087 0084 0001 1 = 04
ffff8801417a9cc0 1808723317 C Co:2:013:0 0 1 >
ffff8801417a9cc0 1808725923 S Co:2:013:0 s 40 0c 0088 0084 0001 1 = ff
ffff8801417a9cc0 1808726467 C Co:2:013:0 0 1 >
ffff8801417a9cc0 1808728954 S Co:2:013:0 s 40 0c 0085 0088 0001 1 = 08
ffff8801417a9cc0 1808729322 C Co:2:013:0 0 1 >
ffff8801417a9cc0 1808731850 S Co:2:013:0 s 40 0c 0085 0088 0001 1 = 00
ffff8801417a9cc0 1808732342 C Co:2:013:0 0 1 >
ffff8801417a9cc0 1808734900 S Co:2:013:0 s 40 0c 0085 0088 0001 1 = 00
ffff8801417a9cc0 1808735343 C Co:2:013:0 0 1 >
ffff8801417a9cc0 1808737924 S Co:2:013:0 s 40 0c 0085 0088 0001 1 = 00
ffff8801417a9cc0 1808738317 C Co:2:013:0 0 1 >
ffff8801417a9cc0 1808740954 S Co:2:013:0 s 40 0c 0085 0088 0001 1 = ff
ffff8801417a9cc0 1808741323 C Co:2:013:0 0 1 >
ffff8801417a9cc0 1808743850 S Co:2:013:0 s 40 0c 0085 0088 0001 1 = 00
ffff8801417a9cc0 1808744344 C Co:2:013:0 0 1 >
ffff8801417a9cc0 1808745877 S Ci:2:013:0 s c0 0c 0084 0006 0001 1 <
ffff8801417a9cc0 1808746219 C Ci:2:013:0 0 1 = 01
ffff8801417a9cc0 1808749922 S Co:2:013:0 s 40 04 0082 1694 0008 8 = 00000000 ba3e0700
ffff8801417a9cc0 1808750327 C Co:2:013:0 0 8 >
ffff8801417a9cc0 1808751941 S Bi:2:013:1 -115 19968 <
ffff8801417a9cc0 1808760823 C Bi:2:013:1 0 19968 = 52529f00 af00ac00 36007300 a900c100 9e00bc00 ac006500 a9008000 23007a00
ffff8801417a9cc0 1808761990 S Bi:2:013:1 -115 16384 <
ffff8801417a9cc0 1808798566 C Bi:2:013:1 0 16384 = 092db92b 1a329c2c 142e8b30 2d30782e cb2e512d 022fda2b 332d4c30 c82add2d
ffff8801417a9cc0 1808798975 S Bi:2:013:1 -115 16384 <
ffff8801417a9cc0 1808851373 C Bi:2:013:1 0 16384 = f746ce46 6c485845 fc48e74a 324a4b47 5e494149 cc47184b e849c34a f0447749
ffff8801417a9cc0 1808859573 S Bi:2:013:1 -115 12800 <
ffff8801417a9cc0 1808888865 C Bi:2:013:1 0 12800 = dd234423 52251325 38237522 62259f25 fe230625 fb25f924 2e268622 7b23f824
ffff8801417a9cc0 1808897593 S Bi:2:013:1 -115 19968 <
ffff8801417a9cc0 1808952831 C Bi:2:013:1 0 19968 = f821af21 47231124 ee22310d 9d0e2822 b0250022 a017cf09 e406b306 d9060607
ffff8801417a9cc0 1808958616 S Bi:2:013:1 -115 16384 <
ffff8801417a9cc0 1809005457 C Bi:2:013:1 0 16384 = a7006b00 b1006e00 98007300 6c00a900 63007e00 bd007700 d1007300 5d009400
ffff8801417a9cc0 1809010655 S Bi:2:013:1 -115 16384 <
ffff8801417a9cc0 1809058084 C Bi:2:013:1 0 16384 = e953f452 e04d694d 7250c650 9351414e 3650bd51 3c50dd51 714ef94f 9d4f1752
ffff8801417a9cc0 1809062583 S Bi:2:013:1 -115 12800 <
ffff8801417a9cc0 1809097671 C Bi:2:013:1 0 12800 = 1f227920 e5220b22 c4217e22 f221e220 8e204e23 9922d821 1a22a422 5322ed23
ffff8801417a9cc0 1809100581 S Bi:2:013:1 -115 19968 <
ffff8801417a9cc0 1809163509 C Bi:2:013:1 0 19968 = cd40bc42 533fa83f 193f3940 af3c883d 0e3df940 983ee03f 5042fe42 67421541
ffff8801417a9cc0 1809168648 S Bi:2:013:1 -115 16384 <
ffff8801417a9cc0 1809206094 C Bi:2:013:1 0 16384 = c4008200 b2007f00 83009d00 91009c00 8300de00 77009200 6800c000 9400a100
ffff8801417a9cc0 1809213543 S Bi:2:013:1 -115 16384 <
ffff8801417a9cc0 1809258697 C Bi:2:013:1 0 16384 = 70008700 5100f200 c100bd00 a5007e00 8200c500 96009200 4a00c600 bd006300
ffff8801417a9cc0 1809265674 S Bi:2:013:1 -115 12800 <
ffff8801417a9cc0 1809304595 C Bi:2:013:1 0 12800 = eb29bf2a e728d22a 632ab62a 1f2dcc29 812c372b 5629932a 8628fa2a 1429762d
ffff8801417a9cc0 1809310521 S Bi:2:013:1 -115 19968 <
ffff8801417a9cc0 1809364087 C Bi:2:013:1 0 19968 = 64344836 e537bf37 f0362d34 7e374f38 fd37073c 99345133 76369b34 b434f536
ffff8801417a9cc0 1809371525 S Bi:2:013:1 -115 16384 <
ffff8801417a9cc0 1809416710 C Bi:2:013:1 0 16384 = b0146e15 b208440b eb261026 3325fe24 1c255d25 57261d27 1325b525 2625ff24
ffff8801417a9cc0 1809423663 S Bi:2:013:1 -115 16384 <
ffff8801417a9cc0 1809467617 C Bi:2:013:1 0 16384 = 8100b900 82009300 8e00bb00 c200fb00 6d008900 8800a300 af00ac00 ee008800
ffff8801417a9cc0 1809468547 S Bi:2:013:1 -115 12800 <
ffff8801417a9cc0 1809505224 C Bi:2:013:1 0 12800 = 8f009000 8a00e500 a1005100 a100de00 c100d100 b500ec00 9b006a00 ce009b00
ffff8801417a9cc0 1809513507 S Bi:2:013:1 -115 19968 <
ffff8801417a9cc0 1809573094 C Bi:2:013:1 0 19968 = 8e08e80c 940adc05 2c02a003 2e010201 d5009600 d200a400 ac006f00 c3009900
ffff8801417a9cc0 1809574532 S Bi:2:013:1 -115 16384 <
ffff8801417a9cc0 1809625751 C Bi:2:013:1 0 16384 = c4601161 6e5f4a61 f45e6b44 e243a542 c0403441 65439c41 2844d140 6442dc40
ffff8801417a9cc0 1809626610 S Bi:2:013:1 -115 16384 <
ffff8801417a9cc0 1809678347 C Bi:2:013:1 0 16384 = 2915d615 3016a214 45159c13 a80b4d08 6423d325 e9247f25 3b265425 9e254b21
ffff8801417a9cc0 1809678636 S Bi:2:013:1 -115 12800 <
ffff8801417a9cc0 1809714110 C Bi:2:013:1 0 12800 = ca00d900 7c00a500 8b009100 3701b500 c8009800 7c008a00 bb00ad00 5d00c600
ffff8801417a9cc0 1809716482 S Bi:2:013:1 -115 19968 <
ffff8801417a9cc0 1809780023 C Bi:2:013:1 0 19968 = 5100e900 9100ce00 8a006c00 e900ce00 a100ba00 c700c700 2b004500 54008800
ffff8801417a9cc0 1809784613 S Bi:2:013:1 -115 16384 <
ffff8801417a9cc0 1809832568 C Bi:2:013:1 0 16384 = fb6b5869 836df06b e16a3466 fd628960 56642863 dd611862 a2625862 ad60c461
ffff8801417a9cc0 1809836670 S Bi:2:013:1 -115 16384 <
ffff8801417a9cc0 1809885254 C Bi:2:013:1 0 16384 = f51f521c e61d901d 1e1ec81e aa1e011e c21b8b12 2c12ba12 1c135211 f0129b11
ffff8801417a9cc0 1809888712 S Bi:2:013:1 -115 12800 <
ffff8801417a9cc0 1809924906 C Bi:2:013:1 0 12800 = d7134b13 8a138212 eb136613 4813ec11 37122213 670d3a09 4429da29 cc252526
ffff8801417a9cc0 1809933506 S Bi:2:013:1 -115 19968 <
ffff8801417a9cc0 1809980386 C Bi:2:013:1 0 19968 = 91037708 1d0d8d0d e407a81d 74223524 da231920 2f233d23 97248822 c5234724
ffff8801417a9cc0 1809985654 S Bi:2:013:1 -115 16384 <
ffff8801417a9cc0 1810033110 C Bi:2:013:1 0 16384 = 99009100 5e008a00 dc007200 6a004700 a3008600 fb004400 a100c000 da008300
ffff8801417a9cc0 1810037642 S Bi:2:013:1 -115 16384 <
ffff8801417a9cc0 1810085745 C Bi:2:013:1 0 16384 = d4769577 166f2e6b 9a746b70 c46d456b 0274a26f b8729773 f271b274 c26fc275
ffff8801417a9cc0 1810089657 S Bi:2:013:1 -115 12800 <
ffff8801417a9cc0 1810131603 C Bi:2:013:1 0 12800 = 8c532753 6156cd55 7d57d555 20550954 c253d153 e753f055 8e53b758 c356f358
ffff8801417a9cc0 1810134636 S Bi:2:013:1 -115 15872 <
ffff8801417a9cc0 1810174159 C Bi:2:013:1 0 15872 = 8f152215 e315d915 e3146715 87158216 ae153015 76164516 0d162216 bb159316
ffff8801417a9cc0 1810179580 S Bi:2:013:1 -115 512 <
ffff8801417a9cc0 1810179739 C Bi:2:013:1 0 186 = d600ae00 98007200 9c006700 5c008200 9a009500 f500af00 a600a100 af00b000
ffff8801417a9cc0 1810182615 S Ci:2:013:0 s c0 0c 0084 48c8 0001 1 <
ffff8801417a9cc0 1810182866 C Ci:2:013:0 0 1 = 03
ffff8801417a9cc0 1810185592 S Ci:2:013:0 s c0 0c 0084 48c8 0001 1 <
ffff8801417a9cc0 1810186043 C Ci:2:013:0 0 1 = 00
ffff8801417a9cc0 1810189562 S Co:2:013:0 s 40 0c 0088 0084 0001 1 = ff
ffff8801417a9cc0 1810189955 C Co:2:013:0 0 1 >
ffff8801417a9cc0 1810194978 S Co:2:013:0 s 40 0c 0088 0084 0001 1 = aa
ffff8801417a9cc0 1810195362 C Co:2:013:0 0 1 >
ffff8801417a9cc0 1810198831 S Co:2:013:0 s 40 0c 0088 0084 0001 1 = 55
ffff8801417a9cc0 1810199241 C Co:2:013:0 0 1 >
ffff8801417a9cc0 1810201882 S Co:2:013:0 s 40 0c 0088 0084 0001 1 = 00
ffff8801417a9cc0 1810202353 C Co:2:013:0 0 1 >
ffff8801417a9cc0 1810204902 S Co:2:013:0 s 40 0c 0088 0084 0001 1 = ff
ffff8801417a9cc0 1810205331 C Co:2:013:0 0 1 >
ffff8801417a9cc0 1810207799 S Co:2:013:0 s 40 0c 0088 0084 0001 1 = 87
ffff8801417a9cc0 1810208206 C Co:2:013:0 0 1 >
ffff8801417a9cc0 1810210829 S Co:2:013:0 s 40 0c 0088 0084 0001 1 = 78
ffff8801417a9cc0 1810211205 C Co:2:013:0 0 1 >
ffff8801417a9cc0 1810213866 S Co:2:013:0 s 40 0c 0088 0084 0001 1 = e0
ffff8801417a9cc0 1810214329 C Co:2:013:0 0 1 >
ffff8801417a9780 1810216949 S Co:2:013:0 s 40 0c 0087 0084 0001 1 = 05
ffff8801417a9780 1810217332 C Co:2:013:0 0 1 >
ffff8801417a9780 1810219793 S Co:2:013:0 s 40 0c 0087 0084 0001 1 = 04
ffff8801417a9780 1810220255 C Co:2:013:0 0 1 >
ffff8801417a9780 1810222826 S Co:2:013:0 s 40 0c 0088 0084 0001 1 = ff
ffff8801417a9780 1810223204 C Co:2:013:0 0 1 >
ffff8801417a9780 1810225866 S Co:2:013:0 s 40 0c 0085 0088 0001 1 = 08
ffff8801417a9780 1810226204 C Co:2:013:0 0 1 >
ffff8801417a9780 1810228898 S Co:2:013:0 s 40 0c 0085 0088 0001 1 = 00
ffff8801417a9780 1810229393 C Co:2:013:0 0 1 >
ffff8801417a9780 1810231792 S Co:2:013:0 s 40 0c 0085 0088 0001 1 = 00
ffff8801417a9780 1810232253 C Co:2:013:0 0 1 >
ffff8801417a9780 1810234828 S Co:2:013:0 s 40 0c 0085 0088 0001 1 = 00
ffff8801417a9780 1810235269 C Co:2:013:0 0 1 >
ffff8801417a9780 1810237872 S Co:2:013:0 s 40 0c 0085 0088 0001 1 = ff
ffff8801417a9780 1810238206 C Co:2:013:0 0 1 >
ffff8801417a9780 1810240896 S Co:2:013:0 s 40 0c 0085 0088 0001 1 = 00
ffff8801417a9780 1810241367 C Co:2:013:0 0 1 >
ffff8801417a9780 1810242973 S Ci:2:013:0 s c0 0c 0084 0006 0001 1 <
ffff8801417a9780 1810243243 C Ci:2:013:0 0 1 = 01
ffff8801417a9780 1810246830 S Co:2:013:0 s 40 04 0082 1694 0008 8 = 00000000 ba3e0700
ffff8801417a9780 1810247243 C Co:2:013:0 0 8 >
ffff8801417a9780 1810248853 S Bi:2:013:1 -115 19968 <
ffff8801417a9780 1810257616 C Bi:2:013:1 0 19968 = 52527b00 87004c00 c8009500 8d008800 d6008b00 9a008900 a100b600 6b006b00
ffff8801417a9780 1810258849 S Bi:2:013:1 -115 16384 <
ffff8801417a9780 1810294667 C Bi:2:013:1 0 16384 = 657aaa78 a278b173 747a0674 527ca974 1b760e78 83742973 14727c75 9b760e78
ffff8801417a9780 1810294986 S Bi:2:013:1 -115 16384 <
ffff8801417a9780 1810347219 C Bi:2:013:1 0 16384 = da6c426d 8c6aed6c 606eb66e e76eb36e 076df16d fa6fdf73 ae71876e cb719d6f
ffff8801417a9780 1810350019 S Bi:2:013:1 -115 12800 <
ffff8801417a9780 1810384800 C Bi:2:013:1 0 12800 = e7255f23 3324c727 ab26f526 1f253826 82244a24 28256127 86260926 22269e25
ffff8801417a9780 1810387881 S Bi:2:013:1 -115 19968 <
ffff8801417a9780 1810448773 C Bi:2:013:1 0 19968 = 31244d23 c325de21 74226422 1c258d25 a123f024 f2244d25 7c234f23 89249224
ffff8801417a9780 1810456025 S Bi:2:013:1 -115 16384 <
ffff8801417a9780 1810501403 C Bi:2:013:1 0 16384 = a500e100 ab009200 8700ac00 7400b400 9500b700 c800b400 ba00b700 8e00c800
ffff8801417a9780 1810508048 S Bi:2:013:1 -115 16384 <
ffff8801417a9780 1810554152 C Bi:2:013:1 0 16384 = bb7b0f78 cd7b6f7b 997dfd78 6e7b7278 4d761a82 fe7d937c 377d4b7d 447cef7f
ffff8801417a9780 1810559970 S Bi:2:013:1 -115 12800 <
ffff8801417a9780 1810593654 C Bi:2:013:1 0 12800 = 98612063 d1638564 08654662 e3638564 e4631062 5a643f64 0f682763 f9644167
ffff8801417a9cc0 1810597944 S Bi:2:013:1 -115 19968 <
ffff8801417a9cc0 1810659387 C Bi:2:013:1 0 19968 = df3daf40 133ea541 fa3e193d e23ef341 143b703f 913dc03b a13d343e 3e3e1840
ffff8801417a9cc0 1810666080 S Bi:2:013:1 -115 16384 <
ffff8801417a9cc0 1810702019 C Bi:2:013:1 0 16384 = 92008b00 7d00b500 b9009000 8400a800 d1008000 9c007000 a3006800 aa00bc00
ffff8801417a9cc0 1810710997 S Bi:2:013:1 -115 16384 <
ffff8801417a9cc0 1810754634 C Bi:2:013:1 0 16384 = bd009c00 6b00a000 6a00bd00 96008d00 4f008800 c6009400 cf00c600 bd008200
ffff8801417a9cc0 1810755979 S Bi:2:013:1 -115 12800 <
ffff8801417a9cc0 1810800509 C Bi:2:013:1 0 12800 = 3f6ad96e ff6bcf6b f86d7c71 416ed26a 686d9b70 dd6dde6f bf6f926d ef6fe770
ffff8801417a9cc0 1810809915 S Bi:2:013:1 -115 19968 <
ffff8801417a9cc0 1810859901 C Bi:2:013:1 0 19968 = 076d676a 0170e76d 66721c70 0c6ce972 3a756773 e96f296e c5701870 0b6e9c71
ffff8801417a9cc0 1810861985 S Bi:2:013:1 -115 16384 <
ffff8801417a9cc0 1810912666 C Bi:2:013:1 0 16384 = 060e0c0d 040e0004 dc1b6628 2b257623 fa240b25 11257724 de24a026 3226a327
ffff8801417a9cc0 1810914032 S Bi:2:013:1 -115 16384 <
ffff8801417a9cc0 1810963548 C Bi:2:013:1 0 16384 = c0006100 6e009a00 bc00ac00 8000b300 b800cd00 f000cc00 dc00ef00 73009900
ffff8801417a9cc0 1810966019 S Bi:2:013:1 -115 12800 <
ffff8801417a9cc0 1811001006 C Bi:2:013:1 0 12800 = a7009200 68009900 a1009a00 85009800 8600b500 7f00c300 82009900 79009200
ffff8801417a9cc0 1811003930 S Bi:2:013:1 -115 19968 <
ffff8801417a9cc0 1811068887 C Bi:2:013:1 0 19968 = 000b650d bb0ad607 6f02b705 47010c01 0901ee00 d000df00 c9000701 e900d500
ffff8801417a9cc0 1811071935 S Bi:2:013:1 -115 16384 <
ffff8801417a9cc0 1811121695 C Bi:2:013:1 0 16384 = db1a571d bf1a9d1a 3f19db1a d61fca1e 0d1fc11f 43210720 4f20eb1f 7b1f761f
ffff8801417a9cc0 1811123961 S Bi:2:013:1 -115 16384 <
ffff8801417a9cc0 1811174287 C Bi:2:013:1 0 16384 = b909c50a c10ab90a a50bb70a 860b3a05 d1148425 24281726 e522d523 4324d423
ffff8801417a9cc0 1811178284 S Bi:2:013:1 -115 12800 <
ffff8801417a9cc0 1811210016 C Bi:2:013:1 0 12800 = 7d008000 9500a800 b900da00 67008e00 5500cd00 ce000101 7800dc00 85007600
ffff8801417a9cc0 1811216106 S Bi:2:013:1 -115 19968 <
ffff8801417a9cc0 1811275777 C Bi:2:013:1 0 19968 = 5c008800 94009c00 77000001 8100d100 75009000 d3008300 a9009700 cb00d100
ffff8801417a9cc0 1811277115 S Bi:2:013:1 -115 16384 <
ffff8801417a9cc0 1811328412 C Bi:2:013:1 0 16384 = 567cc67d 0d800e7d 987b407e b47f9a7f af7e1c80 4676c875 cd73fb52 bc52936b
ffff8801417a9cc0 1811329296 S Bi:2:013:1 -115 16384 <
ffff8801417a9cc0 1811381164 C Bi:2:013:1 0 16384 = a97a3e83 7e82a584 4880d180 a47e0b7b 8e7e8681 7c7a2c7e d47f1f7d 587fb27d
ffff8801417a9cc0 1811381230 S Bi:2:013:1 -115 12800 <
ffff8801417a9cc0 1811420828 C Bi:2:013:1 0 12800 = be0b450c 160c580c 480c380d c90cbe0b 4b0ce60b 070c6606 2f138129 56293b28
ffff8801417a9cc0 1811426182 S Bi:2:013:1 -115 19968 <
ffff8801417a9cc0 1811476439 C Bi:2:013:1 0 19968 = 2c026a07 940b5b0c 0e08a61e 3924c024 4724801f bf206d24 0b27e323 77242525
ffff8801417a9cc0 1811478275 S Bi:2:013:1 -115 16384 <
ffff8801417a9cc0 1811529064 C Bi:2:013:1 0 16384 = a400c400 6100c700 cb00be00 c200a700 cd008e00 fa009600 95007300 76009200
ffff8801417a9cc0 1811530258 S Bi:2:013:1 -115 16384 <
ffff8801417a9cc0 1811581790 C Bi:2:013:1 0 16384 = 294f1c57 d2567e53 dd56c457 79555c57 ea54e850 6f599c6a b76a2469 876c4d68
ffff8801417a9cc0 1811582183 S Bi:2:013:1 -115 12800 <
ffff8801417a9cc0 1811627655 C Bi:2:013:1 0 12800 = 0c0db30c b80c0a0c 290c610b 7e0c6a0c 7b0d7d0c 130c8a0c 5f0b230e 8e10c812
ffff8801417a9cc0 1811636110 S Bi:2:013:1 -115 15872 <
ffff8801417a9cc0 1811669944 C Bi:2:013:1 0 15872 = d803a803 cd03d903 c4035703 7f03ba03 96041205 a3043804 a8045104 7e04aa04
ffff8801417a9cc0 1811674129 S Bi:2:013:1 -115 512 <
ffff8801417a9cc0 1811674296 C Bi:2:013:1 0 186 = 83008900 9900ae00 7f00be00 9e00ec00 7200af00 dd00b600 c1004d00 b9006e00
ffff8801417a9cc0 1811677154 S Ci:2:013:0 s c0 0c 0084 48c8 0001 1 <
ffff8801417a9cc0 1811677567 C Ci:2:013:0 0 1 = 03
ffff8801417a9cc0 1811680233 S Ci:2:013:0 s c0 0c 0084 48c8 0001 1 <
ffff8801417a9cc0 1811680504 C Ci:2:013:0 0 1 = 00
ffff8801417a9cc0 1811684101 S Co:2:013:0 s 40 0c 0088 0084 0001 1 = ff
ffff8801417a9cc0 1811684533 C Co:2:013:0 0 1 >
ffff8801417a9cc0 1811687137 S Co:2:013:0 s 40 0c 0088 0084 0001 1 = aa
ffff8801417a9cc0 1811687692 C Co:2:013:0 0 1 >
ffff8801417a9cc0 1811690173 S Co:2:013:0 s 40 0c 0088 0084 0001 1 = 55
ffff8801417a9cc0 1811690692 C Co:2:013:0 0 1 >
ffff8801417a9cc0 1811693682 S Co:2:013:0 s 40 0c 0088 0084 0001 1 = 00
ffff8801417a9cc0 1811694166 C Co:2:013:0 0 1 >
ffff8801417a9cc0 1811698643 S Co:2:013:0 s 40 0c 0088 0084 0001 1 = ff
ffff8801417a9cc0 1811699192 C Co:2:013:0 0 1 >
ffff8801417a9cc0 1811701679 S Co:2:013:0 s 40 0c 0088 0084 0001 1 = 87
ffff8801417a9cc0 1811702191 C Co:2:013:0 0 1 >
ffff8801417a9cc0 1811704709 S Co:2:013:0 s 40 0c 0088 0084 0001 1 = 78
ffff8801417a9cc0 1811705191 C Co:2:013:0 0 1 >
ffff8801417a9cc0 1811707756 S Co:2:013:0 s 40 0c 0088 0084 0001 1 = e0
ffff8801417a9cc0 1811708167 C Co:2:013:0 0 1 >
ffff8801417a9cc0 1811710648 S Co:2:013:0 s 40 0c 0087 0084 0001 1 = 05
ffff8801417a9cc0 1811711062 C Co:2:013:0 0 1 >
ffff8801417a9cc0 1811713684 S Co:2:013:0 s 40 0c 0087 0084 0001 1 = 04
ffff8801417a9cc0 1811714192 C Co:2:013:0 0 1 >
ffff8801417a9cc0 1811716719 S Co:2:013:0 s 40 0c 0088 0084 0001 1 = ff
ffff8801417a9cc0 1811717192 C Co:2:013:0 0 1 >
ffff8801417a9cc0 1811719754 S Co:2:013:0 s 40 0c 0085 0088 0001 1 = 08
ffff8801417a9cc0 1811720167 C Co:2:013:0 0 1 >
ffff8801417a9cc0 1811722647 S Co:2:013:0 s 40 0c 0085 0088 0001 1 = 00
ffff8801417a9cc0 1811723042 C Co:2:013:0 0 1 >
ffff8801417a9cc0 1811725684 S Co:2:013:0 s 40 0c 0085 0088 0001 1 = 00
ffff8801417a9cc0 1811726194 C Co:2:013:0 0 1 >
ffff8801417a9cc0 1811728716 S Co:2:013:0 s 40 0c 0085 0088 0001 1 = 00
ffff8801417a9cc0 1811729193 C Co:2:013:0 0 1 >
ffff8801417a9cc0 1811731754 S Co:2:013:0 s 40 0c 0085 0088 0001 1 = ff
ffff8801417a9cc0 1811732168 C Co:2:013:0 0 1 >
ffff8801417a9cc0 1811734644 S Co:2:013:0 s 40 0c 0085 0088 0001 1 = 00
ffff8801417a9cc0 1811735068 C Co:2:013:0 0 1 >
ffff8801417a9cc0 1811736668 S Ci:2:013:0 s c0 0c 0084 0006 0001 1 <
ffff8801417a9cc0 1811737297 C Ci:2:013:0 0 1 = 01
ffff8801417a9cc0 1811740708 S Co:2:013:0 s 40 04 0082 1694 0008 8 = 00000000 ba3e0700
ffff8801417a9cc0 1811741196 C Co:2:013:0 0 8 >
ffff8801417a9cc0 1811742857 S Bi:2:013:1 -115 19968 <
ffff8801417a9cc0 1811751958 C Bi:2:013:1 0 19968 = 52529000 7600b800 75005800 7300b200 8700be00 a200bb00 ad008c00 40008a00
ffff8801417a9cc0 1811752740 S Bi:2:013:1 -115 16384 <
ffff8801417a9cc0 1811790527 C Bi:2:013:1 0 16384 = fa6b956e 146a9c6c 096ec86e 4b6ec86b b26acc6e 226fb26c f36acf6b 2c675468
ffff8801417a9cc0 1811797673 S Bi:2:013:1 -115 16384 <
ffff8801417a9cc0 1811843176 C Bi:2:013:1 0 16384 = 2111cc11 af120e12 e6128912 7712ce11 6a133b13 2e136313 e512d812 9e127813
ffff8801417a9cc0 1811849754 S Bi:2:013:1 -115 12800 <
ffff8801417a9cc0 1811880807 C Bi:2:013:1 0 12800 = 33272526 4926a526 781e3804 ae0ec928 06275828 62258127 6418db03 ca15f32a
ffff8801417a9cc0 1811887774 S Bi:2:013:1 -115 19968 <
ffff8801417a9cc0 1811944805 C Bi:2:013:1 0 19968 = 48240423 ba234c23 4a24aa22 dc25e221 2a269024 ca236327 2725b925 df254d24
ffff8801417a9cc0 1811948620 S Bi:2:013:1 -115 16384 <
ffff8801417a9cc0 1811997422 C Bi:2:013:1 0 16384 = 67003c00 3200a200 79007d00 64006000 b1009e00 77005d00 65008200 5f005b00
ffff8801417a9cc0 1812000704 S Bi:2:013:1 -115 16384 <
ffff8801417a9cc0 1812050226 C Bi:2:013:1 0 16384 = 6c77007b 067e0b77 427aed7b d2781978 807bd179 e87e727c 1a72327c f278bd79
ffff8801417a9cc0 1812052750 S Bi:2:013:1 -115 12800 <
ffff8801417a9cc0 1812089687 C Bi:2:013:1 0 12800 = cc5bf25e c559e95a fb5c165b e05cbe58 8758fe5c 805c945b 495ec65e ed5a605e
ffff8801417a9cc0 1812097698 S Bi:2:013:1 -115 19968 <
ffff8801417a9cc0 1812155421 C Bi:2:013:1 0 19968 = eb02ea02 6002d402 e202c002 a3022302 c0024502 2203e602 7e029002 c9029702
ffff8801417a9cc0 1812158693 S Bi:2:013:1 -115 16384 <
ffff8801417a9cc0 1812198099 C Bi:2:013:1 0 16384 = 70007700 78007000 ab006d00 5500b500 a9007600 a600ab00 b200b900 ae00a700
ffff8801417a9cc0 1812203651 S Bi:2:013:1 -115 16384 <
ffff8801417a9cc0 1812250717 C Bi:2:013:1 0 16384 = a8009900 9800c200 93005800 7c00a300 bf007500 7200bd00 b7007300 b300a900
ffff8801417a9cc0 1812255744 S Bi:2:013:1 -115 12800 <
ffff8801417a9cc0 1812296565 C Bi:2:013:1 0 12800 = de6c2c6d 266c6c67 4e6eb76a e46bef6b 7f69ad69 946bd469 016e0770 746d626d
ffff8801417a9cc0 1812300683 S Bi:2:013:1 -115 19968 <
ffff8801417a9cc0 1812356104 C Bi:2:013:1 0 19968 = df6e5b6d aa6b3f6a ef6b6e6d 336c946e ea6b2970 df6aa46d 9c69e068 986c986c
ffff8801417a9cc0 1812361680 S Bi:2:013:1 -115 16384 <
ffff8801417a9cc0 1812408652 C Bi:2:013:1 0 16384 = ad066506 8c064905 18065626 1827dc24 9524c123 b6248125 83221711 61127918
ffff8801417a9cc0 1812413751 S Bi:2:013:1 -115 16384 <
ffff8801417a9cc0 1812459735 C Bi:2:013:1 0 16384 = 9600b400 d600bc00 d800bf00 b0008600 a900ab00 75007b00 80007600 99006500
ffff8801417a9cc0 1812465675 S Bi:2:013:1 -115 12800 <
ffff8801417a9cc0 1812497242 C Bi:2:013:1 0 12800 = db004000 de008700 ad008400 7a00d000 6400af00 b7009800 8e008c00 9a004e00
ffff8801417a9cc0 1812503694 S Bi:2:013:1 -115 19968 <
ffff8801417a9cc0 1812564941 C Bi:2:013:1 0 19968 = 810f9c0e fe0b8d08 4f020706 f100fb00 8c00f800 1c019d00 9c00ad00 7f009e00
ffff8801417a9cc0 1812571771 S Bi:2:013:1 -115 16384 <
ffff8801417a9cc0 1812617739 C Bi:2:013:1 0 16384 = 7a10f411 2d100510 1c10f90f 6a151217 bf15b715 50162a15 43173316 4317e516
ffff8801417a9cc0 1812623681 S Bi:2:013:1 -115 16384 <
ffff8801417a9cc0 1812670330 C Bi:2:013:1 0 16384 = 21052005 2105b004 b805a705 45054805 76048222 9923a323 c7231024 65239623
ffff8801417a9cc0 1812675727 S Bi:2:013:1 -115 12800 <
ffff8801417a9cc0 1812706119 C Bi:2:013:1 0 12800 = 8c00ce00 a7005400 37007900 b300b100 8b00b800 9b007600 ce00d700 df009b00
ffff8801417a9cc0 1812713737 S Bi:2:013:1 -115 19968 <
ffff8801417a9cc0 1812771869 C Bi:2:013:1 0 19968 = ba005800 3900b100 7700c800 8e008600 81003a00 86008200 fd008a00 f7008e00
ffff8801417a9cc0 1812774763 S Bi:2:013:1 -115 16384 <
ffff8801417a9cc0 1812824459 C Bi:2:013:1 0 16384 = ed61d05d e05e2160 17641063 1f653072 0874d475 72720b74 3579e871 98714279
ffff8801417a9cc0 1812826694 S Bi:2:013:1 -115 16384 <
ffff8801417a9cc0 1812877170 C Bi:2:013:1 0 16384 = 511d771f 161ecd1e c91c331d 501d9f1d 9d1e5b1c 6a214823 fd226d23 de222023
ffff8801417a9cc0 1812878712 S Bi:2:013:1 -115 12800 <
ffff8801417a9cc0 1812916734 C Bi:2:013:1 0 12800 = 7b066f06 e9051e06 61066f06 cc058406 e3068e06 a2064006 80051726 3b285d26
ffff8801417a9cc0 1812923645 S Bi:2:013:1 -115 19968 <
ffff8801417a9cc0 1812972340 C Bi:2:013:1 0 19968 = db022309 d50b810e 200ec620 49246d21 35239223 42242224 d2231622 2e25b923
ffff8801417a9cc0 1812975724 S Bi:2:013:1 -115 16384 <
ffff8801417a9cc0 1813025082 C Bi:2:013:1 0 16384 = 81007800 7a00e300 c500b800 2101bb00 ce00e800 ee00c600 6b008c00 a700d100
ffff8801417a9cc0 1813027744 S Bi:2:013:1 -115 16384 <
ffff8801417a9cc0 1813077733 C Bi:2:013:1 0 16384 = 9c704770 4b6fd46f bc6d7e69 776b5a70 8a6b7f6d 6e6a7d70 0373f66e 40731f72
ffff8801417a9cc0 1813079665 S Bi:2:013:1 -115 12800 <
ffff8801417a9cc0 1813123595 C Bi:2:013:1 0 12800 = c44b274b 904c9e47 1d4c2c4c d14a324a 874a3749 8748384b 294b2e49 f4511753
ffff8801417a9cc0 1813124626 S Bi:2:013:1 -115 15872 <
ffff8801417a9cc0 1813166000 C Bi:2:013:1 0 15872 = 0a069605 85054005 a206fe05 d204dc04 f3050d06 fe05e305 89061c06 2406e905
ffff8801417a9cc0 1813170582 S Bi:2:013:1 -115 512 <
ffff8801417a9cc0 1813170679 C Bi:2:013:1 0 186 = 8500c600 77007700 86006000 54008500 9f007700 a2006100 6300af00 d3009800
ffff8801417a9cc0 1813173465 S Ci:2:013:0 s c0 0c 0084 48c8 0001 1 <
ffff8801417a9cc0 1813173678 C Ci:2:013:0 0 1 = 03
ffff8801417a9cc0 1813176546 S Ci:2:013:0 s c0 0c 0084 48c8 0001 1 <
ffff8801417a9cc0 1813176802 C Ci:2:013:0 0 1 = 00
ffff8801417a9cc0 1813180541 S Co:2:013:0 s 40 0c 0088 0084 0001 1 = ff
ffff8801417a9cc0 1813180927 C Co:2:013:0 0 1 >
ffff8801417a9cc0 1813183567 S Co:2:013:0 s 40 0c 0088 0084 0001 1 = aa
ffff8801417a9cc0 1813183928 C Co:2:013:0 0 1 >
ffff8801417a9cc0 1813186479 S Co:2:013:0 s 40 0c 0088 0084 0001 1 = 55
ffff8801417a9cc0 1813186928 C Co:2:013:0 0 1 >
ffff8801417a9cc0 1813189515 S Co:2:013:0 s 40 0c 0088 0084 0001 1 = 00
ffff8801417a9cc0 1813189966 C Co:2:013:0 0 1 >
ffff8801417a9cc0 1813194989 S Co:2:013:0 s 40 0c 0088 0084 0001 1 = ff
ffff8801417a9cc0 1813195427 C Co:2:013:0 0 1 >
ffff8801417a9cc0 1813199164 S Co:2:013:0 s 40 0c 0088 0084 0001 1 = 87
ffff8801417a9cc0 1813199577 C Co:2:013:0 0 1 >
ffff8801417a9cc0 1813202205 S Co:2:013:0 s 40 0c 0088 0084 0001 1 = 78
ffff8801417a9cc0 1813202578 C Co:2:013:0 0 1 >
ffff8801417a9cc0 1813205234 S Co:2:013:0 s 40 0c 0088 0084 0001 1 = e0
ffff8801417a9cc0 1813205678 C Co:2:013:0 0 1 >
ffff8801417a9cc0 1813208131 S Co:2:013:0 s 40 0c 0087 0084 0001 1 = 05
ffff8801417a9cc0 1813208574 C Co:2:013:0 0 1 >
ffff8801417a9cc0 1813211170 S Co:2:013:0 s 40 0c 0087 0084 0001 1 = 04
ffff8801417a9cc0 1813211582 C Co:2:013:0 0 1 >
ffff8801417a9cc0 1813214205 S Co:2:013:0 s 40 0c 0088 0084 0001 1 = ff
ffff8801417a9cc0 1813214558 C Co:2:013:0 0 1 >
ffff8801417a9cc0 1813217234 S Co:2:013:0 s 40 0c 0085 0088 0001 1 = 08
ffff8801417a9cc0 1813217557 C Co:2:013:0 0 1 >
ffff8801417a9cc0 1813220128 S Co:2:013:0 s 40 0c 0085 0088 0001 1 = 00
ffff8801417a9cc0 1813220591 C Co:2:013:0 0 1 >
ffff8801417a9cc0 1813223176 S Co:2:013:0 s 40 0c 0085 0088 0001 1 = 00
ffff8801417a9cc0 1813223587 C Co:2:013:0 0 1 >
ffff8801417a9cc0 1813226206 S Co:2:013:0 s 40 0c 0085 0088 0001 1 = 00
ffff8801417a9cc0 1813226612 C Co:2:013:0 0 1 >
ffff8801417a9cc0 1813229239 S Co:2:013:0 s 40 0c 0085 0088 0001 1 = ff
ffff8801417a9cc0 1813229743 C Co:2:013:0 0 1 >
ffff8801417a9cc0 1813232131 S Co:2:013:0 s 40 0c 0085 0088 0001 1 = 00
ffff8801417a9cc0 1813232620 C Co:2:013:0 0 1 >
ffff8801417a9cc0 1813234153 S Ci:2:013:0 s c0 0c 0084 0006 0001 1 <
ffff8801417a9cc0 1813234472 C Ci:2:013:0 0 1 = 01
ffff8801417a9cc0 1813238204 S Co:2:013:0 s 40 04 0082 1694 0008 8 = 00000000 ba3e0700
ffff8801417a9cc0 1813238592 C Co:2:013:0 0 8 >
ffff8801417a9cc0 1813240221 S Bi:2:013:1 -115 19968 <
ffff8801417a9cc0 1813249617 C Bi:2:013:1 0 19968 = 52524800 9700c800 a4008d00 8300a900 85008b00 c8004000 a5005500 d500a300
ffff8801417a9cc0 1813250234 S Bi:2:013:1 -115 16384 <
ffff8801417a9cc0 1813286636 C Bi:2:013:1 0 16384 = a0758a73 6d77c079 fb702274 f573d771 16712474 fd749a76 f973c975 f96fa26b
ffff8801417a9cc0 1813295158 S Bi:2:013:1 -115 16384 <
ffff8801417a9cc0 1813339215 C Bi:2:013:1 0 16384 = 854a2d4b 404d6548 8e48924d d44b9a4b 5e4c2c50 ff4eff4d 5d4eda4b e74d5b4e
ffff8801417a9cc0 1813346974 S Bi:2:013:1 -115 12800 <
ffff8801417a9cc0 1813376687 C Bi:2:013:1 0 12800 = 9e247b24 47249724 4e247924 1326bc25 b3264729 03264227 26251d27 84267e26
ffff8801417a9cc0 1813386199 S Bi:2:013:1 -115 19968 <
ffff8801417a9cc0 1813440755 C Bi:2:013:1 0 19968 = 87224823 ec227024 f0205b24 6b234025 f3248925 69224b23 1e242e25 df248f24
ffff8801417a9cc0 1813447190 S Bi:2:013:1 -115 16384 <
ffff8801417a9cc0 1813493339 C Bi:2:013:1 0 16384 = 8200bc00 75007a00 7e009e00 97009400 4b008100 99008c00 76007500 90007100
ffff8801417a9cc0 1813499138 S Bi:2:013:1 -115 16384 <
ffff8801417a9cc0 1813546112 C Bi:2:013:1 0 16384 = 7a725272 416fbb6c 3a72ae72 96728372 1f6d8b68 bd6d906f b6703773 6f738f73
ffff8801417a9cc0 1813551189 S Bi:2:013:1 -115 12800 <
ffff8801417a9cc0 1813585637 C Bi:2:013:1 0 12800 = e0146113 e6148613 2d148913 eb148115 1b141214 c615ea14 60136013 d714e813
ffff8801417a9cc0 1813589158 S Bi:2:013:1 -115 19968 <
ffff8801417a9cc0 1813651530 C Bi:2:013:1 0 19968 = 6e354c33 d1321f34 5033df34 d334be31 22334533 b532e432 56326d33 6533bf36
ffff8801417a9cc0 1813657299 S Bi:2:013:1 -115 16384 <
ffff8801417a9cc0 1813694033 C Bi:2:013:1 0 16384 = 8200a800 7400ad00 76007100 97007a00 9f009d00 6c00a200 7f007000 ac007400
ffff8801417a9cc0 1813702096 S Bi:2:013:1 -115 16384 <
ffff8801417a9cc0 1813746783 C Bi:2:013:1 0 16384 = 85006e00 c0008c00 ca00b600 bb007e00 a4007600 7d00a100 8d008d00 7200a200
ffff8801417a9cc0 1813754194 S Bi:2:013:1 -115 12800 <
ffff8801417a9cc0 1813792655 C Bi:2:013:1 0 12800 = b1043205 79052f05 a9040b05 8f045d05 2c05e704 7f042805 a3049804 8d046404
ffff8801417a9cc0 1813799131 S Bi:2:013:1 -115 19968 <
ffff8801417a9cc0 1813852156 C Bi:2:013:1 0 19968 = 91213520 10219021 ad207421 ee226721 2923c722 831ff922 16213020 0121a421
ffff8801417a9cc0 1813860138 S Bi:2:013:1 -115 16384 <
ffff8801417a9cc0 1813904747 C Bi:2:013:1 0 16384 = eb023103 03031303 e1030424 31272326 6b23e625 fe24c926 84273006 01069527
ffff8801417a9cc0 1813912221 S Bi:2:013:1 -115 16384 <
ffff8801417a9cc0 1813955653 C Bi:2:013:1 0 16384 = 9600bf00 a0007800 5b008b00 cc009200 b100cb00 4a005700 4b00b600 a0009000
ffff8801417a9cc0 1813957139 S Bi:2:013:1 -115 12800 <
ffff8801417a9cc0 1813993116 C Bi:2:013:1 0 12800 = 77007100 a800e500 d200d600 7e00e600 b3006e00 77002e00 7f004300 8e00ed00
ffff8801417a9cc0 1813995164 S Bi:2:013:1 -115 19968 <
ffff8801417a9cc0 1814061036 C Bi:2:013:1 0 19968 = 4f0dfb0c 2e0b6a04 bc016b01 1501d200 1001b900 b100cf00 7d00b800 8300c100
ffff8801417a9cc0 1814063243 S Bi:2:013:1 -115 16384 <
ffff8801417a9cc0 1814113621 C Bi:2:013:1 0 16384 = 71089408 32084008 6808aa08 900eec11 80135812 80127011 98121711 a211ae13
ffff8801417a9cc0 1814115234 S Bi:2:013:1 -115 16384 <
ffff8801417a9cc0 1814166285 C Bi:2:013:1 0 16384 = e2022003 08034d03 a9024403 8103e402 e103d322 3724d521 3a23eb20 d2262628
ffff8801417a9cc0 1814167196 S Bi:2:013:1 -115 12800 <
ffff8801417a9cc0 1814202144 C Bi:2:013:1 0 12800 = 9600c900 7d007200 d0007e00 5200b100 b3007a00 9100bc00 5a007900 ac00d100
ffff8801417a9cc0 1814205100 S Bi:2:013:1 -115 19968 <
ffff8801417a9cc0 1814267778 C Bi:2:013:1 0 19968 = fb00be00 3b009e00 ac008a00 84005a00 7d006c00 30007700 3d005b00 4f009a00
ffff8801417a9cc0 1814273257 S Bi:2:013:1 -115 16384 <
ffff8801417a9cc0 1814320505 C Bi:2:013:1 0 16384 = 0f2a832d 292bab2a 3c2c7f2d 872a8b15 63094109 1308a508 43087b08 6b081208
ffff8801417a9cc0 1814325164 S Bi:2:013:1 -115 16384 <
ffff8801417a9cc0 1814373126 C Bi:2:013:1 0 16384 = 9906b006 b706e506 b5065e06 f9063407 4f06e606 b20a350d 070d120c a40deb0c
ffff8801417a9cc0 1814377213 S Bi:2:013:1 -115 12800 <
ffff8801417a9cc0 1814412660 C Bi:2:013:1 0 12800 = cb029d02 6002bb02 87025a02 4d02c502 cc02f902 6703ed02 06051325 7a2a9329
ffff8801417a9cc0 1814415182 S Bi:2:013:1 -115 19968 <
ffff8801417a9cc0 1814468391 C Bi:2:013:1 0 19968 = 17079f0a b30c6e08 77129322 0f252723 3d257421 af211c25 9122e222 c3238321
ffff8801417a9cc0 1814476145 S Bi:2:013:1 -115 16384 <
ffff8801417a9cc0 1814521017 C Bi:2:013:1 0 16384 = 69008500 41007900 7c007c00 af007000 51009000 ae008700 9800b200 b7007600
ffff8801417a9cc0 1814528216 S Bi:2:013:1 -115 16384 <
ffff8801417a9cc0 1814573783 C Bi:2:013:1 0 16384 = 191afa1a 6818ef19 a31af71a e2199a1a 531aca19 891b8d0b 2104d403 4a03eb03
ffff8801417a9cc0 1814580179 S Bi:2:013:1 -115 12800 <
ffff8801417a9cc0 1814619477 C Bi:2:013:1 0 12800 = 64022102 97026802 50025c02 d1010d02 28023202 4602da01 8902af02 7302f902
ffff8801417a9cc0 1814625100 S Bi:2:013:1 -115 15872 <
ffff8801417a9cc0 1814661904 C Bi:2:013:1 0 15872 = 81015e02 5d022802 0b028702 07022902 c502c802 a402a202 b402d402 49029f02
ffff8801417a9cc0 1814670174 S Bi:2:013:1 -115 512 <
ffff8801417a9cc0 1814670229 C Bi:2:013:1 0 186 = 73009700 c7009200 6c00a200 8a00d000 9a00d100 3000db00 86009b00 83007500
ffff8801417a9cc0 1814673090 S Ci:2:013:0 s c0 0c 0084 48c8 0001 1 <
ffff8801417a9cc0 1814673396 C Ci:2:013:0 0 1 = 03
ffff8801417a9cc0 1814676178 S Ci:2:013:0 s c0 0c 0084 48c8 0001 1 <
ffff8801417a9cc0 1814676514 C Ci:2:013:0 0 1 = 00
ffff8801417a9cc0 1814680162 S Co:2:013:0 s 40 0c 0088 0084 0001 1 = ff
ffff8801417a9cc0 1814680647 C Co:2:013:0 0 1 >
ffff8801417a9cc0 1814683224 S Co:2:013:0 s 40 0c 0088 0084 0001 1 = aa
ffff8801417a9cc0 1814683641 C Co:2:013:0 0 1 >
ffff8801417a9cc0 1814686104 S Co:2:013:0 s 40 0c 0088 0084 0001 1 = 55
ffff8801417a9cc0 1814686516 C Co:2:013:0 0 1 >
ffff8801417a9cc0 1814689135 S Co:2:013:0 s 40 0c 0088 0084 0001 1 = 00
ffff8801417a9cc0 1814689516 C Co:2:013:0 0 1 >
ffff8801417a9cc0 1814692174 S Co:2:013:0 s 40 0c 0088 0084 0001 1 = ff
ffff8801417a9cc0 1814692640 C Co:2:013:0 0 1 >
ffff8801417a9cc0 1814697024 S Co:2:013:0 s 40 0c 0088 0084 0001 1 = 87
ffff8801417a9cc0 1814697511 C Co:2:013:0 0 1 >
ffff8801417a9cc0 1814699556 S Co:2:013:0 s 40 0c 0088 0084 0001 1 = 78
ffff8801417a9cc0 1814700042 C Co:2:013:0 0 1 >
ffff8801417a9cc0 1814702590 S Co:2:013:0 s 40 0c 0088 0084 0001 1 = e0
ffff8801417a9cc0 1814703024 C Co:2:013:0 0 1 >
ffff8801417a9cc0 1814705626 S Co:2:013:0 s 40 0c 0087 0084 0001 1 = 05
ffff8801417a9cc0 1814706166 C Co:2:013:0 0 1 >
ffff8801417a9cc0 1814708524 S Co:2:013:0 s 40 0c 0087 0084 0001 1 = 04
ffff8801417a9cc0 1814709007 C Co:2:013:0 0 1 >
ffff8801417a9cc0 1814711560 S Co:2:013:0 s 40 0c 0088 0084 0001 1 = ff
ffff8801417a9cc0 1814712022 C Co:2:013:0 0 1 >
ffff8801417a9cc0 1814714597 S Co:2:013:0 s 40 0c 0085 0088 0001 1 = 08
ffff8801417a9cc0 1814715043 C Co:2:013:0 0 1 >
ffff8801417a9cc0 1814717632 S Co:2:013:0 s 40 0c 0085 0088 0001 1 = 00
ffff8801417a9cc0 1814718166 C Co:2:013:0 0 1 >
ffff8801417a9cc0 1814720531 S Co:2:013:0 s 40 0c 0085 0088 0001 1 = 00
ffff8801417a9cc0 1814721044 C Co:2:013:0 0 1 >
ffff8801417a9cc0 1814723712 S Co:2:013:0 s 40 0c 0085 0088 0001 1 = 00
ffff8801417a9cc0 1814724142 C Co:2:013:0 0 1 >
ffff8801417a9cc0 1814726601 S Co:2:013:0 s 40 0c 0085 0088 0001 1 = ff
ffff8801417a9cc0 1814727044 C Co:2:013:0 0 1 >
ffff8801417a9cc0 1814729637 S Co:2:013:0 s 40 0c 0085 0088 0001 1 = 00
ffff8801417a9cc0 1814730022 C Co:2:013:0 0 1 >
ffff8801417a9cc0 1814731630 S Ci:2:013:0 s c0 0c 0084 0006 0001 1 <
ffff8801417a9cc0 1814731893 C Ci:2:013:0 0 1 = 01
ffff8801417a9cc0 1814735567 S Co:2:013:0 s 40 04 0082 1694 0008 8 = 00000000 ba3e0700
ffff8801417a9cc0 1814736045 C Co:2:013:0 0 8 >
ffff8801417a9cc0 1814737591 S Bi:2:013:1 -115 19968 <
ffff8801417a9cc0 1814746392 C Bi:2:013:1 0 19968 = 52529900 79007c00 78007400 7a00bf00 ad007400 56006300 61006700 82004000
ffff8801417a9cc0 1814747608 S Bi:2:013:1 -115 16384 <
ffff8801417a9cc0 1814782540 C Bi:2:013:1 0 16384 = dc03cc03 7e035b03 bb024203 63037b03 0d032f03 f902a203 9d029f03 e8025803
ffff8801417a9cc0 1814783742 S Bi:2:013:1 -115 16384 <
ffff8801417a9cc0 1814835154 C Bi:2:013:1 0 16384 = 9e03d903 25047f03 bb03ce03 20048303 4004d403 6203f503 11049a03 87039d03
ffff8801417a9cc0 1814835631 S Bi:2:013:1 -115 12800 <
ffff8801417a9cc0 1814872648 C Bi:2:013:1 0 12800 = 9525bc23 30264a27 dc25b709 c50b9a1c 8323fc23 5e25b725 10288b24 ed257a24
ffff8801417a9cc0 1814880583 S Bi:2:013:1 -115 19968 <
ffff8801417a9cc0 1814936677 C Bi:2:013:1 0 19968 = cc224f23 a023c725 e222d124 6424cd24 6225ae23 cc254925 b024b922 72256620
ffff8801417a9cc0 1814941592 S Bi:2:013:1 -115 16384 <
ffff8801417a9cc0 1814989299 C Bi:2:013:1 0 16384 = 69007e00 a3007400 8600a900 8d009600 5e007900 b1007600 75007300 56008000
ffff8801417a9cc0 1814993650 S Bi:2:013:1 -115 16384 <
ffff8801417a9cc0 1815041991 C Bi:2:013:1 0 16384 = 4d068506 65067406 a8055806 17060a06 40063406 3606c305 22062d06 9606b406
ffff8801417a9cc0 1815045693 S Bi:2:013:1 -115 12800 <
ffff8801417a9cc0 1815081528 C Bi:2:013:1 0 12800 = 02137712 56119414 4f133412 c0133e13 46136613 30136613 4b133b13 3b14e213
ffff8801417a9cc0 1815083581 S Bi:2:013:1 -115 19968 <
ffff8801417a9cc0 1815147409 C Bi:2:013:1 0 19968 = d4048104 fd049304 ad04f804 af042804 0a054a04 31058205 2d053c05 b404e304
ffff8801417a9cc0 1815151683 S Bi:2:013:1 -115 16384 <
ffff8801417a9cc0 1815189933 C Bi:2:013:1 0 16384 = 9c004e00 87008f00 6000a500 7200aa00 6e008600 6b005000 8300ab00 95007200
ffff8801417a9cc0 1815196627 S Bi:2:013:1 -115 16384 <
ffff8801417a9cc0 1815242578 C Bi:2:013:1 0 16384 = b4009b00 7100a800 9100b200 41005700 7e007d00 3800b300 7f006e00 41007600
ffff8801417a9cc0 1815248707 S Bi:2:013:1 -115 12800 <
ffff8801417a9cc0 1815288417 C Bi:2:013:1 0 12800 = 4c180a17 63188a17 a9174218 5e18c417 2718f019 6a19b219 0919811a 461ae919
ffff8801417a9cc0 1815293662 S Bi:2:013:1 -115 19968 <
ffff8801417a9cc0 1815347955 C Bi:2:013:1 0 19968 = 202bae25 b5274d27 dc273829 6928272b 5c27ce2a 3d297228 cd271228 21278729
ffff8801417a9cc0 1815354702 S Bi:2:013:1 -115 16384 <
ffff8801417a9cc0 1815400539 C Bi:2:013:1 0 16384 = 7601a201 f401da01 3e03d024 bc270b25 22241e25 b1251e25 ad251525 56257224
ffff8801417a9cc0 1815406595 S Bi:2:013:1 -115 16384 <
ffff8801417a9cc0 1815451421 C Bi:2:013:1 0 16384 = 7600a200 9900fc00 7b006c00 9d006100 6f00c600 6b009b00 b500b400 92007a00
ffff8801417a9cc0 1815458618 S Bi:2:013:1 -115 12800 <
ffff8801417a9cc0 1815488917 C Bi:2:013:1 0 12800 = 7b007600 b6004a00 9d004700 3300c600 b9009900 90006200 c5009700 a6008100
ffff8801417a9cc0 1815496602 S Bi:2:013:1 -115 19968 <
ffff8801417a9cc0 1815556819 C Bi:2:013:1 0 19968 = 0f0eba0c 050bb902 43032101 f900b600 a7009800 a700e700 a0007d00 8b00b100
ffff8801417a9cc0 1815564723 S Bi:2:013:1 -115 16384 <
ffff8801417a9cc0 1815609588 C Bi:2:013:1 0 16384 = 34263226 32267325 fa244726 d9245425 c2241c25 5425f228 1027d828 720cad04
ffff8801417a9cc0 1815616669 S Bi:2:013:1 -115 16384 <
ffff8801417a9cc0 1815662197 C Bi:2:013:1 0 16384 = 7e016c01 56017f01 be01bf01 0102e401 1404961f dd208324 ec220323 6b22d321
ffff8801417a9cc0 1815668670 S Bi:2:013:1 -115 12800 <
ffff8801417a9cc0 1815697946 C Bi:2:013:1 0 12800 = 9b008700 6e008900 7100b200 85009d00 c8006b00 13017c00 c8008a00 5e00bb00
ffff8801417a9cc0 1815706555 S Bi:2:013:1 -115 19968 <
ffff8801417a9cc0 1815763682 C Bi:2:013:1 0 19968 = a400aa00 c8008500 52005c00 95008800 b900ae00 3a006c00 43008c00 e7006b00
ffff8801417a9cc0 1815767572 S Bi:2:013:1 -115 16384 <
ffff8801417a9cc0 1815816472 C Bi:2:013:1 0 16384 = f8174f18 af153a15 a316ce15 b915ef14 c4167a16 f5156915 4d145c15 9b15b915
ffff8801417a9cc0 1815819657 S Bi:2:013:1 -115 16384 <
ffff8801417a9cc0 1815869044 C Bi:2:013:1 0 16384 = 162b662a 4f2a7b2a cb2a282a a4294029 5829062a 61282c2b 072a3f2a 902ae72b
ffff8801417a9cc0 1815871617 S Bi:2:013:1 -115 12800 <
ffff8801417a9cc0 1815908731 C Bi:2:013:1 0 12800 = 3926f527 20277527 d229f627 0429bb26 7827c824 5c28e428 f926f127 e2286427
ffff8801417a9cc0 1815916623 S Bi:2:013:1 -115 19968 <
ffff8801417a9cc0 1815964355 C Bi:2:013:1 0 19968 = 100a510a 710e6318 08202623 3b227522 1c211222 a224c223 a5232623 4c259d24
ffff8801417a9cc0 1815968630 S Bi:2:013:1 -115 16384 <
ffff8801417a9cc0 1816016983 C Bi:2:013:1 0 16384 = de009000 4800ae00 5e007c00 9000bb00 71006c00 b300a900 5300b300 b1008800
ffff8801417a9cc0 1816020617 S Bi:2:013:1 -115 16384 <
ffff8801417a9cc0 1816069708 C Bi:2:013:1 0 16384 = 210a2422 cb275214 7b044d1a 9a33150c 9803a80b 3f180421 7619bb03 980e1e17
ffff8801417a9cc0 1816072666 S Bi:2:013:1 -115 12800 <
ffff8801417a9cc0 1816115580 C Bi:2:013:1 0 12800 = d1259326 912ab00a 3909951d ef20e520 c51fae20 6b29502a 770ace0a 3d298b0d
ffff8801417a9cc0 1816117597 S Bi:2:013:1 -115 15872 <
ffff8801417a9cc0 1816157823 C Bi:2:013:1 0 15872 = ee0c7c07 e01b6527 a21b9408 460f9228 872bc527 660de604 6e05661b fa2c272a
ffff8801417a9cc0 1816162553 S Bi:2:013:1 -115 512 <
ffff8801417a9cc0 1816162658 C Bi:2:013:1 0 186 = 68009300 9b00a400 c7007f00 b300cd00 a900c000 7600b300 93007200 5d002c00
ffff8801417a9cc0 1816165600 S Ci:2:013:0 s c0 0c 0084 48c8 0001 1 <
ffff8801417a9cc0 1816165903 C Ci:2:013:0 0 1 = 03
ffff8801417a9cc0 1816168699 S Ci:2:013:0 s c0 0c 0084 48c8 0001 1 <
ffff8801417a9cc0 1816168944 C Ci:2:013:0 0 1 = 00
ffff8801417a9cc0 1816172526 S Co:2:013:0 s 40 0c 0088 0084 0001 1 = ff
ffff8801417a9cc0 1816172939 C Co:2:013:0 0 1 >
ffff8801417a9cc0 1816175562 S Co:2:013:0 s 40 0c 0088 0084 0001 1 = aa
ffff8801417a9cc0 1816176066 C Co:2:013:0 0 1 >
ffff8801417a9cc0 1816182379 S Co:2:013:0 s 40 0c 0088 0084 0001 1 = 55
ffff8801417a9cc0 1816182815 C Co:2:013:0 0 1 >
ffff8801417a9cc0 1816184738 S Co:2:013:0 s 40 0c 0088 0084 0001 1 = 00
ffff8801417a9cc0 1816185190 C Co:2:013:0 0 1 >
ffff8801417a9cc0 1816187773 S Co:2:013:0 s 40 0c 0088 0084 0001 1 = ff
ffff8801417a9cc0 1816188191 C Co:2:013:0 0 1 >
ffff8801417a9cc0 1816190807 S Co:2:013:0 s 40 0c 0088 0084 0001 1 = 87
ffff8801417a9cc0 1816191196 C Co:2:013:0 0 1 >
ffff8801417a9cc0 1816193838 S Co:2:013:0 s 40 0c 0088 0084 0001 1 = 78
ffff8801417a9cc0 1816194278 C Co:2:013:0 0 1 >
ffff8801417a9cc0 1816196733 S Co:2:013:0 s 40 0c 0088 0084 0001 1 = e0
ffff8801417a9cc0 1816197216 C Co:2:013:0 0 1 >
ffff8801417a9cc0 1816199771 S Co:2:013:0 s 40 0c 0087 0084 0001 1 = 05
ffff8801417a9cc0 1816200177 C Co:2:013:0 0 1 >
ffff8801417a9cc0 1816202805 S Co:2:013:0 s 40 0c 0087 0084 0001 1 = 04
ffff8801417a9cc0 1816203154 C Co:2:013:0 0 1 >
ffff8801417a9cc0 1816205840 S Co:2:013:0 s 40 0c 0088 0084 0001 1 = ff
ffff8801417a9cc0 1816206279 C Co:2:013:0 0 1 >
ffff8801417a9cc0 1816208732 S Co:2:013:0 s 40 0c 0085 0088 0001 1 = 08
ffff8801417a9cc0 1816209153 C Co:2:013:0 0 1 >
ffff8801417a9cc0 1816211768 S Co:2:013:0 s 40 0c 0085 0088 0001 1 = 00
ffff8801417a9cc0 1816212191 C Co:2:013:0 0 1 >
ffff8801417a9cc0 1816214801 S Co:2:013:0 s 40 0c 0085 0088 0001 1 = 00
ffff8801417a9cc0 1816215191 C Co:2:013:0 0 1 >
ffff8801417a9cc0 1816217837 S Co:2:013:0 s 40 0c 0085 0088 0001 1 = 00
ffff8801417a9cc0 1816218177 C Co:2:013:0 0 1 >
ffff8801417a9cc0 1816220733 S Co:2:013:0 s 40 0c 0085 0088 0001 1 = d8
ffff8801417a9cc0 1816221154 C Co:2:013:0 0 1 >
ffff8801417a9cc0 1816223773 S Co:2:013:0 s 40 0c 0085 0088 0001 1 = 00
ffff8801417a9cc0 1816224153 C Co:2:013:0 0 1 >
ffff8801417a9cc0 1816225799 S Ci:2:013:0 s c0 0c 0084 0006 0001 1 <
ffff8801417a9cc0 1816226066 C Ci:2:013:0 0 1 = 01
ffff8801417a9540 1816229878 S Co:2:013:0 s 40 04 0082 1694 0008 8 = 00000000 10230600
ffff8801417a9540 1816230282 C Co:2:013:0 0 8 >
ffff8801417a9540 1816231971 S Bi:2:013:1 -115 19968 <
ffff8801417a9540 1816241431 C Bi:2:013:1 0 19968 = 5252a900 87007d00 be009e00 9b00cc00 bb007900 8900ce00 7e007800 b800a800
ffff8801417a9540 1816241881 S Bi:2:013:1 -115 16384 <
ffff8801417a9540 1816278472 C Bi:2:013:1 0 16384 = ab249d26 2c220027 57252926 9f25f628 74232728 c8256327 17249a25 3c266523
ffff8801417a9540 1816286828 S Bi:2:013:1 -115 16384 <
ffff8801417a9540 1816331112 C Bi:2:013:1 0 16384 = 5a241526 6f247a26 06272626 c1272325 30264226 ff271528 b7262e27 b025ae28
ffff8801417a9540 1816338976 S Bi:2:013:1 -115 12800 <
ffff8801417a9540 1816368571 C Bi:2:013:1 0 12800 = 82216324 ad228a25 5c24ad23 37237324 8225ab23 0b252726 8123bb26 7b255225
ffff8801417a9540 1816379627 S Bi:2:013:1 -115 19968 <
ffff8801417a9540 1816432627 C Bi:2:013:1 0 19968 = c023f520 09226f23 c7230922 60220b23 b9237425 60237c23 ce245c25 d221d322
ffff8801417a9540 1816433875 S Bi:2:013:1 -115 16384 <
ffff8801417a9540 1816485225 C Bi:2:013:1 0 16384 = c7007200 88005800 8e005b00 8900c400 dc009700 51005a00 86005700 7c005700
ffff8801417a9540 1816485883 S Bi:2:013:1 -115 16384 <
ffff8801417a9540 1816537974 C Bi:2:013:1 0 16384 = 5d27ea27 8d272c28 95248e27 f326c025 7a25ba24 8825db25 bf27ca26 bc278a27
ffff8801417a9540 1816546799 S Bi:2:013:1 -115 12800 <
ffff8801417a9540 1816577600 C Bi:2:013:1 0 12800 = 172a7b25 b4267c27 41278328 aa28ad28 a327ba26 8e27ea28 b929b728 73291227
ffff8801417a9540 1816584798 S Bi:2:013:1 -115 19968 <
ffff8801417a9540 1816643374 C Bi:2:013:1 0 19968 = 0725b224 54235c24 08247025 42268326 a7244126 cc25b224 a825c724 3c253626
ffff8801417a9540 1816645835 S Bi:2:013:1 -115 16384 <
ffff8801417a9540 1816685853 C Bi:2:013:1 0 16384 = a3006e00 c500ae00 4c009900 b700a200 56007900 b9008200 5d007600 8c008700
ffff8801417a9540 1816690782 S Bi:2:013:1 -115 16384 <
ffff8801417a9540 1816738583 C Bi:2:013:1 0 16384 = 9900bc00 89004d00 b000a300 81007600 7200dd00 a1007200 8900a700 46009800
ffff8801417a9540 1816742852 S Bi:2:013:1 -115 12800 <
ffff8801417a9540 1816784370 C Bi:2:013:1 0 12800 = 4f245723 2c24a724 fc23fc23 9d23c623 6a25fa23 75240c27 3a231426 d3249725
ffff8801417a9540 1816787797 S Bi:2:013:1 -115 19968 <
ffff8801417a9540 1816843842 C Bi:2:013:1 0 19968 = 4a2b3127 ff261527 4927d827 dc293229 2e268e29 67298529 3a275c2a ab276f28
ffff8801417a9540 1816848823 S Bi:2:013:1 -115 16384 <
ffff8801417a9540 1816896630 C Bi:2:013:1 0 16384 = 05235325 60233b24 7725d725 18254425 fa23bc24 36256425 2324f721 eb24e725
ffff8801417a9540 1816900880 S Bi:2:013:1 -115 16384 <
ffff8801417a9540 1816947510 C Bi:2:013:1 0 16384 = 9e009a00 bc00a800 ae004600 ad005c00 d100ab00 57007d00 78009300 6c008800
ffff8801417a9540 1816952873 S Bi:2:013:1 -115 12800 <
ffff8801417a9540 1816984963 C Bi:2:013:1 0 12800 = 9f00b700 ab00c200 aa004600 c3007100 b900dd00 b100a500 74009500 bf006100
ffff8801417a9540 1816990783 S Bi:2:013:1 -115 19968 <
ffff8801417a9540 1817052682 C Bi:2:013:1 0 19968 = 560c0a0b 6c042801 bb00c300 de001501 5b007500 8d00b900 5d00b000 c0008500
ffff8801417a9540 1817058894 S Bi:2:013:1 -115 16384 <
ffff8801417a9540 1817105476 C Bi:2:013:1 0 16384 = d9030403 d1030006 d0079f06 e4056804 2204f605 fb069907 72053e06 3b087907
ffff8801417a9540 1817110807 S Bi:2:013:1 -115 16384 <
ffff8801417a9540 1817158099 C Bi:2:013:1 0 16384 = 5800ed00 f500c700 ab00e100 c200a800 06018e00 d900c200 a900b300 d000d700
ffff8801417a9540 1817162848 S Bi:2:013:1 -115 12800 <
ffff8801417a9540 1817193875 C Bi:2:013:1 0 12800 = a5009a00 50004500 5000e400 6f00b700 bb007800 8c007400 88007700 5a00a500
ffff8801417a9540 1817200839 S Bi:2:013:1 -115 19968 <
ffff8801417a9540 1817259590 C Bi:2:013:1 0 19968 = 25009100 88009700 b0006b00 d500af00 bf009e00 8300bc00 3c009000 8900a200
ffff8801417a9540 1817261882 S Bi:2:013:1 -115 16384 <
ffff8801417a9540 1817312401 C Bi:2:013:1 0 16384 = a6007e00 62003a00 69006900 6600ce00 77007500 95008800 66009000 94006900
ffff8801417a9540 1817313888 S Bi:2:013:1 -115 16384 <
ffff8801417a9540 1817365029 C Bi:2:013:1 0 16384 = 7b009600 5b005900 95009500 72006500 5c009300 a1008d00 5b009500 6600af00
ffff8801417a9540 1817365809 S Bi:2:013:1 -115 12800 <
ffff8801417a9540 1817404506 C Bi:2:013:1 0 12800 = 9b007b00 b0008800 ac00bf00 b4006400 9c00b100 a4007b00 83008800 c1009b00
ffff8801417a9540 1817410790 S Bi:2:013:1 -115 8704 <
ffff8801417a9540 1817439820 C Bi:2:013:1 0 8704 = a6003600 b7005b00 0201a800 34009700 e0009d00 a4008900 7e007200 af006f00
ffff8801417a9540 1817448802 S Bi:2:013:1 -115 512 <
ffff8801417a9540 1817448945 C Bi:2:013:1 0 272 = 67007a00 c800ed00 92008f00 9600a000 91005900 83007500 8c009800 50009200
ffff8801417a9540 1817451844 S Ci:2:013:0 s c0 0c 0084 48c8 0001 1 <
ffff8801417a9540 1817452197 C Ci:2:013:0 0 1 = 03
ffff8801417a9540 1817454923 S Ci:2:013:0 s c0 0c 0084 48c8 0001 1 <
ffff8801417a9540 1817455196 C Ci:2:013:0 0 1 = 00
