ffff88008b3c5800 1699683011 S Co:2:013:0 s 40 0c 0088 2008 0001 1 = ff
ffff88008b3c5800 1699683453 C Co:2:013:0 0 1 >
ffff88008b3c5800 1699686047 S Co:2:013:0 s 40 0c 0088 2008 0001 1 = aa
ffff88008b3c5800 1699686452 C Co:2:013:0 0 1 >
ffff88008b3c5800 1699688941 S Co:2:013:0 s 40 0c 0088 2008 0001 1 = 55
ffff88008b3c5800 1699689326 C Co:2:013:0 0 1 >
ffff88008b3c5800 1699691974 S Co:2:013:0 s 40 0c 0088 2008 0001 1 = 00
ffff88008b3c5800 1699692450 C Co:2:013:0 0 1 >
ffff88008b3c5800 1699695013 S Co:2:013:0 s 40 0c 0088 2008 0001 1 = ff
ffff88008b3c5800 1699695451 C Co:2:013:0 0 1 >
ffff88008b3c5800 1699698048 S Co:2:013:0 s 40 0c 0088 2008 0001 1 = 87
ffff88008b3c5800 1699698451 C Co:2:013:0 0 1 >
ffff88008b3c5800 1699700922 S Co:2:013:0 s 40 0c 0088 2008 0001 1 = 78
ffff88008b3c5800 1699701321 C Co:2:013:0 0 1 >
ffff88008b3c5800 1699703957 S Co:2:013:0 s 40 0c 0088 2008 0001 1 = e0
ffff88008b3c5800 1699704445 C Co:2:013:0 0 1 >
ffff88008b3c5800 1699707001 S Co:2:013:0 s 40 0c 0087 2008 0001 1 = 05
ffff88008b3c5800 1699707413 C Co:2:013:0 0 1 >
ffff88008b3c5800 1699710033 S Co:2:013:0 s 40 0c 0087 2008 0001 1 = 04
ffff88008b3c5800 1699710415 C Co:2:013:0 0 1 >
ffff88008b3c5800 1699712925 S Co:2:013:0 s 40 0c 0088 2008 0001 1 = ff
ffff88008b3c5800 1699713291 C Co:2:013:0 0 1 >
ffff88008b3c5800 1699715959 S Co:2:013:0 s 40 0c 0085 0088 0001 1 = 00
ffff88008b3c5800 1699716291 C Co:2:013:0 0 1 >
ffff88008b3c5800 1699718992 S Co:2:013:0 s 40 0c 0085 0088 0001 1 = 00
ffff88008b3c5800 1699719415 C Co:2:013:0 0 1 >
ffff88008b3c5800 1699722028 S Co:2:013:0 s 40 0c 0085 0088 0001 1 = 00
ffff88008b3c5800 1699722414 C Co:2:013:0 0 1 >
ffff88008b3c5800 1699724939 S Co:2:013:0 s 40 0c 0085 0088 0001 1 = 00
ffff88008b3c5800 1699725290 C Co:2:013:0 0 1 >
ffff88008b3c5800 1699727993 S Co:2:013:0 s 40 0c 0085 0088 0001 1 = 00
ffff88008b3c5800 1699728415 C Co:2:013:0 0 1 >
ffff88008b3c5800 1699731047 S Co:2:013:0 s 40 0c 0085 0088 0001 1 = 00
ffff88008b3c5800 1699731415 C Co:2:013:0 0 1 >
ffff88008b3c5800 1699733080 S Ci:2:013:0 s c0 0c 0084 0006 0001 1 <
ffff88008b3c5800 1699733415 C Ci:2:013:0 0 1 = 03
ffff88008b3c5800 1699735913 S Ci:2:013:0 s c0 0c 0084 0006 0001 1 <
ffff88008b3c5800 1699736166 C Ci:2:013:0 0 1 = 00
ffff88004dbbfa40 1699875034 S Co:2:013:0 s 40 0c 0088 0001 0001 1 = ff
ffff88004dbbfa40 1699875631 C Co:2:013:0 0 1 >
ffff88004dbbfa40 1699878085 S Co:2:013:0 s 40 0c 0088 0001 0001 1 = aa
ffff88004dbbfa40 1699878627 C Co:2:013:0 0 1 >
ffff88004dbbfa40 1699880965 S Co:2:013:0 s 40 0c 0088 0001 0001 1 = 55
ffff88004dbbfa40 1699881503 C Co:2:013:0 0 1 >
ffff88004dbbfa40 1699883967 S Co:2:013:0 s 40 0c 0088 0001 0001 1 = 00
ffff88004dbbfa40 1699884507 C Co:2:013:0 0 1 >
ffff88004dbbfa40 1699886992 S Co:2:013:0 s 40 0c 0088 0001 0001 1 = ff
ffff88004dbbfa40 1699887507 C Co:2:013:0 0 1 >
ffff88004dbbfa40 1699890003 S Co:2:013:0 s 40 0c 0088 0001 0001 1 = 87
ffff88004dbbfa40 1699890479 C Co:2:013:0 0 1 >
ffff88004dbbfa40 1699892960 S Co:2:013:0 s 40 0c 0088 0001 0001 1 = 78
ffff88004dbbfa40 1699893500 C Co:2:013:0 0 1 >
ffff88004dbbfa40 1699895992 S Co:2:013:0 s 40 0c 0088 0001 0001 1 = e0
ffff88004dbbfa40 1699896507 C Co:2:013:0 0 1 >
ffff88004dbbfa40 1699899046 S Co:2:013:0 s 40 0c 0087 0001 0001 1 = 05
ffff88004dbbfa40 1699899633 C Co:2:013:0 0 1 >
ffff88004dbbfa40 1699902091 S Co:2:013:0 s 40 0c 0087 0001 0001 1 = 04
ffff88004dbbfa40 1699902636 C Co:2:013:0 0 1 >
ffff88004dbbfa40 1699904966 S Co:2:013:0 s 40 0c 0088 0001 0001 1 = ff
ffff88004dbbfa40 1699905456 C Co:2:013:0 0 1 >
ffff88004dbbfa40 1699907982 S Co:2:013:0 s 40 0c 0085 0088 0001 1 = dd
ffff88004dbbfa40 1699908507 C Co:2:013:0 0 1 >
ffff88004dbbfa40 1699911012 S Co:2:013:0 s 40 0c 0085 0088 0001 1 = 00
ffff88004dbbfa40 1699911507 C Co:2:013:0 0 1 >
ffff88004dbbfa40 1699914051 S Co:2:013:0 s 40 0c 0085 0088 0001 1 = 00
ffff88004dbbfa40 1699914484 C Co:2:013:0 0 1 >
ffff88004dbbfa40 1699916966 S Co:2:013:0 s 40 0c 0085 0088 0001 1 = 00
ffff88004dbbfa40 1699917335 C Co:2:013:0 0 1 >
ffff88004dbbfa40 1699919974 S Co:2:013:0 s 40 0c 0085 0088 0001 1 = 0c
ffff88004dbbfa40 1699920505 C Co:2:013:0 0 1 >
ffff88004dbbfa40 1699923015 S Co:2:013:0 s 40 0c 0085 0088 0001 1 = 00
ffff88004dbbfa40 1699923508 C Co:2:013:0 0 1 >
ffff88004dbbfa40 1699925043 S Ci:2:013:0 s c0 0c 0084 0006 0001 1 <
ffff88004dbbfa40 1699925341 C Ci:2:013:0 0 1 = 01
ffff88004dbbfa40 1699928958 S Co:2:013:0 s 40 04 0082 1694 0008 8 = 00000000 0c000000
ffff88004dbbfa40 1699929356 C Co:2:013:0 0 8 >
ffff88004dbbfa40 1699930976 S Bi:2:013:1 -115 512 <
ffff88004dbbfa40 1699931072 C Bi:2:013:1 0 12 = 000000ff f0000500 004e0000
ffff88004dbbfa40 1699934001 S Ci:2:013:0 s c0 0c 0084 48c8 0001 1 <
ffff88004dbbfa40 1699934339 C Ci:2:013:0 0 1 = 03
ffff88004dbbfa40 1699937046 S Ci:2:013:0 s c0 0c 0084 48c8 0001 1 <
ffff88004dbbfa40 1699937341 C Ci:2:013:0 0 1 = 00
ffff88004dbbfa40 1699940968 S Co:2:013:0 s 40 0c 0088 82ef 0001 1 = ff
ffff88004dbbfa40 1699941483 C Co:2:013:0 0 1 >
ffff88004dbbfa40 1699943980 S Co:2:013:0 s 40 0c 0088 82ef 0001 1 = aa
ffff88004dbbfa40 1699944488 C Co:2:013:0 0 1 >
ffff88004dbbfa40 1699947016 S Co:2:013:0 s 40 0c 0088 82ef 0001 1 = 55
ffff88004dbbfa40 1699947451 C Co:2:013:0 0 1 >
ffff88004dbbfa40 1699950045 S Co:2:013:0 s 40 0c 0088 82ef 0001 1 = 00
ffff88004dbbfa40 1699950461 C Co:2:013:0 0 1 >
ffff88004dbbfa40 1699952962 S Co:2:013:0 s 40 0c 0088 82ef 0001 1 = ff
ffff88004dbbfa40 1699953509 C Co:2:013:0 0 1 >
ffff88004dbbfa40 1699955982 S Co:2:013:0 s 40 0c 0088 82ef 0001 1 = 87
ffff88004dbbfa40 1699956507 C Co:2:013:0 0 1 >
ffff88004dbbfa40 1699959006 S Co:2:013:0 s 40 0c 0088 82ef 0001 1 = 78
ffff88004dbbfa40 1699959483 C Co:2:013:0 0 1 >
ffff88004dbbfa40 1699962036 S Co:2:013:0 s 40 0c 0088 82ef 0001 1 = e0
ffff88004dbbfa40 1699962635 C Co:2:013:0 0 1 >
ffff88004dbbfa40 1699964965 S Co:2:013:0 s 40 0c 0087 82ef 0001 1 = 05
ffff88004dbbfa40 1699965509 C Co:2:013:0 0 1 >
ffff88004dbbfa40 1699967979 S Co:2:013:0 s 40 0c 0087 82ef 0001 1 = 04
ffff88004dbbfa40 1699968451 C Co:2:013:0 0 1 >
ffff88004dbbfa40 1699971008 S Co:2:013:0 s 40 0c 0088 82ef 0001 1 = ff
ffff88004dbbfa40 1699971425 C Co:2:013:0 0 1 >
ffff88004dbbfa40 1699974039 S Co:2:013:0 s 40 0c 0085 0088 0001 1 = 00
ffff88004dbbfa40 1699974425 C Co:2:013:0 0 1 >
ffff88004dbbfa40 1699976950 S Co:2:013:0 s 40 0c 0085 0088 0001 1 = 00
ffff88004dbbfa40 1699977471 C Co:2:013:0 0 1 >
ffff88004dbbfa40 1699979983 S Co:2:013:0 s 40 0c 0085 0088 0001 1 = 00
ffff88004dbbfa40 1699980504 C Co:2:013:0 0 1 >
ffff88004dbbfa40 1699983016 S Co:2:013:0 s 40 0c 0085 0088 0001 1 = 00
ffff88004dbbfa40 1699983509 C Co:2:013:0 0 1 >
ffff88004dbbfa40 1699986055 S Co:2:013:0 s 40 0c 0085 0088 0001 1 = 00
ffff88004dbbfa40 1699986473 C Co:2:013:0 0 1 >
ffff88004dbbfa40 1699988940 S Co:2:013:0 s 40 0c 0085 0088 0001 1 = 00
ffff88004dbbfa40 1699989380 C Co:2:013:0 0 1 >
ffff88004dbbfa40 1699990987 S Ci:2:013:0 s c0 0c 0084 0006 0001 1 <
ffff88004dbbfa40 1699991385 C Ci:2:013:0 0 1 = 03
ffff88004dbbfa40 1699994031 S Ci:2:013:0 s c0 0c 0084 0006 0001 1 <
ffff88004dbbfa40 1699994341 C Ci:2:013:0 0 1 = 00
ffff88008b3c5800 1700132931 S Co:2:013:0 s 40 0c 0088 0001 0001 1 = ff
ffff88008b3c5800 1700133307 C Co:2:013:0 0 1 >
ffff88008b3c5800 1700135957 S Co:2:013:0 s 40 0c 0088 0001 0001 1 = aa
ffff88008b3c5800 1700136306 C Co:2:013:0 0 1 >
ffff88008b3c5800 1700138990 S Co:2:013:0 s 40 0c 0088 0001 0001 1 = 55
ffff88008b3c5800 1700139429 C Co:2:013:0 0 1 >
ffff88004dbbfa40 1700142030 S Co:2:013:0 s 40 0c 0088 0001 0001 1 = 00
ffff88004dbbfa40 1700142426 C Co:2:013:0 0 1 >
ffff88004dbbfa40 1700144934 S Co:2:013:0 s 40 0c 0088 0001 0001 1 = ff
ffff88004dbbfa40 1700145340 C Co:2:013:0 0 1 >
ffff88004dbbfa40 1700147957 S Co:2:013:0 s 40 0c 0088 0001 0001 1 = 87
ffff88004dbbfa40 1700148341 C Co:2:013:0 0 1 >
ffff88004dbbfa40 1700150990 S Co:2:013:0 s 40 0c 0088 0001 0001 1 = 78
ffff88004dbbfa40 1700151466 C Co:2:013:0 0 1 >
ffff88004dbbfa40 1700154028 S Co:2:013:0 s 40 0c 0088 0001 0001 1 = e0
ffff88004dbbfa40 1700154451 C Co:2:013:0 0 1 >
ffff88004dbbfa40 1700156926 S Co:2:013:0 s 40 0c 0087 0001 0001 1 = 05
ffff88004dbbfa40 1700157304 C Co:2:013:0 0 1 >
ffff88004dbbfa40 1700159965 S Co:2:013:0 s 40 0c 0087 0001 0001 1 = 04
ffff88004dbbfa40 1700160341 C Co:2:013:0 0 1 >
ffff88004dbbfa40 1700162998 S Co:2:013:0 s 40 0c 0088 0001 0001 1 = ff
ffff88004dbbfa40 1700163466 C Co:2:013:0 0 1 >
ffff88004dbbfa40 1700166034 S Co:2:013:0 s 40 0c 0085 0088 0001 1 = dd
ffff88004dbbfa40 1700166466 C Co:2:013:0 0 1 >
ffff88004dbbfa40 1700168923 S Co:2:013:0 s 40 0c 0085 0088 0001 1 = 00
ffff88004dbbfa40 1700169327 C Co:2:013:0 0 1 >
ffff88004dbbfa40 1700171959 S Co:2:013:0 s 40 0c 0085 0088 0001 1 = 00
ffff88004dbbfa40 1700172346 C Co:2:013:0 0 1 >
ffff8800941333c0 1700175006 S Co:2:013:0 s 40 0c 0085 0088 0001 1 = 00
ffff8800941333c0 1700175472 C Co:2:013:0 0 1 >
ffff8800941333c0 1700178077 S Co:2:013:0 s 40 0c 0085 0088 0001 1 = 0c
ffff8800941333c0 1700178478 C Co:2:013:0 0 1 >
ffff8800941333c0 1700180939 S Co:2:013:0 s 40 0c 0085 0088 0001 1 = 00
ffff8800941333c0 1700181518 C Co:2:013:0 0 1 >
ffff8800941333c0 1700182962 S Ci:2:013:0 s c0 0c 0084 0006 0001 1 <
ffff8800941333c0 1700183217 C Ci:2:013:0 0 1 = 01
ffff8800941333c0 1700187002 S Co:2:013:0 s 40 04 0082 1694 0008 8 = 00000000 0c000000
ffff8800941333c0 1700187347 C Co:2:013:0 0 8 >
ffff8800941333c0 1700189053 S Bi:2:013:1 -115 512 <
ffff8800941333c0 1700189292 C Bi:2:013:1 0 12 = 000000ff f0000500 004e0000
ffff8800941333c0 1700191914 S Ci:2:013:0 s c0 0c 0084 48c8 0001 1 <
ffff8800941333c0 1700192181 C Ci:2:013:0 0 1 = 03
ffff8800941333c0 1700194961 S Ci:2:013:0 s c0 0c 0084 48c8 0001 1 <
ffff8800941333c0 1700195182 C Ci:2:013:0 0 1 = 00
ffff8800941333c0 1700208079 S Co:2:013:0 s 40 0c 0088 0001 0001 1 = ff
ffff8800941333c0 1700208469 C Co:2:013:0 0 1 >
ffff8800941333c0 1700211120 S Co:2:013:0 s 40 0c 0088 0001 0001 1 = aa
ffff8800941333c0 1700211593 C Co:2:013:0 0 1 >
ffff8800941333c0 1700214156 S Co:2:013:0 s 40 0c 0088 0001 0001 1 = 55
ffff8800941333c0 1700214593 C Co:2:013:0 0 1 >
ffff8800941333c0 1700217022 S Co:2:013:0 s 40 0c 0088 0001 0001 1 = 00
ffff8800941333c0 1700217463 C Co:2:013:0 0 1 >
ffff8800941333c0 1700220055 S Co:2:013:0 s 40 0c 0088 0001 0001 1 = ff
ffff8800941333c0 1700220463 C Co:2:013:0 0 1 >
ffff8800941333c0 1700223087 S Co:2:013:0 s 40 0c 0088 0001 0001 1 = 87
ffff8800941333c0 1700223453 C Co:2:013:0 0 1 >
ffff8801417a9540 1700226157 S Co:2:013:0 s 40 0c 0088 0001 0001 1 = 78
ffff8801417a9540 1700226558 C Co:2:013:0 0 1 >
ffff8801417a9540 1700229026 S Co:2:013:0 s 40 0c 0088 0001 0001 1 = e0
ffff8801417a9540 1700229470 C Co:2:013:0 0 1 >
ffff8801417a9540 1700232058 S Co:2:013:0 s 40 0c 0087 0001 0001 1 = 05
ffff8801417a9540 1700232464 C Co:2:013:0 0 1 >
ffff8801417a9540 1700235091 S Co:2:013:0 s 40 0c 0087 0001 0001 1 = 04
ffff8801417a9540 1700235465 C Co:2:013:0 0 1 >
ffff8801417a9540 1700238134 S Co:2:013:0 s 40 0c 0088 0001 0001 1 = ff
ffff8801417a9540 1700238581 C Co:2:013:0 0 1 >
ffff8801417a9540 1700241023 S Co:2:013:0 s 40 0c 0085 0088 0001 1 = 00
ffff8801417a9540 1700241464 C Co:2:013:0 0 1 >
ffff8801417a9540 1700244059 S Co:2:013:0 s 40 0c 0085 0088 0001 1 = 00
ffff8801417a9540 1700244465 C Co:2:013:0 0 1 >
ffff8801417a9540 1700247094 S Co:2:013:0 s 40 0c 0085 0088 0001 1 = 00
ffff8801417a9540 1700247469 C Co:2:013:0 0 1 >
ffff8801417a9540 1700250133 S Co:2:013:0 s 40 0c 0085 0088 0001 1 = 00
ffff8801417a9540 1700250598 C Co:2:013:0 0 1 >
ffff8801417a9540 1700253028 S Co:2:013:0 s 40 0c 0085 0088 0001 1 = 00
ffff8801417a9540 1700253470 C Co:2:013:0 0 1 >
ffff8801417a9540 1700256065 S Co:2:013:0 s 40 0c 0085 0088 0001 1 = 00
ffff8801417a9540 1700256495 C Co:2:013:0 0 1 >
ffff8801417a9540 1700258141 S Ci:2:013:0 s c0 0c 0084 0006 0001 1 <
ffff8801417a9540 1700258470 C Ci:2:013:0 0 1 = 03
ffff8801417a9540 1700261174 S Ci:2:013:0 s c0 0c 0084 0006 0001 1 <
ffff8801417a9540 1700261469 C Ci:2:013:0 0 1 = 00
ffff8801417a9600 1700400100 S Co:2:013:0 s 40 0c 0088 0001 0001 1 = ff
ffff8801417a9600 1700400563 C Co:2:013:0 0 1 >
ffff8801417a9600 1700403142 S Co:2:013:0 s 40 0c 0088 0001 0001 1 = aa
ffff8801417a9600 1700403606 C Co:2:013:0 0 1 >
ffff8801417a9600 1700406173 S Co:2:013:0 s 40 0c 0088 0001 0001 1 = 55
ffff8801417a9600 1700406651 C Co:2:013:0 0 1 >
ffff8801417a9600 1700409048 S Co:2:013:0 s 40 0c 0088 0001 0001 1 = 00
ffff8801417a9600 1700409439 C Co:2:013:0 0 1 >
ffff8801417a9600 1700412052 S Co:2:013:0 s 40 0c 0088 0001 0001 1 = ff
ffff8801417a9600 1700412475 C Co:2:013:0 0 1 >
ffff8801417a9600 1700415077 S Co:2:013:0 s 40 0c 0088 0001 0001 1 = 87
ffff8801417a9600 1700415480 C Co:2:013:0 0 1 >
ffff8801417a9600 1700418106 S Co:2:013:0 s 40 0c 0088 0001 0001 1 = 78
ffff8801417a9600 1700418566 C Co:2:013:0 0 1 >
ffff8801417a9600 1700421047 S Co:2:013:0 s 40 0c 0088 0001 0001 1 = e0
ffff8801417a9600 1700421516 C Co:2:013:0 0 1 >
ffff8801417a9600 1700424104 S Co:2:013:0 s 40 0c 0087 0001 0001 1 = 05
ffff8801417a9600 1700424440 C Co:2:013:0 0 1 >
ffff8801417a9600 1700427104 S Co:2:013:0 s 40 0c 0087 0001 0001 1 = 04
ffff8801417a9600 1700427651 C Co:2:013:0 0 1 >
ffff8801417a9600 1700430148 S Co:2:013:0 s 40 0c 0088 0001 0001 1 = ff
ffff8801417a9600 1700430661 C Co:2:013:0 0 1 >
ffff8801417a9600 1700433058 S Co:2:013:0 s 40 0c 0085 0088 0001 1 = dd
ffff8801417a9600 1700433440 C Co:2:013:0 0 1 >
ffff8801417a9600 1700436070 S Co:2:013:0 s 40 0c 0085 0088 0001 1 = 00
ffff8801417a9600 1700436474 C Co:2:013:0 0 1 >
ffff8801417a9600 1700439103 S Co:2:013:0 s 40 0c 0085 0088 0001 1 = 00
ffff8801417a9600 1700439482 C Co:2:013:0 0 1 >
ffff8801417a9600 1700442145 S Co:2:013:0 s 40 0c 0085 0088 0001 1 = 00
ffff8801417a9600 1700442601 C Co:2:013:0 0 1 >
ffff8801417a9600 1700445056 S Co:2:013:0 s 40 0c 0085 0088 0001 1 = 0c
ffff8801417a9600 1700445525 C Co:2:013:0 0 1 >
ffff8801417a9600 1700448061 S Co:2:013:0 s 40 0c 0085 0088 0001 1 = 00
ffff8801417a9600 1700448476 C Co:2:013:0 0 1 >
ffff8801417a9600 1700450086 S Ci:2:013:0 s c0 0c 0084 0006 0001 1 <
ffff8801417a9600 1700450316 C Ci:2:013:0 0 1 = 01
ffff8801417a9600 1700454123 S Co:2:013:0 s 40 04 0082 1694 0008 8 = 00000000 0c000000
ffff8801417a9600 1700454442 C Co:2:013:0 0 8 >
ffff8801417a9600 1700456076 S Bi:2:013:1 -115 512 <
ffff8801417a9600 1700456249 C Bi:2:013:1 0 12 = 000000ff f0000500 004e0000
ffff8801417a9600 1700459116 S Ci:2:013:0 s c0 0c 0084 48c8 0001 1 <
ffff8801417a9600 1700459527 C Ci:2:013:0 0 1 = 03
ffff8801417a9600 1700462089 S Ci:2:013:0 s c0 0c 0084 48c8 0001 1 <
ffff8801417a9600 1700462379 C Ci:2:013:0 0 1 = 00
ffff8801417a9600 1700466161 S Co:2:013:0 s 40 0c 0088 82eb 0001 1 = ff
ffff8801417a9600 1700466625 C Co:2:013:0 0 1 >
ffff8801417a9600 1700469060 S Co:2:013:0 s 40 0c 0088 82eb 0001 1 = aa
ffff8801417a9600 1700469487 C Co:2:013:0 0 1 >
ffff8801417a9600 1700472073 S Co:2:013:0 s 40 0c 0088 82eb 0001 1 = 55
ffff8801417a9600 1700472476 C Co:2:013:0 0 1 >
ffff8801417a9600 1700475110 S Co:2:013:0 s 40 0c 0088 82eb 0001 1 = 00
ffff8801417a9600 1700475628 C Co:2:013:0 0 1 >
ffff8801417a9600 1700478301 S Co:2:013:0 s 40 0c 0088 82eb 0001 1 = ff
ffff8801417a9600 1700478735 C Co:2:013:0 0 1 >
ffff8801417a9600 1700481035 S Co:2:013:0 s 40 0c 0088 82eb 0001 1 = 87
ffff8801417a9600 1700481521 C Co:2:013:0 0 1 >
ffff8801417a9600 1700484105 S Co:2:013:0 s 40 0c 0088 82eb 0001 1 = 78
ffff8801417a9600 1700484652 C Co:2:013:0 0 1 >
ffff8801417a9600 1700487092 S Co:2:013:0 s 40 0c 0088 82eb 0001 1 = e0
ffff8801417a9600 1700487478 C Co:2:013:0 0 1 >
ffff8801417a9600 1700490110 S Co:2:013:0 s 40 0c 0087 82eb 0001 1 = 05
ffff8801417a9600 1700490443 C Co:2:013:0 0 1 >
ffff8801417a9600 1700493052 S Co:2:013:0 s 40 0c 0087 82eb 0001 1 = 04
ffff8801417a9600 1700493526 C Co:2:013:0 0 1 >
ffff8801417a9600 1700496063 S Co:2:013:0 s 40 0c 0088 82eb 0001 1 = ff
ffff8801417a9600 1700496483 C Co:2:013:0 0 1 >
ffff8801417a9600 1700499096 S Co:2:013:0 s 40 0c 0085 0088 0001 1 = 00
ffff8801417a9600 1700499506 C Co:2:013:0 0 1 >
ffff8801417a9600 1700502130 S Co:2:013:0 s 40 0c 0085 0088 0001 1 = 00
ffff8801417a9600 1700502628 C Co:2:013:0 0 1 >
ffff8801417a9600 1700505029 S Co:2:013:0 s 40 0c 0085 0088 0001 1 = 00
ffff8801417a9600 1700505503 C Co:2:013:0 0 1 >
ffff8801417a9600 1700508069 S Co:2:013:0 s 40 0c 0085 0088 0001 1 = 00
ffff8801417a9600 1700508503 C Co:2:013:0 0 1 >
ffff8801417a9600 1700511110 S Co:2:013:0 s 40 0c 0085 0088 0001 1 = 00
ffff8801417a9600 1700511496 C Co:2:013:0 0 1 >
ffff8801417a9600 1700514140 S Co:2:013:0 s 40 0c 0085 0088 0001 1 = 00
ffff8801417a9600 1700514629 C Co:2:013:0 0 1 >
ffff8801417a9600 1700516219 S Ci:2:013:0 s c0 0c 0084 0006 0001 1 <
ffff8801417a9600 1700516478 C Ci:2:013:0 0 1 = 03
ffff8801417a9600 1700519141 S Ci:2:013:0 s c0 0c 0084 0006 0001 1 <
ffff8801417a9600 1700519839 C Ci:2:013:0 0 1 = 00
ffff8801417a9600 1700658113 S Co:2:013:0 s 40 0c 0088 0001 0001 1 = ff
ffff8801417a9600 1700658573 C Co:2:013:0 0 1 >
ffff8801417a9600 1700661077 S Co:2:013:0 s 40 0c 0088 0001 0001 1 = aa
ffff8801417a9600 1700661489 C Co:2:013:0 0 1 >
ffff8801417a9600 1700664060 S Co:2:013:0 s 40 0c 0088 0001 0001 1 = 55
ffff8801417a9600 1700664510 C Co:2:013:0 0 1 >
ffff8801417a9600 1700667094 S Co:2:013:0 s 40 0c 0088 0001 0001 1 = 00
ffff8801417a9600 1700667619 C Co:2:013:0 0 1 >
ffff8801417a9600 1700670131 S Co:2:013:0 s 40 0c 0088 0001 0001 1 = ff
ffff8801417a9600 1700670615 C Co:2:013:0 0 1 >
ffff8801417a9600 1700673028 S Co:2:013:0 s 40 0c 0088 0001 0001 1 = 87
ffff8801417a9600 1700673484 C Co:2:013:0 0 1 >
ffff8801417a9600 1700676071 S Co:2:013:0 s 40 0c 0088 0001 0001 1 = 78
ffff8801417a9600 1700676484 C Co:2:013:0 0 1 >
ffff8801417a9600 1700679099 S Co:2:013:0 s 40 0c 0088 0001 0001 1 = e0
ffff8801417a9600 1700679445 C Co:2:013:0 0 1 >
ffff8801417a9600 1700682143 S Co:2:013:0 s 40 0c 0087 0001 0001 1 = 05
ffff8801417a9600 1700682637 C Co:2:013:0 0 1 >
ffff8801417a9600 1700685025 S Co:2:013:0 s 40 0c 0087 0001 0001 1 = 04
ffff8801417a9600 1700685513 C Co:2:013:0 0 1 >
ffff8801417a9600 1700688064 S Co:2:013:0 s 40 0c 0088 0001 0001 1 = ff
ffff8801417a9600 1700688448 C Co:2:013:0 0 1 >
ffff8801417a9600 1700691103 S Co:2:013:0 s 40 0c 0085 0088 0001 1 = dd
ffff8801417a9600 1700691507 C Co:2:013:0 0 1 >
ffff8801417a9600 1700694271 S Co:2:013:0 s 40 0c 0085 0088 0001 1 = 00
ffff8801417a9600 1700694735 C Co:2:013:0 0 1 >
ffff8801417a9600 1700697026 S Co:2:013:0 s 40 0c 0085 0088 0001 1 = 00
ffff8801417a9600 1700697469 C Co:2:013:0 0 1 >
ffff8801417a9600 1700700057 S Co:2:013:0 s 40 0c 0085 0088 0001 1 = 00
ffff8801417a9600 1700700447 C Co:2:013:0 0 1 >
ffff8801417a9600 1700703092 S Co:2:013:0 s 40 0c 0085 0088 0001 1 = 0c
ffff8801417a9600 1700703510 C Co:2:013:0 0 1 >
ffff8801417a9600 1700706126 S Co:2:013:0 s 40 0c 0085 0088 0001 1 = 00
ffff8801417a9600 1700706485 C Co:2:013:0 0 1 >
ffff8801417a9600 1700708185 S Ci:2:013:0 s c0 0c 0084 0006 0001 1 <
ffff8801417a9600 1700708447 C Ci:2:013:0 0 1 = 01
ffff8801417a9600 1700712065 S Co:2:013:0 s 40 04 0082 1694 0008 8 = 00000000 0c000000
ffff8801417a9600 1700712484 C Co:2:013:0 0 8 >
ffff8801417a9600 1700714086 S Bi:2:013:1 -115 512 <
ffff8801417a9600 1700714213 C Bi:2:013:1 0 12 = 000000ff f0000500 004e0000
ffff8801417a9600 1700717127 S Ci:2:013:0 s c0 0c 0084 48c8 0001 1 <
ffff8801417a9600 1700717330 C Ci:2:013:0 0 1 = 03
ffff8801417a9600 1700720018 S Ci:2:013:0 s c0 0c 0084 48c8 0001 1 <
ffff8801417a9600 1700720945 C Ci:2:013:0 0 1 = 00
ffff8801417a9600 1700724067 S Co:2:013:0 s 40 0c 0088 b7d5 0001 1 = ff
ffff8801417a9600 1700724639 C Co:2:013:0 0 1 >
ffff8801417a9600 1700727103 S Co:2:013:0 s 40 0c 0088 b7d5 0001 1 = aa
ffff8801417a9600 1700727450 C Co:2:013:0 0 1 >
ffff8801417a9600 1700730130 S Co:2:013:0 s 40 0c 0088 b7d5 0001 1 = 55
ffff8801417a9600 1700730577 C Co:2:013:0 0 1 >
ffff8801417a9600 1700733033 S Co:2:013:0 s 40 0c 0088 b7d5 0001 1 = 00
ffff8801417a9600 1700733512 C Co:2:013:0 0 1 >
ffff8801417a9600 1700736066 S Co:2:013:0 s 40 0c 0088 b7d5 0001 1 = ff
ffff8801417a9600 1700736622 C Co:2:013:0 0 1 >
ffff8801417a9600 1700739095 S Co:2:013:0 s 40 0c 0088 b7d5 0001 1 = 87
ffff8801417a9600 1700739448 C Co:2:013:0 0 1 >
ffff8801417a9600 1700742137 S Co:2:013:0 s 40 0c 0088 b7d5 0001 1 = 78
ffff8801417a9600 1700742637 C Co:2:013:0 0 1 >
ffff8801417a9600 1700745033 S Co:2:013:0 s 40 0c 0088 b7d5 0001 1 = e0
ffff8801417a9600 1700745511 C Co:2:013:0 0 1 >
ffff8801417a9600 1700748074 S Co:2:013:0 s 40 0c 0087 b7d5 0001 1 = 05
ffff8801417a9600 1700748451 C Co:2:013:0 0 1 >
ffff8801417a9600 1700751108 S Co:2:013:0 s 40 0c 0087 b7d5 0001 1 = 04
ffff8801417a9600 1700751637 C Co:2:013:0 0 1 >
ffff8801417a9600 1700754166 S Co:2:013:0 s 40 0c 0088 b7d5 0001 1 = ff
ffff8801417a9600 1700754636 C Co:2:013:0 0 1 >
ffff8801417a9600 1700757028 S Co:2:013:0 s 40 0c 0085 0088 0001 1 = 00
ffff8801417a9600 1700757471 C Co:2:013:0 0 1 >
ffff8801417a9600 1700760061 S Co:2:013:0 s 40 0c 0085 0088 0001 1 = 00
ffff8801417a9600 1700760448 C Co:2:013:0 0 1 >
ffff8801417a9600 1700763101 S Co:2:013:0 s 40 0c 0085 0088 0001 1 = 00
ffff8801417a9600 1700763517 C Co:2:013:0 0 1 >
ffff8801417a9600 1700766132 S Co:2:013:0 s 40 0c 0085 0088 0001 1 = 00
ffff8801417a9600 1700766645 C Co:2:013:0 0 1 >
ffff8801417a9600 1700769032 S Co:2:013:0 s 40 0c 0085 0088 0001 1 = 00
ffff8801417a9600 1700769450 C Co:2:013:0 0 1 >
ffff8801417a9600 1700772063 S Co:2:013:0 s 40 0c 0085 0088 0001 1 = 00
ffff8801417a9600 1700772486 C Co:2:013:0 0 1 >
ffff8801417a9600 1700774102 S Ci:2:013:0 s c0 0c 0084 0006 0001 1 <
ffff8801417a9600 1700774325 C Ci:2:013:0 0 1 = 03
ffff8801417a9600 1700777121 S Ci:2:013:0 s c0 0c 0084 0006 0001 1 <
ffff8801417a9600 1700777326 C Ci:2:013:0 0 1 = 00
ffff8801417a9600 1700781031 S Co:2:013:0 s 40 0c 0088 0000 0001 1 = ff
ffff8801417a9600 1700781456 C Co:2:013:0 0 1 >
ffff8801417a9600 1700784061 S Co:2:013:0 s 40 0c 0088 0000 0001 1 = aa
ffff8801417a9600 1700784450 C Co:2:013:0 0 1 >
ffff8801417a9600 1700787099 S Co:2:013:0 s 40 0c 0088 0000 0001 1 = 55
ffff8801417a9600 1700787639 C Co:2:013:0 0 1 >
ffff8801417a9600 1700790130 S Co:2:013:0 s 40 0c 0088 0000 0001 1 = 00
ffff8801417a9600 1700790614 C Co:2:013:0 0 1 >
ffff8801417a9600 1700793029 S Co:2:013:0 s 40 0c 0088 0000 0001 1 = ff
ffff8801417a9600 1700793488 C Co:2:013:0 0 1 >
ffff8801417a9600 1700796067 S Co:2:013:0 s 40 0c 0088 0000 0001 1 = 87
ffff8801417a9600 1700796502 C Co:2:013:0 0 1 >
ffff8801417a9600 1700799095 S Co:2:013:0 s 40 0c 0088 0000 0001 1 = 78
ffff8801417a9600 1700799638 C Co:2:013:0 0 1 >
ffff8801417a9600 1700802130 S Co:2:013:0 s 40 0c 0088 0000 0001 1 = e0
ffff8801417a9600 1700802612 C Co:2:013:0 0 1 >
ffff8801417a9600 1700805055 S Co:2:013:0 s 40 0c 0087 0000 0001 1 = 05
ffff8801417a9600 1700805534 C Co:2:013:0 0 1 >
ffff8801417a9600 1700808064 S Co:2:013:0 s 40 0c 0087 0000 0001 1 = 04
ffff8801417a9600 1700808513 C Co:2:013:0 0 1 >
ffff8801417a9600 1700811107 S Co:2:013:0 s 40 0c 0088 0000 0001 1 = ff
ffff8801417a9600 1700811638 C Co:2:013:0 0 1 >
ffff8801417a9600 1700814137 S Co:2:013:0 s 40 0c 0085 0088 0001 1 = e2
ffff8801417a9600 1700814489 C Co:2:013:0 0 1 >
ffff8801417a9600 1700817031 S Co:2:013:0 s 40 0c 0085 0088 0001 1 = 00
ffff8801417a9600 1700817514 C Co:2:013:0 0 1 >
ffff8801417a9600 1700820066 S Co:2:013:0 s 40 0c 0085 0088 0001 1 = 00
ffff8801417a9600 1700820479 C Co:2:013:0 0 1 >
ffff8801417a9600 1700823094 S Co:2:013:0 s 40 0c 0085 0088 0001 1 = 00
ffff8801417a9600 1700823488 C Co:2:013:0 0 1 >
ffff8801417a9600 1700826130 S Co:2:013:0 s 40 0c 0085 0088 0001 1 = 01
ffff8801417a9600 1700826489 C Co:2:013:0 0 1 >
ffff8801417a9600 1700829033 S Co:2:013:0 s 40 0c 0085 0088 0001 1 = 00
ffff8801417a9600 1700829499 C Co:2:013:0 0 1 >
ffff8801417a9600 1700831055 S Ci:2:013:0 s c0 0c 0084 0006 0001 1 <
ffff8801417a9600 1700831382 C Ci:2:013:0 0 1 = 01
ffff8801417a9600 1700835103 S Co:2:013:0 s 40 04 0082 1694 0008 8 = 00000000 01000000
ffff8801417a9600 1700835514 C Co:2:013:0 0 8 >
ffff8801417a9600 1700837121 S Bi:2:013:1 -115 512 <
ffff8801417a9600 1703506843 C Bi:2:013:1 0 1 = 02
ffff8801417a9600 1703514194 S Ci:2:013:0 s c0 0c 0084 48c8 0001 1 <
ffff8801417a9600 1703514668 C Ci:2:013:0 0 1 = 03
ffff8801417a9600 1703517081 S Ci:2:013:0 s c0 0c 0084 48c8 0001 1 <
ffff8801417a9600 1703517291 C Ci:2:013:0 0 1 = 00
ffff8801417a9600 1703566952 S Co:2:013:0 s 40 0c 0088 3b50 0001 1 = ff
ffff8801417a9600 1703567418 C Co:2:013:0 0 1 >
ffff8801417a9600 1703571380 S Co:2:013:0 s 40 0c 0088 3b50 0001 1 = aa
ffff8801417a9600 1703571793 C Co:2:013:0 0 1 >
ffff8801417a9600 1703574405 S Co:2:013:0 s 40 0c 0088 3b50 0001 1 = 55
ffff8801417a9600 1703574793 C Co:2:013:0 0 1 >
ffff8801417a9600 1703577300 S Co:2:013:0 s 40 0c 0088 3b50 0001 1 = 00
ffff8801417a9600 1703577668 C Co:2:013:0 0 1 >
ffff8801417a9600 1703580340 S Co:2:013:0 s 40 0c 0088 3b50 0001 1 = ff
ffff8801417a9600 1703580793 C Co:2:013:0 0 1 >
ffff8801417a9600 1703583371 S Co:2:013:0 s 40 0c 0088 3b50 0001 1 = 87
ffff8801417a9600 1703583793 C Co:2:013:0 0 1 >
ffff8801417a9600 1703586408 S Co:2:013:0 s 40 0c 0088 3b50 0001 1 = 78
ffff8801417a9600 1703586794 C Co:2:013:0 0 1 >
ffff880095356900 1703589311 S Co:2:013:0 s 40 0c 0088 3b50 0001 1 = e0
ffff880095356900 1703589667 C Co:2:013:0 0 1 >
ffff880095356900 1703592331 S Co:2:013:0 s 40 0c 0087 3b50 0001 1 = 05
ffff880095356900 1703592705 C Co:2:013:0 0 1 >
ffff880095356900 1703595370 S Co:2:013:0 s 40 0c 0087 3b50 0001 1 = 04
ffff880095356900 1703595831 C Co:2:013:0 0 1 >
ffff880095356900 1703598406 S Co:2:013:0 s 40 0c 0088 3b50 0001 1 = ff
ffff880095356900 1703598830 C Co:2:013:0 0 1 >
ffff880095356900 1703601316 S Co:2:013:0 s 40 0c 0085 0088 0001 1 = 00
ffff880095356900 1703601672 C Co:2:013:0 0 1 >
ffff880095356900 1703604352 S Co:2:013:0 s 40 0c 0085 0088 0001 1 = 00
ffff880095356900 1707224340 C Co:2:013:0 0 1 >
ffff880095356900 1707243409 S Co:2:013:0 s 40 0c 0085 0088 0001 1 = 00
ffff880095356900 1707243834 C Co:2:013:0 0 1 >
ffff880095356900 1707246489 S Co:2:013:0 s 40 0c 0085 0088 0001 1 = 00
ffff880095356900 1707246958 C Co:2:013:0 0 1 >
ffff880095356900 1707249330 S Co:2:013:0 s 40 0c 0085 0088 0001 1 = 00
ffff880095356900 1707249710 C Co:2:013:0 0 1 >
ffff880095356900 1707252318 S Co:2:013:0 s 40 0c 0085 0088 0001 1 = 00
ffff880095356900 1707252702 C Co:2:013:0 0 1 >
ffff880095356900 1707254394 S Ci:2:013:0 s c0 0c 0084 0006 0001 1 <
ffff880095356900 1707254702 C Ci:2:013:0 0 1 = 03
ffff880095356900 1707257398 S Ci:2:013:0 s c0 0c 0084 0006 0001 1 <
ffff880095356900 1707257703 C Ci:2:013:0 0 1 = 00
ffff880095356900 1707396337 S Co:2:013:0 s 40 0c 0088 0001 0001 1 = ff
ffff880095356900 1707396857 C Co:2:013:0 0 1 >
ffff880095356900 1707399383 S Co:2:013:0 s 40 0c 0088 0001 0001 1 = aa
ffff880095356900 1707399797 C Co:2:013:0 0 1 >
ffff880095356900 1707402406 S Co:2:013:0 s 40 0c 0088 0001 0001 1 = 55
ffff880095356900 1707402798 C Co:2:013:0 0 1 >
ffff880095356900 1707405307 S Co:2:013:0 s 40 0c 0088 0001 0001 1 = 00
ffff880095356900 1707405698 C Co:2:013:0 0 1 >
ffff880095356900 1707408327 S Co:2:013:0 s 40 0c 0088 0001 0001 1 = ff
ffff880095356900 1707408831 C Co:2:013:0 0 1 >
ffff880095356900 1707411361 S Co:2:013:0 s 40 0c 0088 0001 0001 1 = 87
ffff880095356900 1707411832 C Co:2:013:0 0 1 >
ffff880095356900 1707414392 S Co:2:013:0 s 40 0c 0088 0001 0001 1 = 78
ffff880095356900 1707414833 C Co:2:013:0 0 1 >
ffff880095356900 1707417308 S Co:2:013:0 s 40 0c 0088 0001 0001 1 = e0
ffff880095356900 1707417714 C Co:2:013:0 0 1 >
ffff880095356900 1707420380 S Co:2:013:0 s 40 0c 0087 0001 0001 1 = 05
ffff880095356900 1707420881 C Co:2:013:0 0 1 >
ffff880095356900 1707423387 S Co:2:013:0 s 40 0c 0087 0001 0001 1 = 04
ffff880095356900 1707423838 C Co:2:013:0 0 1 >
ffff880095356900 1707426407 S Co:2:013:0 s 40 0c 0088 0001 0001 1 = ff
ffff880095356900 1707426860 C Co:2:013:0 0 1 >
ffff880095356900 1707429309 S Co:2:013:0 s 40 0c 0085 0088 0001 1 = dd
ffff880095356900 1707429719 C Co:2:013:0 0 1 >
ffff880095356900 1707432335 S Co:2:013:0 s 40 0c 0085 0088 0001 1 = 00
ffff880095356900 1707432709 C Co:2:013:0 0 1 >
ffff880095356900 1707435370 S Co:2:013:0 s 40 0c 0085 0088 0001 1 = 00
ffff880095356900 1707435833 C Co:2:013:0 0 1 >
ffff880095356900 1707438406 S Co:2:013:0 s 40 0c 0085 0088 0001 1 = 00
ffff880095356900 1707438833 C Co:2:013:0 0 1 >
ffff880095356900 1707441349 S Co:2:013:0 s 40 0c 0085 0088 0001 1 = 0c
ffff880095356900 1707441706 C Co:2:013:0 0 1 >
ffff880095356900 1707444330 S Co:2:013:0 s 40 0c 0085 0088 0001 1 = 00
ffff880095356900 1707444708 C Co:2:013:0 0 1 >
ffff880095356900 1707446359 S Ci:2:013:0 s c0 0c 0084 0006 0001 1 <
ffff880095356900 1707446709 C Ci:2:013:0 0 1 = 01
ffff880095356900 1707450414 S Co:2:013:0 s 40 04 0082 1694 0008 8 = 00000000 0c000000
ffff880095356900 1707450834 C Co:2:013:0 0 8 >
ffff880095356900 1707452432 S Bi:2:013:1 -115 512 <
ffff880095356900 1707452584 C Bi:2:013:1 0 12 = 000000ff f0000500 004e0000
ffff880095356900 1707455371 S Ci:2:013:0 s c0 0c 0084 48c8 0001 1 <
ffff880095356900 1707455758 C Ci:2:013:0 0 1 = 03
ffff880095356900 1707458362 S Ci:2:013:0 s c0 0c 0084 48c8 0001 1 <
ffff880095356900 1707458694 C Ci:2:013:0 0 1 = 00
ffff880095356900 1707462992 S Co:2:013:0 s 40 0c 0088 f954 0001 1 = ff
ffff880095356900 1707463463 C Co:2:013:0 0 1 >
ffff880095356900 1707465843 S Co:2:013:0 s 40 0c 0088 f954 0001 1 = aa
ffff880095356900 1707466335 C Co:2:013:0 0 1 >
ffff880095356900 1707468877 S Co:2:013:0 s 40 0c 0088 f954 0001 1 = 55
ffff880095356900 1707469334 C Co:2:013:0 0 1 >
ffff880095356900 1707471939 S Co:2:013:0 s 40 0c 0088 f954 0001 1 = 00
ffff880095356900 1707472334 C Co:2:013:0 0 1 >
ffff880095356900 1707474967 S Co:2:013:0 s 40 0c 0088 f954 0001 1 = ff
ffff880095356900 1707475460 C Co:2:013:0 0 1 >
ffff880095356900 1707477838 S Co:2:013:0 s 40 0c 0088 f954 0001 1 = 87
ffff880095356900 1707478335 C Co:2:013:0 0 1 >
ffff880095356900 1707480872 S Co:2:013:0 s 40 0c 0088 f954 0001 1 = 78
ffff880095356900 1707481335 C Co:2:013:0 0 1 >
ffff880095356900 1707483916 S Co:2:013:0 s 40 0c 0088 f954 0001 1 = e0
ffff880095356900 1707484335 C Co:2:013:0 0 1 >
ffff880095356900 1707486957 S Co:2:013:0 s 40 0c 0087 f954 0001 1 = 05
ffff880095356900 1707487334 C Co:2:013:0 0 1 >
ffff880095356900 1707489838 S Co:2:013:0 s 40 0c 0087 f954 0001 1 = 04
ffff880095356900 1707490360 C Co:2:013:0 0 1 >
ffff880095356900 1707492877 S Co:2:013:0 s 40 0c 0088 f954 0001 1 = ff
ffff880095356900 1707493360 C Co:2:013:0 0 1 >
ffff880095356900 1707495906 S Co:2:013:0 s 40 0c 0085 0088 0001 1 = 00
ffff880095356900 1707496336 C Co:2:013:0 0 1 >
ffff880095356900 1707498953 S Co:2:013:0 s 40 0c 0085 0088 0001 1 = 00
ffff880095356900 1707499335 C Co:2:013:0 0 1 >
ffff880095356900 1707501837 S Co:2:013:0 s 40 0c 0085 0088 0001 1 = 00
ffff880095356900 1707502210 C Co:2:013:0 0 1 >
ffff880095356900 1707504873 S Co:2:013:0 s 40 0c 0085 0088 0001 1 = 00
ffff880095356900 1707505361 C Co:2:013:0 0 1 >
ffff880095356900 1707507917 S Co:2:013:0 s 40 0c 0085 0088 0001 1 = 00
ffff880095356900 1707508362 C Co:2:013:0 0 1 >
ffff880095356900 1707510958 S Co:2:013:0 s 40 0c 0085 0088 0001 1 = 00
ffff880095356900 1707511335 C Co:2:013:0 0 1 >
ffff880095356900 1707512832 S Ci:2:013:0 s c0 0c 0084 0006 0001 1 <
ffff880095356900 1707513115 C Ci:2:013:0 0 1 = 03
ffff880095356900 1707515864 S Ci:2:013:0 s c0 0c 0084 0006 0001 1 <
ffff880095356900 1707516086 C Ci:2:013:0 0 1 = 00
ffff880095356900 1707519914 S Co:2:013:0 s 40 0c 0088 0001 0001 1 = ff
ffff880095356900 1707520334 C Co:2:013:0 0 1 >
ffff880095356900 1707522959 S Co:2:013:0 s 40 0c 0088 0001 0001 1 = aa
ffff880095356900 1707523462 C Co:2:013:0 0 1 >
ffff880095356900 1707525842 S Co:2:013:0 s 40 0c 0088 0001 0001 1 = 55
ffff880095356900 1707526362 C Co:2:013:0 0 1 >
ffff880095356900 1707528876 S Co:2:013:0 s 40 0c 0088 0001 0001 1 = 00
ffff880095356900 1707529364 C Co:2:013:0 0 1 >
ffff880095356900 1707531907 S Co:2:013:0 s 40 0c 0088 0001 0001 1 = ff
ffff880095356900 1707532336 C Co:2:013:0 0 1 >
ffff880095356900 1707534955 S Co:2:013:0 s 40 0c 0088 0001 0001 1 = 87
ffff880095356900 1707535461 C Co:2:013:0 0 1 >
ffff880095356900 1707537839 S Co:2:013:0 s 40 0c 0088 0001 0001 1 = 78
ffff880095356900 1707538336 C Co:2:013:0 0 1 >
ffff880095356900 1707540871 S Co:2:013:0 s 40 0c 0088 0001 0001 1 = e0
ffff880095356900 1707541337 C Co:2:013:0 0 1 >
ffff880095356900 1707543908 S Co:2:013:0 s 40 0c 0087 0001 0001 1 = 05
ffff880095356900 1707544338 C Co:2:013:0 0 1 >
ffff880095356900 1707546968 S Co:2:013:0 s 40 0c 0087 0001 0001 1 = 04
ffff880095356900 1707547338 C Co:2:013:0 0 1 >
ffff880095356900 1707549839 S Co:2:013:0 s 40 0c 0088 0001 0001 1 = ff
ffff880095356900 1707550336 C Co:2:013:0 0 1 >
ffff880095356900 1707552872 S Co:2:013:0 s 40 0c 0085 0088 0001 1 = 0a
ffff880095356900 1707553336 C Co:2:013:0 0 1 >
ffff880095356900 1707555908 S Co:2:013:0 s 40 0c 0085 0088 0001 1 = 00
ffff880095356900 1707556364 C Co:2:013:0 0 1 >
ffff880095356900 1707558954 S Co:2:013:0 s 40 0c 0085 0088 0001 1 = 00
ffff880095356900 1707559337 C Co:2:013:0 0 1 >
ffff880095356900 1707561843 S Co:2:013:0 s 40 0c 0085 0088 0001 1 = 00
ffff880095356900 1707562219 C Co:2:013:0 0 1 >
ffff880095356900 1707564879 S Co:2:013:0 s 40 0c 0085 0088 0001 1 = 08
ffff880095356900 1707565326 C Co:2:013:0 0 1 >
ffff880095356900 1707567907 S Co:2:013:0 s 40 0c 0085 0088 0001 1 = 00
ffff880095356900 1707568337 C Co:2:013:0 0 1 >
ffff880095356900 1707569935 S Ci:2:013:0 s c0 0c 0084 0006 0001 1 <
ffff880095356900 1707570214 C Ci:2:013:0 0 1 = 00
ffff880095356900 1707573842 S Co:2:013:0 s 40 0c 0085 f8d8 0001 1 = 13
ffff880095356900 1707574218 C Co:2:013:0 0 1 >
ffff880095356900 1707576878 S Co:2:013:0 s 40 0c 0085 f8d8 0001 1 = 00
ffff880095356900 1707577363 C Co:2:013:0 0 1 >
ffff880095356900 1707579913 S Co:2:013:0 s 40 0c 0085 f8d8 0001 1 = 04
ffff880095356900 1707580363 C Co:2:013:0 0 1 >
ffff880095356900 1707582955 S Co:2:013:0 s 40 0c 0085 f8d8 0001 1 = 00
ffff880095356900 1707583339 C Co:2:013:0 0 1 >
ffff880095356900 1707585838 S Co:2:013:0 s 40 0c 0085 f8d8 0001 1 = 02
ffff880095356900 1707586213 C Co:2:013:0 0 1 >
ffff880095356900 1707588874 S Co:2:013:0 s 40 0c 0085 f8d8 0001 1 = 00
ffff880095356900 1707589363 C Co:2:013:0 0 1 >
ffff880095356900 1707591910 S Co:2:013:0 s 40 0c 0085 f8d8 0001 1 = 64
ffff880095356900 1707592363 C Co:2:013:0 0 1 >
ffff880095356900 1707594951 S Co:2:013:0 s 40 0c 0085 f8d8 0001 1 = 00
ffff880095356900 1707595338 C Co:2:013:0 0 1 >
ffff880095356900 1707596832 S Ci:2:013:0 s c0 0c 0084 0008 0001 1 <
ffff880095356900 1707597108 C Ci:2:013:0 0 1 = 03
ffff880095356900 1707599867 S Ci:2:013:0 s c0 0c 0084 0008 0001 1 <
ffff880095356900 1707600052 C Ci:2:013:0 0 1 = 00
ffff8801417a9600 1707603924 S Co:2:013:0 s 40 0c 0088 0084 0001 1 = ff
ffff8801417a9600 1707604303 C Co:2:013:0 0 1 >
ffff8801417a9600 1707607096 S Co:2:013:0 s 40 0c 0088 0084 0001 1 = aa
ffff8801417a9600 1707607589 C Co:2:013:0 0 1 >
ffff8801417a9600 1707609843 S Co:2:013:0 s 40 0c 0088 0084 0001 1 = 55
ffff8801417a9600 1707610339 C Co:2:013:0 0 1 >
ffff8801417a9600 1707612883 S Co:2:013:0 s 40 0c 0088 0084 0001 1 = 00
ffff8801417a9600 1707613339 C Co:2:013:0 0 1 >
ffff8801417a9600 1707615922 S Co:2:013:0 s 40 0c 0088 0084 0001 1 = ff
ffff8801417a9600 1707616340 C Co:2:013:0 0 1 >
ffff8801417a9600 1707618960 S Co:2:013:0 s 40 0c 0088 0084 0001 1 = 87
ffff8801417a9600 1707619339 C Co:2:013:0 0 1 >
ffff8801417a9600 1707621841 S Co:2:013:0 s 40 0c 0088 0084 0001 1 = 78
ffff8801417a9600 1707622364 C Co:2:013:0 0 1 >
ffff8801417a9600 1707624874 S Co:2:013:0 s 40 0c 0088 0084 0001 1 = e0
ffff8801417a9600 1707625364 C Co:2:013:0 0 1 >
ffff8801417a9600 1707627922 S Co:2:013:0 s 40 0c 0087 0084 0001 1 = 05
ffff8801417a9600 1707628366 C Co:2:013:0 0 1 >
ffff8801417a9600 1707630973 S Co:2:013:0 s 40 0c 0087 0084 0001 1 = 04
ffff8801417a9600 1707631339 C Co:2:013:0 0 1 >
ffff8801417a9600 1707633839 S Co:2:013:0 s 40 0c 0088 0084 0001 1 = ff
ffff8801417a9600 1707634346 C Co:2:013:0 0 1 >
ffff8801417a9600 1707636877 S Co:2:013:0 s 40 0c 0085 0088 0001 1 = 0a
ffff8801417a9600 1707637365 C Co:2:013:0 0 1 >
ffff8801417a9600 1707639912 S Co:2:013:0 s 40 0c 0085 0088 0001 1 = 00
ffff8801417a9600 1707640365 C Co:2:013:0 0 1 >
ffff8801417a9600 1707642955 S Co:2:013:0 s 40 0c 0085 0088 0001 1 = 00
ffff8801417a9600 1707643325 C Co:2:013:0 0 1 >
ffff8801417a9600 1707645836 S Co:2:013:0 s 40 0c 0085 0088 0001 1 = 00
ffff8801417a9600 1707646219 C Co:2:013:0 0 1 >
ffff8801417a9600 1707648872 S Co:2:013:0 s 40 0c 0085 0088 0001 1 = 08
ffff8801417a9600 1707649365 C Co:2:013:0 0 1 >
ffff8801417a9600 1707651911 S Co:2:013:0 s 40 0c 0085 0088 0001 1 = 00
ffff8801417a9600 1707652365 C Co:2:013:0 0 1 >
ffff8801417a9600 1707653987 S Ci:2:013:0 s c0 0c 0084 0006 0001 1 <
ffff8801417a9600 1707654340 C Ci:2:013:0 0 1 = 00
ffff8801417a9600 1707657840 S Co:2:013:0 s 40 0c 0085 f8d8 0001 1 = 13
ffff8801417a9600 1707658181 C Co:2:013:0 0 1 >
ffff8801417a9600 1707660874 S Co:2:013:0 s 40 0c 0085 f8d8 0001 1 = 00
ffff8801417a9600 1707661366 C Co:2:013:0 0 1 >
ffff8801417a9600 1707663912 S Co:2:013:0 s 40 0c 0085 f8d8 0001 1 = 04
ffff8801417a9600 1707664368 C Co:2:013:0 0 1 >
ffff8801417a9600 1707666970 S Co:2:013:0 s 40 0c 0085 f8d8 0001 1 = 00
ffff8801417a9600 1707667342 C Co:2:013:0 0 1 >
ffff8801417a9600 1707669849 S Co:2:013:0 s 40 0c 0085 f8d8 0001 1 = 04
ffff8801417a9600 1707670327 C Co:2:013:0 0 1 >
ffff8801417a9600 1707672881 S Co:2:013:0 s 40 0c 0085 f8d8 0001 1 = 00
ffff8801417a9600 1707673366 C Co:2:013:0 0 1 >
ffff8801417a9600 1707675931 S Co:2:013:0 s 40 0c 0085 f8d8 0001 1 = 64
ffff8801417a9600 1707676330 C Co:2:013:0 0 1 >
ffff8801417a9600 1707678961 S Co:2:013:0 s 40 0c 0085 f8d8 0001 1 = 00
ffff8801417a9600 1707679342 C Co:2:013:0 0 1 >
ffff8801417a9600 1707680829 S Ci:2:013:0 s c0 0c 0084 0008 0001 1 <
ffff8801417a9600 1707681091 C Ci:2:013:0 0 1 = 03
ffff8801417a9600 1707683859 S Ci:2:013:0 s c0 0c 0084 0008 0001 1 <
ffff8801417a9600 1707684093 C Ci:2:013:0 0 1 = 00
ffff8801417a9600 1707687900 S Co:2:013:0 s 40 0c 0088 0084 0001 1 = ff
ffff8801417a9600 1707688342 C Co:2:013:0 0 1 >
ffff8801417a9600 1707690930 S Co:2:013:0 s 40 0c 0088 0084 0001 1 = aa
ffff8801417a9600 1707691341 C Co:2:013:0 0 1 >
ffff8801417a9600 1707693848 S Co:2:013:0 s 40 0c 0088 0084 0001 1 = 55
ffff8801417a9600 1707694343 C Co:2:013:0 0 1 >
ffff8801417a9600 1707696879 S Co:2:013:0 s 40 0c 0088 0084 0001 1 = 00
ffff8801417a9600 1707697342 C Co:2:013:0 0 1 >
ffff8801417a9600 1707699914 S Co:2:013:0 s 40 0c 0088 0084 0001 1 = ff
ffff8801417a9600 1707700328 C Co:2:013:0 0 1 >
ffff8801417a9600 1707702989 S Co:2:013:0 s 40 0c 0088 0084 0001 1 = 87
ffff8801417a9600 1707703466 C Co:2:013:0 0 1 >
ffff8801417a9600 1707705837 S Co:2:013:0 s 40 0c 0088 0084 0001 1 = 78
ffff8801417a9600 1707706218 C Co:2:013:0 0 1 >
ffff8801417a9600 1707708871 S Co:2:013:0 s 40 0c 0088 0084 0001 1 = e0
ffff8801417a9600 1707709342 C Co:2:013:0 0 1 >
ffff8801417a9600 1707711910 S Co:2:013:0 s 40 0c 0087 0084 0001 1 = 05
ffff8801417a9600 1707712342 C Co:2:013:0 0 1 >
ffff8801417a9600 1707714958 S Co:2:013:0 s 40 0c 0087 0084 0001 1 = 04
ffff8801417a9600 1707715344 C Co:2:013:0 0 1 >
ffff8801417a9600 1707717835 S Co:2:013:0 s 40 0c 0088 0084 0001 1 = ff
ffff8801417a9600 1707718217 C Co:2:013:0 0 1 >
ffff8801417a9600 1707720864 S Co:2:013:0 s 40 0c 0085 0088 0001 1 = 0a
ffff8801417a9600 1707721332 C Co:2:013:0 0 1 >
ffff8801417a9600 1707723893 S Co:2:013:0 s 40 0c 0085 0088 0001 1 = 00
ffff8801417a9600 1707724366 C Co:2:013:0 0 1 >
ffff8801417a9600 1707726932 S Co:2:013:0 s 40 0c 0085 0088 0001 1 = 00
ffff8801417a9600 1707727343 C Co:2:013:0 0 1 >
ffff8801417a9600 1707729843 S Co:2:013:0 s 40 0c 0085 0088 0001 1 = 00
ffff8801417a9600 1707730225 C Co:2:013:0 0 1 >
ffff8801417a9600 1707732872 S Co:2:013:0 s 40 0c 0085 0088 0001 1 = 08
ffff8801417a9600 1707733343 C Co:2:013:0 0 1 >
ffff8801417a9600 1707735966 S Co:2:013:0 s 40 0c 0085 0088 0001 1 = 00
ffff8801417a9600 1707736349 C Co:2:013:0 0 1 >
ffff8801417a9600 1707737943 S Ci:2:013:0 s c0 0c 0084 0006 0001 1 <
ffff8801417a9600 1707738250 C Ci:2:013:0 0 1 = 00
ffff8801417a9600 1707741840 S Co:2:013:0 s 40 0c 0085 f8d8 0001 1 = 13
ffff8801417a9600 1707742219 C Co:2:013:0 0 1 >
ffff8801417a9600 1707744881 S Co:2:013:0 s 40 0c 0085 f8d8 0001 1 = 00
ffff8801417a9600 1707745343 C Co:2:013:0 0 1 >
ffff8801417a9600 1707747926 S Co:2:013:0 s 40 0c 0085 f8d8 0001 1 = 04
ffff8801417a9600 1707748360 C Co:2:013:0 0 1 >
ffff8801417a9600 1707750969 S Co:2:013:0 s 40 0c 0085 f8d8 0001 1 = 00
ffff8801417a9600 1707751338 C Co:2:013:0 0 1 >
ffff8801417a9600 1707753844 S Co:2:013:0 s 40 0c 0085 f8d8 0001 1 = 08
ffff8801417a9600 1707754219 C Co:2:013:0 0 1 >
ffff8801417a9600 1707756883 S Co:2:013:0 s 40 0c 0085 f8d8 0001 1 = 00
ffff8801417a9600 1707757344 C Co:2:013:0 0 1 >
ffff8801417a9600 1707759915 S Co:2:013:0 s 40 0c 0085 f8d8 0001 1 = 64
ffff8801417a9600 1707760350 C Co:2:013:0 0 1 >
ffff8801417a9600 1707762969 S Co:2:013:0 s 40 0c 0085 f8d8 0001 1 = 00
ffff8801417a9600 1707763344 C Co:2:013:0 0 1 >
ffff8801417a9600 1707764832 S Ci:2:013:0 s c0 0c 0084 0008 0001 1 <
ffff8801417a9600 1707765127 C Ci:2:013:0 0 1 = 03
ffff8801417a9600 1707767867 S Ci:2:013:0 s c0 0c 0084 0008 0001 1 <
ffff8801417a9600 1707768094 C Ci:2:013:0 0 1 = 00
ffff8801417a9600 1707771907 S Co:2:013:0 s 40 0c 0088 48c8 0001 1 = ff
ffff8801417a9600 1707772349 C Co:2:013:0 0 1 >
ffff8801417a9600 1707774955 S Co:2:013:0 s 40 0c 0088 48c8 0001 1 = aa
ffff8801417a9600 1707775345 C Co:2:013:0 0 1 >
ffff8801417a9600 1707777839 S Co:2:013:0 s 40 0c 0088 48c8 0001 1 = 55
ffff8801417a9600 1707778220 C Co:2:013:0 0 1 >
ffff8801417a9600 1707780871 S Co:2:013:0 s 40 0c 0088 48c8 0001 1 = 00
ffff8801417a9600 1707781345 C Co:2:013:0 0 1 >
ffff8801417a9600 1707783908 S Co:2:013:0 s 40 0c 0088 48c8 0001 1 = ff
ffff8801417a9600 1707784329 C Co:2:013:0 0 1 >
ffff8801417a9600 1707786956 S Co:2:013:0 s 40 0c 0088 48c8 0001 1 = 87
ffff8801417a9600 1707787469 C Co:2:013:0 0 1 >
ffff8801417a9600 1707789839 S Co:2:013:0 s 40 0c 0088 48c8 0001 1 = 78
ffff8801417a9600 1707790205 C Co:2:013:0 0 1 >
ffff8801417a9600 1707792873 S Co:2:013:0 s 40 0c 0088 48c8 0001 1 = e0
ffff8801417a9600 1707793371 C Co:2:013:0 0 1 >
ffff8801417a9600 1707795927 S Co:2:013:0 s 40 0c 0087 48c8 0001 1 = 05
ffff8801417a9600 1707796346 C Co:2:013:0 0 1 >
ffff8801417a9600 1707798955 S Co:2:013:0 s 40 0c 0087 48c8 0001 1 = 04
ffff8801417a9600 1707799345 C Co:2:013:0 0 1 >
ffff8801417a9600 1707801837 S Co:2:013:0 s 40 0c 0088 48c8 0001 1 = ff
ffff8801417a9600 1707802368 C Co:2:013:0 0 1 >
ffff8801417a9600 1707804872 S Co:2:013:0 s 40 0c 0085 0088 0001 1 = 0a
ffff8801417a9600 1707805309 C Co:2:013:0 0 1 >
ffff8801417a9600 1707807906 S Co:2:013:0 s 40 0c 0085 0088 0001 1 = 00
ffff8801417a9600 1707808310 C Co:2:013:0 0 1 >
ffff8801417a9600 1707810957 S Co:2:013:0 s 40 0c 0085 0088 0001 1 = 00
ffff8801417a9600 1707811329 C Co:2:013:0 0 1 >
ffff8801417a9600 1707813841 S Co:2:013:0 s 40 0c 0085 0088 0001 1 = 00
ffff8801417a9600 1707814222 C Co:2:013:0 0 1 >
ffff8801417a9600 1707816881 S Co:2:013:0 s 40 0c 0085 0088 0001 1 = 08
ffff8801417a9600 1707817347 C Co:2:013:0 0 1 >
ffff8801417a9600 1707819914 S Co:2:013:0 s 40 0c 0085 0088 0001 1 = 00
ffff8801417a9600 1707820346 C Co:2:013:0 0 1 >
ffff8801417a9600 1707821938 S Ci:2:013:0 s c0 0c 0084 0006 0001 1 <
ffff8801417a9600 1707822225 C Ci:2:013:0 0 1 = 00
ffff8801417a9600 1707825839 S Co:2:013:0 s 40 0c 0085 f8d4 0001 1 = 14
ffff8801417a9600 1707826206 C Co:2:013:0 0 1 >
ffff8801417a9600 1707828877 S Co:2:013:0 s 40 0c 0085 f8d4 0001 1 = 00
ffff8801417a9600 1707829371 C Co:2:013:0 0 1 >
ffff8801417a9600 1707831912 S Co:2:013:0 s 40 0c 0085 f8d4 0001 1 = 04
ffff8801417a9600 1707832343 C Co:2:013:0 0 1 >
ffff8801417a9600 1707835009 S Co:2:013:0 s 40 0c 0085 f8d4 0001 1 = 00
ffff8801417a9600 1707835471 C Co:2:013:0 0 1 >
ffff8801417a9600 1707837845 S Co:2:013:0 s 40 0c 0085 f8d4 0001 1 = 02
ffff8801417a9600 1707838221 C Co:2:013:0 0 1 >
ffff8801417a9600 1707840884 S Co:2:013:0 s 40 0c 0085 f8d4 0001 1 = 00
ffff8801417a9600 1707841332 C Co:2:013:0 0 1 >
ffff8801417a9600 1707843927 S Co:2:013:0 s 40 0c 0085 f8d4 0001 1 = 64
ffff8801417a9600 1707844346 C Co:2:013:0 0 1 >
ffff8800941333c0 1707847008 S Co:2:013:0 s 40 0c 0085 f8d4 0001 1 = 00
ffff8800941333c0 1707847521 C Co:2:013:0 0 1 >
ffff8800941333c0 1707848916 S Ci:2:013:0 s c0 0c 0084 0008 0001 1 <
ffff8800941333c0 1707849254 C Ci:2:013:0 0 1 = 03
ffff8800941333c0 1707851967 S Ci:2:013:0 s c0 0c 0084 0008 0001 1 <
ffff8800941333c0 1707852186 C Ci:2:013:0 0 1 = 00
ffff8800941333c0 1707855879 S Co:2:013:0 s 40 0c 0088 0084 0001 1 = ff
ffff8800941333c0 1707856310 C Co:2:013:0 0 1 >
ffff8800941333c0 1707858908 S Co:2:013:0 s 40 0c 0088 0084 0001 1 = aa
ffff8800941333c0 1707859310 C Co:2:013:0 0 1 >
ffff8800941333c0 1707861839 S Co:2:013:0 s 40 0c 0088 0084 0001 1 = 55
ffff8800941333c0 1707862185 C Co:2:013:0 0 1 >
ffff8800941333c0 1707864878 S Co:2:013:0 s 40 0c 0088 0084 0001 1 = 00
ffff8800941333c0 1707865310 C Co:2:013:0 0 1 >
ffff8800941333c0 1707867920 S Co:2:013:0 s 40 0c 0088 0084 0001 1 = ff
ffff8800941333c0 1707868310 C Co:2:013:0 0 1 >
ffff8800941333c0 1707870956 S Co:2:013:0 s 40 0c 0088 0084 0001 1 = 87
ffff8800941333c0 1707871311 C Co:2:013:0 0 1 >
ffff8800941333c0 1707873835 S Co:2:013:0 s 40 0c 0088 0084 0001 1 = 78
ffff8800941333c0 1707874186 C Co:2:013:0 0 1 >
ffff8800941333c0 1707876867 S Co:2:013:0 s 40 0c 0088 0084 0001 1 = e0
ffff8800941333c0 1707877310 C Co:2:013:0 0 1 >
ffff8800941333c0 1707879906 S Co:2:013:0 s 40 0c 0087 0084 0001 1 = 05
ffff8800941333c0 1707880312 C Co:2:013:0 0 1 >
ffff8800941333c0 1707882943 S Co:2:013:0 s 40 0c 0087 0084 0001 1 = 04
ffff8800941333c0 1707883311 C Co:2:013:0 0 1 >
ffff8800941333c0 1707885838 S Co:2:013:0 s 40 0c 0088 0084 0001 1 = ff
ffff8800941333c0 1707886187 C Co:2:013:0 0 1 >
ffff8800941333c0 1707888869 S Co:2:013:0 s 40 0c 0085 0088 0001 1 = 0a
ffff8800941333c0 1707889186 C Co:2:013:0 0 1 >
ffff8800941333c0 1707891903 S Co:2:013:0 s 40 0c 0085 0088 0001 1 = 00
ffff8800941333c0 1707892311 C Co:2:013:0 0 1 >
ffff8800941333c0 1707894934 S Co:2:013:0 s 40 0c 0085 0088 0001 1 = 00
ffff8800941333c0 1707895313 C Co:2:013:0 0 1 >
ffff8800941333c0 1707897840 S Co:2:013:0 s 40 0c 0085 0088 0001 1 = 00
ffff8800941333c0 1707898186 C Co:2:013:0 0 1 >
ffff8800941333c0 1707900874 S Co:2:013:0 s 40 0c 0085 0088 0001 1 = 08
ffff8800941333c0 1707901186 C Co:2:013:0 0 1 >
ffff8800941333c0 1707903912 S Co:2:013:0 s 40 0c 0085 0088 0001 1 = 00
ffff8800941333c0 1707904311 C Co:2:013:0 0 1 >
ffff8800941333c0 1707905941 S Ci:2:013:0 s c0 0c 0084 0006 0001 1 <
ffff8800941333c0 1707906186 C Ci:2:013:0 0 1 = 00
ffff8800941333c0 1707909895 S Co:2:013:0 s 40 0c 0085 f8d4 0001 1 = 14
ffff8800941333c0 1707910390 C Co:2:013:0 0 1 >
ffff8800941333c0 1707912873 S Co:2:013:0 s 40 0c 0085 f8d4 0001 1 = 00
ffff8800941333c0 1707913326 C Co:2:013:0 0 1 >
ffff8800941333c0 1707915926 S Co:2:013:0 s 40 0c 0085 f8d4 0001 1 = 04
ffff8800941333c0 1707916312 C Co:2:013:0 0 1 >
ffff8800941333c0 1707918960 S Co:2:013:0 s 40 0c 0085 f8d4 0001 1 = 00
ffff8800941333c0 1707919312 C Co:2:013:0 0 1 >
ffff8800941333c0 1707921839 S Co:2:013:0 s 40 0c 0085 f8d4 0001 1 = 04
ffff8800941333c0 1707922187 C Co:2:013:0 0 1 >
ffff8800941333c0 1707924874 S Co:2:013:0 s 40 0c 0085 f8d4 0001 1 = 00
ffff8800941333c0 1707925186 C Co:2:013:0 0 1 >
ffff8800941333c0 1707927909 S Co:2:013:0 s 40 0c 0085 f8d4 0001 1 = 64
ffff8800941333c0 1707928312 C Co:2:013:0 0 1 >
ffff8800941333c0 1707930959 S Co:2:013:0 s 40 0c 0085 f8d4 0001 1 = 00
ffff8800941333c0 1707931313 C Co:2:013:0 0 1 >
ffff8800941333c0 1707932832 S Ci:2:013:0 s c0 0c 0084 0008 0001 1 <
ffff8800941333c0 1707933064 C Ci:2:013:0 0 1 = 03
ffff8800941333c0 1707935866 S Ci:2:013:0 s c0 0c 0084 0008 0001 1 <
ffff8800941333c0 1707936188 C Ci:2:013:0 0 1 = 00
ffff8800941333c0 1707939908 S Co:2:013:0 s 40 0c 0088 0084 0001 1 = ff
ffff8800941333c0 1707940312 C Co:2:013:0 0 1 >
ffff8800941333c0 1707942952 S Co:2:013:0 s 40 0c 0088 0084 0001 1 = aa
ffff8800941333c0 1707943312 C Co:2:013:0 0 1 >
ffff8800941333c0 1707945836 S Co:2:013:0 s 40 0c 0088 0084 0001 1 = 55
ffff8800941333c0 1707946187 C Co:2:013:0 0 1 >
ffff8800941333c0 1707948874 S Co:2:013:0 s 40 0c 0088 0084 0001 1 = 00
ffff8800941333c0 1707949313 C Co:2:013:0 0 1 >
ffff8800941333c0 1707951908 S Co:2:013:0 s 40 0c 0088 0084 0001 1 = ff
ffff8800941333c0 1707952312 C Co:2:013:0 0 1 >
ffff8800941333c0 1707954956 S Co:2:013:0 s 40 0c 0088 0084 0001 1 = 87
ffff8800941333c0 1707955314 C Co:2:013:0 0 1 >
ffff8800941333c0 1707957967 S Co:2:013:0 s 40 0c 0088 0084 0001 1 = 78
ffff8800941333c0 1707958315 C Co:2:013:0 0 1 >
ffff8800941333c0 1707960871 S Co:2:013:0 s 40 0c 0088 0084 0001 1 = e0
ffff8800941333c0 1707961314 C Co:2:013:0 0 1 >
ffff8800941333c0 1707963908 S Co:2:013:0 s 40 0c 0087 0084 0001 1 = 05
ffff8800941333c0 1707964314 C Co:2:013:0 0 1 >
ffff8800941333c0 1707966955 S Co:2:013:0 s 40 0c 0087 0084 0001 1 = 04
ffff8800941333c0 1707967314 C Co:2:013:0 0 1 >
ffff8800941333c0 1707969838 S Co:2:013:0 s 40 0c 0088 0084 0001 1 = ff
ffff8800941333c0 1707970188 C Co:2:013:0 0 1 >
ffff8800941333c0 1707973094 S Co:2:013:0 s 40 0c 0085 0088 0001 1 = 0a
ffff8800941333c0 1707973440 C Co:2:013:0 0 1 >
ffff8800941333c0 1707975905 S Co:2:013:0 s 40 0c 0085 0088 0001 1 = 00
ffff8800941333c0 1707976314 C Co:2:013:0 0 1 >
ffff8800941333c0 1707978943 S Co:2:013:0 s 40 0c 0085 0088 0001 1 = 00
ffff8800941333c0 1707979314 C Co:2:013:0 0 1 >
ffff8800941333c0 1707981840 S Co:2:013:0 s 40 0c 0085 0088 0001 1 = 00
ffff8800941333c0 1707982190 C Co:2:013:0 0 1 >
ffff8800941333c0 1707984877 S Co:2:013:0 s 40 0c 0085 0088 0001 1 = 08
ffff8800941333c0 1707985313 C Co:2:013:0 0 1 >
ffff8800941333c0 1707987913 S Co:2:013:0 s 40 0c 0085 0088 0001 1 = 00
ffff8800941333c0 1707988314 C Co:2:013:0 0 1 >
ffff8800941333c0 1707989941 S Ci:2:013:0 s c0 0c 0084 0006 0001 1 <
ffff8800941333c0 1707990689 C Ci:2:013:0 0 1 = 00
ffff8800941333c0 1707993896 S Co:2:013:0 s 40 0c 0085 f8d4 0001 1 = 14
ffff8800941333c0 1707994357 C Co:2:013:0 0 1 >
ffff8800941333c0 1707996878 S Co:2:013:0 s 40 0c 0085 f8d4 0001 1 = 00
ffff8800941333c0 1707997316 C Co:2:013:0 0 1 >
ffff8800941333c0 1707999909 S Co:2:013:0 s 40 0c 0085 f8d4 0001 1 = 04
ffff8800941333c0 1708000315 C Co:2:013:0 0 1 >
ffff8800941333c0 1708002958 S Co:2:013:0 s 40 0c 0085 f8d4 0001 1 = 00
ffff8800941333c0 1708003314 C Co:2:013:0 0 1 >
ffff8801417a9540 1708005844 S Co:2:013:0 s 40 0c 0085 f8d4 0001 1 = 08
ffff8801417a9540 1708006190 C Co:2:013:0 0 1 >
ffff8801417a9540 1708008870 S Co:2:013:0 s 40 0c 0085 f8d4 0001 1 = 00
ffff8801417a9540 1708009192 C Co:2:013:0 0 1 >
ffff8801417a9540 1708011900 S Co:2:013:0 s 40 0c 0085 f8d4 0001 1 = 64
ffff8801417a9540 1708012353 C Co:2:013:0 0 1 >
ffff8801417a9540 1708014934 S Co:2:013:0 s 40 0c 0085 f8d4 0001 1 = 00
ffff8801417a9540 1708015353 C Co:2:013:0 0 1 >
ffff88004dbbfa40 1708016898 S Ci:2:013:0 s c0 0c 0084 0008 0001 1 <
ffff88004dbbfa40 1708017232 C Ci:2:013:0 0 1 = 03
ffff88004dbbfa40 1708019963 S Ci:2:013:0 s c0 0c 0084 0008 0001 1 <
ffff88004dbbfa40 1708020191 C Ci:2:013:0 0 1 = 00
ffff88004dbbfa40 1708026986 S Co:2:013:0 s 40 0c 0088 d8ef 0001 1 = ff
ffff88004dbbfa40 1708027463 C Co:2:013:0 0 1 >
ffff88004dbbfa40 1708029878 S Co:2:013:0 s 40 0c 0088 d8ef 0001 1 = aa
ffff88004dbbfa40 1708030352 C Co:2:013:0 0 1 >
ffff88004dbbfa40 1708032922 S Co:2:013:0 s 40 0c 0088 d8ef 0001 1 = 55
ffff88004dbbfa40 1708033345 C Co:2:013:0 0 1 >
ffff88004dbbfa40 1708035955 S Co:2:013:0 s 40 0c 0088 d8ef 0001 1 = 00
ffff88004dbbfa40 1708036315 C Co:2:013:0 0 1 >
ffff88004dbbfa40 1708038985 S Co:2:013:0 s 40 0c 0088 d8ef 0001 1 = ff
ffff88004dbbfa40 1708039478 C Co:2:013:0 0 1 >
ffff88004dbbfa40 1708041886 S Co:2:013:0 s 40 0c 0088 d8ef 0001 1 = 87
ffff88004dbbfa40 1708042379 C Co:2:013:0 0 1 >
ffff88004dbbfa40 1708044946 S Co:2:013:0 s 40 0c 0088 d8ef 0001 1 = 78
ffff88004dbbfa40 1708045340 C Co:2:013:0 0 1 >
ffff88004dbbfa40 1708047961 S Co:2:013:0 s 40 0c 0088 d8ef 0001 1 = e0
ffff88004dbbfa40 1708048315 C Co:2:013:0 0 1 >
ffff88004dbbfa40 1708050977 S Co:2:013:0 s 40 0c 0087 d8ef 0001 1 = 05
ffff88004dbbfa40 1708051354 C Co:2:013:0 0 1 >
ffff88004dbbfa40 1708053885 S Co:2:013:0 s 40 0c 0087 d8ef 0001 1 = 04
ffff88004dbbfa40 1708054352 C Co:2:013:0 0 1 >
ffff88004dbbfa40 1708056916 S Co:2:013:0 s 40 0c 0088 d8ef 0001 1 = ff
ffff88004dbbfa40 1708057340 C Co:2:013:0 0 1 >
ffff88004dbbfa40 1708059951 S Co:2:013:0 s 40 0c 0085 0088 0001 1 = 0a
ffff88004dbbfa40 1708060316 C Co:2:013:0 0 1 >
ffff88004dbbfa40 1708063021 S Co:2:013:0 s 40 0c 0085 0088 0001 1 = 00
ffff88004dbbfa40 1708063526 C Co:2:013:0 0 1 >
ffff88004dbbfa40 1708065936 S Co:2:013:0 s 40 0c 0085 0088 0001 1 = 00
ffff88004dbbfa40 1708066404 C Co:2:013:0 0 1 >
ffff88004dbbfa40 1708068935 S Co:2:013:0 s 40 0c 0085 0088 0001 1 = 00
ffff88004dbbfa40 1708069320 C Co:2:013:0 0 1 >
ffff88004dbbfa40 1708071978 S Co:2:013:0 s 40 0c 0085 0088 0001 1 = 0e
ffff88004dbbfa40 1708072317 C Co:2:013:0 0 1 >
ffff88004dbbfa40 1708075012 S Co:2:013:0 s 40 0c 0085 0088 0001 1 = 00
ffff88004dbbfa40 1708075479 C Co:2:013:0 0 1 >
ffff88004dbbfa40 1708076886 S Ci:2:013:0 s c0 0c 0084 0006 0001 1 <
ffff88004dbbfa40 1708077229 C Ci:2:013:0 0 1 = 00
ffff88004dbbfa40 1708080895 S Co:2:013:0 s 40 0c 0085 f848 0001 1 = 12
ffff88004dbbfa40 1708081355 C Co:2:013:0 0 1 >
ffff88004dbbfa40 1708083917 S Co:2:013:0 s 40 0c 0085 f848 0001 1 = 00
ffff88004dbbfa40 1708084320 C Co:2:013:0 0 1 >
ffff88004dbbfa40 1708086946 S Co:2:013:0 s 40 0c 0085 f848 0001 1 = 0a
ffff88004dbbfa40 1708087355 C Co:2:013:0 0 1 >
ffff88004dbbfa40 1708089885 S Co:2:013:0 s 40 0c 0085 f848 0001 1 = 00
ffff88004dbbfa40 1708090381 C Co:2:013:0 0 1 >
ffff88004dbbfa40 1708092938 S Co:2:013:0 s 40 0c 0085 f848 0001 1 = 80
ffff88004dbbfa40 1708093356 C Co:2:013:0 0 1 >
ffff88004dbbfa40 1708095954 S Co:2:013:0 s 40 0c 0085 f848 0001 1 = 00
ffff88004dbbfa40 1708096320 C Co:2:013:0 0 1 >
ffff88004dbbfa40 1708098985 S Co:2:013:0 s 40 0c 0085 f848 0001 1 = 00
ffff88004dbbfa40 1708099362 C Co:2:013:0 0 1 >
ffff88004dbbfa40 1708101910 S Co:2:013:0 s 40 0c 0085 f848 0001 1 = 00
ffff88004dbbfa40 1708102400 C Co:2:013:0 0 1 >
ffff88004dbbfa40 1708104913 S Co:2:013:0 s 40 0c 0085 f848 0001 1 = 00
ffff88004dbbfa40 1708105380 C Co:2:013:0 0 1 >
ffff88004dbbfa40 1708107954 S Co:2:013:0 s 40 0c 0085 f848 0001 1 = 00
ffff88004dbbfa40 1708108320 C Co:2:013:0 0 1 >
ffff8800941333c0 1708111101 S Co:2:013:0 s 40 0c 0085 f848 0001 1 = 18
ffff8800941333c0 1708111445 C Co:2:013:0 0 1 >
ffff8800941333c0 1708113905 S Co:2:013:0 s 40 0c 0085 f848 0001 1 = 1d
ffff8800941333c0 1708114320 C Co:2:013:0 0 1 >
ffff8800941333c0 1708116919 S Co:2:013:0 s 40 0c 0085 f848 0001 1 = d5
ffff8800941333c0 1708117319 C Co:2:013:0 0 1 >
ffff8800941333c0 1708119957 S Co:2:013:0 s 40 0c 0085 f848 0001 1 = 1c
ffff8800941333c0 1708120319 C Co:2:013:0 0 1 >
ffff8800941333c0 1708122019 S Ci:2:013:0 s c0 0c 0084 000e 0001 1 <
ffff8800941333c0 1708122319 C Ci:2:013:0 0 1 = 03
ffff8800941333c0 1708124909 S Ci:2:013:0 s c0 0c 0084 000e 0001 1 <
ffff8800941333c0 1708125694 C Ci:2:013:0 0 1 = 00
ffff8800941333c0 1708129489 S Co:2:013:0 s 40 0c 0088 f8eb 0001 1 = ff
ffff8800941333c0 1708129945 C Co:2:013:0 0 1 >
ffff8800941333c0 1708132524 S Co:2:013:0 s 40 0c 0088 f8eb 0001 1 = aa
ffff8800941333c0 1708132946 C Co:2:013:0 0 1 >
ffff8800941333c0 1708135544 S Co:2:013:0 s 40 0c 0088 f8eb 0001 1 = 55
ffff8800941333c0 1708135943 C Co:2:013:0 0 1 >
ffff88005ad6c6c0 1708138482 S Co:2:013:0 s 40 0c 0088 f8eb 0001 1 = 00
ffff88005ad6c6c0 1708138985 C Co:2:013:0 0 1 >
ffff88005ad6c6c0 1708141511 S Co:2:013:0 s 40 0c 0088 f8eb 0001 1 = ff
ffff88005ad6c6c0 1708141947 C Co:2:013:0 0 1 >
ffff88005ad6c6c0 1708144524 S Co:2:013:0 s 40 0c 0088 f8eb 0001 1 = 87
ffff88005ad6c6c0 1708144943 C Co:2:013:0 0 1 >
ffff88005ad6c6c0 1708147554 S Co:2:013:0 s 40 0c 0088 f8eb 0001 1 = 78
ffff88005ad6c6c0 1708147983 C Co:2:013:0 0 1 >
ffff88005ad6c6c0 1708150451 S Co:2:013:0 s 40 0c 0088 f8eb 0001 1 = e0
ffff88005ad6c6c0 1708150862 C Co:2:013:0 0 1 >
ffff88005ad6c6c0 1708153494 S Co:2:013:0 s 40 0c 0087 f8eb 0001 1 = 05
ffff88005ad6c6c0 1708153967 C Co:2:013:0 0 1 >
ffff88005ad6c6c0 1708156524 S Co:2:013:0 s 40 0c 0087 f8eb 0001 1 = 04
ffff88005ad6c6c0 1708156944 C Co:2:013:0 0 1 >
ffff88005ad6c6c0 1708159545 S Co:2:013:0 s 40 0c 0088 f8eb 0001 1 = ff
ffff88005ad6c6c0 1708159944 C Co:2:013:0 0 1 >
ffff88005ad6c6c0 1708162463 S Co:2:013:0 s 40 0c 0085 0088 0001 1 = 0a
ffff88005ad6c6c0 1708162852 C Co:2:013:0 0 1 >
ffff88005ad6c6c0 1708165496 S Co:2:013:0 s 40 0c 0085 0088 0001 1 = 00
ffff88005ad6c6c0 1708165983 C Co:2:013:0 0 1 >
ffff88005ad6c6c0 1708168533 S Co:2:013:0 s 40 0c 0085 0088 0001 1 = 00
ffff88005ad6c6c0 1708168967 C Co:2:013:0 0 1 >
ffff88005ad6c6c0 1708171561 S Co:2:013:0 s 40 0c 0085 0088 0001 1 = 00
ffff88005ad6c6c0 1708171944 C Co:2:013:0 0 1 >
ffff88005ad6c6c0 1708174462 S Co:2:013:0 s 40 0c 0085 0088 0001 1 = 06
ffff88005ad6c6c0 1708174869 C Co:2:013:0 0 1 >
ffff88005ad6c6c0 1708177490 S Co:2:013:0 s 40 0c 0085 0088 0001 1 = 00
ffff88005ad6c6c0 1708177822 C Co:2:013:0 0 1 >
ffff88005ad6c6c0 1708179522 S Ci:2:013:0 s c0 0c 0084 0006 0001 1 <
ffff88005ad6c6c0 1708179820 C Ci:2:013:0 0 1 = 00
ffff88005ad6c6c0 1708183562 S Co:2:013:0 s 40 0c 0085 f8f0 0001 1 = 17
ffff88005ad6c6c0 1708183945 C Co:2:013:0 0 1 >
ffff88005ad6c6c0 1708186462 S Co:2:013:0 s 40 0c 0085 f8f0 0001 1 = 00
ffff88005ad6c6c0 1708186886 C Co:2:013:0 0 1 >
ffff88005ad6c6c0 1708189488 S Co:2:013:0 s 40 0c 0085 f8f0 0001 1 = 02
ffff88005ad6c6c0 1708189850 C Co:2:013:0 0 1 >
ffff88005ad6c6c0 1708192520 S Co:2:013:0 s 40 0c 0085 f8f0 0001 1 = 00
ffff88005ad6c6c0 1708192948 C Co:2:013:0 0 1 >
ffff88005ad6c6c0 1708195557 S Co:2:013:0 s 40 0c 0085 f8f0 0001 1 = 01
ffff88005ad6c6c0 1708195945 C Co:2:013:0 0 1 >
ffff88005ad6c6c0 1708198465 S Co:2:013:0 s 40 0c 0085 f8f0 0001 1 = 00
ffff88005ad6c6c0 1708198858 C Co:2:013:0 0 1 >
ffff88005ad6c6c0 1708200532 S Ci:2:013:0 s c0 0c 0084 0006 0001 1 <
ffff88005ad6c6c0 1708200858 C Ci:2:013:0 0 1 = 03
ffff88005ad6c6c0 1708203527 S Ci:2:013:0 s c0 0c 0084 0006 0001 1 <
ffff88005ad6c6c0 1708203858 C Ci:2:013:0 0 1 = 00
ffff88005ad6c6c0 1708207417 S Co:2:013:0 s 40 0c 0088 0001 0001 1 = ff
ffff88005ad6c6c0 1708207823 C Co:2:013:0 0 1 >
ffff88005ad6c6c0 1708210456 S Co:2:013:0 s 40 0c 0088 0001 0001 1 = aa
ffff88005ad6c6c0 1708210858 C Co:2:013:0 0 1 >
ffff88005ad6c6c0 1708213494 S Co:2:013:0 s 40 0c 0088 0001 0001 1 = 55
ffff88005ad6c6c0 1708213980 C Co:2:013:0 0 1 >
ffff88005ad6c6c0 1708216527 S Co:2:013:0 s 40 0c 0088 0001 0001 1 = 00
ffff88005ad6c6c0 1708216995 C Co:2:013:0 0 1 >
ffff88005ad6c6c0 1708219549 S Co:2:013:0 s 40 0c 0088 0001 0001 1 = ff
ffff88005ad6c6c0 1708219946 C Co:2:013:0 0 1 >
ffff88005ad6c6c0 1708222461 S Co:2:013:0 s 40 0c 0088 0001 0001 1 = 87
ffff88005ad6c6c0 1708222859 C Co:2:013:0 0 1 >
ffff88005ad6c6c0 1708225500 S Co:2:013:0 s 40 0c 0088 0001 0001 1 = 78
ffff88005ad6c6c0 1708226013 C Co:2:013:0 0 1 >
ffff88005ad6c6c0 1708228528 S Co:2:013:0 s 40 0c 0088 0001 0001 1 = e0
ffff88005ad6c6c0 1708229010 C Co:2:013:0 0 1 >
ffff88005ad6c6c0 1708231558 S Co:2:013:0 s 40 0c 0087 0001 0001 1 = 05
ffff88005ad6c6c0 1708231970 C Co:2:013:0 0 1 >
ffff88005ad6c6c0 1708234503 S Co:2:013:0 s 40 0c 0087 0001 0001 1 = 04
ffff88005ad6c6c0 1708234948 C Co:2:013:0 0 1 >
ffff88005ad6c6c0 1708237497 S Co:2:013:0 s 40 0c 0088 0001 0001 1 = ff
ffff88005ad6c6c0 1708237986 C Co:2:013:0 0 1 >
ffff88005ad6c6c0 1708240534 S Co:2:013:0 s 40 0c 0085 0088 0001 1 = d7
ffff88005ad6c6c0 1708241010 C Co:2:013:0 0 1 >
ffff88005ad6c6c0 1708243568 S Co:2:013:0 s 40 0c 0085 0088 0001 1 = 00
ffff88005ad6c6c0 1708243984 C Co:2:013:0 0 1 >
ffff88005ad6c6c0 1708246461 S Co:2:013:0 s 40 0c 0085 0088 0001 1 = 00
ffff88005ad6c6c0 1708246870 C Co:2:013:0 0 1 >
ffff88005ad6c6c0 1708249494 S Co:2:013:0 s 40 0c 0085 0088 0001 1 = 00
ffff88005ad6c6c0 1708249822 C Co:2:013:0 0 1 >
ffff88005ad6c6c0 1708252531 S Co:2:013:0 s 40 0c 0085 0088 0001 1 = 67
ffff88005ad6c6c0 1708253011 C Co:2:013:0 0 1 >
ffff88005ad6c6c0 1708255561 S Co:2:013:0 s 40 0c 0085 0088 0001 1 = 00
ffff88005ad6c6c0 1708255985 C Co:2:013:0 0 1 >
ffff88005ad6c6c0 1708257651 S Ci:2:013:0 s c0 0c 0084 0006 0001 1 <
ffff88005ad6c6c0 1708258486 C Ci:2:013:0 0 1 = 01
ffff88005ad6c6c0 1708263509 S Co:2:013:0 s 40 04 0082 1694 0008 8 = 00000000 67000000
ffff88005ad6c6c0 1708263825 C Co:2:013:0 0 8 >
ffff88005ad6c6c0 1708265584 S Bi:2:013:1 -115 512 <
ffff88005ad6c6c0 1708268110 C Bi:2:013:1 0 103 = 00000000 00000000 00000000 00000000 00000000 00000000 00000000 00000000
ffff88005ad6c6c0 1708270459 S Ci:2:013:0 s c0 0c 0084 48c8 0001 1 <
ffff88005ad6c6c0 1708270730 C Ci:2:013:0 0 1 = 03
ffff88005ad6c6c0 1708273530 S Ci:2:013:0 s c0 0c 0084 48c8 0001 1 <
ffff88005ad6c6c0 1708274360 C Ci:2:013:0 0 1 = 00
ffff88005ad6c6c0 1708278245 S Co:2:013:0 s 40 0c 0088 0001 0001 1 = ff
ffff88005ad6c6c0 1708278736 C Co:2:013:0 0 1 >
ffff88005ad6c6c0 1708281204 S Co:2:013:0 s 40 0c 0088 0001 0001 1 = aa
ffff88005ad6c6c0 1708281615 C Co:2:013:0 0 1 >
ffff88005ad6c6c0 1708284167 S Co:2:013:0 s 40 0c 0088 0001 0001 1 = 55
ffff88005ad6c6c0 1708284619 C Co:2:013:0 0 1 >
ffff88005ad6c6c0 1708287204 S Co:2:013:0 s 40 0c 0088 0001 0001 1 = 00
ffff88005ad6c6c0 1708287635 C Co:2:013:0 0 1 >
ffff88005ad6c6c0 1708290243 S Co:2:013:0 s 40 0c 0088 0001 0001 1 = ff
ffff88005ad6c6c0 1708290699 C Co:2:013:0 0 1 >
ffff88005ad6c6c0 1708293136 S Co:2:013:0 s 40 0c 0088 0001 0001 1 = 87
ffff88005ad6c6c0 1708293636 C Co:2:013:0 0 1 >
ffff88005ad6c6c0 1708296169 S Co:2:013:0 s 40 0c 0088 0001 0001 1 = 78
ffff88005ad6c6c0 1708296638 C Co:2:013:0 0 1 >
ffff88005ad6c6c0 1708299205 S Co:2:013:0 s 40 0c 0088 0001 0001 1 = e0
ffff88005ad6c6c0 1708299637 C Co:2:013:0 0 1 >
ffff88005ad6c6c0 1708302239 S Co:2:013:0 s 40 0c 0087 0001 0001 1 = 05
ffff88005ad6c6c0 1708302730 C Co:2:013:0 0 1 >
ffff88005ad6c6c0 1708305134 S Co:2:013:0 s 40 0c 0087 0001 0001 1 = 04
ffff88005ad6c6c0 1708305574 C Co:2:013:0 0 1 >
ffff88005ad6c6c0 1708308173 S Co:2:013:0 s 40 0c 0088 0001 0001 1 = ff
ffff88005ad6c6c0 1708308612 C Co:2:013:0 0 1 >
ffff88005ad6c6c0 1708311223 S Co:2:013:0 s 40 0c 0085 0088 0001 1 = dc
ffff88005ad6c6c0 1708311616 C Co:2:013:0 0 1 >
ffff88005ad6c6c0 1708314249 S Co:2:013:0 s 40 0c 0085 0088 0001 1 = 00
ffff88005ad6c6c0 1708314601 C Co:2:013:0 0 1 >
ffff88005ad6c6c0 1708317136 S Co:2:013:0 s 40 0c 0085 0088 0001 1 = 00
ffff88005ad6c6c0 1708317451 C Co:2:013:0 0 1 >
ffff88005ad6c6c0 1708320167 S Co:2:013:0 s 40 0c 0085 0088 0001 1 = 00
ffff88005ad6c6c0 1708320577 C Co:2:013:0 0 1 >
ffff88005ad6c6c0 1708323210 S Co:2:013:0 s 40 0c 0085 0088 0001 1 = 1d
ffff88005ad6c6c0 1708323618 C Co:2:013:0 0 1 >
ffff88005ad6c6c0 1708326243 S Co:2:013:0 s 40 0c 0085 0088 0001 1 = 00
ffff88005ad6c6c0 1708326617 C Co:2:013:0 0 1 >
ffff88005ad6c6c0 1708328309 S Ci:2:013:0 s c0 0c 0084 0006 0001 1 <
ffff88005ad6c6c0 1708328613 C Ci:2:013:0 0 1 = 00
ffff88005ad6c6c0 1708332176 S Co:2:013:0 s 40 0c 0085 f6ec 0001 1 = c4
ffff88005ad6c6c0 1708332575 C Co:2:013:0 0 1 >
ffff88005ad6c6c0 1708335218 S Co:2:013:0 s 40 0c 0085 f6ec 0001 1 = 24
ffff88005ad6c6c0 1708335639 C Co:2:013:0 0 1 >
ffff88005ad6c6c0 1708338254 S Co:2:013:0 s 40 0c 0085 f6ec 0001 1 = a6
ffff88005ad6c6c0 1708338613 C Co:2:013:0 0 1 >
ffff88005ad6c6c0 1708341134 S Co:2:013:0 s 40 0c 0085 f6ec 0001 1 = 18
ffff88005ad6c6c0 1708341639 C Co:2:013:0 0 1 >
ffff88005ad6c6c0 1708344168 S Co:2:013:0 s 40 0c 0085 f6ec 0001 1 = a6
ffff88005ad6c6c0 1708344624 C Co:2:013:0 0 1 >
ffff88005ad6c6c0 1708347209 S Co:2:013:0 s 40 0c 0085 f6ec 0001 1 = 18
ffff88005ad6c6c0 1708347575 C Co:2:013:0 0 1 >
ffff88005ad6c6c0 1708350240 S Co:2:013:0 s 40 0c 0085 f6ec 0001 1 = 51
ffff88005ad6c6c0 1708350606 C Co:2:013:0 0 1 >
ffff88005ad6c6c0 1708353135 S Co:2:013:0 s 40 0c 0085 f6ec 0001 1 = 4e
ffff88005ad6c6c0 1708353639 C Co:2:013:0 0 1 >
ffff88005ad6c6c0 1708356168 S Co:2:013:0 s 40 0c 0085 f6ec 0001 1 = 6a
ffff88005ad6c6c0 1708356639 C Co:2:013:0 0 1 >
ffff88005ad6c6c0 1708359199 S Co:2:013:0 s 40 0c 0085 f6ec 0001 1 = 00
ffff88005ad6c6c0 1708359599 C Co:2:013:0 0 1 >
ffff88005ad6c6c0 1708362233 S Co:2:013:0 s 40 0c 0085 f6ec 0001 1 = 00
ffff88005ad6c6c0 1708362576 C Co:2:013:0 0 1 >
ffff88005ad6c6c0 1708365162 S Co:2:013:0 s 40 0c 0085 f6ec 0001 1 = 00
ffff88005ad6c6c0 1708365662 C Co:2:013:0 0 1 >
ffff88005ad6c6c0 1708368173 S Co:2:013:0 s 40 0c 0085 f6ec 0001 1 = 0a
ffff88005ad6c6c0 1708368613 C Co:2:013:0 0 1 >
ffff88005ad6c6c0 1708371208 S Co:2:013:0 s 40 0c 0085 f6ec 0001 1 = 0a
ffff88005ad6c6c0 1708371613 C Co:2:013:0 0 1 >
ffff88005ad6c6c0 1708374248 S Co:2:013:0 s 40 0c 0085 f6ec 0001 1 = 0a
ffff88005ad6c6c0 1708374614 C Co:2:013:0 0 1 >
ffff88005ad6c6c0 1708377136 S Co:2:013:0 s 40 0c 0085 f6ec 0001 1 = 05
ffff88005ad6c6c0 1708377489 C Co:2:013:0 0 1 >
ffff88005ad6c6c0 1708380170 S Co:2:013:0 s 40 0c 0085 f6ec 0001 1 = 00
ffff88005ad6c6c0 1708380598 C Co:2:013:0 0 1 >
ffff88005ad6c6c0 1708383208 S Co:2:013:0 s 40 0c 0085 f6ec 0001 1 = 00
ffff88005ad6c6c0 1708383621 C Co:2:013:0 0 1 >
ffff88005ad6c6c0 1708386248 S Co:2:013:0 s 40 0c 0085 f6ec 0001 1 = 04
ffff88005ad6c6c0 1708386765 C Co:2:013:0 0 1 >
ffff88005ad6c6c0 1708389143 S Co:2:013:0 s 40 0c 0085 f6ec 0001 1 = 10
ffff88005ad6c6c0 1708389624 C Co:2:013:0 0 1 >
ffff88005ad6c6c0 1708392199 S Co:2:013:0 s 40 0c 0085 f6ec 0001 1 = 4e
ffff88005ad6c6c0 1708392625 C Co:2:013:0 0 1 >
ffff88005ad6c6c0 1708395208 S Co:2:013:0 s 40 0c 0085 f6ec 0001 1 = 00
ffff88005ad6c6c0 1708395625 C Co:2:013:0 0 1 >
ffff88005ad6c6c0 1708398244 S Co:2:013:0 s 40 0c 0085 f6ec 0001 1 = 29
ffff88005ad6c6c0 1708398601 C Co:2:013:0 0 1 >
ffff88005ad6c6c0 1708401144 S Co:2:013:0 s 40 0c 0085 f6ec 0001 1 = 00
ffff88005ad6c6c0 1708401578 C Co:2:013:0 0 1 >
ffff88005ad6c6c0 1708404190 S Co:2:013:0 s 40 0c 0085 f6ec 0001 1 = 00
ffff88005ad6c6c0 1708404600 C Co:2:013:0 0 1 >
ffff88005ad6c6c0 1708407207 S Co:2:013:0 s 40 0c 0085 f6ec 0001 1 = 00
ffff88005ad6c6c0 1708407577 C Co:2:013:0 0 1 >
ffff88005ad6c6c0 1708410237 S Co:2:013:0 s 40 0c 0085 f6ec 0001 1 = 00
ffff88005ad6c6c0 1708410577 C Co:2:013:0 0 1 >
ffff88005ad6c6c0 1708413144 S Co:2:013:0 s 40 0c 0085 f6ec 0001 1 = 00
ffff88005ad6c6c0 1708413578 C Co:2:013:0 0 1 >
ffff88005ad6c6c0 1708416184 S Co:2:013:0 s 40 0c 0085 f6ec 0001 1 = 00
ffff88005ad6c6c0 1708416577 C Co:2:013:0 0 1 >
ffff88005ad6c6c0 1708418218 S Ci:2:013:0 s c0 0c 0084 001d 0001 1 <
ffff88005ad6c6c0 1708418454 C Ci:2:013:0 0 1 = 03
ffff88005ad6c6c0 1708421260 S Ci:2:013:0 s c0 0c 0084 001d 0001 1 <
ffff88005ad6c6c0 1708421452 C Ci:2:013:0 0 1 = 00
ffff88005ad6c6c0 1708425129 S Co:2:013:0 s 40 0c 0088 0064 0001 1 = ff
ffff88005ad6c6c0 1708425578 C Co:2:013:0 0 1 >
ffff88005ad6c6c0 1708428159 S Co:2:013:0 s 40 0c 0088 0064 0001 1 = aa
ffff88005ad6c6c0 1708428624 C Co:2:013:0 0 1 >
ffff88005ad6c6c0 1708431200 S Co:2:013:0 s 40 0c 0088 0064 0001 1 = 55
ffff88005ad6c6c0 1708431601 C Co:2:013:0 0 1 >
ffff88005ad6c6c0 1708434220 S Co:2:013:0 s 40 0c 0088 0064 0001 1 = 00
ffff88005ad6c6c0 1708434607 C Co:2:013:0 0 1 >
ffff88005ad6c6c0 1708437138 S Co:2:013:0 s 40 0c 0088 0064 0001 1 = ff
ffff88005ad6c6c0 1708437577 C Co:2:013:0 0 1 >
ffff88005ad6c6c0 1708440197 S Co:2:013:0 s 40 0c 0088 0064 0001 1 = 87
ffff88005ad6c6c0 1708440608 C Co:2:013:0 0 1 >
ffff88005ad6c6c0 1708443199 S Co:2:013:0 s 40 0c 0088 0064 0001 1 = 78
ffff88005ad6c6c0 1708443626 C Co:2:013:0 0 1 >
ffff88005ad6c6c0 1708446240 S Co:2:013:0 s 40 0c 0088 0064 0001 1 = e0
ffff88005ad6c6c0 1708446753 C Co:2:013:0 0 1 >
ffff88005ad6c6c0 1708449141 S Co:2:013:0 s 40 0c 0087 0064 0001 1 = 05
ffff88005ad6c6c0 1708449578 C Co:2:013:0 0 1 >
ffff88005ad6c6c0 1708452198 S Co:2:013:0 s 40 0c 0087 0064 0001 1 = 04
ffff88005ad6c6c0 1708452626 C Co:2:013:0 0 1 >
ffff88005ad6c6c0 1708455216 S Co:2:013:0 s 40 0c 0088 0064 0001 1 = ff
ffff88005ad6c6c0 1708455608 C Co:2:013:0 0 1 >
ffff88005ad6c6c0 1708458248 S Co:2:013:0 s 40 0c 0085 0088 0001 1 = 15
ffff88005ad6c6c0 1708458602 C Co:2:013:0 0 1 >
ffff88005ad6c6c0 1708461134 S Co:2:013:0 s 40 0c 0085 0088 0001 1 = 00
ffff88005ad6c6c0 1708461580 C Co:2:013:0 0 1 >
ffff88005ad6c6c0 1708464198 S Co:2:013:0 s 40 0c 0085 0088 0001 1 = 00
ffff88005ad6c6c0 1708464627 C Co:2:013:0 0 1 >
ffff88005ad6c6c0 1708467212 S Co:2:013:0 s 40 0c 0085 0088 0001 1 = 00
ffff88005ad6c6c0 1708467627 C Co:2:013:0 0 1 >
ffff88005ad6c6c0 1708470246 S Co:2:013:0 s 40 0c 0085 0088 0001 1 = 10
ffff88005ad6c6c0 1708470609 C Co:2:013:0 0 1 >
ffff88005ad6c6c0 1708473182 S Co:2:013:0 s 40 0c 0085 0088 0001 1 = 00
ffff88005ad6c6c0 1708473580 C Co:2:013:0 0 1 >
ffff88005ad6c6c0 1708475228 S Ci:2:013:0 s c0 0c 0084 0006 0001 1 <
ffff88005ad6c6c0 1708475456 C Ci:2:013:0 0 1 = 00
ffff88005ad6c6c0 1708479205 S Co:2:013:0 s 40 0c 0085 f8e0 0001 1 = 00
ffff88005ad6c6c0 1708479582 C Co:2:013:0 0 1 >
ffff88005ad6c6c0 1708482242 S Co:2:013:0 s 40 0c 0085 f8e0 0001 1 = 0f
ffff88005ad6c6c0 1708482581 C Co:2:013:0 0 1 >
ffff88005ad6c6c0 1708485136 S Co:2:013:0 s 40 0c 0085 f8e0 0001 1 = 71
ffff88005ad6c6c0 1708485453 C Co:2:013:0 0 1 >
ffff88005ad6c6c0 1708488168 S Co:2:013:0 s 40 0c 0085 f8e0 0001 1 = 02
ffff88005ad6c6c0 1708488579 C Co:2:013:0 0 1 >
ffff88005ad6c6c0 1708491209 S Co:2:013:0 s 40 0c 0085 f8e0 0001 1 = 80
ffff88005ad6c6c0 1708491583 C Co:2:013:0 0 1 >
ffff88005ad6c6c0 1708494241 S Co:2:013:0 s 40 0c 0085 f8e0 0001 1 = 20
ffff88005ad6c6c0 1708494583 C Co:2:013:0 0 1 >
ffff88005ad6c6c0 1708497134 S Co:2:013:0 s 40 0c 0085 f8e0 0001 1 = 04
ffff88005ad6c6c0 1708497455 C Co:2:013:0 0 1 >
ffff88005ad6c6c0 1708500168 S Co:2:013:0 s 40 0c 0085 f8e0 0001 1 = 00
ffff88005ad6c6c0 1708500580 C Co:2:013:0 0 1 >
ffff88005ad6c6c0 1708503212 S Co:2:013:0 s 40 0c 0085 f8e0 0001 1 = 01
ffff88005ad6c6c0 1708503604 C Co:2:013:0 0 1 >
ffff88005ad6c6c0 1708508126 S Co:2:013:0 s 40 0c 0085 f8e0 0001 1 = 0a
ffff88005ad6c6c0 1708508458 C Co:2:013:0 0 1 >
ffff88005ad6c6c0 1708511167 S Co:2:013:0 s 40 0c 0085 f8e0 0001 1 = 00
ffff88005ad6c6c0 1708511582 C Co:2:013:0 0 1 >
ffff88005ad6c6c0 1708514202 S Co:2:013:0 s 40 0c 0085 f8e0 0001 1 = 00
ffff88005ad6c6c0 1708514583 C Co:2:013:0 0 1 >
ffff88005ad6c6c0 1708517233 S Co:2:013:0 s 40 0c 0085 f8e0 0001 1 = 00
ffff88005ad6c6c0 1708517581 C Co:2:013:0 0 1 >
ffff88005ad6c6c0 1708520125 S Co:2:013:0 s 40 0c 0085 f8e0 0001 1 = 80
ffff88005ad6c6c0 1708520456 C Co:2:013:0 0 1 >
ffff88005ad6c6c0 1708523163 S Co:2:013:0 s 40 0c 0085 f8e0 0001 1 = 10
ffff88005ad6c6c0 1708523633 C Co:2:013:0 0 1 >
ffff88005ad6c6c0 1708526202 S Co:2:013:0 s 40 0c 0085 f8e0 0001 1 = 00
ffff88005ad6c6c0 1708526630 C Co:2:013:0 0 1 >
ffff88005ad6c6c0 1708528217 S Ci:2:013:0 s c0 0c 0084 0010 0001 1 <
ffff88005ad6c6c0 1708528457 C Ci:2:013:0 0 1 = 03
ffff88005ad6c6c0 1708531204 S Ci:2:013:0 s c0 0c 0084 0010 0001 1 <
ffff88005ad6c6c0 1708531459 C Ci:2:013:0 0 1 = 00
ffff88005ad6c6c0 1708535176 S Co:2:013:0 s 40 0c 0088 f900 0001 1 = ff
ffff88005ad6c6c0 1708535585 C Co:2:013:0 0 1 >
ffff88005ad6c6c0 1708538201 S Co:2:013:0 s 40 0c 0088 f900 0001 1 = aa
ffff88005ad6c6c0 1708538583 C Co:2:013:0 0 1 >
ffff88005ad6c6c0 1708541230 S Co:2:013:0 s 40 0c 0088 f900 0001 1 = 55
ffff88005ad6c6c0 1708541581 C Co:2:013:0 0 1 >
ffff88005ad6c6c0 1708544123 S Co:2:013:0 s 40 0c 0088 f900 0001 1 = 00
ffff88005ad6c6c0 1708544582 C Co:2:013:0 0 1 >
ffff88005ad6c6c0 1708547165 S Co:2:013:0 s 40 0c 0088 f900 0001 1 = ff
ffff88005ad6c6c0 1708547585 C Co:2:013:0 0 1 >
ffff88005ad6c6c0 1708550202 S Co:2:013:0 s 40 0c 0088 f900 0001 1 = 87
ffff88005ad6c6c0 1708550606 C Co:2:013:0 0 1 >
ffff88005ad6c6c0 1708553229 S Co:2:013:0 s 40 0c 0088 f900 0001 1 = 78
ffff88005ad6c6c0 1708553581 C Co:2:013:0 0 1 >
ffff88005ad6c6c0 1708556124 S Co:2:013:0 s 40 0c 0088 f900 0001 1 = e0
ffff88005ad6c6c0 1708556582 C Co:2:013:0 0 1 >
ffff88005ad6c6c0 1708559157 S Co:2:013:0 s 40 0c 0087 f900 0001 1 = 05
ffff88005ad6c6c0 1708559585 C Co:2:013:0 0 1 >
ffff88005ad6c6c0 1708562202 S Co:2:013:0 s 40 0c 0087 f900 0001 1 = 04
ffff88005ad6c6c0 1708562585 C Co:2:013:0 0 1 >
ffff88005ad6c6c0 1708565225 S Co:2:013:0 s 40 0c 0088 f900 0001 1 = ff
ffff88005ad6c6c0 1708565582 C Co:2:013:0 0 1 >
ffff88005ad6c6c0 1708568125 S Co:2:013:0 s 40 0c 0085 0088 0001 1 = 00
ffff88005ad6c6c0 1708568459 C Co:2:013:0 0 1 >
ffff88005ad6c6c0 1708571163 S Co:2:013:0 s 40 0c 0085 0088 0001 1 = 00
ffff88005ad6c6c0 1708571632 C Co:2:013:0 0 1 >
ffff88005ad6c6c0 1708574195 S Co:2:013:0 s 40 0c 0085 0088 0001 1 = 00
ffff88005ad6c6c0 1708574631 C Co:2:013:0 0 1 >
ffff88005ad6c6c0 1708577233 S Co:2:013:0 s 40 0c 0085 0088 0001 1 = 00
ffff88005ad6c6c0 1708577582 C Co:2:013:0 0 1 >
ffff88005ad6c6c0 1708580125 S Co:2:013:0 s 40 0c 0085 0088 0001 1 = 00
ffff88005ad6c6c0 1708580489 C Co:2:013:0 0 1 >
ffff88005ad6c6c0 1708583159 S Co:2:013:0 s 40 0c 0085 0088 0001 1 = 00
ffff88005ad6c6c0 1708583632 C Co:2:013:0 0 1 >
ffff88005ad6c6c0 1708585196 S Ci:2:013:0 s c0 0c 0084 0006 0001 1 <
ffff88005ad6c6c0 1708585507 C Ci:2:013:0 0 1 = 03
ffff88005ad6c6c0 1708588223 S Ci:2:013:0 s c0 0c 0084 0006 0001 1 <
ffff88005ad6c6c0 1708588459 C Ci:2:013:0 0 1 = 00
ffff88005ad6c6c0 1708592122 S Co:2:013:0 s 40 0c 0088 0001 0001 1 = ff
ffff88005ad6c6c0 1708592586 C Co:2:013:0 0 1 >
ffff88005ad6c6c0 1708595158 S Co:2:013:0 s 40 0c 0088 0001 0001 1 = aa
ffff88005ad6c6c0 1708595586 C Co:2:013:0 0 1 >
ffff88005ad6c6c0 1708598196 S Co:2:013:0 s 40 0c 0088 0001 0001 1 = 55
ffff88005ad6c6c0 1708598587 C Co:2:013:0 0 1 >
ffff88005ad6c6c0 1708601229 S Co:2:013:0 s 40 0c 0088 0001 0001 1 = 00
ffff88005ad6c6c0 1708601583 C Co:2:013:0 0 1 >
ffff88005ad6c6c0 1708604122 S Co:2:013:0 s 40 0c 0088 0001 0001 1 = ff
ffff88005ad6c6c0 1708604584 C Co:2:013:0 0 1 >
ffff88005ad6c6c0 1708607158 S Co:2:013:0 s 40 0c 0088 0001 0001 1 = 87
ffff88005ad6c6c0 1708607587 C Co:2:013:0 0 1 >
ffff88005ad6c6c0 1708610189 S Co:2:013:0 s 40 0c 0088 0001 0001 1 = 78
ffff88005ad6c6c0 1708610584 C Co:2:013:0 0 1 >
ffff88005ad6c6c0 1708613229 S Co:2:013:0 s 40 0c 0088 0001 0001 1 = e0
ffff88005ad6c6c0 1708613585 C Co:2:013:0 0 1 >
ffff88005ad6c6c0 1708616123 S Co:2:013:0 s 40 0c 0087 0001 0001 1 = 05
ffff88005ad6c6c0 1708616459 C Co:2:013:0 0 1 >
ffff88005ad6c6c0 1708619160 S Co:2:013:0 s 40 0c 0087 0001 0001 1 = 04
ffff88005ad6c6c0 1708619584 C Co:2:013:0 0 1 >
ffff88005ad6c6c0 1708622205 S Co:2:013:0 s 40 0c 0088 0001 0001 1 = ff
ffff88005ad6c6c0 1708622587 C Co:2:013:0 0 1 >
ffff88005ad6c6c0 1708625232 S Co:2:013:0 s 40 0c 0085 0088 0001 1 = d1
ffff88005ad6c6c0 1708625584 C Co:2:013:0 0 1 >
ffff88005ad6c6c0 1708628124 S Co:2:013:0 s 40 0c 0085 0088 0001 1 = 00
ffff88005ad6c6c0 1708628459 C Co:2:013:0 0 1 >
ffff88005ad6c6c0 1708631170 S Co:2:013:0 s 40 0c 0085 0088 0001 1 = 00
ffff88005ad6c6c0 1708631587 C Co:2:013:0 0 1 >
ffff88005ad6c6c0 1708634204 S Co:2:013:0 s 40 0c 0085 0088 0001 1 = 00
ffff88005ad6c6c0 1708634586 C Co:2:013:0 0 1 >
ffff88005ad6c6c0 1708637227 S Co:2:013:0 s 40 0c 0085 0088 0001 1 = 04
ffff88005ad6c6c0 1708637585 C Co:2:013:0 0 1 >
ffff88005ad6c6c0 1708640124 S Co:2:013:0 s 40 0c 0085 0088 0001 1 = 00
ffff88005ad6c6c0 1708640460 C Co:2:013:0 0 1 >
ffff88005ad6c6c0 1708642154 S Ci:2:013:0 s c0 0c 0084 0006 0001 1 <
ffff88005ad6c6c0 1708642509 C Ci:2:013:0 0 1 = 00
ffff88005ad6c6c0 1708646193 S Co:2:013:0 s 40 0c 0085 f8e4 0001 1 = 10
ffff88005ad6c6c0 1708646584 C Co:2:013:0 0 1 >
ffff88005ad6c6c0 1708649235 S Co:2:013:0 s 40 0c 0085 f8e4 0001 1 = 73
ffff88005ad6c6c0 1708649586 C Co:2:013:0 0 1 >
ffff88005ad6c6c0 1708652123 S Co:2:013:0 s 40 0c 0085 f8e4 0001 1 = 00
ffff88005ad6c6c0 1708652490 C Co:2:013:0 0 1 >
ffff88005ad6c6c0 1708655168 S Co:2:013:0 s 40 0c 0085 f8e4 0001 1 = 00
ffff88005ad6c6c0 1708655615 C Co:2:013:0 0 1 >
ffff88005ad6c6c0 1708657190 S Ci:2:013:0 s c0 0c 0084 0004 0001 1 <
ffff88005ad6c6c0 1708657523 C Ci:2:013:0 0 1 = 03
ffff88005ad6c6c0 1708660224 S Ci:2:013:0 s c0 0c 0084 0004 0001 1 <
ffff88005ad6c6c0 1708660461 C Ci:2:013:0 0 1 = 00
ffff88005ad6c6c0 1709199193 S Co:2:013:0 s 40 0c 0088 0000 0001 1 = ff
ffff88005ad6c6c0 1709199642 C Co:2:013:0 0 1 >
ffff88005ad6c6c0 1709202216 S Co:2:013:0 s 40 0c 0088 0000 0001 1 = aa
ffff88005ad6c6c0 1709202642 C Co:2:013:0 0 1 >
ffff88005ad6c6c0 1709205136 S Co:2:013:0 s 40 0c 0088 0000 0001 1 = 55
ffff88005ad6c6c0 1709205516 C Co:2:013:0 0 1 >
ffff88005ad6c6c0 1709208188 S Co:2:013:0 s 40 0c 0088 0000 0001 1 = 00
ffff88005ad6c6c0 1709208640 C Co:2:013:0 0 1 >
ffff88005ad6c6c0 1709211207 S Co:2:013:0 s 40 0c 0088 0000 0001 1 = ff
ffff88005ad6c6c0 1709211606 C Co:2:013:0 0 1 >
ffff88005ad6c6c0 1709214243 S Co:2:013:0 s 40 0c 0088 0000 0001 1 = 87
ffff88005ad6c6c0 1709214628 C Co:2:013:0 0 1 >
ffff88005ad6c6c0 1709217135 S Co:2:013:0 s 40 0c 0088 0000 0001 1 = 78
ffff88005ad6c6c0 1709217667 C Co:2:013:0 0 1 >
ffff88005ad6c6c0 1709220173 S Co:2:013:0 s 40 0c 0088 0000 0001 1 = e0
ffff88005ad6c6c0 1709220665 C Co:2:013:0 0 1 >
ffff88005ad6c6c0 1709223205 S Co:2:013:0 s 40 0c 0087 0000 0001 1 = 05
ffff88005ad6c6c0 1709223667 C Co:2:013:0 0 1 >
ffff88005ad6c6c0 1709226241 S Co:2:013:0 s 40 0c 0087 0000 0001 1 = 04
ffff88005ad6c6c0 1709226666 C Co:2:013:0 0 1 >
ffff88005ad6c6c0 1709229143 S Co:2:013:0 s 40 0c 0088 0000 0001 1 = ff
ffff88005ad6c6c0 1709229667 C Co:2:013:0 0 1 >
ffff88005ad6c6c0 1709232184 S Co:2:013:0 s 40 0c 0085 0088 0001 1 = 00
ffff88005ad6c6c0 1709232668 C Co:2:013:0 0 1 >
ffff88005ad6c6c0 1709235229 S Co:2:013:0 s 40 0c 0085 0088 0001 1 = 00
ffff88005ad6c6c0 1709235668 C Co:2:013:0 0 1 >
ffff88005ad6c6c0 1709238274 S Co:2:013:0 s 40 0c 0085 0088 0001 1 = 00
ffff88005ad6c6c0 1709238712 C Co:2:013:0 0 1 >
ffff88005ad6c6c0 1709241139 S Co:2:013:0 s 40 0c 0085 0088 0001 1 = 00
ffff88005ad6c6c0 1709241668 C Co:2:013:0 0 1 >
ffff88005ad6c6c0 1709244168 S Co:2:013:0 s 40 0c 0085 0088 0001 1 = 00
ffff88005ad6c6c0 1709244669 C Co:2:013:0 0 1 >
ffff88005ad6c6c0 1709247190 S Co:2:013:0 s 40 0c 0085 0088 0001 1 = 00
ffff88005ad6c6c0 1709247669 C Co:2:013:0 0 1 >
ffff88005ad6c6c0 1709249210 S Ci:2:013:0 s c0 0c 0084 0006 0001 1 <
ffff88005ad6c6c0 1709249523 C Ci:2:013:0 0 1 = 03
ffff88005ad6c6c0 1709252128 S Ci:2:013:0 s c0 0c 0084 0006 0001 1 <
ffff88005ad6c6c0 1709252390 C Ci:2:013:0 0 1 = 00
ffff88005ad6c6c0 1709256184 S Co:2:013:0 s 40 0c 0088 969e 0001 1 = ff
ffff88005ad6c6c0 1709256642 C Co:2:013:0 0 1 >
ffff88005ad6c6c0 1709259221 S Co:2:013:0 s 40 0c 0088 969e 0001 1 = aa
ffff88005ad6c6c0 1709259654 C Co:2:013:0 0 1 >
ffff88005ad6c6c0 1709262268 S Co:2:013:0 s 40 0c 0088 969e 0001 1 = 55
ffff88005ad6c6c0 1709262794 C Co:2:013:0 0 1 >
ffff88005ad6c6c0 1709265139 S Co:2:013:0 s 40 0c 0088 969e 0001 1 = 00
ffff88005ad6c6c0 1709265670 C Co:2:013:0 0 1 >
ffff88005ad6c6c0 1709268169 S Co:2:013:0 s 40 0c 0088 969e 0001 1 = ff
ffff88005ad6c6c0 1709268668 C Co:2:013:0 0 1 >
ffff88005ad6c6c0 1709271191 S Co:2:013:0 s 40 0c 0088 969e 0001 1 = 87
ffff88005ad6c6c0 1709271643 C Co:2:013:0 0 1 >
ffff88005ad6c6c0 1709274225 S Co:2:013:0 s 40 0c 0088 969e 0001 1 = 78
ffff88005ad6c6c0 1709274793 C Co:2:013:0 0 1 >
ffff88005ad6c6c0 1709277143 S Co:2:013:0 s 40 0c 0088 969e 0001 1 = e0
ffff88005ad6c6c0 1709277512 C Co:2:013:0 0 1 >
ffff88005ad6c6c0 1709280170 S Co:2:013:0 s 40 0c 0087 969e 0001 1 = 05
ffff88005ad6c6c0 1709280644 C Co:2:013:0 0 1 >
ffff88005ad6c6c0 1709283226 S Co:2:013:0 s 40 0c 0087 969e 0001 1 = 04
ffff88005ad6c6c0 1709283644 C Co:2:013:0 0 1 >
ffff88005ad6c6c0 1709286239 S Co:2:013:0 s 40 0c 0088 969e 0001 1 = ff
ffff88005ad6c6c0 1709286768 C Co:2:013:0 0 1 >
ffff88005ad6c6c0 1709289140 S Co:2:013:0 s 40 0c 0085 0088 0001 1 = 1b
ffff88005ad6c6c0 1709289518 C Co:2:013:0 0 1 >
ffff88005ad6c6c0 1709292171 S Co:2:013:0 s 40 0c 0085 0088 0001 1 = 00
ffff88005ad6c6c0 1709292669 C Co:2:013:0 0 1 >
ffff88005ad6c6c0 1709295226 S Co:2:013:0 s 40 0c 0085 0088 0001 1 = 00
ffff88005ad6c6c0 1709295670 C Co:2:013:0 0 1 >
ffff88005ad6c6c0 1709298235 S Co:2:013:0 s 40 0c 0085 0088 0001 1 = 00
ffff88005ad6c6c0 1709298644 C Co:2:013:0 0 1 >
ffff88005ad6c6c0 1709301141 S Co:2:013:0 s 40 0c 0085 0088 0001 1 = 01
ffff88005ad6c6c0 1709301550 C Co:2:013:0 0 1 >
ffff88005ad6c6c0 1709304176 S Co:2:013:0 s 40 0c 0085 0088 0001 1 = 00
ffff88005ad6c6c0 1709304670 C Co:2:013:0 0 1 >
ffff88005ad6c6c0 1709306199 S Ci:2:013:0 s c0 0c 0084 0006 0001 1 <
ffff88005ad6c6c0 1709306919 C Ci:2:013:0 0 1 = 03
ffff88005ad6c6c0 1709309236 S Ci:2:013:0 s c0 0c 0084 0006 0001 1 <
ffff88005ad6c6c0 1709309607 C Ci:2:013:0 0 1 = 00
ffff88005ad6c6c0 1709313143 S Co:2:013:0 s 40 0c 0088 0cc8 0001 1 = ff
ffff88005ad6c6c0 1709313608 C Co:2:013:0 0 1 >
ffff88005ad6c6c0 1709316185 S Co:2:013:0 s 40 0c 0088 0cc8 0001 1 = aa
ffff88005ad6c6c0 1709316696 C Co:2:013:0 0 1 >
ffff88005ad6c6c0 1709319222 S Co:2:013:0 s 40 0c 0088 0cc8 0001 1 = 55
ffff88005ad6c6c0 1709319656 C Co:2:013:0 0 1 >
ffff88005ad6c6c0 1709322269 S Co:2:013:0 s 40 0c 0088 0cc8 0001 1 = 00
ffff88005ad6c6c0 1709322781 C Co:2:013:0 0 1 >
ffff88005ad6c6c0 1709325140 S Co:2:013:0 s 40 0c 0088 0cc8 0001 1 = ff
ffff88005ad6c6c0 1709325483 C Co:2:013:0 0 1 >
ffff88005ad6c6c0 1709328169 S Co:2:013:0 s 40 0c 0088 0cc8 0001 1 = 87
ffff88005ad6c6c0 1709328637 C Co:2:013:0 0 1 >
ffff88005ad6c6c0 1709331192 S Co:2:013:0 s 40 0c 0088 0cc8 0001 1 = 78
ffff88005ad6c6c0 1709331656 C Co:2:013:0 0 1 >
ffff88005ad6c6c0 1709334223 S Co:2:013:0 s 40 0c 0088 0cc8 0001 1 = e0
ffff88005ad6c6c0 1709334609 C Co:2:013:0 0 1 >
ffff88005ad6c6c0 1709337136 S Co:2:013:0 s 40 0c 0087 0cc8 0001 1 = 05
ffff88005ad6c6c0 1709337482 C Co:2:013:0 0 1 >
ffff88005ad6c6c0 1709340174 S Co:2:013:0 s 40 0c 0087 0cc8 0001 1 = 04
ffff88005ad6c6c0 1709340609 C Co:2:013:0 0 1 >
ffff88005ad6c6c0 1709343211 S Co:2:013:0 s 40 0c 0088 0cc8 0001 1 = ff
ffff88005ad6c6c0 1709343640 C Co:2:013:0 0 1 >
ffff88005ad6c6c0 1709346240 S Co:2:013:0 s 40 0c 0085 0088 0001 1 = 18
ffff88005ad6c6c0 1709346657 C Co:2:013:0 0 1 >
ffff88005ad6c6c0 1709349137 S Co:2:013:0 s 40 0c 0085 0088 0001 1 = 00
ffff88005ad6c6c0 1709349484 C Co:2:013:0 0 1 >
ffff88005ad6c6c0 1709352176 S Co:2:013:0 s 40 0c 0085 0088 0001 1 = 00
ffff88005ad6c6c0 1709352655 C Co:2:013:0 0 1 >
ffff88005ad6c6c0 1709355207 S Co:2:013:0 s 40 0c 0085 0088 0001 1 = 1d
ffff88005ad6c6c0 1709355659 C Co:2:013:0 0 1 >
ffff88005ad6c6c0 1709358246 S Co:2:013:0 s 40 0c 0085 0088 0001 1 = 1a
ffff88005ad6c6c0 1709358699 C Co:2:013:0 0 1 >
ffff88005ad6c6c0 1709361137 S Co:2:013:0 s 40 0c 0085 0088 0001 1 = 00
ffff88005ad6c6c0 1709361484 C Co:2:013:0 0 1 >
ffff88005ad6c6c0 1709363161 S Ci:2:013:0 s c0 0c 0084 0006 0001 1 <
ffff88005ad6c6c0 1709363384 C Ci:2:013:0 0 1 = 03
ffff88005ad6c6c0 1709366194 S Ci:2:013:0 s c0 0c 0084 0006 0001 1 <
ffff88005ad6c6c0 1709366518 C Ci:2:013:0 0 1 = 08
ffff8801417a9540 1710865189 S Co:2:013:0 s 40 0c 0088 ffff 0001 1 = ff
ffff8801417a9540 1710865572 C Co:2:013:0 0 1 >
ffff8801417a9540 1710868220 S Co:2:013:0 s 40 0c 0088 ffff 0001 1 = aa
ffff8801417a9540 1710868696 C Co:2:013:0 0 1 >
ffff8801417a9540 1710871259 S Co:2:013:0 s 40 0c 0088 ffff 0001 1 = 55
ffff8801417a9540 1710871696 C Co:2:013:0 0 1 >
ffff8801417a9540 1710874146 S Co:2:013:0 s 40 0c 0088 ffff 0001 1 = 00
ffff8801417a9540 1710874577 C Co:2:013:0 0 1 >
ffff8801417a9540 1710877180 S Co:2:013:0 s 40 0c 0088 ffff 0001 1 = ff
ffff8801417a9540 1710877572 C Co:2:013:0 0 1 >
ffff8801417a9540 1710880213 S Co:2:013:0 s 40 0c 0088 ffff 0001 1 = 87
ffff8801417a9540 1710880698 C Co:2:013:0 0 1 >
ffff8801417a9540 1710883242 S Co:2:013:0 s 40 0c 0088 ffff 0001 1 = 78
ffff8801417a9540 1710883698 C Co:2:013:0 0 1 >
ffff88004dbbfa40 1710886155 S Co:2:013:0 s 40 0c 0088 ffff 0001 1 = e0
ffff88004dbbfa40 1710886627 C Co:2:013:0 0 1 >
ffff88004dbbfa40 1710889206 S Co:2:013:0 s 40 0c 0087 ffff 0001 1 = 05
ffff88004dbbfa40 1710889577 C Co:2:013:0 0 1 >
ffff88004dbbfa40 1710892220 S Co:2:013:0 s 40 0c 0087 ffff 0001 1 = 04
ffff88004dbbfa40 1710892698 C Co:2:013:0 0 1 >
ffff88004dbbfa40 1710895204 S Co:2:013:0 s 40 0c 0088 ffff 0001 1 = ff
ffff88004dbbfa40 1710895709 C Co:2:013:0 0 1 >
ffff88004dbbfa40 1710898182 S Co:2:013:0 s 40 0c 0085 0088 0001 1 = 18
ffff88004dbbfa40 1710898568 C Co:2:013:0 0 1 >
ffff88004dbbfa40 1710901257 S Co:2:013:0 s 40 0c 0085 0088 0001 1 = 00
ffff88004dbbfa40 1710901690 C Co:2:013:0 0 1 >
ffff88004dbbfa40 1710904211 S Co:2:013:0 s 40 0c 0085 0088 0001 1 = 00
ffff88004dbbfa40 1710904698 C Co:2:013:0 0 1 >
ffff88004dbbfa40 1710907239 S Co:2:013:0 s 40 0c 0085 0088 0001 1 = 1d
ffff88004dbbfa40 1710907749 C Co:2:013:0 0 1 >
ffff88004dbbfa40 1710910145 S Co:2:013:0 s 40 0c 0085 0088 0001 1 = 1a
ffff88004dbbfa40 1710910579 C Co:2:013:0 0 1 >
ffff88004dbbfa40 1710913234 S Co:2:013:0 s 40 0c 0085 0088 0001 1 = 00
ffff88004dbbfa40 1710913705 C Co:2:013:0 0 1 >
ffff88004dbbfa40 1710915223 S Ci:2:013:0 s c0 0c 0084 0006 0001 1 <
ffff88004dbbfa40 1710915849 C Ci:2:013:0 0 1 = 01
ffff88004dbbfa40 1710919251 S Co:2:013:0 s 40 04 0082 1694 0008 8 = 00000000 1a1d0000
ffff88004dbbfa40 1710919664 C Co:2:013:0 0 8 >
ffff88004dbbfa40 1710921145 S Bi:2:013:1 -115 7168 <
ffff88004dbbfa40 1711025937 C Bi:2:013:1 0 7168 = 70707070 70707070 00707070 70707070 00707070 70707070 00707070 70707070
ffff8800941333c0 1711038289 S Bi:2:013:1 -115 512 <
ffff8800941333c0 1711038416 C Bi:2:013:1 0 282 = 00707070 70707070 00707070 70707070 00707070 70707070 00707070 70707070
ffff8800941333c0 1711041154 S Ci:2:013:0 s c0 0c 0084 48c8 0001 1 <
ffff8800941333c0 1711041451 C Ci:2:013:0 0 1 = 03
ffff8800941333c0 1711044290 S Ci:2:013:0 s c0 0c 0084 48c8 0001 1 <
ffff8800941333c0 1711044622 C Ci:2:013:0 0 1 = 00
ffff8801417a9540 1711048221 S Co:2:013:0 s 40 0c 0088 0750 0001 1 = ff
ffff8801417a9540 1711048703 C Co:2:013:0 0 1 >
ffff8801417a9540 1711051207 S Co:2:013:0 s 40 0c 0088 0750 0001 1 = aa
ffff8801417a9540 1711051702 C Co:2:013:0 0 1 >
ffff8800941339c0 1711054213 S Co:2:013:0 s 40 0c 0088 0750 0001 1 = 55
ffff8800941339c0 1711054702 C Co:2:013:0 0 1 >
ffff8800941339c0 1711057208 S Co:2:013:0 s 40 0c 0088 0750 0001 1 = 00
ffff8800941339c0 1711057752 C Co:2:013:0 0 1 >
ffff8800941339c0 1711060220 S Co:2:013:0 s 40 0c 0088 0750 0001 1 = ff
ffff8800941339c0 1711060703 C Co:2:013:0 0 1 >
ffff8800941339c0 1711063257 S Co:2:013:0 s 40 0c 0088 0750 0001 1 = 87
ffff8800941339c0 1711063702 C Co:2:013:0 0 1 >
ffff8800941339c0 1711066163 S Co:2:013:0 s 40 0c 0088 0750 0001 1 = 78
ffff8800941339c0 1711066579 C Co:2:013:0 0 1 >
ffff8800941339c0 1711069179 S Co:2:013:0 s 40 0c 0088 0750 0001 1 = e0
ffff8800941339c0 1711069544 C Co:2:013:0 0 1 >
ffff8800941339c0 1711072211 S Co:2:013:0 s 40 0c 0087 0750 0001 1 = 05
ffff8800941339c0 1711072543 C Co:2:013:0 0 1 >
ffff8800941339c0 1711075239 S Co:2:013:0 s 40 0c 0087 0750 0001 1 = 04
ffff8800941339c0 1711075667 C Co:2:013:0 0 1 >
ffff8800941339c0 1711078153 S Co:2:013:0 s 40 0c 0088 0750 0001 1 = ff
ffff8800941339c0 1711078541 C Co:2:013:0 0 1 >
ffff8800941339c0 1711081181 S Co:2:013:0 s 40 0c 0085 0088 0001 1 = 0f
ffff8800941339c0 1711081579 C Co:2:013:0 0 1 >
ffff8800941339c0 1711084218 S Co:2:013:0 s 40 0c 0085 0088 0001 1 = 00
ffff8800941339c0 1711084703 C Co:2:013:0 0 1 >
ffff8800941339c0 1711087252 S Co:2:013:0 s 40 0c 0085 0088 0001 1 = 00
ffff8800941339c0 1711087669 C Co:2:013:0 0 1 >
ffff8800941339c0 1711090279 S Co:2:013:0 s 40 0c 0085 0088 0001 1 = 00
ffff8800941339c0 1711090665 C Co:2:013:0 0 1 >
ffff8800941339c0 1711093185 S Co:2:013:0 s 40 0c 0085 0088 0001 1 = 12
ffff8800941339c0 1711093541 C Co:2:013:0 0 1 >
ffff8800941339c0 1711096222 S Co:2:013:0 s 40 0c 0085 0088 0001 1 = 00
ffff8800941339c0 1711096579 C Co:2:013:0 0 1 >
ffff8800941339c0 1711098247 S Ci:2:013:0 s c0 0c 0084 0006 0001 1 <
ffff8800941339c0 1711098578 C Ci:2:013:0 0 1 = 01
ffff88004dbbf680 1711102233 S Co:2:013:0 s 40 04 0082 1694 0008 8 = 00000000 12000000
ffff88004dbbf680 1711102544 C Co:2:013:0 0 8 >
ffff88004dbbf680 1711104270 S Bi:2:013:1 -115 512 <
ffff88004dbbf680 1711104416 C Bi:2:013:1 0 18 = a2039a03 44070808 c44e0000 00000000 0000
ffff88004dbbf680 1711107223 S Ci:2:013:0 s c0 0c 0084 48c8 0001 1 <
ffff88004dbbf680 1711107417 C Ci:2:013:0 0 1 = 03
ffff88004dbbf680 1711110335 S Ci:2:013:0 s c0 0c 0084 48c8 0001 1 <
ffff88004dbbf680 1711110606 C Ci:2:013:0 0 1 = 00
ffff88004dbbf680 1711129784 S Co:2:013:0 s 40 0c 0088 1054 0001 1 = ff
ffff88004dbbf680 1711130173 C Co:2:013:0 0 1 >
ffff88004dbbf680 1711132810 S Co:2:013:0 s 40 0c 0088 1054 0001 1 = aa
ffff88004dbbf680 1711133168 C Co:2:013:0 0 1 >
ffff88004dbbf680 1711135834 S Co:2:013:0 s 40 0c 0088 1054 0001 1 = 55
ffff88004dbbf680 1711136292 C Co:2:013:0 0 1 >
ffff88004dbbf680 1711138735 S Co:2:013:0 s 40 0c 0088 1054 0001 1 = 00
ffff88004dbbf680 1711139170 C Co:2:013:0 0 1 >
ffff88004dbbf680 1711141778 S Co:2:013:0 s 40 0c 0088 1054 0001 1 = ff
ffff88004dbbf680 1711142171 C Co:2:013:0 0 1 >
ffff88004dbbf680 1711144806 S Co:2:013:0 s 40 0c 0088 1054 0001 1 = 87
ffff88004dbbf680 1711145166 C Co:2:013:0 0 1 >
ffff88004dbbf680 1711147829 S Co:2:013:0 s 40 0c 0088 1054 0001 1 = 78
ffff88004dbbf680 1711148293 C Co:2:013:0 0 1 >
ffff88004dbbf680 1711150746 S Co:2:013:0 s 40 0c 0088 1054 0001 1 = e0
ffff88004dbbf680 1711151188 C Co:2:013:0 0 1 >
ffff88004dbbf680 1711153782 S Co:2:013:0 s 40 0c 0087 1054 0001 1 = 05
ffff88004dbbf680 1711154170 C Co:2:013:0 0 1 >
ffff88004dbbf680 1711156820 S Co:2:013:0 s 40 0c 0087 1054 0001 1 = 04
ffff88004dbbf680 1711157170 C Co:2:013:0 0 1 >
ffff88004dbbf680 1711159846 S Co:2:013:0 s 40 0c 0088 1054 0001 1 = ff
ffff88004dbbf680 1711160293 C Co:2:013:0 0 1 >
ffff88004dbbf680 1711162740 S Co:2:013:0 s 40 0c 0085 0088 0001 1 = 08
ffff88004dbbf680 1711163170 C Co:2:013:0 0 1 >
ffff88004dbbf680 1711165773 S Co:2:013:0 s 40 0c 0085 0088 0001 1 = 00
ffff88004dbbf680 1711166207 C Co:2:013:0 0 1 >
ffff88004dbbf680 1711168811 S Co:2:013:0 s 40 0c 0085 0088 0001 1 = 00
ffff88004dbbf680 1711169171 C Co:2:013:0 0 1 >
ffff88004dbbf680 1711171846 S Co:2:013:0 s 40 0c 0085 0088 0001 1 = 00
ffff88004dbbf680 1711172298 C Co:2:013:0 0 1 >
ffff88004dbbf680 1711174741 S Co:2:013:0 s 40 0c 0085 0088 0001 1 = ff
ffff88004dbbf680 1711175170 C Co:2:013:0 0 1 >
ffff88004dbbf680 1711177777 S Co:2:013:0 s 40 0c 0085 0088 0001 1 = 00
ffff88004dbbf680 1711178169 C Co:2:013:0 0 1 >
ffff88004dbbf680 1711179805 S Ci:2:013:0 s c0 0c 0084 0006 0001 1 <
ffff88004dbbf680 1711180088 C Ci:2:013:0 0 1 = 03
ffff88004dbbf680 1711182839 S Ci:2:013:0 s c0 0c 0084 0006 0001 1 <
ffff88004dbbf680 1711183091 C Ci:2:013:0 0 1 = 08
ffff8800941333c0 1712681863 S Co:2:013:0 s 40 0c 0088 ffff 0001 1 = ff
ffff8800941333c0 1712682394 C Co:2:013:0 0 1 >
ffff8800941333c0 1712684714 S Co:2:013:0 s 40 0c 0088 ffff 0001 1 = aa
ffff8800941333c0 1712685096 C Co:2:013:0 0 1 >
ffff8800941333c0 1712687738 S Co:2:013:0 s 40 0c 0088 ffff 0001 1 = 55
ffff8800941333c0 1712688096 C Co:2:013:0 0 1 >
ffff8800941333c0 1712690764 S Co:2:013:0 s 40 0c 0088 ffff 0001 1 = 00
ffff8800941333c0 1712691221 C Co:2:013:0 0 1 >
ffff8800941333c0 1712693791 S Co:2:013:0 s 40 0c 0088 ffff 0001 1 = ff
ffff8800941333c0 1712694220 C Co:2:013:0 0 1 >
ffff8800941333c0 1712696716 S Co:2:013:0 s 40 0c 0088 ffff 0001 1 = 87
ffff8800941333c0 1712697095 C Co:2:013:0 0 1 >
ffff88004dbbf680 1712699803 S Co:2:013:0 s 40 0c 0088 ffff 0001 1 = 78
ffff88004dbbf680 1712700265 C Co:2:013:0 0 1 >
ffff88004dbbf680 1712702787 S Co:2:013:0 s 40 0c 0088 ffff 0001 1 = e0
ffff88004dbbf680 1712703222 C Co:2:013:0 0 1 >
ffff88004dbbf680 1712705822 S Co:2:013:0 s 40 0c 0087 ffff 0001 1 = 05
ffff88004dbbf680 1712706221 C Co:2:013:0 0 1 >
ffff88004dbbf680 1712708720 S Co:2:013:0 s 40 0c 0087 ffff 0001 1 = 04
ffff88004dbbf680 1712709096 C Co:2:013:0 0 1 >
ffff88004dbbf680 1712711755 S Co:2:013:0 s 40 0c 0088 ffff 0001 1 = ff
ffff88004dbbf680 1712712221 C Co:2:013:0 0 1 >
ffff88004dbbf680 1712714789 S Co:2:013:0 s 40 0c 0085 0088 0001 1 = 08
ffff88004dbbf680 1712715221 C Co:2:013:0 0 1 >
ffff88004dbbf680 1712717824 S Co:2:013:0 s 40 0c 0085 0088 0001 1 = 00
ffff88004dbbf680 1712718221 C Co:2:013:0 0 1 >
ffff88004dbbf680 1712720721 S Co:2:013:0 s 40 0c 0085 0088 0001 1 = 00
ffff88004dbbf680 1712721097 C Co:2:013:0 0 1 >
ffff88004dbbf680 1712723755 S Co:2:013:0 s 40 0c 0085 0088 0001 1 = 00
ffff88004dbbf680 1712724097 C Co:2:013:0 0 1 >
ffff88004dbbf680 1712726792 S Co:2:013:0 s 40 0c 0085 0088 0001 1 = ff
ffff88004dbbf680 1712727223 C Co:2:013:0 0 1 >
ffff88004dbbf680 1712729828 S Co:2:013:0 s 40 0c 0085 0088 0001 1 = 00
ffff88004dbbf680 1712730221 C Co:2:013:0 0 1 >
ffff88004dbbf680 1712731711 S Ci:2:013:0 s c0 0c 0084 0006 0001 1 <
ffff88004dbbf680 1712732347 C Ci:2:013:0 0 1 = 01
ffff88004dbbf680 1712735749 S Co:2:013:0 s 40 04 0082 1694 0008 8 = 00000000 ba3e0700
ffff88004dbbf680 1712736097 C Co:2:013:0 0 8 >
ffff88004dbbf680 1712737781 S Bi:2:013:1 -115 19968 <
ffff88004dbbf680 1712746223 C Bi:2:013:1 0 19968 = 52522102 f301fb01 0602dd01 fe01ee01 ed01f401 bc010802 a701bc01 cc01b401
ffff88004dbbf680 1712747789 S Bi:2:013:1 -115 16384 <
ffff88004dbbf680 1712755666 C Bi:2:013:1 0 16384 = 8d009e00 b3006500 00007d00 8900f700 97005600 7e008200 55005700 57007900
ffff88004dbbf680 1712756762 S Bi:2:013:1 -115 16384 <
ffff88004dbbf680 1712763516 C Bi:2:013:1 0 16384 = 4900b000 6d004b00 a3005d00 51007000 5700ba00 d100c600 8d00cc00 65008100
ffff88004dbbf680 1712765839 S Bi:2:013:1 -115 12800 <
ffff88004dbbf680 1712772268 C Bi:2:013:1 0 12800 = 87008800 5c00a700 3d00e900 84008f00 9b007a00 8600c100 79009200 c9003c00
ffff88004dbbf680 1712774802 S Bi:2:013:1 -115 19968 <
ffff88004dbbf680 1712783304 C Bi:2:013:1 0 19968 = 85000d00 d0009800 74008200 ce008700 93004200 9f00a000 57006400 1a007c00
ffff88004dbbf680 1712784823 S Bi:2:013:1 -115 16384 <
ffff88004dbbf680 1712791900 C Bi:2:013:1 0 16384 = 99007900 8b005e00 5f004100 69007900 73004600 3a005d00 61005400 40004b00
ffff88004dbbf680 1712793782 S Bi:2:013:1 -115 16384 <
ffff88004dbbf680 1712801022 C Bi:2:013:1 0 16384 = 74006700 79008800 3d005200 b1002600 5b006300 70005d00 83005a00 c6006200
ffff88004dbbf680 1712802844 S Bi:2:013:1 -115 12800 <
ffff88004dbbf680 1712808438 C Bi:2:013:1 0 12800 = 6f00c100 ac006f00 8e006a00 70009600 6b004900 68007b00 a1004e00 7600a700
ffff88004dbbf680 1712811803 S Bi:2:013:1 -115 19968 <
ffff88004dbbf680 1712821433 C Bi:2:013:1 0 19968 = b600d800 54007e00 d700eb00 6f00d200 76004800 7700a200 7000a200 8200d300
ffff88004dbbf680 1712821810 S Bi:2:013:1 -115 16384 <
ffff88004dbbf680 1712829482 C Bi:2:013:1 0 16384 = 3e007000 92007800 7b006d00 84004c00 78008f00 70008d00 64003f00 53003a00
ffff88004dbbf680 1712830740 S Bi:2:013:1 -115 16384 <
ffff88004dbbf680 1712838502 C Bi:2:013:1 0 16384 = 6c009400 a0006f00 56009500 8e009200 3400a500 a4002d00 bd00a700 50006f00
ffff88004dbbf680 1712839707 S Bi:2:013:1 -115 12800 <
ffff88004dbbf680 1712845375 C Bi:2:013:1 0 12800 = ca009100 9700c800 b000c700 48006100 7b008e00 6a008300 9700a100 8d005e00
ffff88004dbbf680 1712848936 S Bi:2:013:1 -115 19968 <
ffff88004dbbf680 1712858378 C Bi:2:013:1 0 19968 = b8008100 87006900 90007500 75006600 de00da00 9100a700 75009700 6f00ad00
ffff88004dbbf680 1712858815 S Bi:2:013:1 -115 16384 <
ffff88004dbbf680 1712866627 C Bi:2:013:1 0 16384 = bd014401 2201b500 d9001e01 f9003401 2b02b101 c301be01 ff011502 db011502
ffff88004dbbf680 1712867752 S Bi:2:013:1 -115 16384 <
ffff88004dbbf680 1712875517 C Bi:2:013:1 0 16384 = b100a100 a300c200 a6007000 bb00d100 a1007300 8d00e100 74009800 b200bc00
ffff88004dbbf680 1712876765 S Bi:2:013:1 -115 12800 <
ffff88004dbbf680 1712898165 C Bi:2:013:1 0 12800 = b5007500 be008900 9300ae00 5b005000 79003500 c1009100 52007b00 b500a300
ffff88004dbbf680 1712905782 S Bi:2:013:1 -115 19968 <
ffff88004dbbf680 1712966065 C Bi:2:013:1 0 19968 = 260bdf08 d8018f02 e800fa00 9e006100 db00bf00 74009b00 9900d800 6b008a00
ffff88004dbbf680 1712973753 S Bi:2:013:1 -115 16384 <
ffff88004dbbf680 1713018649 C Bi:2:013:1 0 16384 = 9a25f227 14261525 44233924 5b2b9828 c925fe23 5f243c28 58265924 bb267725
ffff88004dbbf680 1713025778 S Bi:2:013:1 -115 16384 <
ffff88004dbbf680 1713071438 C Bi:2:013:1 0 16384 = 1e243626 ad23c824 1726e725 6024a924 f7264927 8f24ac24 a123e322 24242526
ffff88004dbbf680 1713077858 S Bi:2:013:1 -115 12800 <
ffff88004dbbf680 1713107195 C Bi:2:013:1 0 12800 = 0a01c300 f9009a00 c7009e00 c3009500 e6004700 f300c700 c300b300 b6008000
ffff88004dbbf680 1713115862 S Bi:2:013:1 -115 19968 <
ffff88004dbbf680 1713172786 C Bi:2:013:1 0 19968 = b500f600 a9006800 69008c00 90007600 4700bf00 9a009400 36009a00 dc007400
ffff88004dbbf680 1713176738 S Bi:2:013:1 -115 16384 <
ffff88004dbbf680 1713225539 C Bi:2:013:1 0 16384 = f625b425 6e26422a 98275026 56264327 b7244928 65221024 2d257b25 a225c326
ffff88004dbbf680 1713228809 S Bi:2:013:1 -115 16384 <
ffff88004dbbf680 1713278157 C Bi:2:013:1 0 16384 = dd2a2e28 b52b8c27 41283a28 5127852a 2828d627 6e279c27 4d280328 9d29c426
ffff88004dbbf680 1713280838 S Bi:2:013:1 -115 12800 <
ffff88004dbbf680 1713317788 C Bi:2:013:1 0 12800 = ae25cd26 91262628 dd27ff27 2f282525 5e27c127 38296b25 ce28ec25 e026cf26
ffff88004dbbf680 1713325763 S Bi:2:013:1 -115 19968 <
ffff88004dbbf680 1713373414 C Bi:2:013:1 0 19968 = 390cf60a 950cde11 b11d881e 89235923 3725f025 6124cb24 4e24b122 43236225
ffff88004dbbf680 1713377855 S Bi:2:013:1 -115 16384 <
ffff88004dbbf680 1713426123 C Bi:2:013:1 0 16384 = 7200d900 5500de00 fe00a500 ce00bd00 cf006700 aa009700 99005800 7c00a100
ffff88004dbbf680 1713434155 S Bi:2:013:1 -115 16384 <
ffff88004dbbf680 1713478821 C Bi:2:013:1 0 16384 = bc26ec26 a1256427 14269826 ad24a724 08253125 24253326 be25fc28 87251125
ffff88004dbbf680 1713486073 S Bi:2:013:1 -115 12800 <
ffff88004dbbf680 1713524659 C Bi:2:013:1 0 12800 = 91255725 2e287828 ea273529 7129d826 b928d125 4626f226 8c27c828 7e27c226
ffff88004dbbf680 1713531031 S Bi:2:013:1 -115 15872 <
ffff88004dbbf680 1713567003 C Bi:2:013:1 0 15872 = 50294d28 12279228 a42ae427 b7263d26 e229b625 27257c28 8c273a26 1728eb25
ffff88004dbbf680 1713569054 S Bi:2:013:1 -115 512 <
ffff88004dbbf680 1713569164 C Bi:2:013:1 0 186 = de00b800 a8008e00 6f008200 82009900 75009300 51007100 4c009500 aa009d00
ffff88004dbbf680 1713571951 S Ci:2:013:0 s c0 0c 0084 48c8 0001 1 <
ffff88004dbbf680 1713572773 C Ci:2:013:0 0 1 = 03
ffff88004dbbf680 1713575068 S Ci:2:013:0 s c0 0c 0084 48c8 0001 1 <
ffff88004dbbf680 1713575376 C Ci:2:013:0 0 1 = 00
ffff88004dbbf680 1713579024 S Co:2:013:0 s 40 0c 0088 0084 0001 1 = ff
ffff88004dbbf680 1713579396 C Co:2:013:0 0 1 >
ffff88004dbbf680 1713582059 S Co:2:013:0 s 40 0c 0088 0084 0001 1 = aa
ffff88004dbbf680 1713582500 C Co:2:013:0 0 1 >
ffff88004dbbf680 1713588441 S Co:2:013:0 s 40 0c 0088 0084 0001 1 = 55
ffff88004dbbf680 1713588901 C Co:2:013:0 0 1 >
ffff88004dbbf680 1713592522 S Co:2:013:0 s 40 0c 0088 0084 0001 1 = 00
ffff88004dbbf680 1713593050 C Co:2:013:0 0 1 >
ffff88004dbbf680 1713595557 S Co:2:013:0 s 40 0c 0088 0084 0001 1 = ff
ffff88004dbbf680 1713596002 C Co:2:013:0 0 1 >
ffff88004dbbf680 1713598454 S Co:2:013:0 s 40 0c 0088 0084 0001 1 = 87
ffff88004dbbf680 1713598876 C Co:2:013:0 0 1 >
ffff88004dbbf680 1713601495 S Co:2:013:0 s 40 0c 0088 0084 0001 1 = 78
ffff88004dbbf680 1713601919 C Co:2:013:0 0 1 >
ffff88004dbbf680 1713604531 S Co:2:013:0 s 40 0c 0088 0084 0001 1 = e0
ffff88004dbbf680 1713605048 C Co:2:013:0 0 1 >
ffff88004dbbf680 1713607415 S Co:2:013:0 s 40 0c 0087 0084 0001 1 = 05
ffff88004dbbf680 1713607752 C Co:2:013:0 0 1 >
ffff88004dbbf680 1713610445 S Co:2:013:0 s 40 0c 0087 0084 0001 1 = 04
ffff88004dbbf680 1713610876 C Co:2:013:0 0 1 >
ffff88004dbbf680 1713613484 S Co:2:013:0 s 40 0c 0088 0084 0001 1 = ff
ffff88004dbbf680 1713613877 C Co:2:013:0 0 1 >
ffff88004dbbf680 1713616522 S Co:2:013:0 s 40 0c 0085 0088 0001 1 = 08
ffff88004dbbf680 1713616905 C Co:2:013:0 0 1 >
ffff88004dbbf680 1713619539 S Co:2:013:0 s 40 0c 0085 0088 0001 1 = 00
ffff88004dbbf680 1713619877 C Co:2:013:0 0 1 >
ffff88004dbbf680 1713622452 S Co:2:013:0 s 40 0c 0085 0088 0001 1 = 00
ffff88004dbbf680 1713622924 C Co:2:013:0 0 1 >
ffff88004dbbf680 1713625487 S Co:2:013:0 s 40 0c 0085 0088 0001 1 = 00
ffff88004dbbf680 1713625923 C Co:2:013:0 0 1 >
ffff88004dbbf680 1713628523 S Co:2:013:0 s 40 0c 0085 0088 0001 1 = ff
ffff88004dbbf680 1713628877 C Co:2:013:0 0 1 >
ffff88004dbbf680 1713631549 S Co:2:013:0 s 40 0c 0085 0088 0001 1 = 00
ffff88004dbbf680 1713631877 C Co:2:013:0 0 1 >
ffff88004dbbf680 1713633504 S Ci:2:013:0 s c0 0c 0084 0006 0001 1 <
ffff88004dbbf680 1713634377 C Ci:2:013:0 0 1 = 01
ffff88004dbbf680 1713637479 S Co:2:013:0 s 40 04 0082 1694 0008 8 = 00000000 ba3e0700
ffff88004dbbf680 1713637899 C Co:2:013:0 0 8 >
ffff88004dbbf680 1713639502 S Bi:2:013:1 -115 19968 <
ffff88004dbbf680 1713648877 C Bi:2:013:1 0 19968 = 52526b00 6e00c700 a9007400 94006900 8b007000 9100cc00 8100a400 82008400
ffff88004dbbf680 1713649521 S Bi:2:013:1 -115 16384 <
ffff88004dbbf680 1713687549 C Bi:2:013:1 0 16384 = dd265728 5f26ce27 6d283321 66262d24 8426ea23 f5246f24 73268428 3025e326
ffff88004dbbf680 1713694443 S Bi:2:013:1 -115 16384 <
ffff88004dbbf680 1713740171 C Bi:2:013:1 0 16384 = 34296028 e1268529 2d2a0e2b a927e828 8426f528 d9288f28 bd2a6927 7d29952a
ffff88004dbbf680 1713746553 S Bi:2:013:1 -115 12800 <
ffff88004dbbf680 1713777757 C Bi:2:013:1 0 12800 = 0b0deb0c 7e0be50c a70d310d f00fba29 820dd40e 330e260f 1710940e 130f2410
ffff88004dbbf680 1713784503 S Bi:2:013:1 -115 19968 <
ffff88004dbbf680 1713841841 C Bi:2:013:1 0 19968 = e224bc23 2322bf25 fa261508 4d04f604 4719e025 e7242d23 af119705 3909c225
ffff88004dbbf680 1713845524 S Bi:2:013:1 -115 16384 <
ffff88004dbbf680 1713894412 C Bi:2:013:1 0 16384 = 8400c200 64009e00 81006700 8d00b500 9f006100 88007600 65008000 9100a800
ffff88004dbbf680 1713897477 S Bi:2:013:1 -115 16384 <
ffff88004dbbf680 1713947218 C Bi:2:013:1 0 16384 = 6c26c628 c129a120 ec047a0e d627271d 5c0eaf06 1e040404 4f07aa10 08273825
ffff88004dbbf680 1713949513 S Bi:2:013:1 -115 12800 <
ffff88004dbbf680 1713986681 C Bi:2:013:1 0 12800 = d02a1d29 161d3805 6012722c c228df2a 7825bc08 24104d2c fc2c782b 3d2c4d2d
ffff88004dbbf680 1713994455 S Bi:2:013:1 -115 19968 <
ffff88004dbbf680 1714052394 C Bi:2:013:1 0 19968 = a4299829 ba1d1309 db03c104 8203c308 6222352a 4527bf27 cc260226 fc247926
ffff88004dbbf680 1714057430 S Bi:2:013:1 -115 16384 <
ffff88004dbbf680 1714095019 C Bi:2:013:1 0 16384 = 4f008300 8800a100 86009400 99009500 5d00b700 a7007c00 5400b600 8e008600
ffff88004dbbf680 1714098139 S Bi:2:013:1 -115 16384 <
ffff88004dbbf680 1714147652 C Bi:2:013:1 0 16384 = 92007300 ab00ce00 85009f00 d8006c00 b6009000 c0006c00 6d00e100 ac00ab00
ffff88004dbbf680 1714155123 S Bi:2:013:1 -115 12800 <
ffff88004dbbf680 1714193585 C Bi:2:013:1 0 12800 = 1526ec26 35243624 89217621 3f238823 55267025 5423d726 f926cc25 78248024
ffff88004dbbf680 1714199997 S Bi:2:013:1 -115 19968 <
ffff88004dbbf680 1714252941 C Bi:2:013:1 0 19968 = 9d2a942a 49290f27 e6284026 8029d829 28286c2a 0a291a28 51289e29 32288f29
ffff88004dbbf680 1714262970 S Bi:2:013:1 -115 16384 <
ffff88004dbbf680 1714305694 C Bi:2:013:1 0 16384 = 990c9028 05274827 af27a728 6027e326 8427d826 45271826 a827e426 1227c926
ffff88004dbbf680 1714307450 S Bi:2:013:1 -115 16384 <
ffff88004dbbf680 1714356574 C Bi:2:013:1 0 16384 = c9007700 6a006d00 7f006500 61006700 6e009a00 eb009a00 7d006700 8200a800
ffff88004dbbf680 1714359512 S Bi:2:013:1 -115 12800 <
ffff88004dbbf680 1714394091 C Bi:2:013:1 0 12800 = 53009c00 7300bb00 a8005a00 8300b900 64008600 d3009300 8300be00 88008000
ffff88004dbbf680 1714397548 S Bi:2:013:1 -115 19968 <
ffff88004dbbf680 1714461949 C Bi:2:013:1 0 19968 = a90ad30b b9026e06 8e044801 9100ba00 a700d500 a500d300 ac006b00 9d009a00
ffff88004dbbf680 1714465588 S Bi:2:013:1 -115 16384 <
ffff88004dbbf680 1714514618 C Bi:2:013:1 0 16384 = 54083908 1007f906 cd063f07 1e06a106 73067e07 2a07d706 03074007 df060307
ffff88004dbbf680 1714517546 S Bi:2:013:1 -115 16384 <
ffff88004dbbf680 1714567214 C Bi:2:013:1 0 16384 = f3669d72 0f6f9454 770a182b f227d628 71298426 95272828 b0270c26 172b6429
ffff88004dbbf680 1714569448 S Bi:2:013:1 -115 12800 <
ffff88004dbbf680 1714602937 C Bi:2:013:1 0 12800 = 7200de00 c1008600 de00a600 ab005e00 95006900 a7008900 8d007c00 7200af00
ffff88004dbbf680 1714607454 S Bi:2:013:1 -115 19968 <
ffff88004dbbf680 1714668703 C Bi:2:013:1 0 19968 = 89005200 9500d700 a300dc00 57008000 8d00af00 9400b100 b1005e00 9500a400
ffff88004dbbf680 1714675605 S Bi:2:013:1 -115 16384 <
ffff88004dbbf680 1714721500 C Bi:2:013:1 0 16384 = b70aa00a 3f0a4708 46088e08 d908e108 43088e07 db07ca07 7808b107 2a098208
ffff88004dbbf680 1714727478 S Bi:2:013:1 -115 16384 <
ffff88004dbbf680 1714774121 C Bi:2:013:1 0 16384 = 3608e106 a4063907 c9074306 df062906 9506a206 ed06a206 6406e405 5706d306
ffff88004dbbf680 1714779493 S Bi:2:013:1 -115 12800 <
ffff88004dbbf680 1714813701 C Bi:2:013:1 0 12800 = 416f6071 1071ad74 55721871 fc758e6f 810e4d28 302c332b 3d2b3428 cb28db26
ffff88004dbbf680 1714817522 S Bi:2:013:1 -115 19968 <
ffff88004dbbf680 1714869375 C Bi:2:013:1 0 19968 = 9e08010a a70a6704 e9050521 37217a23 8e22a521 a023c521 c0225622 f222bb20
ffff88004dbbf680 1714869589 S Bi:2:013:1 -115 16384 <
ffff88004dbbf680 1714922008 C Bi:2:013:1 0 16384 = 8c00a000 8a005000 73009700 8b00dd00 56006100 a200a900 8700c600 6d006800
ffff88004dbbf680 1714930442 S Bi:2:013:1 -115 16384 <
ffff88004dbbf680 1714974548 C Bi:2:013:1 0 16384 = 39050905 98042905 6b059705 06055003 5e03ac03 3a031903 93031e03 61034d03
ffff88004dbbf680 1714982488 S Bi:2:013:1 -115 12800 <
ffff88004dbbf680 1715020552 C Bi:2:013:1 0 12800 = 6706dd06 cd068a06 78069806 d206a606 8d06ce06 e5059f06 3d07f106 92063c07
ffff88004dbbf680 1715027461 S Bi:2:013:1 -115 15872 <
ffff88004dbbf680 1715062832 C Bi:2:013:1 0 15872 = b80a190c 7c0aa80b c50ad30a 6a0baa0b 270b9f0a f60a670b ff0ac309 b20a180a
ffff88004dbbf680 1715065477 S Bi:2:013:1 -115 512 <
ffff88004dbbf680 1715065589 C Bi:2:013:1 0 186 = 9000b000 c500cf00 a300ca00 88005000 7800d300 7e000001 70007900 96006200
ffff88004dbbf680 1715069844 S Ci:2:013:0 s c0 0c 0084 48c8 0001 1 <
ffff88004dbbf680 1715070223 C Ci:2:013:0 0 1 = 03
ffff88004dbbf680 1715072934 S Ci:2:013:0 s c0 0c 0084 48c8 0001 1 <
ffff88004dbbf680 1715073175 C Ci:2:013:0 0 1 = 00
ffff88004dbbf680 1715076788 S Co:2:013:0 s 40 0c 0088 0084 0001 1 = ff
ffff88004dbbf680 1715077177 C Co:2:013:0 0 1 >
ffff88004dbbf680 1715079830 S Co:2:013:0 s 40 0c 0088 0084 0001 1 = aa
ffff88004dbbf680 1715080175 C Co:2:013:0 0 1 >
ffff88004dbbf680 1715082952 S Co:2:013:0 s 40 0c 0088 0084 0001 1 = 55
ffff88004dbbf680 1715083300 C Co:2:013:0 0 1 >
ffff88004dbbf680 1715089416 S Co:2:013:0 s 40 0c 0088 0084 0001 1 = 00
ffff88004dbbf680 1715089801 C Co:2:013:0 0 1 >
ffff88004dbbf680 1715091949 S Co:2:013:0 s 40 0c 0088 0084 0001 1 = ff
ffff88004dbbf680 1715092472 C Co:2:013:0 0 1 >
ffff88004dbbf680 1715094981 S Co:2:013:0 s 40 0c 0088 0084 0001 1 = 87
ffff88004dbbf680 1715095427 C Co:2:013:0 0 1 >
ffff88004dbbf680 1715097897 S Co:2:013:0 s 40 0c 0088 0084 0001 1 = 78
ffff88004dbbf680 1715098301 C Co:2:013:0 0 1 >
ffff88004dbbf680 1715100937 S Co:2:013:0 s 40 0c 0088 0084 0001 1 = e0
ffff88004dbbf680 1715101327 C Co:2:013:0 0 1 >
ffff88004dbbf680 1715103970 S Co:2:013:0 s 40 0c 0087 0084 0001 1 = 05
ffff88004dbbf680 1715104300 C Co:2:013:0 0 1 >
ffff88004dbbf680 1715107006 S Co:2:013:0 s 40 0c 0087 0084 0001 1 = 04
ffff88004dbbf680 1715107426 C Co:2:013:0 0 1 >
ffff88004dbbf680 1715109896 S Co:2:013:0 s 40 0c 0088 0084 0001 1 = ff
ffff88004dbbf680 1715110348 C Co:2:013:0 0 1 >
ffff88004dbbf680 1715112926 S Co:2:013:0 s 40 0c 0085 0088 0001 1 = 08
ffff88004dbbf680 1715113348 C Co:2:013:0 0 1 >
ffff88004dbbf680 1715115960 S Co:2:013:0 s 40 0c 0085 0088 0001 1 = 00
ffff88004dbbf680 1715116328 C Co:2:013:0 0 1 >
ffff88004dbbf680 1715118996 S Co:2:013:0 s 40 0c 0085 0088 0001 1 = 00
ffff88004dbbf680 1715119427 C Co:2:013:0 0 1 >
ffff88004dbbf680 1715121897 S Co:2:013:0 s 40 0c 0085 0088 0001 1 = 00
ffff88004dbbf680 1715122348 C Co:2:013:0 0 1 >
ffff88004dbbf680 1715124932 S Co:2:013:0 s 40 0c 0085 0088 0001 1 = ff
ffff88004dbbf680 1715125337 C Co:2:013:0 0 1 >
ffff88004dbbf680 1715128546 S Co:2:013:0 s 40 0c 0085 0088 0001 1 = 00
ffff88004dbbf680 1715128929 C Co:2:013:0 0 1 >
ffff88004dbbf680 1715132188 S Ci:2:013:0 s c0 0c 0084 0006 0001 1 <
ffff88004dbbf680 1715132549 C Ci:2:013:0 0 1 = 01
ffff88004dbbf680 1715138951 S Co:2:013:0 s 40 04 0082 1694 0008 8 = 00000000 ba3e0700
ffff88004dbbf680 1715139304 C Co:2:013:0 0 8 >
ffff88004dbbf680 1715160259 S Bi:2:013:1 -115 19968 <
ffff88004dbbf680 1715169330 C Bi:2:013:1 0 19968 = 52529d00 48007400 71005e00 94008700 6b005600 5600a000 62009c00 b2006700
ffff88004dbbf680 1715171244 S Bi:2:013:1 -115 16384 <
ffff88004dbbf680 1715183472 C Bi:2:013:1 0 16384 = 1203d503 d502b502 f3022603 ce025d03 c4029d03 6e03b402 9b030503 1f034d03
ffff88004dbbf680 1715185303 S Bi:2:013:1 -115 16384 <
ffff88004dbbf680 1715236109 C Bi:2:013:1 0 16384 = 46065b06 60069b06 0f075006 d4069706 96069606 73066a06 7c063e07 23074406
ffff88004dbbf680 1715243267 S Bi:2:013:1 -115 12800 <
ffff88004dbbf680 1715273591 C Bi:2:013:1 0 12800 = 7427c524 cf258c24 20266226 0625d428 1229f026 ab25cd28 09282a29 19280828
ffff88004dbbf680 1715281301 S Bi:2:013:1 -115 19968 <
ffff88004dbbf680 1715337586 C Bi:2:013:1 0 19968 = 9f23c922 6a248d23 07237424 ac223123 02240922 2e234b24 0c259624 23252d23
ffff88004dbbf680 1715342257 S Bi:2:013:1 -115 16384 <
ffff88004dbbf680 1715390189 C Bi:2:013:1 0 16384 = 61006f00 7e006a00 6d009700 4c008d00 c8008d00 9200a700 b3008300 b200a700
ffff88004dbbf680 1715394356 S Bi:2:013:1 -115 16384 <
ffff88004dbbf680 1715442948 C Bi:2:013:1 0 16384 = f60dfe0c 690e390e 280f7a0e 8d0d540d 7e0e3b0e fa0d860f 790efe0e 840d8e0e
ffff88004dbbf680 1715446371 S Bi:2:013:1 -115 12800 <
ffff88004dbbf680 1715482606 C Bi:2:013:1 0 12800 = 9e039d02 b6033204 93036903 22041b04 14046503 25040304 9d033b04 b6030c04
ffff88004dbbf680 1715491332 S Bi:2:013:1 -115 19968 <
ffff88004dbbf680 1715548359 C Bi:2:013:1 0 19968 = bb0d730c 8f0c610d 160d240c e90c3e0c 2b08e30a 9b0c330c d50cfd0b dc0b820c
ffff88004dbbf680 1715552239 S Bi:2:013:1 -115 16384 <
ffff88004dbbf680 1715590877 C Bi:2:013:1 0 16384 = a000b800 da007100 62003300 a3007a00 6e009300 8f007800 8d00b000 7200aa00
ffff88004dbbf680 1715597281 S Bi:2:013:1 -115 16384 <
ffff88004dbbf680 1715643569 C Bi:2:013:1 0 16384 = d2008e00 9a007c00 8b006c00 bf007500 b2008800 9f00bc00 90004300 58009c00
ffff88004dbbf680 1715649367 S Bi:2:013:1 -115 12800 <
ffff88004dbbf680 1715689391 C Bi:2:013:1 0 12800 = ae02fd01 ac02d602 d0022202 a7025602 b8026f02 6e025402 f6022e02 50029902
ffff88004dbbf680 1715694350 S Bi:2:013:1 -115 19968 <
ffff88004dbbf680 1715749027 C Bi:2:013:1 0 19968 = 52096d09 eb091a0a 7909e009 ae095709 f2099109 53097d09 96091c0a ac092109
ffff88004dbbf680 1715755359 S Bi:2:013:1 -115 16384 <
ffff88004dbbf680 1715801632 C Bi:2:013:1 0 16384 = 7b387e0a d7297d29 bb263426 b7272327 8f25b027 2828eb27 2227a826 cc25b527
ffff88004dbbf680 1715807290 S Bi:2:013:1 -115 16384 <
ffff88004dbbf680 1715852481 C Bi:2:013:1 0 16384 = 7c004d00 96006f00 5a006900 c1005f00 7000cd00 ea00d900 29009a00 a3007700
ffff88004dbbf680 1715859324 S Bi:2:013:1 -115 12800 <
ffff88004dbbf680 1715890034 C Bi:2:013:1 0 12800 = 8600fc00 c300c900 44000a00 5f000d00 33009800 8200bb00 c5004400 a0009d00
ffff88004dbbf680 1715897319 S Bi:2:013:1 -115 19968 <
ffff88004dbbf680 1715957877 C Bi:2:013:1 0 19968 = 9b0cf90c a4058901 2001d900 ad007f00 bb00cb00 c800b700 90009400 6d009700
ffff88004dbbf680 1715965413 S Bi:2:013:1 -115 16384 <
ffff88004dbbf680 1716010509 C Bi:2:013:1 0 16384 = 0618c019 9118310d cc0a330c 000be50c af0cd00b e60cff0b 780b130c 680acb0b
ffff88004dbbf680 1716017346 S Bi:2:013:1 -115 16384 <
ffff88004dbbf680 1716063291 C Bi:2:013:1 0 16384 = 374e584a f64ca44c 20404007 5424ed26 5a28ab28 5c267c26 5e250622 77267326
ffff88004dbbf680 1716069276 S Bi:2:013:1 -115 12800 <
ffff88004dbbf680 1716098997 C Bi:2:013:1 0 12800 = 97009100 6f00d300 7500a200 8c00d000 9e00b300 d0009c00 aa00ba00 5a00d300
ffff88004dbbf680 1716107245 S Bi:2:013:1 -115 19968 <
ffff88004dbbf680 1716164793 C Bi:2:013:1 0 19968 = e9006d00 32008700 ec008900 95008900 9a009d00 54008800 33007b00 80005b00
ffff88004dbbf680 1716168267 S Bi:2:013:1 -115 16384 <
ffff88004dbbf680 1716217341 C Bi:2:013:1 0 16384 = bf22e722 54217421 fa200121 9f1fcc1f be1fc422 74207321 2a216720 73214820
ffff88004dbbf680 1716220329 S Bi:2:013:1 -115 16384 <
ffff88004dbbf680 1716270110 C Bi:2:013:1 0 16384 = 90048604 89044c04 d7036404 65042f03 d703c403 f6035703 c803b302 da03a103
ffff88004dbbf680 1716272436 S Bi:2:013:1 -115 12800 <
ffff88004dbbf680 1716309639 C Bi:2:013:1 0 12800 = 1d503c50 df52dc52 5c518d51 53534251 8351750a 1525e828 1a2c5b29 25276825
ffff88004dbbf680 1716317350 S Bi:2:013:1 -115 19968 <
ffff88004dbbf680 1716365345 C Bi:2:013:1 0 19968 = 1a03bc07 d10ba70b 72094f1e 2a23ca1f e521cb21 b6236d21 2b210623 f521bb1f
ffff88004dbbf680 1716369404 S Bi:2:013:1 -115 16384 <
ffff88004dbbf680 1716417994 C Bi:2:013:1 0 16384 = 8b008c00 44008f00 af008d00 a6007200 5500cf00 35007800 7a00ac00 9e007600
ffff88004dbbf680 1716421326 S Bi:2:013:1 -115 16384 <
ffff88004dbbf680 1716470637 C Bi:2:013:1 0 16384 = 1c128f10 f910f911 dc118510 6710cd11 5d0c480b 910cb20b 450c470d a90b580c
ffff88004dbbf680 1716473358 S Bi:2:013:1 -115 12800 <
ffff88004dbbf680 1716516535 C Bi:2:013:1 0 12800 = 0f17da15 5e174e16 da17d116 c3171b16 37158616 0e16391c 811c491c 641b411d
ffff88004dbbf680 1716518287 S Bi:2:013:1 -115 15872 <
ffff88004dbbf680 1716558920 C Bi:2:013:1 0 15872 = ae159e14 e414bf15 8f155715 bf15da13 c9130c15 af139413 1d143e15 4f156614
ffff88004dbbf680 1716563239 S Bi:2:013:1 -115 512 <
ffff88004dbbf680 1716563377 C Bi:2:013:1 0 186 = 8600d100 c6008d00 d5006f00 b500aa00 5c009200 bd009b00 ae009b00 77007500
ffff88004dbbf680 1716566267 S Ci:2:013:0 s c0 0c 0084 48c8 0001 1 <
ffff88004dbbf680 1716566475 C Ci:2:013:0 0 1 = 03
ffff88004dbbf680 1716569339 S Ci:2:013:0 s c0 0c 0084 48c8 0001 1 <
ffff88004dbbf680 1716569600 C Ci:2:013:0 0 1 = 00
ffff88004dbbf680 1716573225 S Co:2:013:0 s 40 0c 0088 0084 0001 1 = ff
ffff88004dbbf680 1716573629 C Co:2:013:0 0 1 >
ffff88004dbbf680 1716576267 S Co:2:013:0 s 40 0c 0088 0084 0001 1 = aa
ffff88004dbbf680 1716576724 C Co:2:013:0 0 1 >
ffff88004dbbf680 1716579304 S Co:2:013:0 s 40 0c 0088 0084 0001 1 = 55
ffff88004dbbf680 1716579772 C Co:2:013:0 0 1 >
ffff88004dbbf680 1716582346 S Co:2:013:0 s 40 0c 0088 0084 0001 1 = 00
ffff88004dbbf680 1716582727 C Co:2:013:0 0 1 >
ffff88004dbbf680 1716590962 S Co:2:013:0 s 40 0c 0088 0084 0001 1 = ff
ffff88004dbbf680 1716591352 C Co:2:013:0 0 1 >
ffff88004dbbf680 1716593487 S Co:2:013:0 s 40 0c 0088 0084 0001 1 = 87
ffff88004dbbf680 1716593877 C Co:2:013:0 0 1 >
ffff88004dbbf680 1716596406 S Co:2:013:0 s 40 0c 0088 0084 0001 1 = 78
ffff88004dbbf680 1716596898 C Co:2:013:0 0 1 >
ffff88004dbbf680 1716599435 S Co:2:013:0 s 40 0c 0088 0084 0001 1 = e0
ffff88004dbbf680 1716599897 C Co:2:013:0 0 1 >
ffff88004dbbf680 1716602473 S Co:2:013:0 s 40 0c 0087 0084 0001 1 = 05
ffff88004dbbf680 1716602850 C Co:2:013:0 0 1 >
ffff88004dbbf680 1716605505 S Co:2:013:0 s 40 0c 0087 0084 0001 1 = 04
ffff88004dbbf680 1716605851 C Co:2:013:0 0 1 >
ffff88004dbbf680 1716608405 S Co:2:013:0 s 40 0c 0088 0084 0001 1 = ff
ffff88004dbbf680 1716608852 C Co:2:013:0 0 1 >
ffff88004dbbf680 1716611432 S Co:2:013:0 s 40 0c 0085 0088 0001 1 = 08
ffff88004dbbf680 1716611897 C Co:2:013:0 0 1 >
ffff88004dbbf680 1716614467 S Co:2:013:0 s 40 0c 0085 0088 0001 1 = 00
ffff88004dbbf680 1716614898 C Co:2:013:0 0 1 >
ffff88004dbbf680 1716617501 S Co:2:013:0 s 40 0c 0085 0088 0001 1 = 00
ffff88004dbbf680 1716617871 C Co:2:013:0 0 1 >
ffff88004dbbf680 1716620406 S Co:2:013:0 s 40 0c 0085 0088 0001 1 = 00
ffff88004dbbf680 1716620899 C Co:2:013:0 0 1 >
ffff88004dbbf680 1716623437 S Co:2:013:0 s 40 0c 0085 0088 0001 1 = ff
ffff88004dbbf680 1716623898 C Co:2:013:0 0 1 >
ffff88004dbbf680 1716626471 S Co:2:013:0 s 40 0c 0085 0088 0001 1 = 00
ffff88004dbbf680 1716626898 C Co:2:013:0 0 1 >
ffff88004dbbf680 1716628500 S Ci:2:013:0 s c0 0c 0084 0006 0001 1 <
ffff88004dbbf680 1716628898 C Ci:2:013:0 0 1 = 01
ffff88004dbbf680 1716632399 S Co:2:013:0 s 40 04 0082 1694 0008 8 = 00000000 ba3e0700
ffff88004dbbf680 1716632753 C Co:2:013:0 0 8 >
ffff88004dbbf680 1716634425 S Bi:2:013:1 -115 19968 <
ffff88004dbbf680 1716643388 C Bi:2:013:1 0 19968 = 5252b200 87008300 b900c100 6d009100 97008700 4d009a00 87008d00 7d008600
ffff88004dbbf680 1716644463 S Bi:2:013:1 -115 16384 <
ffff88004dbbf680 1716679486 C Bi:2:013:1 0 16384 = b30d1b0e 0a0dcc0c ee0d030d 910e180f 370d480d 330de10c e90bd50c 470d460c
ffff88004dbbf680 1716686032 S Bi:2:013:1 -115 16384 <
ffff88004dbbf680 1716732166 C Bi:2:013:1 0 16384 = 821df91b 071c941c 7e1d911f dc1d231d bd1d211e fc1e381e 841ebd1f ba1c501d
ffff88004dbbf680 1716738074 S Bi:2:013:1 -115 12800 <
ffff88004dbbf680 1716769632 C Bi:2:013:1 0 12800 = 8524fd27 7c0d1f04 4a22e724 c726b825 e9250f27 bd255804 d409ce28 03291b1f
ffff88004dbbf680 1716775920 S Bi:2:013:1 -115 19968 <
ffff88004dbbf680 1716833651 C Bi:2:013:1 0 19968 = c4246b22 0923a725 25251f0c 6310790c 62094b17 ef0a581b 921f6824 d7254221
ffff88004dbbf680 1716836938 S Bi:2:013:1 -115 16384 <
ffff88004dbbf680 1716886446 C Bi:2:013:1 0 16384 = 3e009000 6e00bd00 5e005d00 5d008300 9c006c00 7a005a00 74007400 a500b500
ffff88004dbbf680 1716889073 S Bi:2:013:1 -115 16384 <
ffff88004dbbf680 1716939050 C Bi:2:013:1 0 16384 = e619191a b0197a1c 21183718 47188d1a 9419ed19 77195319 941a671a 8418f817
ffff88004dbbf680 1716941057 S Bi:2:013:1 -115 12800 <
ffff88004dbbf680 1716978659 C Bi:2:013:1 0 12800 = 89145d13 17156d15 40158615 a3123114 e614b015 0616f314 7c142515 89162a15
ffff88004dbbf680 1716985974 S Bi:2:013:1 -115 19968 <
ffff88004dbbf680 1717044430 C Bi:2:013:1 0 19968 = 0c110811 f210a80f 9e104c11 ed106610 0e11fd0f ef110f10 9c108a11 9c0fa310
ffff88004dbbf680 1717047004 S Bi:2:013:1 -115 16384 <
ffff88004dbbf680 1717086891 C Bi:2:013:1 0 16384 = d400a300 c900d700 b2008500 36009000 67008600 71005600 9400bc00 5b009800
ffff88004dbbf680 1717091964 S Bi:2:013:1 -115 16384 <
ffff88004dbbf680 1717139657 C Bi:2:013:1 0 16384 = 3700ab00 9e006300 6900c100 8d008a00 a1007500 ca00d600 a8007300 2b004a00
ffff88004dbbf680 1717144023 S Bi:2:013:1 -115 12800 <
ffff88004dbbf680 1717185541 C Bi:2:013:1 0 12800 = 190b8a0b c90a7b0b 320a750b 7e0b460a f70ae40a 800b060b 780a0d0a 6a0bf309
ffff88004dbbf680 1717188995 S Bi:2:013:1 -115 19968 <
ffff88004dbbf680 1717244918 C Bi:2:013:1 0 19968 = 762c262b d42bbb2a f828e32d 9d29a62b 022e672d 092bb02a cc2a692b 8b2bc82c
ffff88004dbbf680 1717249980 S Bi:2:013:1 -115 16384 <
ffff88004dbbf680 1717297707 C Bi:2:013:1 0 16384 = 6f42c810 ce109227 7f277c25 261a001b 6518ed28 c211cc03 8517302c f929ad27
ffff88004dbbf680 1717302110 S Bi:2:013:1 -115 16384 <
ffff88004dbbf680 1717348546 C Bi:2:013:1 0 16384 = 76005900 8000a200 5d00a600 87008100 90009d00 a7003900 be00c000 bc008600
ffff88004dbbf680 1717354083 S Bi:2:013:1 -115 12800 <
ffff88004dbbf680 1717386065 C Bi:2:013:1 0 12800 = 70006700 bf009200 a200af00 9c007100 ab009e00 48006e00 75006b00 9d00b200
ffff88004dbbf680 1717392005 S Bi:2:013:1 -115 19968 <
ffff88004dbbf680 1717453880 C Bi:2:013:1 0 19968 = 490de50b d50a1903 c6013b01 bb00af00 f5007600 b1008500 ba009000 8e00c200
ffff88004dbbf680 1717460067 S Bi:2:013:1 -115 16384 <
ffff88004dbbf680 1717506534 C Bi:2:013:1 0 16384 = 0824ca24 6d25a822 751f591f 2a1f1d21 291f3a21 f61fd520 4e20c021 071f461e
ffff88004dbbf680 1717512106 S Bi:2:013:1 -115 16384 <
ffff88004dbbf680 1717559304 C Bi:2:013:1 0 16384 = 9a3ef03a 273b093c ad3d6417 cd0d4529 c1266f27 9e241c26 ab233523 bb25a724
ffff88004dbbf680 1717564022 S Bi:2:013:1 -115 12800 <
ffff88004dbbf680 1717594954 C Bi:2:013:1 0 12800 = 56007800 d600d100 c600b600 f1006a00 8200a600 d100b800 aa006500 ee00a800
ffff88004dbbf680 1717602066 S Bi:2:013:1 -115 19968 <
ffff88004dbbf680 1717660797 C Bi:2:013:1 0 19968 = d6009300 ac00be00 a5008000 6300ca00 7d009100 8b00ed00 68009200 72008900
ffff88004dbbf680 1717663050 S Bi:2:013:1 -115 16384 <
ffff88004dbbf680 1717713488 C Bi:2:013:1 0 16384 = c2351e37 af377136 d238bd2f ac31f430 532fc733 28308830 2631562e 3832632f
ffff88004dbbf680 1717714986 S Bi:2:013:1 -115 16384 <
ffff88004dbbf680 1717766185 C Bi:2:013:1 0 16384 = b208dd09 9c0a2109 0f094909 b7087c08 68097909 fd09010a 8709bf08 de098209
ffff88004dbbf680 1717767006 S Bi:2:013:1 -115 12800 <
ffff88004dbbf680 1717805683 C Bi:2:013:1 0 12800 = 53349733 6b33af35 0336ec35 9b34c635 46395a1a 0a0d2a28 dd276b2b 3a281328
ffff88004dbbf680 1717811964 S Bi:2:013:1 -115 19968 <
ffff88004dbbf680 1717861303 C Bi:2:013:1 0 19968 = 4903a409 030cc10b 8e0a9a1f 5f25fc20 7c23c523 47247824 9925b822 fb217522
ffff88004dbbf680 1717864051 S Bi:2:013:1 -115 16384 <
ffff88004dbbf680 1717914080 C Bi:2:013:1 0 16384 = 84007e00 bb00c400 8900bc00 83009c00 ef009500 83007a00 b6001c00 e700ad00
ffff88004dbbf680 1717916099 S Bi:2:013:1 -115 16384 <
ffff88004dbbf680 1717966690 C Bi:2:013:1 0 16384 = e10df20c 2e0eb90d db0de10c 130d790d 210c8f08 50094e09 56087e09 fa08f608
ffff88004dbbf680 1717967998 S Bi:2:013:1 -115 12800 <
ffff88004dbbf680 1718012566 C Bi:2:013:1 0 12800 = 3917d117 af183918 3e192f19 00185819 ec176d17 a818b118 dc1db81d 601e1a21
ffff88004dbbf680 1718022065 S Bi:2:013:1 -115 15872 <
ffff88004dbbf680 1718054902 C Bi:2:013:1 0 15872 = b32c322c 352d3f2e 052c202a ab26cd22 1421d820 14219f21 4c23a523 4b22f921
ffff88008e887140 1718059922 S Bi:2:013:1 -115 512 <
ffff88008e887140 1718060052 C Bi:2:013:1 0 186 = a8008000 86009e00 6e008c00 a2009900 5b007600 41007d00 b900a000 c400d600
ffff88008e887140 1718062955 S Ci:2:013:0 s c0 0c 0084 48c8 0001 1 <
ffff88008e887140 1718063311 C Ci:2:013:0 0 1 = 03
ffff88008e887140 1718066030 S Ci:2:013:0 s c0 0c 0084 48c8 0001 1 <
ffff88008e887140 1718066311 C Ci:2:013:0 0 1 = 00
ffff88008e887140 1718070021 S Co:2:013:0 s 40 0c 0088 0084 0001 1 = ff
ffff88008e887140 1718070440 C Co:2:013:0 0 1 >
ffff88008e887140 1718072930 S Co:2:013:0 s 40 0c 0088 0084 0001 1 = aa
ffff88008e887140 1718073461 C Co:2:013:0 0 1 >
ffff88008e887140 1718075969 S Co:2:013:0 s 40 0c 0088 0084 0001 1 = 55
ffff88008e887140 1718076461 C Co:2:013:0 0 1 >
ffff88008e887140 1718079005 S Co:2:013:0 s 40 0c 0088 0084 0001 1 = 00
ffff88008e887140 1718079437 C Co:2:013:0 0 1 >
ffff88008e887140 1718082047 S Co:2:013:0 s 40 0c 0088 0084 0001 1 = ff
ffff88008e887140 1718082437 C Co:2:013:0 0 1 >
ffff88008e887140 1718089173 S Co:2:013:0 s 40 0c 0088 0084 0001 1 = 87
ffff88008e887140 1718089547 C Co:2:013:0 0 1 >
ffff88008e887140 1718091712 S Co:2:013:0 s 40 0c 0088 0084 0001 1 = 78
ffff88008e887140 1718092212 C Co:2:013:0 0 1 >
ffff88008e887140 1718094767 S Co:2:013:0 s 40 0c 0088 0084 0001 1 = e0
ffff88008e887140 1718095337 C Co:2:013:0 0 1 >
ffff88008e887140 1718097649 S Co:2:013:0 s 40 0c 0087 0084 0001 1 = 05
ffff88008e887140 1718098057 C Co:2:013:0 0 1 >
ffff88008e887140 1718100682 S Co:2:013:0 s 40 0c 0087 0084 0001 1 = 04
ffff88008e887140 1718101212 C Co:2:013:0 0 1 >
ffff88008e887140 1718103714 S Co:2:013:0 s 40 0c 0088 0084 0001 1 = ff
ffff88008e887140 1718104212 C Co:2:013:0 0 1 >
ffff88008e887140 1718106748 S Co:2:013:0 s 40 0c 0085 0088 0001 1 = 08
ffff88008e887140 1718107212 C Co:2:013:0 0 1 >
ffff88008e887140 1718109646 S Co:2:013:0 s 40 0c 0085 0088 0001 1 = 00
ffff88008e887140 1718110072 C Co:2:013:0 0 1 >
ffff88008e887140 1718112683 S Co:2:013:0 s 40 0c 0085 0088 0001 1 = 00
ffff88008e887140 1718113062 C Co:2:013:0 0 1 >
ffff88008e887140 1718115718 S Co:2:013:0 s 40 0c 0085 0088 0001 1 = 00
ffff88008e887140 1718116198 C Co:2:013:0 0 1 >
ffff88008e887140 1718118748 S Co:2:013:0 s 40 0c 0085 0088 0001 1 = ff
ffff88008e887140 1718119213 C Co:2:013:0 0 1 >
ffff88008e887140 1718121641 S Co:2:013:0 s 40 0c 0085 0088 0001 1 = 00
ffff88008e887140 1718122088 C Co:2:013:0 0 1 >
ffff88008e887140 1718123744 S Ci:2:013:0 s c0 0c 0084 0006 0001 1 <
ffff88008e887140 1718124063 C Ci:2:013:0 0 1 = 01
ffff88008e887140 1718129433 S Co:2:013:0 s 40 04 0082 1694 0008 8 = 00000000 ba3e0700
ffff88008e887140 1718129780 C Co:2:013:0 0 8 >
ffff88008e887140 1718130994 S Bi:2:013:1 -115 19968 <
ffff88008e887140 1718140400 C Bi:2:013:1 0 19968 = 52527800 a900b400 4c00c800 95006000 96009900 dc00ce00 ab009500 72009400
ffff88008e887140 1718140941 S Bi:2:013:1 -115 16384 <
ffff88008e887140 1718175471 C Bi:2:013:1 0 16384 = 6a077308 3608c807 c0071308 9c088107 f0072608 f207be07 7907b108 3509c708
ffff88008e887140 1718179014 S Bi:2:013:1 -115 16384 <
ffff88008e887140 1718241158 C Bi:2:013:1 0 16384 = 5a306530 bf2d662f 532cf02e 3a2f5231 e52fe933 fe2e4f32 dc309d30 cc304b32
ffff88008e887140 1718241809 S Bi:2:013:1 -115 12800 <
ffff88008e887140 1718283227 C Bi:2:013:1 0 12800 = 9a288f27 b6281726 bc0a6e05 2b06a906 a6055305 1310651f b00bd705 f2042406
ffff88008e887140 1718286800 S Bi:2:013:1 -115 19968 <
ffff88008e887140 1718347194 C Bi:2:013:1 0 19968 = 9a251423 cc23d224 87203420 0e249622 1324e714 60199c23 65240822 2325b523
ffff88008e887140 1718354804 S Bi:2:013:1 -115 16384 <
ffff88008e887140 1718399997 C Bi:2:013:1 0 16384 = ae00c900 2c007c00 a3007600 98006900 b2007600 6200ac00 76007900 65008e00
ffff88008e887140 1718406856 S Bi:2:013:1 -115 16384 <
ffff88008e887140 1718452576 C Bi:2:013:1 0 16384 = b842fc40 7f41ac43 c0439a42 dd407643 e6434043 57424e43 863f3544 f942cb43
ffff88008e887140 1718458726 S Bi:2:013:1 -115 12800 <
ffff88008e887140 1718492243 C Bi:2:013:1 0 12800 = 8d09fb08 db09b409 a909bf09 180b090a 340a280b 220a290a cc09f609 120b160b
ffff88008e887140 1718496732 S Bi:2:013:1 -115 19968 <
ffff88008e887140 1718557998 C Bi:2:013:1 0 19968 = 9a370d39 882b8938 8b362d38 b7373538 30356838 193ad138 6f385737 ee358e39
ffff88008e887140 1718564828 S Bi:2:013:1 -115 16384 <
ffff88008e887140 1718600462 C Bi:2:013:1 0 16384 = 84005a00 7d007800 3e009300 4e00bf00 7f008e00 5c009500 b2005500 58009500
ffff88008e887140 1718600888 S Bi:2:013:1 -115 16384 <
ffff88008e887140 1718653082 C Bi:2:013:1 0 16384 = 91004400 90009b00 8c00af00 99009a00 c000d300 ab008600 6b007600 82009900
ffff88008e887140 1718661702 S Bi:2:013:1 -115 12800 <
ffff88008e887140 1718698986 C Bi:2:013:1 0 12800 = 422c602f 712bdc2a 132f5b2d cb2bf72b 762dde2d 0d2d0d2d b42dc22b 5f2d622d
ffff88008e887140 1718706760 S Bi:2:013:1 -115 19968 <
ffff88008e887140 1718758465 C Bi:2:013:1 0 19968 = 6c5a0559 1b59c158 07594b59 c559925b 7358a95d 8d593c57 c559125b 59581656
ffff88008e887140 1718758727 S Bi:2:013:1 -115 16384 <
ffff88008e887140 1718811093 C Bi:2:013:1 0 16384 = 7c25d922 06052923 05256226 fb267625 7d236723 11247125 5827cd23 f824c024
ffff88008e887140 1718819724 S Bi:2:013:1 -115 16384 <
ffff88008e887140 1718861964 C Bi:2:013:1 0 16384 = b500b600 7300a900 9c008700 5200c700 8700b900 9a00b300 b2007c00 73009e00
ffff88008e887140 1718864694 S Bi:2:013:1 -115 12800 <
ffff88008e887140 1718899500 C Bi:2:013:1 0 12800 = ac00be00 c200c400 a0008300 8e00af00 b3007d00 97004500 9d00a500 b200a900
ffff88008e887140 1718902709 S Bi:2:013:1 -115 19968 <
ffff88008e887140 1718967356 C Bi:2:013:1 0 19968 = 7a0b7b0c 000bb004 2a027603 e000ee00 c4000401 9e00f300 a9008f00 cb00c900
ffff88008e887140 1718970826 S Bi:2:013:1 -115 16384 <
ffff88008e887140 1719019975 C Bi:2:013:1 0 16384 = 4945e148 f948c642 3e467e42 7843e642 cd409e42 863fa23f ee403d40 37429442
ffff88008e887140 1719022762 S Bi:2:013:1 -115 16384 <
ffff88008e887140 1719072763 C Bi:2:013:1 0 16384 = 4d231424 1d231320 d723d724 f406ec1b d3264f25 4125cc23 5d245823 7424bd25
ffff88008e887140 1719074778 S Bi:2:013:1 -115 12800 <
ffff88008e887140 1719108523 C Bi:2:013:1 0 12800 = ef008b00 99000c01 a7008200 c9009b00 c7006800 ca00fb00 a3008b00 a8007400
ffff88008e887140 1719112782 S Bi:2:013:1 -115 19968 <
ffff88008e887140 1719174275 C Bi:2:013:1 0 19968 = 92004d00 c200a200 6e00c600 a800ea00 a7006d00 c200c400 d6007c00 a500c400
ffff88008e887140 1719180808 S Bi:2:013:1 -115 16384 <
ffff88008e887140 1719226847 C Bi:2:013:1 0 16384 = ea50874f 6a51464e f950464d 3d466f46 68493e49 8647ca49 ce467e4a eb4ad546
ffff88008e887140 1719232822 S Bi:2:013:1 -115 16384 <
ffff88008e887140 1719279634 C Bi:2:013:1 0 16384 = c8377439 97356637 5e398f36 1538e237 6a2d0d2b a32abc2b e82bf829 822bbd2b
ffff88008e887140 1719284830 S Bi:2:013:1 -115 12800 <
ffff88008e887140 1719319109 C Bi:2:013:1 0 12800 = fd1ed220 031f181f 73209421 3c1f0420 0721651e a007291f ce295a28 bb269828
ffff88008e887140 1719322712 S Bi:2:013:1 -115 19968 <
ffff88008e887140 1719374728 C Bi:2:013:1 0 19968 = fa03c208 000c5b0c f6072b21 6b230222 fd20d723 c5231524 db21aa24 f5221a21
ffff88008e887140 1719374779 S Bi:2:013:1 -115 16384 <
ffff88008e887140 1719427533 C Bi:2:013:1 0 16384 = bf007900 af00db00 aa00b200 92007300 d4007400 cc007e00 78006800 df007800
ffff88008e887140 1719435764 S Bi:2:013:1 -115 16384 <
ffff88008e887140 1719480259 C Bi:2:013:1 0 16384 = 59373937 e0367b37 01354e35 d6339136 ba331330 602dc02d 642da92c 4a2d412d
ffff88008e887140 1719487786 S Bi:2:013:1 -115 12800 <
ffff88008e887140 1719526019 C Bi:2:013:1 0 12800 = 2b43a240 3d40ec41 ef418f40 6b40983f fa3dd73f 6e41d940 163f4740 e940753f
ffff88008e887140 1719532796 S Bi:2:013:1 -115 15872 <
ffff88008e887140 1719568384 C Bi:2:013:1 0 15872 = 5d42cf43 0e44e044 29465b44 7d426040 c23ebd3e 543c5d3c 2240893d 3e3f883d
ffff88008e887140 1719570805 S Bi:2:013:1 -115 512 <
ffff88008e887140 1719570985 C Bi:2:013:1 0 186 = af003d00 d0008300 c700b100 c800be00 da00a400 6700db00 9700b600 9b005a00
ffff88008e887140 1719573740 S Ci:2:013:0 s c0 0c 0084 48c8 0001 1 <
ffff88008e887140 1719574158 C Ci:2:013:0 0 1 = 03
ffff88008e887140 1719576813 S Ci:2:013:0 s c0 0c 0084 48c8 0001 1 <
ffff88008e887140 1719577116 C Ci:2:013:0 0 1 = 00
ffff88008e887140 1719580774 S Co:2:013:0 s 40 0c 0088 0084 0001 1 = ff
ffff88008e887140 1719581236 C Co:2:013:0 0 1 >
ffff88008e887140 1719586962 S Co:2:013:0 s 40 0c 0088 0084 0001 1 = aa
ffff88008e887140 1719587360 C Co:2:013:0 0 1 >
ffff88008e887140 1719592393 S Co:2:013:0 s 40 0c 0088 0084 0001 1 = 55
ffff88008e887140 1719592861 C Co:2:013:0 0 1 >
ffff88008e887140 1719595441 S Co:2:013:0 s 40 0c 0088 0084 0001 1 = 00
ffff88008e887140 1719596024 C Co:2:013:0 0 1 >
ffff88008e887140 1719598373 S Co:2:013:0 s 40 0c 0088 0084 0001 1 = ff
ffff88008e887140 1719598869 C Co:2:013:0 0 1 >
ffff88008e887140 1719601404 S Co:2:013:0 s 40 0c 0088 0084 0001 1 = 87
ffff88008e887140 1719601884 C Co:2:013:0 0 1 >
ffff88008e887140 1719604408 S Co:2:013:0 s 40 0c 0088 0084 0001 1 = 78
ffff88008e887140 1719604911 C Co:2:013:0 0 1 >
ffff88008e887140 1719607295 S Co:2:013:0 s 40 0c 0088 0084 0001 1 = e0
ffff88008e887140 1719607737 C Co:2:013:0 0 1 >
ffff88008e887140 1719610329 S Co:2:013:0 s 40 0c 0087 0084 0001 1 = 05
ffff88008e887140 1719610738 C Co:2:013:0 0 1 >
ffff88008e887140 1719613364 S Co:2:013:0 s 40 0c 0087 0084 0001 1 = 04
ffff88008e887140 1719613737 C Co:2:013:0 0 1 >
ffff88008e887140 1719616395 S Co:2:013:0 s 40 0c 0088 0084 0001 1 = ff
ffff88008e887140 1719616861 C Co:2:013:0 0 1 >
ffff880144dd0ec0 1719619486 S Co:2:013:0 s 40 0c 0085 0088 0001 1 = 08
ffff880144dd0ec0 1719619862 C Co:2:013:0 0 1 >
ffff880144dd0ec0 1719622363 S Co:2:013:0 s 40 0c 0085 0088 0001 1 = 00
ffff880144dd0ec0 1719622745 C Co:2:013:0 0 1 >
ffff880144dd0ec0 1719625404 S Co:2:013:0 s 40 0c 0085 0088 0001 1 = 00
ffff880144dd0ec0 1719625905 C Co:2:013:0 0 1 >
ffff880144dd0ec0 1719628386 S Co:2:013:0 s 40 0c 0085 0088 0001 1 = 00
ffff880144dd0ec0 1719628888 C Co:2:013:0 0 1 >
ffff880144dd0ec0 1719631418 S Co:2:013:0 s 40 0c 0085 0088 0001 1 = ff
ffff880144dd0ec0 1719631863 C Co:2:013:0 0 1 >
ffff880144dd0ec0 1719634329 S Co:2:013:0 s 40 0c 0085 0088 0001 1 = 00
ffff880144dd0ec0 1719634763 C Co:2:013:0 0 1 >
ffff880144dd0ec0 1719636401 S Ci:2:013:0 s c0 0c 0084 0006 0001 1 <
ffff880144dd0ec0 1719636739 C Ci:2:013:0 0 1 = 01
ffff880144dd0ec0 1719640392 S Co:2:013:0 s 40 04 0082 1694 0008 8 = 00000000 ba3e0700
ffff880144dd0ec0 1719640889 C Co:2:013:0 0 8 >
ffff880144dd0ec0 1719642509 S Bi:2:013:1 -115 19968 <
ffff880144dd0ec0 1719651987 C Bi:2:013:1 0 19968 = 5252e200 70009f00 a3007300 51008f00 9e006600 97006600 a400a300 8800c300
ffff880144dd0ec0 1719652425 S Bi:2:013:1 -115 16384 <
ffff880144dd0ec0 1719689035 C Bi:2:013:1 0 16384 = f02b932c 4431192d c12cb92f 77306d2d da2c002d a52e3f2d e62ffb2c 4e2a292e
ffff880144dd0ec0 1719697502 S Bi:2:013:1 -115 16384 <
ffff880144dd0ec0 1719741580 C Bi:2:013:1 0 16384 = 04467045 47460646 084b6f49 6d4ba644 9a49fa48 5049cf4d de48354a 34467748
ffff880144dd0ec0 1719747882 S Bi:2:013:1 -115 12800 <
ffff880144dd0ec0 1719779161 C Bi:2:013:1 0 12800 = 7623b524 0e261d24 c923d822 f023d226 4425bf24 6125e723 32260823 e822be24
ffff880144dd0ec0 1719785953 S Bi:2:013:1 -115 19968 <
ffff880144dd0ec0 1719843129 C Bi:2:013:1 0 19968 = a9203e21 1f233324 d822440c 7d0fb020 c424f921 0917b009 cf06ff07 74061b07
ffff880144dd0ec0 1719846963 S Bi:2:013:1 -115 16384 <
ffff880144dd0ec0 1719895871 C Bi:2:013:1 0 16384 = 8d008600 c900b700 ad005e00 7600ac00 66005b00 6c001000 90007800 b700c400
ffff880144dd0ec0 1719898844 S Bi:2:013:1 -115 16384 <
ffff880144dd0ec0 1719948503 C Bi:2:013:1 0 16384 = 7f545e51 0e4e4350 e24f0951 3552cc4f 03515452 5551c952 084c914e 3c4fdf51
ffff880144dd0ec0 1719950889 S Bi:2:013:1 -115 12800 <
ffff880144dd0ec0 1719988150 C Bi:2:013:1 0 12800 = dd22de21 5b21be23 53223b22 4c227221 98209522 9a22b721 6b21ab21 a4215c24
ffff880144dd0ec0 1719995851 S Bi:2:013:1 -115 19968 <
ffff880144dd0ec0 1720053926 C Bi:2:013:1 0 19968 = e43f4e3f 903f5c3f 6340fe40 d03e9e40 b33fa43f ca3e8140 1b416843 1442aa40
ffff880144dd0ec0 1720056861 S Bi:2:013:1 -115 16384 <
ffff880144dd0ec0 1720096368 C Bi:2:013:1 0 16384 = 8d009800 87008300 7d00b800 be007f00 7e00a600 d400b000 8900ac00 b4007a00
ffff880144dd0ec0 1720101831 S Bi:2:013:1 -115 16384 <
ffff880144dd0ec0 1720149144 C Bi:2:013:1 0 16384 = a2008d00 9b007a00 9b00ab00 e800bb00 9d00ce00 b600a200 a200e800 e300a400
ffff880144dd0ec0 1720153905 S Bi:2:013:1 -115 12800 <
ffff880144dd0ec0 1720195000 C Bi:2:013:1 0 12800 = 1f28462a 612bbe2a c92b632b 652f532a 542a192a 33296c29 862bb12a be286b2c
ffff880144dd0ec0 1720198814 S Bi:2:013:1 -115 19968 <
ffff880144dd0ec0 1720254535 C Bi:2:013:1 0 19968 = cb36e135 3337e937 7e374b35 2a365637 1e38623b 60358f34 0c376734 ee33cb37
ffff880144dd0ec0 1720259831 S Bi:2:013:1 -115 16384 <
ffff880144dd0ec0 1720307164 C Bi:2:013:1 0 16384 = 7b150a15 6808ff0c 5127dd24 0d25b525 db245824 d724ae24 f424c425 1225bb23
ffff880144dd0ec0 1720311973 S Bi:2:013:1 -115 16384 <
ffff880144dd0ec0 1720358020 C Bi:2:013:1 0 16384 = 9a007000 bd005c00 bb00df00 ac008f00 a6009300 b7008f00 82009600 6a005800
ffff880144dd0ec0 1720363811 S Bi:2:013:1 -115 12800 <
ffff880144dd0ec0 1720395518 C Bi:2:013:1 0 12800 = aa009f00 7300a200 7900c400 d100c500 bd005300 a5008300 8500d000 c600d600
ffff880144dd0ec0 1720401850 S Bi:2:013:1 -115 19968 <
ffff880144dd0ec0 1720463355 C Bi:2:013:1 0 19968 = 3d09ef0c f50a0c05 ac02de02 be008500 ea00f200 dc00db00 db00c800 d100bc00
ffff880144dd0ec0 1720469893 S Bi:2:013:1 -115 16384 <
ffff880144dd0ec0 1720516191 C Bi:2:013:1 0 16384 = 065e7a5f bf5e565f 5d5e0446 2a424d44 10401243 0443a742 7f45893f ef42b942
ffff880144dd0ec0 1720521859 S Bi:2:013:1 -115 16384 <
ffff880144dd0ec0 1720568818 C Bi:2:013:1 0 16384 = 49140f15 86153614 9b145c14 f30a1709 7324b326 ca26ed25 0b27f722 cb26671e
ffff880144dd0ec0 1720573886 S Bi:2:013:1 -115 12800 <
ffff880144dd0ec0 1720604562 C Bi:2:013:1 0 12800 = 7200c000 d7007300 b8003e00 e200af00 c5007a00 3d00bb00 7a00ae00 85007c00
ffff880144dd0ec0 1720611895 S Bi:2:013:1 -115 19968 <
ffff880144dd0ec0 1720670237 C Bi:2:013:1 0 19968 = d400a900 94009500 ad00bc00 9700dc00 8a004e00 a100a100 de007900 5400c200
ffff880144dd0ec0 1720672901 S Bi:2:013:1 -115 16384 <
ffff880144dd0ec0 1720722931 C Bi:2:013:1 0 16384 = 7e6bfb6b ea6cc069 516a8866 d0661a63 4d646a62 48631b62 8662b563 95630664
ffff880144dd0ec0 1720724866 S Bi:2:013:1 -115 16384 <
ffff880144dd0ec0 1720775699 C Bi:2:013:1 0 16384 = b21df91c db1dc01c f91e921d ca1f511d 3b1d6411 a611b411 c811f210 38110f10
ffff880144dd0ec0 1720776903 S Bi:2:013:1 -115 12800 <
ffff880144dd0ec0 1720815167 C Bi:2:013:1 0 12800 = b912d013 a213c212 2c130513 44131f13 a5127113 580c010a 3e29da29 af24fb25
ffff880144dd0ec0 1720821910 S Bi:2:013:1 -115 19968 <
ffff880144dd0ec0 1720870808 C Bi:2:013:1 0 19968 = 65037e09 200b800d f507881d 8d229324 36233d21 cb227c23 c624c121 c6234f24
ffff880144dd0ec0 1720873862 S Bi:2:013:1 -115 16384 <
ffff880144dd0ec0 1720923579 C Bi:2:013:1 0 16384 = 8a00b300 ba009900 8900c900 8e009100 b900de00 a2007400 9000d100 a400a500
ffff880144dd0ec0 1720925954 S Bi:2:013:1 -115 16384 <
ffff880144dd0ec0 1720976146 C Bi:2:013:1 0 16384 = 43730e76 646f5a6d 4475fa72 1d71a16d de71146f b773b574 1d73fe72 a66e8172
ffff880144dd0ec0 1720977864 S Bi:2:013:1 -115 12800 <
ffff880144dd0ec0 1721022025 C Bi:2:013:1 0 12800 = aa555e56 0b573657 b657bc54 36573254 ce563054 7153c854 0253ba58 085ad559
ffff880144dd0ec0 1721031907 S Bi:2:013:1 -115 15872 <
ffff880144dd0ec0 1721064372 C Bi:2:013:1 0 15872 = ea153f14 3b158b15 98157014 21170e16 c3151116 68163117 5a176716 c3156116
ffff880144dd0ec0 1721069906 S Bi:2:013:1 -115 512 <
ffff880144dd0ec0 1721069998 C Bi:2:013:1 0 186 = c0007d00 7d00a900 d7003b00 7800bf00 6e009c00 f900a100 7000a000 a000c700
ffff880144dd0500 1721072819 S Ci:2:013:0 s c0 0c 0084 48c8 0001 1 <
ffff880144dd0500 1721073172 C Ci:2:013:0 0 1 = 03
ffff880144dd0500 1721075942 S Ci:2:013:0 s c0 0c 0084 48c8 0001 1 <
ffff880144dd0500 1721076287 C Ci:2:013:0 0 1 = 00
ffff880144dd0500 1721079868 S Co:2:013:0 s 40 0c 0088 0084 0001 1 = ff
ffff880144dd0500 1721080278 C Co:2:013:0 0 1 >
ffff880144dd0500 1721082996 S Co:2:013:0 s 40 0c 0088 0084 0001 1 = aa
ffff880144dd0500 1721083410 C Co:2:013:0 0 1 >
ffff880144dd0500 1721090807 S Co:2:013:0 s 40 0c 0088 0084 0001 1 = 55
ffff880144dd0500 1721091272 C Co:2:013:0 0 1 >
ffff880144dd0500 1721093342 S Co:2:013:0 s 40 0c 0088 0084 0001 1 = 00
ffff880144dd0500 1721093813 C Co:2:013:0 0 1 >
ffff880144dd0500 1721096240 S Co:2:013:0 s 40 0c 0088 0084 0001 1 = ff
ffff880144dd0500 1721096811 C Co:2:013:0 0 1 >
ffff880144dd0500 1721099267 S Co:2:013:0 s 40 0c 0088 0084 0001 1 = 87
ffff880144dd0500 1721099811 C Co:2:013:0 0 1 >
ffff880144dd0500 1721102331 S Co:2:013:0 s 40 0c 0088 0084 0001 1 = 78
ffff880144dd0500 1721102812 C Co:2:013:0 0 1 >
ffff880144dd0500 1721105368 S Co:2:013:0 s 40 0c 0088 0084 0001 1 = e0
ffff880144dd0500 1721105902 C Co:2:013:0 0 1 >
ffff880144dd0500 1721108239 S Co:2:013:0 s 40 0c 0087 0084 0001 1 = 05
ffff880144dd0500 1721108689 C Co:2:013:0 0 1 >
ffff880144dd0500 1721111289 S Co:2:013:0 s 40 0c 0087 0084 0001 1 = 04
ffff880144dd0500 1721111811 C Co:2:013:0 0 1 >
ffff880144dd0500 1721114342 S Co:2:013:0 s 40 0c 0088 0084 0001 1 = ff
ffff880144dd0500 1721114795 C Co:2:013:0 0 1 >
ffff880144dd0500 1721117395 S Co:2:013:0 s 40 0c 0085 0088 0001 1 = 08
ffff880144dd0500 1721117780 C Co:2:013:0 0 1 >
ffff880144dd0ec0 1721120280 S Co:2:013:0 s 40 0c 0085 0088 0001 1 = 00
ffff880144dd0ec0 1721120668 C Co:2:013:0 0 1 >
ffff880144dd0ec0 1721123269 S Co:2:013:0 s 40 0c 0085 0088 0001 1 = 00
ffff880144dd0ec0 1721123713 C Co:2:013:0 0 1 >
ffff88008e887140 1721126298 S Co:2:013:0 s 40 0c 0085 0088 0001 1 = 00
ffff88008e887140 1721126649 C Co:2:013:0 0 1 >
ffff88008e887140 1721130335 S Co:2:013:0 s 40 0c 0085 0088 0001 1 = ff
ffff88008e887140 1721130751 C Co:2:013:0 0 1 >
ffff88008e887140 1721133297 S Co:2:013:0 s 40 0c 0085 0088 0001 1 = 00
ffff88008e887140 1721133623 C Co:2:013:0 0 1 >
ffff88008e887140 1721135421 S Ci:2:013:0 s c0 0c 0084 0006 0001 1 <
ffff88008e887140 1721135624 C Ci:2:013:0 0 1 = 01
ffff88008e887140 1721139363 S Co:2:013:0 s 40 04 0082 1694 0008 8 = 00000000 ba3e0700
ffff88008e887140 1721139751 C Co:2:013:0 0 8 >
ffff88008e887140 1721141497 S Bi:2:013:1 -115 19968 <
ffff88008e887140 1721150753 C Bi:2:013:1 0 19968 = 5252a700 5c008e00 66009700 3700a200 9600a400 5300be00 72008300 70008900
ffff88008e887140 1721151408 S Bi:2:013:1 -115 16384 <
ffff88008e887140 1721184922 C Bi:2:013:1 0 16384 = 73775479 9c78cb73 ca78b373 6479bc76 2777fb75 8d738374 7d700574 d273c879
ffff88008e887140 1721187374 S Bi:2:013:1 -115 16384 <
ffff88008e887140 1721237639 C Bi:2:013:1 0 16384 = 376d886f 786c346e b26df96d 5a6f466e 0b6b666d df6ee870 d06e146f cf72da6a
ffff88008e887140 1721240840 S Bi:2:013:1 -115 12800 <
ffff88008e887140 1721275221 C Bi:2:013:1 0 12800 = 7c258a23 fa241125 1626cb24 99242f26 12258624 21253927 6d25f524 5c26b926
ffff88008e887140 1721278789 S Bi:2:013:1 -115 19968 <
ffff88008e887140 1721339221 C Bi:2:013:1 0 19968 = db25e522 cd258a22 2a238722 58259324 33247425 a7244e25 d2249f24 4b24de25
ffff88008e887140 1721346897 S Bi:2:013:1 -115 16384 <
ffff88008e887140 1721391807 C Bi:2:013:1 0 16384 = b7006d00 cb007000 7700a000 38008900 9f006a00 a0009e00 5900a300 99006d00
ffff88008e887140 1721398807 S Bi:2:013:1 -115 16384 <
ffff88008e887140 1721444597 C Bi:2:013:1 0 16384 = f57a817c ad7fe77a 487eca77 297cbc76 5677337f 137ea17b 0b7a107b 7d7da27d
ffff88008e887140 1721450975 S Bi:2:013:1 -115 12800 <
ffff88008e887140 1721484056 C Bi:2:013:1 0 12800 = 0d64ba61 46665161 c3673263 8563f066 af67d765 0e64be65 9f654c64 34659b66
ffff88008e887140 1721488860 S Bi:2:013:1 -115 19968 <
ffff88008e887140 1721549827 C Bi:2:013:1 0 19968 = 173ee840 bb3ce140 263f7c3e d73dd641 313d8a3c fb3c543f e93e8f3f c03d8b3e
ffff88008e887140 1721556832 S Bi:2:013:1 -115 16384 <
ffff88008e887140 1721592441 C Bi:2:013:1 0 16384 = ad00e900 94009d00 9e00d300 7a00b200 79009400 bd007f00 73009c00 5200b200
ffff88008e887140 1721592842 S Bi:2:013:1 -115 16384 <
ffff88008e887140 1721645022 C Bi:2:013:1 0 16384 = ba00db00 f0007700 e100c200 97006300 7200c400 e600ef00 ee007b00 a400a800
ffff88008e887140 1721653813 S Bi:2:013:1 -115 12800 <
ffff88008e887140 1721690985 C Bi:2:013:1 0 12800 = 806db66f 46691368 e76ead6f 086d946a c26d6c6c 7e6db86f 03728069 c46cf16f
ffff88008e887140 1721698778 S Bi:2:013:1 -115 19968 <
ffff88008e887140 1721750424 C Bi:2:013:1 0 19968 = 4a6ee26b 8c6e346f 2b703670 ad6cf971 e273ff76 ee70456e 90700773 0c708d74
ffff88008e887140 1721750929 S Bi:2:013:1 -115 16384 <
ffff88008e887140 1721803060 C Bi:2:013:1 0 16384 = d30d730d a70dcd03 111fdd25 dc259623 f2256325 d1259025 e523b526 61262825
ffff88008e887140 1721811839 S Bi:2:013:1 -115 16384 <
ffff88008e887140 1721854051 C Bi:2:013:1 0 16384 = 7a009800 5500d400 c7009f00 7e005a00 cc00c000 8800c400 0501bc00 66006100
ffff88008e887140 1721856800 S Bi:2:013:1 -115 12800 <
ffff88008e887140 1721891573 C Bi:2:013:1 0 12800 = a2009b00 5200cc00 88007c00 8c009700 67009900 88003200 90009100 7300de00
ffff88008e887140 1721894827 S Bi:2:013:1 -115 19968 <
ffff88008e887140 1721959445 C Bi:2:013:1 0 19968 = aa0b080e ed0ae506 c202bf04 5b01c900 e500f900 e200f600 1601f300 e100f300
ffff88008e887140 1721962948 S Bi:2:013:1 -115 16384 <
ffff88008e887140 1722012074 C Bi:2:013:1 0 16384 = 731acc1a c61aa519 541a881a e820d01f fe1e581e 9d1f3420 6821ea1f 221e561f
ffff88008e887140 1722014970 S Bi:2:013:1 -115 16384 <
ffff88008e887140 1722064671 C Bi:2:013:1 0 16384 = c40aae0a 180b220b e00ac50a 9b0b3f04 f2130526 8027c825 76221423 09268325
ffff88008e887140 1722066949 S Bi:2:013:1 -115 12800 <
ffff88008e887140 1722100454 C Bi:2:013:1 0 12800 = b9008000 8800ac00 9200bb00 92008b00 81000c01 8300b100 e500b700 54009f00
ffff88008e887140 1722104756 S Bi:2:013:1 -115 19968 <
ffff88008e887140 1722166164 C Bi:2:013:1 0 19968 = 5300a800 7d00c900 da009c00 da00a300 62003c00 7d009e00 5200d500 96005b00
ffff88008e887140 1722172884 S Bi:2:013:1 -115 16384 <
ffff88008e887140 1722218787 C Bi:2:013:1 0 16384 = 9679c17c 4b80cf7d 0a7ec87b 5c7f0a7f 4381ed7e 8878e977 36734153 b2504d68
ffff88008e887140 1722224822 S Bi:2:013:1 -115 16384 <
ffff88008e887140 1722271573 C Bi:2:013:1 0 16384 = 317c7e84 88812785 4b7fff7e a07eb079 f47ef181 8c7c3c7f e080d07e 4d7df57b
ffff88008e887140 1722276811 S Bi:2:013:1 -115 12800 <
ffff88008e887140 1722311225 C Bi:2:013:1 0 12800 = eb0b1d0c d10a9e0c a90bf90c a70caa0b ce0b7a0c 520d1006 8f14fb27 222a4f25
ffff88008e887140 1722314818 S Bi:2:013:1 -115 19968 <
ffff88008e887140 1722366833 C Bi:2:013:1 0 19968 = e101fc06 330cd20c 6e07d91d 6e22c323 2a228b20 50215522 0f26c621 6f243225
ffff88008e887140 1722366918 S Bi:2:013:1 -115 16384 <
ffff88008e887140 1722419444 C Bi:2:013:1 0 16384 = 96000b01 4e00b800 f200ed00 7e00a100 ba009900 b900aa00 a000d700 bd00a800
ffff88008e887140 1722427746 S Bi:2:013:1 -115 16384 <
ffff88008e887140 1722472055 C Bi:2:013:1 0 16384 = 65510d56 60579654 c6578257 34562c57 5956e254 745bed6b 3569346d d36bf567
ffff88008e887140 1722479815 S Bi:2:013:1 -115 12800 <
ffff88008e887140 1722517965 C Bi:2:013:1 0 12800 = 240ec60c 9a0d060d 870c4c0c a50c330d 9e0c280c 900c8b0d 6b0c660c b5105211
ffff88008e887140 1722524767 S Bi:2:013:1 -115 15872 <
ffff88008e887140 1722560323 C Bi:2:013:1 0 15872 = c403c803 2b04e403 1904b203 bb03c603 70049704 a1045f04 6d04b204 68047204
ffff88008e887140 1722562780 S Bi:2:013:1 -115 512 <
ffff88008e887140 1722562971 C Bi:2:013:1 0 186 = 6400a500 97005800 db00ac00 63007000 7900b300 8300ae00 b2009700 a100b500
ffff88008e887140 1722565811 S Ci:2:013:0 s c0 0c 0084 48c8 0001 1 <
ffff88008e887140 1722566050 C Ci:2:013:0 0 1 = 03
ffff88008e887140 1722568886 S Ci:2:013:0 s c0 0c 0084 48c8 0001 1 <
ffff88008e887140 1722569175 C Ci:2:013:0 0 1 = 00
ffff88008e887140 1722572753 S Co:2:013:0 s 40 0c 0088 0084 0001 1 = ff
ffff88008e887140 1722573220 C Co:2:013:0 0 1 >
ffff88008e887140 1722575784 S Co:2:013:0 s 40 0c 0088 0084 0001 1 = aa
ffff88008e887140 1722576222 C Co:2:013:0 0 1 >
ffff88008e887140 1722578819 S Co:2:013:0 s 40 0c 0088 0084 0001 1 = 55
ffff88008e887140 1722579347 C Co:2:013:0 0 1 >
ffff88008e887140 1722581848 S Co:2:013:0 s 40 0c 0088 0084 0001 1 = 00
ffff88008e887140 1722582299 C Co:2:013:0 0 1 >
ffff88008e887140 1722586709 S Co:2:013:0 s 40 0c 0088 0084 0001 1 = ff
ffff88008e887140 1722587176 C Co:2:013:0 0 1 >
ffff88008e887140 1722589249 S Co:2:013:0 s 40 0c 0088 0084 0001 1 = 87
ffff88008e887140 1722589722 C Co:2:013:0 0 1 >
ffff88008e887140 1722592284 S Co:2:013:0 s 40 0c 0088 0084 0001 1 = 78
ffff88008e887140 1722592704 C Co:2:013:0 0 1 >
ffff88008e887140 1722595319 S Co:2:013:0 s 40 0c 0088 0084 0001 1 = e0
ffff88008e887140 1722595675 C Co:2:013:0 0 1 >
ffff88008e887140 1722598231 S Co:2:013:0 s 40 0c 0087 0084 0001 1 = 05
ffff88008e887140 1722598675 C Co:2:013:0 0 1 >
ffff88008e887140 1722601251 S Co:2:013:0 s 40 0c 0087 0084 0001 1 = 04
ffff88008e887140 1722601722 C Co:2:013:0 0 1 >
ffff88008e887140 1722604293 S Co:2:013:0 s 40 0c 0088 0084 0001 1 = ff
ffff88008e887140 1722604698 C Co:2:013:0 0 1 >
ffff88008e887140 1722607324 S Co:2:013:0 s 40 0c 0085 0088 0001 1 = 08
ffff88008e887140 1722607675 C Co:2:013:0 0 1 >
ffff88008e887140 1722610213 S Co:2:013:0 s 40 0c 0085 0088 0001 1 = 00
ffff88008e887140 1722610564 C Co:2:013:0 0 1 >
ffff88008e887140 1722613250 S Co:2:013:0 s 40 0c 0085 0088 0001 1 = 00
ffff88008e887140 1722613676 C Co:2:013:0 0 1 >
ffff88008e887140 1722616281 S Co:2:013:0 s 40 0c 0085 0088 0001 1 = 00
ffff88008e887140 1722616721 C Co:2:013:0 0 1 >
ffff88008e887140 1722619305 S Co:2:013:0 s 40 0c 0085 0088 0001 1 = ff
ffff88008e887140 1722619675 C Co:2:013:0 0 1 >
ffff88008e887140 1722622208 S Co:2:013:0 s 40 0c 0085 0088 0001 1 = 00
ffff88008e887140 1722622551 C Co:2:013:0 0 1 >
ffff88008e887140 1722624244 S Ci:2:013:0 s c0 0c 0084 0006 0001 1 <
ffff88008e887140 1722624637 C Ci:2:013:0 0 1 = 01
ffff88008e887140 1722628295 S Co:2:013:0 s 40 04 0082 1694 0008 8 = 00000000 ba3e0700
ffff88008e887140 1722628678 C Co:2:013:0 0 8 >
ffff88008e887140 1722630300 S Bi:2:013:1 -115 19968 <
ffff88008e887140 1722638695 C Bi:2:013:1 0 19968 = 5252ab00 7200aa00 98009300 84007300 c0006400 78008500 9b009300 91003e00
ffff88008e887140 1722640361 S Bi:2:013:1 -115 16384 <
ffff88008e887140 1722680814 C Bi:2:013:1 0 16384 = fb691c6d aa6d906c cb6ce26d 686ccb6b 056ee46b b06eff6d 836ad26b 6068f96a
ffff88008e887140 1722685246 S Bi:2:013:1 -115 16384 <
ffff88008e887140 1722733633 C Bi:2:013:1 0 16384 = 7e104911 1d11f011 53129111 05123411 6613d712 83125812 90138612 4813c913
ffff88008e887140 1722737325 S Bi:2:013:1 -115 12800 <
ffff88008e887140 1722771055 C Bi:2:013:1 0 12800 = bc262c25 05289726 7f1c0804 eb10aa28 5827b729 f5251b28 fc16cd03 d4184e29
ffff88008e887140 1722780571 S Bi:2:013:1 -115 19968 <
ffff88008e887140 1722835113 C Bi:2:013:1 0 19968 = e6235e23 41259823 5f247423 36244a24 64254a24 1c247c25 d7228a24 11262e24
ffff88008e887140 1722842474 S Bi:2:013:1 -115 16384 <
ffff88008e887140 1722887681 C Bi:2:013:1 0 16384 = 61009100 68007a00 b3009b00 e1007d00 8200cf00 f5006400 36008300 4d006f00
ffff88008e887140 1722894532 S Bi:2:013:1 -115 16384 <
ffff88008e887140 1722940477 C Bi:2:013:1 0 16384 = 5f782a7c ab7f307a d579ba7b b676f179 d47bf279 fb7feb7c 8872077a e67a7179
ffff88008e887140 1722946544 S Bi:2:013:1 -115 12800 <
ffff88008e887140 1722979979 C Bi:2:013:1 0 12800 = 6e5de45c 245d6359 1b5b0c5c 575cec5b 99597b5f 205ed45d 2c60355d ed5d395e
ffff88008e887140 1722984434 S Bi:2:013:1 -115 19968 <
ffff88008e887140 1723045895 C Bi:2:013:1 0 19968 = a9023c03 e501d302 d702ff02 bb028202 e902be02 94029f02 6f02ef02 7702dc02
ffff88008e887140 1723052410 S Bi:2:013:1 -115 16384 <
ffff88008e887140 1723088341 C Bi:2:013:1 0 16384 = 65006900 5e00ad00 73005400 be00d300 67009800 e2008f00 92009000 8200f400
ffff88008e887140 1723088480 S Bi:2:013:1 -115 16384 <
ffff88008e887140 1723140944 C Bi:2:013:1 0 16384 = f8008900 9b00cd00 df00c600 ad00ab00 95008400 96009200 e8005200 76008600
ffff88008e887140 1723149564 S Bi:2:013:1 -115 12800 <
ffff88008e887140 1723186844 C Bi:2:013:1 0 12800 = 106dae6c 066d0c69 a16e926b 9e6ace6b 7a6aeb6a e068546a ee70966e fa6c8e6b
ffff88008e887140 1723194528 S Bi:2:013:1 -115 19968 <
ffff88008e887140 1723246259 C Bi:2:013:1 0 19968 = 966db46b 036e766a c86b716d 386d6e6e 146bde6c 8f6b536c 166ada6a 936b846c
ffff88008e887140 1723246527 S Bi:2:013:1 -115 16384 <
ffff88008e887140 1723298950 C Bi:2:013:1 0 16384 = 64062f06 01072605 c106f125 fb278d25 a2268723 d1255928 5321fd12 ef14be19
ffff88008e887140 1723307450 S Bi:2:013:1 -115 16384 <
ffff88008e887140 1723349851 C Bi:2:013:1 0 16384 = c6007a00 9500d700 bd009700 8700a500 8d00cc00 9400b000 ae006c00 9b00be00
ffff88008e887140 1723352390 S Bi:2:013:1 -115 12800 <
ffff88008e887140 1723387366 C Bi:2:013:1 0 12800 = 8b007300 b8009200 55006500 7400cb00 9500a600 8500b800 5500cb00 8200a500
ffff88008e887140 1723390432 S Bi:2:013:1 -115 19968 <
ffff88008e887140 1723455266 C Bi:2:013:1 0 19968 = 860e470e 1b0b1407 9202fd04 05012601 e700cc00 c500b800 c2009d00 ea008900
ffff88008e887140 1723458548 S Bi:2:013:1 -115 16384 <
ffff88008e887140 1723507872 C Bi:2:013:1 0 16384 = 6a107410 5f118f0f 5a106210 3615ae16 cf14ae14 7b16af15 f3164215 ef157915
ffff88008e887140 1723510483 S Bi:2:013:1 -115 16384 <
ffff88008e887140 1723560617 C Bi:2:013:1 0 16384 = c3046004 2905d604 d6052a06 dd05ca04 54051624 5824e723 bd245822 e223b524
ffff88008e887140 1723562491 S Bi:2:013:1 -115 12800 <
ffff88008e887140 1723596249 C Bi:2:013:1 0 12800 = 8800e000 98006c00 c600b300 bf00dc00 8b00b200 a900b200 bb00d000 c0008100
ffff88008e887140 1723600452 S Bi:2:013:1 -115 19968 <
ffff88008e887140 1723662025 C Bi:2:013:1 0 19968 = 8c009600 64005400 a7001900 b7007f00 69008400 0c01ab00 0501e900 9800a800
ffff88008e887140 1723668459 S Bi:2:013:1 -115 16384 <
ffff88008e887140 1723714797 C Bi:2:013:1 0 16384 = d9627760 485f575d 0e633e62 59627871 5674a975 8a748e72 46747973 3876c973
ffff88008e887140 1723720545 S Bi:2:013:1 -115 16384 <
ffff88008e887140 1723767396 C Bi:2:013:1 0 16384 = ed1e3b1e 431d881d 8b1d721d 851dac1c 1d1d9b1d 4e224c24 db218923 df22bf23
ffff88008e887140 1723772525 S Bi:2:013:1 -115 12800 <
ffff88008e887140 1723807001 C Bi:2:013:1 0 12800 = 44079506 c8059305 4d069a06 06063406 df068606 90063d06 44063426 0a297e25
ffff88008e887140 1723810462 S Bi:2:013:1 -115 19968 <
ffff88008e887140 1723862670 C Bi:2:013:1 0 19968 = b8028b08 080cae0d 9a0f2f1f f223dd20 85233823 2b23f223 c3225022 d924b924
ffff88008e887140 1723871438 S Bi:2:013:1 -115 16384 <
ffff88008e887140 1723915297 C Bi:2:013:1 0 16384 = 66008b00 cf00a500 a5009400 96009900 9d00c700 97008200 8000b100 9c00a400
ffff88008e887140 1723916412 S Bi:2:013:1 -115 16384 <
ffff88008e887140 1723967913 C Bi:2:013:1 0 16384 = 866f4b6e f46f2870 ae6cfd6a 1a6f5770 2f6db76c b26c756f 0272e870 6a727473
ffff88008e887140 1723968560 S Bi:2:013:1 -115 12800 <
ffff88008e887140 1724013928 C Bi:2:013:1 0 12800 = f94bc74d 6948c349 2e4ba54b 654aa64c 704b714a a54a904a d04b3949 da52fc50
ffff88008e887140 1724022586 S Bi:2:013:1 -115 15872 <
ffff88008e887140 1724056149 C Bi:2:013:1 0 15872 = d5059505 ad050205 b0056d05 b005e605 e1056806 b9051306 b1063c06 3e06c306
ffff88008e887140 1724060384 S Bi:2:013:1 -115 512 <
ffff88008e887140 1724060504 C Bi:2:013:1 0 186 = 56008c00 2a003b00 ab00aa00 af00ed00 8c009a00 8c00d300 9200c700 9e00ad00
ffff88008e887140 1724063406 S Ci:2:013:0 s c0 0c 0084 48c8 0001 1 <
ffff88008e887140 1724063758 C Ci:2:013:0 0 1 = 03
ffff88008e887140 1724066611 S Ci:2:013:0 s c0 0c 0084 48c8 0001 1 <
ffff88008e887140 1724066883 C Ci:2:013:0 0 1 = 00
ffff88008e887140 1724070459 S Co:2:013:0 s 40 0c 0088 0084 0001 1 = ff
ffff88008e887140 1724070870 C Co:2:013:0 0 1 >
ffff88008e887140 1724073451 S Co:2:013:0 s 40 0c 0088 0084 0001 1 = aa
ffff88008e887140 1724073892 C Co:2:013:0 0 1 >
ffff88008e887140 1724076430 S Co:2:013:0 s 40 0c 0088 0084 0001 1 = 55
ffff88008e887140 1724076885 C Co:2:013:0 0 1 >
ffff8800941333c0 1724079512 S Co:2:013:0 s 40 0c 0088 0084 0001 1 = 00
ffff8800941333c0 1724079974 C Co:2:013:0 0 1 >
ffff8800941333c0 1724082498 S Co:2:013:0 s 40 0c 0088 0084 0001 1 = ff
ffff8800941333c0 1724082857 C Co:2:013:0 0 1 >
ffff8800941333c0 1724088050 S Co:2:013:0 s 40 0c 0088 0084 0001 1 = 87
ffff8800941333c0 1724088475 C Co:2:013:0 0 1 >
ffff8800941333c0 1724091084 S Co:2:013:0 s 40 0c 0088 0084 0001 1 = 78
ffff8800941333c0 1724091474 C Co:2:013:0 0 1 >
ffff8800941333c0 1724094120 S Co:2:013:0 s 40 0c 0088 0084 0001 1 = e0
ffff8800941333c0 1724094473 C Co:2:013:0 0 1 >
ffff8800941333c0 1724097016 S Co:2:013:0 s 40 0c 0087 0084 0001 1 = 05
ffff8800941333c0 1724097472 C Co:2:013:0 0 1 >
ffff8800941333c0 1724100053 S Co:2:013:0 s 40 0c 0087 0084 0001 1 = 04
ffff8800941333c0 1724100473 C Co:2:013:0 0 1 >
ffff8800941333c0 1724103090 S Co:2:013:0 s 40 0c 0088 0084 0001 1 = ff
ffff8800941333c0 1724103474 C Co:2:013:0 0 1 >
ffff8800941333c0 1724106129 S Co:2:013:0 s 40 0c 0085 0088 0001 1 = 08
ffff8800941333c0 1724106500 C Co:2:013:0 0 1 >
ffff8800941333c0 1724109013 S Co:2:013:0 s 40 0c 0085 0088 0001 1 = 00
ffff8800941333c0 1724109348 C Co:2:013:0 0 1 >
ffff8800941333c0 1724112047 S Co:2:013:0 s 40 0c 0085 0088 0001 1 = 00
ffff8800941333c0 1724112349 C Co:2:013:0 0 1 >
ffff8800941333c0 1724115081 S Co:2:013:0 s 40 0c 0085 0088 0001 1 = 00
ffff8800941333c0 1724115474 C Co:2:013:0 0 1 >
ffff8800941333c0 1724118112 S Co:2:013:0 s 40 0c 0085 0088 0001 1 = ff
ffff8800941333c0 1724118475 C Co:2:013:0 0 1 >
ffff8800941333c0 1724121018 S Co:2:013:0 s 40 0c 0085 0088 0001 1 = 00
ffff8800941333c0 1724121349 C Co:2:013:0 0 1 >
ffff8800941333c0 1724123040 S Ci:2:013:0 s c0 0c 0084 0006 0001 1 <
ffff8800941333c0 1724123474 C Ci:2:013:0 0 1 = 01
ffff8800941333c0 1724128108 S Co:2:013:0 s 40 04 0082 1694 0008 8 = 00000000 ba3e0700
ffff8800941333c0 1724128478 C Co:2:013:0 0 8 >
ffff8800941333c0 1724129633 S Bi:2:013:1 -115 19968 <
ffff8800941333c0 1724138942 C Bi:2:013:1 0 19968 = 52526200 65005b00 6e00a700 59006d00 56009700 6500b500 68005e00 40006800
ffff8800941333c0 1724139636 S Bi:2:013:1 -115 16384 <
ffff8800941333c0 1724176767 C Bi:2:013:1 0 16384 = 7b741075 da78e578 3b6ef474 c0772171 fb71f273 4974ee75 cf738070 bf6d8a6a
ffff8800941333c0 1724184538 S Bi:2:013:1 -115 16384 <
ffff8800941333c0 1724229518 C Bi:2:013:1 0 16384 = df4cb649 404b2b49 cf4a6e4d 1e4cc94a 1c4d084e a94b6b4f 1e4e924c 6e4ef04c
ffff8800941333c0 1724236593 S Bi:2:013:1 -115 12800 <
ffff8800941333c0 1724266870 C Bi:2:013:1 0 12800 = d224bd24 91238d24 ae266825 ef25b924 18262229 37277826 0626b425 fb252026
ffff8800941333c0 1724278949 S Bi:2:013:1 -115 19968 <
ffff8800941333c0 1724331064 C Bi:2:013:1 0 19968 = 56210e23 6522b724 f2214923 4f24fc23 0b252e26 ec244924 4a234025 6424ec23
ffff8800941333c0 1724334026 S Bi:2:013:1 -115 16384 <
ffff8800941333c0 1724383696 C Bi:2:013:1 0 16384 = 9c009600 58006100 81006b00 7f008500 a7009600 62002d00 5c008900 60008f00
ffff8800941333c0 1724385989 S Bi:2:013:1 -115 16384 <
ffff8800941333c0 1724436282 C Bi:2:013:1 0 16384 = 22753b71 fe6ff96b 7971ff72 2874eb73 936a4268 19703570 56709471 6272c273
ffff8800941333c0 1724438020 S Bi:2:013:1 -115 12800 <
ffff8800941333c0 1724475889 C Bi:2:013:1 0 12800 = d413b512 42142415 c5136b13 a3151814 bf143c14 a8156316 ac138c14 ef13a114
ffff8800941333c0 1724482867 S Bi:2:013:1 -115 19968 <
ffff8800941333c0 1724541661 C Bi:2:013:1 0 19968 = 28358033 6333b132 f232f335 94328133 f232f232 e732fb31 b2322e34 f6332334
ffff8800941333c0 1724543886 S Bi:2:013:1 -115 16384 <
ffff8800941333c0 1724584294 C Bi:2:013:1 0 16384 = 89009c00 76007100 77007c00 8d008000 7e005100 86006f00 a500a100 8a006b00
ffff8800941333c0 1724588855 S Bi:2:013:1 -115 16384 <
ffff8800941333c0 1724636918 C Bi:2:013:1 0 16384 = 5f007a00 7f009f00 d2006f00 b0007200 ad006000 9100a300 59007b00 98009000
ffff8800941333c0 1724640925 S Bi:2:013:1 -115 12800 <
ffff8800941333c0 1724682782 C Bi:2:013:1 0 12800 = 1205c804 6205a704 ce04cf04 3004b404 54053d05 dc044b05 2b044804 ce043404
ffff8800941333c0 1724685847 S Bi:2:013:1 -115 19968 <
ffff8800941333c0 1724742247 C Bi:2:013:1 0 19968 = 1d20901f 8c209020 8e20661f 0723a821 60211322 061fbd20 451f2120 ec212320
ffff8800941333c0 1724746871 S Bi:2:013:1 -115 16384 <
ffff8800941333c0 1724794917 C Bi:2:013:1 0 16384 = 0b030d03 d8029402 e403e023 9527a725 4f24af24 d5251e26 a8272806 87062f28
ffff8800941333c0 1724798924 S Bi:2:013:1 -115 16384 <
ffff8800941333c0 1724845793 C Bi:2:013:1 0 16384 = c8006700 74006900 7d00a200 5300bb00 6600d900 88007800 4600af00 90004400
ffff8800941333c0 1724850982 S Bi:2:013:1 -115 12800 <
ffff8800941333c0 1724883289 C Bi:2:013:1 0 12800 = 6a00bd00 7e007800 74008000 4c009800 b2006e00 71007700 ba00bc00 cb007b00
ffff8800941333c0 1724888826 S Bi:2:013:1 -115 19968 <
ffff8800941333c0 1724951159 C Bi:2:013:1 0 19968 = 1c0d480d 820b6804 1502df00 96006c00 b200d400 a400b100 5e009000 b7009d00
ffff8800941333c0 1724956946 S Bi:2:013:1 -115 16384 <
ffff8800941333c0 1725003819 C Bi:2:013:1 0 16384 = c508c808 4e071c08 7e070c09 1a0f6412 3512b212 ff113711 b7121711 93126a13
ffff8800941333c0 1725008991 S Bi:2:013:1 -115 16384 <
ffff8800941333c0 1725056591 C Bi:2:013:1 0 16384 = bd020003 a7020303 c002c302 fa022e03 9a03e321 f4244522 f923c923 4d264728
ffff8800941333c0 1725060921 S Bi:2:013:1 -115 12800 <
ffff8800941333c0 1725092256 C Bi:2:013:1 0 12800 = 5c00a900 94009300 de00a100 8e009d00 bd00c100 85009300 c700a500 df00bf00
ffff8800941333c0 1725098902 S Bi:2:013:1 -115 19968 <
ffff8800941333c0 1725158075 C Bi:2:013:1 0 19968 = 9e007c00 d4004100 d600b200 a1006d00 8f00a900 d0004e00 5b007500 2700a200
ffff8800941333c0 1725159919 S Bi:2:013:1 -115 16384 <
ffff8800941333c0 1725210680 C Bi:2:013:1 0 16384 = a529802a ef2b3a2a 802b112c d02a9213 4209300a f408e408 9f07cb08 e007ef08
ffff8800941333c0 1725211949 S Bi:2:013:1 -115 16384 <
ffff8800941333c0 1725263431 C Bi:2:013:1 0 16384 = 3b062707 7406e006 1406eb06 e2068106 9e06ce06 960adb0c f80cf90b 940bb90c
ffff8800941333c0 1725263990 S Bi:2:013:1 -115 12800 <
ffff8800941333c0 1725302941 C Bi:2:013:1 0 12800 = d1027202 b5029202 97029b02 c102b502 89022103 ed028903 0b055725 8529e328
ffff8800941333c0 1725308838 S Bi:2:013:1 -115 19968 <
ffff8800941333c0 1725358559 C Bi:2:013:1 0 19968 = d207dc0a be0b4809 c0133522 6924d523 0425d721 66237f24 35231f24 0c235c22
ffff8800941333c0 1725360904 S Bi:2:013:1 -115 16384 <
ffff8800941333c0 1725411354 C Bi:2:013:1 0 16384 = 81009100 84006800 8d007200 a3009700 85006e00 90006900 cd00b900 6e000c00
ffff8800941333c0 1725412961 S Bi:2:013:1 -115 16384 <
ffff8800941333c0 1725463927 C Bi:2:013:1 0 16384 = 251a691b 9a18da19 2619e61a e81a5f1a 301b731a 621cc70a 50047b04 bd03a003
ffff8800941333c0 1725464958 S Bi:2:013:1 -115 12800 <
ffff8800941333c0 1725509839 C Bi:2:013:1 0 12800 = e4012102 b902e601 52020d02 3c021d02 16023402 4202f801 43023d02 e402f702
ffff8800941333c0 1725518883 S Bi:2:013:1 -115 15872 <
ffff8800941333c0 1725552212 C Bi:2:013:1 0 15872 = e901d301 88027802 46023802 38021a02 6f02cc02 a4028602 a302ae02 0c032203
ffff8800941333c0 1725556933 S Bi:2:013:1 -115 512 <
ffff8800941333c0 1725557066 C Bi:2:013:1 0 186 = 93009400 b5008b00 a0009400 31009600 8e009700 ca009d00 a1007c00 99007a00
ffff8800941333c0 1725559820 S Ci:2:013:0 s c0 0c 0084 48c8 0001 1 <
ffff8800941333c0 1725560196 C Ci:2:013:0 0 1 = 03
ffff8800941333c0 1725562900 S Ci:2:013:0 s c0 0c 0084 48c8 0001 1 <
ffff8800941333c0 1725563179 C Ci:2:013:0 0 1 = 00
ffff8800941333c0 1725566907 S Co:2:013:0 s 40 0c 0088 0084 0001 1 = ff
ffff8800941333c0 1725567275 C Co:2:013:0 0 1 >
ffff8800941333c0 1725573748 S Co:2:013:0 s 40 0c 0088 0084 0001 1 = aa
ffff8800941333c0 1725574195 C Co:2:013:0 0 1 >
ffff8800941333c0 1725576787 S Co:2:013:0 s 40 0c 0088 0084 0001 1 = 55
ffff8800941333c0 1725577175 C Co:2:013:0 0 1 >
ffff8800941333c0 1725579820 S Co:2:013:0 s 40 0c 0088 0084 0001 1 = 00
ffff8800941333c0 1725580321 C Co:2:013:0 0 1 >
ffff8800941333c0 1725582949 S Co:2:013:0 s 40 0c 0088 0084 0001 1 = ff
ffff8800941333c0 1725583399 C Co:2:013:0 0 1 >
ffff8800941333c0 1725585766 S Co:2:013:0 s 40 0c 0088 0084 0001 1 = 87
ffff8800941333c0 1725586176 C Co:2:013:0 0 1 >
ffff8800941333c0 1725588787 S Co:2:013:0 s 40 0c 0088 0084 0001 1 = 78
ffff8800941333c0 1725589149 C Co:2:013:0 0 1 >
ffff8800941333c0 1725591822 S Co:2:013:0 s 40 0c 0088 0084 0001 1 = e0
ffff8800941333c0 1725592321 C Co:2:013:0 0 1 >
ffff8800941333c0 1725594857 S Co:2:013:0 s 40 0c 0087 0084 0001 1 = 05
ffff8800941333c0 1725595321 C Co:2:013:0 0 1 >
ffff8800941333c0 1725597765 S Co:2:013:0 s 40 0c 0087 0084 0001 1 = 04
ffff8800941333c0 1725598148 C Co:2:013:0 0 1 >
ffff8800941333c0 1725600806 S Co:2:013:0 s 40 0c 0088 0084 0001 1 = ff
ffff8800941333c0 1725601285 C Co:2:013:0 0 1 >
ffff8800941333c0 1725603852 S Co:2:013:0 s 40 0c 0085 0088 0001 1 = 08
ffff8800941333c0 1725604322 C Co:2:013:0 0 1 >
ffff8800941333c0 1725606900 S Co:2:013:0 s 40 0c 0085 0088 0001 1 = 00
ffff8800941333c0 1725607320 C Co:2:013:0 0 1 >
ffff8800941333c0 1725609740 S Co:2:013:0 s 40 0c 0085 0088 0001 1 = 00
ffff8800941333c0 1725610150 C Co:2:013:0 0 1 >
ffff8800941333c0 1725612767 S Co:2:013:0 s 40 0c 0085 0088 0001 1 = 00
ffff8800941333c0 1725613149 C Co:2:013:0 0 1 >
ffff8800941333c0 1725615798 S Co:2:013:0 s 40 0c 0085 0088 0001 1 = ff
ffff8800941333c0 1725616150 C Co:2:013:0 0 1 >
ffff8800941333c0 1725618828 S Co:2:013:0 s 40 0c 0085 0088 0001 1 = 00
ffff8800941333c0 1725619150 C Co:2:013:0 0 1 >
ffff8800941333c0 1725620783 S Ci:2:013:0 s c0 0c 0084 0006 0001 1 <
ffff8800941333c0 1725621025 C Ci:2:013:0 0 1 = 01
ffff8800941333c0 1725624772 S Co:2:013:0 s 40 04 0082 1694 0008 8 = 00000000 ba3e0700
ffff8800941333c0 1725625172 C Co:2:013:0 0 8 >
ffff8800941333c0 1725626796 S Bi:2:013:1 -115 19968 <
ffff8800941333c0 1725635854 C Bi:2:013:1 0 19968 = 52528f00 93007d00 94007100 60005500 6b005000 94008900 86008200 a1008100
ffff8800941333c0 1725636824 S Bi:2:013:1 -115 16384 <
ffff8800941333c0 1725672718 C Bi:2:013:1 0 16384 = c0035d03 6e03f202 f4025403 bd03e802 1b037c03 2d03ba03 68034203 dc023d03
ffff8800941333c0 1725672926 S Bi:2:013:1 -115 16384 <
ffff8800941333c0 1725725486 C Bi:2:013:1 0 16384 = 6103b303 3804fe02 60031104 6b040c04 c103bd03 61032a04 81040b04 d403a703
ffff8800941333c0 1725733796 S Bi:2:013:1 -115 12800 <
ffff8800941333c0 1725762953 C Bi:2:013:1 0 12800 = d5257a24 4424b125 2126d109 750a641c 9a242525 7f25b527 c726e624 7426fa23
ffff8800941333c0 1725771833 S Bi:2:013:1 -115 19968 <
ffff8800941333c0 1725826941 C Bi:2:013:1 0 19968 = 26245022 ea22fc24 f0221525 82233824 44247225 2225c324 f1243622 20252a20
ffff8800941333c0 1725832827 S Bi:2:013:1 -115 16384 <
ffff8800941333c0 1725879565 C Bi:2:013:1 0 16384 = 6d006a00 d1007d00 88004400 c1009d00 5c008400 d9008000 9b001000 90006600
ffff8800941333c0 1725884911 S Bi:2:013:1 -115 16384 <
ffff8800941333c0 1725932234 C Bi:2:013:1 0 16384 = 7c063b06 a705ad06 2606d205 5c06fe05 85062b06 f1065a06 8b062805 4706a406
ffff8800941333c0 1725936826 S Bi:2:013:1 -115 12800 <
ffff8800941333c0 1725971853 C Bi:2:013:1 0 12800 = 4c131213 1f11c413 2d137212 2c130e14 cf139513 e3131c13 3112f612 8b139013
ffff8800941333c0 1725974813 S Bi:2:013:1 -115 19968 <
ffff8800941333c0 1726037539 C Bi:2:013:1 0 19968 = 5f053004 0b059304 1205e904 ab04e304 e8045a04 ca044d05 e0045604 b004e204
ffff8800941333c0 1726042789 S Bi:2:013:1 -115 16384 <
ffff8800941333c0 1726080203 C Bi:2:013:1 0 16384 = a9006900 8a007100 90004e00 7d006d00 a5007100 66005600 ac006100 91008100
ffff8800941333c0 1726087726 S Bi:2:013:1 -115 16384 <
ffff8800941333c0 1726132833 C Bi:2:013:1 0 16384 = aa006500 62007e00 70002300 5a009f00 4b007e00 7f009b00 ca008200 7a007200
ffff8800941333c0 1726139796 S Bi:2:013:1 -115 12800 <
ffff8800941333c0 1726178729 C Bi:2:013:1 0 12800 = 3f1e401d fb1b261e 061b3c1e 461de21b 541c871d 351da21d 8f1d5f1f 281e1320
ffff8800941333c0 1726184748 S Bi:2:013:1 -115 19968 <
ffff8800941333c0 1726238072 C Bi:2:013:1 0 19968 = 1b2bbd25 65266029 77295127 72272729 322a5e2a 5a28be28 e2286d28 2b264628
ffff8800941333c0 1726245757 S Bi:2:013:1 -115 16384 <
ffff8800941333c0 1726290709 C Bi:2:013:1 0 16384 = 2101a401 a501e301 ed02a823 4a257524 4e249824 2e25af23 d1242826 97242024
ffff8800941333c0 1726297815 S Bi:2:013:1 -115 16384 <
ffff8800941333c0 1726341717 C Bi:2:013:1 0 16384 = 3b006000 4b007800 93007100 aa009b00 aa009f00 c100ad00 46009200 6100c300
ffff8800941333c0 1726342762 S Bi:2:013:1 -115 12800 <
ffff8800941333c0 1726379053 C Bi:2:013:1 0 12800 = 3a009d00 19015b00 93008f00 6900b100 0a01c700 dc004a00 8e007200 5c004d00
ffff8800941333c0 1726387731 S Bi:2:013:1 -115 19968 <
ffff8800941333c0 1726446962 C Bi:2:013:1 0 19968 = 180e830c 7b095102 41030401 ff007a00 bd00a700 e1008300 b1008b00 7e009300
ffff8800941333c0 1726448737 S Bi:2:013:1 -115 16384 <
ffff8800941333c0 1726499717 C Bi:2:013:1 0 16384 = d5249927 b9256924 9724a527 c5272025 e225f025 20256227 ac264929 9f0c5c05
ffff8800941333c0 1726500803 S Bi:2:013:1 -115 16384 <
ffff8800941333c0 1726552340 C Bi:2:013:1 0 16384 = 78015801 16013b01 a401ee01 10026802 69031a20 11220d25 1a25b821 5920f223
ffff8800941333c0 1726552856 S Bi:2:013:1 -115 12800 <
ffff8800941333c0 1726588104 C Bi:2:013:1 0 12800 = cb004700 b9006200 d700da00 1901bb00 c4007700 9c00f200 b700df00 8e00a800
ffff8800941333c0 1726590874 S Bi:2:013:1 -115 19968 <
ffff8800941333c0 1726654017 C Bi:2:013:1 0 19968 = 9a00da00 4700d800 77009200 9f006700 6000d800 50004f00 4a004f00 a7004900
ffff8800941333c0 1726658846 S Bi:2:013:1 -115 16384 <
ffff8800941333c0 1726706624 C Bi:2:013:1 0 16384 = 96161518 90158815 7d176515 1116af14 e5160e17 64161915 5e153a15 63144b14
ffff8800941333c0 1726710875 S Bi:2:013:1 -115 16384 <
ffff8800941333c0 1726759267 C Bi:2:013:1 0 16384 = 7a2bcb2a 462b3e2b 7029ad2a 382c6c28 af2a2329 9e288029 b3296a28 c6282429
ffff8800941333c0 1726762815 S Bi:2:013:1 -115 12800 <
ffff8800941333c0 1726798880 C Bi:2:013:1 0 12800 = b4255328 cf256b26 32285a28 b6287726 bd285526 ef274328 bd262626 1b28a927
ffff8800941333c0 1726807732 S Bi:2:013:1 -115 19968 <
ffff8800941333c0 1726854465 C Bi:2:013:1 0 19968 = c10a920a 790e1f19 a41fca22 8b238121 0c205322 6e225223 1f23d522 55250825
ffff8800941333c0 1726859798 S Bi:2:013:1 -115 16384 <
ffff8800941333c0 1726907278 C Bi:2:013:1 0 16384 = 73005f00 9a00f100 74007400 b2009000 7a009a00 b300c000 c8009f00 7d00c000
ffff8800941333c0 1726911844 S Bi:2:013:1 -115 16384 <
ffff8800941333c0 1726959849 C Bi:2:013:1 0 16384 = dc0bd025 662c3818 98036f16 e332970c 4603f20e 9b1c7023 321a2303 2f0caa12
ffff8800941333c0 1726963887 S Bi:2:013:1 -115 12800 <
ffff8800941333c0 1727005765 C Bi:2:013:1 0 12800 = 8f26da26 84297a0a 17090a1e c9214021 7d20f221 7d29d127 900a2f0b 8229eb0c
ffff8800941333c0 1727008809 S Bi:2:013:1 -115 15872 <
ffff8800941333c0 1727048119 C Bi:2:013:1 0 15872 = eb0d4d07 901c2127 4b1b9508 ed0e2b28 292ce829 5c0d3604 1806f71b a22bcf29
ffff8800941333c0 1727053800 S Bi:2:013:1 -115 512 <
ffff8800941333c0 1727053993 C Bi:2:013:1 0 186 = 9c009700 79006200 59007f00 8500bc00 6700b200 9b00a800 fc00b100 0401b000
ffff8800941333c0 1727056840 S Ci:2:013:0 s c0 0c 0084 48c8 0001 1 <
ffff8800941333c0 1727057245 C Ci:2:013:0 0 1 = 03
ffff8800941333c0 1727059943 S Ci:2:013:0 s c0 0c 0084 48c8 0001 1 <
ffff8800941333c0 1727060198 C Ci:2:013:0 0 1 = 00
ffff8800941333c0 1727063759 S Co:2:013:0 s 40 0c 0088 0084 0001 1 = ff
ffff8800941333c0 1727064198 C Co:2:013:0 0 1 >
ffff8800941333c0 1727066962 S Co:2:013:0 s 40 0c 0088 0084 0001 1 = aa
ffff8800941333c0 1727067324 C Co:2:013:0 0 1 >
ffff8800941333c0 1727073010 S Co:2:013:0 s 40 0c 0088 0084 0001 1 = 55
ffff8800941333c0 1727073449 C Co:2:013:0 0 1 >
ffff8800941333c0 1727075533 S Co:2:013:0 s 40 0c 0088 0084 0001 1 = 00
ffff8800941333c0 1727075948 C Co:2:013:0 0 1 >
ffff8800941333c0 1727078569 S Co:2:013:0 s 40 0c 0088 0084 0001 1 = ff
ffff8800941333c0 1727078949 C Co:2:013:0 0 1 >
ffff8800941333c0 1727081607 S Co:2:013:0 s 40 0c 0088 0084 0001 1 = 87
ffff8800941333c0 1727081948 C Co:2:013:0 0 1 >
ffff8800941333c0 1727084498 S Co:2:013:0 s 40 0c 0088 0084 0001 1 = 78
ffff8800941333c0 1727084948 C Co:2:013:0 0 1 >
ffff8800941333c0 1727087536 S Co:2:013:0 s 40 0c 0088 0084 0001 1 = e0
ffff8800941333c0 1727087992 C Co:2:013:0 0 1 >
ffff8800941333c0 1727090564 S Co:2:013:0 s 40 0c 0087 0084 0001 1 = 05
ffff8800941333c0 1727090996 C Co:2:013:0 0 1 >
ffff8800941333c0 1727093597 S Co:2:013:0 s 40 0c 0087 0084 0001 1 = 04
ffff8800941333c0 1727093970 C Co:2:013:0 0 1 >
ffff8800941333c0 1727096499 S Co:2:013:0 s 40 0c 0088 0084 0001 1 = ff
ffff8800941333c0 1727096974 C Co:2:013:0 0 1 >
ffff8800941333c0 1727099530 S Co:2:013:0 s 40 0c 0085 0088 0001 1 = 08
ffff8800941333c0 1727099969 C Co:2:013:0 0 1 >
ffff8800941333c0 1727102570 S Co:2:013:0 s 40 0c 0085 0088 0001 1 = 00
ffff8800941333c0 1727102996 C Co:2:013:0 0 1 >
ffff8800941333c0 1727105603 S Co:2:013:0 s 40 0c 0085 0088 0001 1 = 00
ffff8800941333c0 1727105994 C Co:2:013:0 0 1 >
ffff8800941333c0 1727108498 S Co:2:013:0 s 40 0c 0085 0088 0001 1 = 00
ffff8800941333c0 1727108851 C Co:2:013:0 0 1 >
ffff8800941333c0 1727111541 S Co:2:013:0 s 40 0c 0085 0088 0001 1 = d8
ffff8800941333c0 1727111996 C Co:2:013:0 0 1 >
ffff8800941333c0 1727114570 S Co:2:013:0 s 40 0c 0085 0088 0001 1 = 00
ffff8800941333c0 1727114999 C Co:2:013:0 0 1 >
ffff8800941333c0 1727116603 S Ci:2:013:0 s c0 0c 0084 0006 0001 1 <
ffff8800941333c0 1727116877 C Ci:2:013:0 0 1 = 01
ffff8800941333c0 1727120497 S Co:2:013:0 s 40 04 0082 1694 0008 8 = 00000000 10230600
ffff8800941333c0 1727120824 C Co:2:013:0 0 8 >
ffff8800941333c0 1727122526 S Bi:2:013:1 -115 19968 <
ffff8800941333c0 1727131732 C Bi:2:013:1 0 19968 = 52525400 d400c500 af008c00 9100b900 54009d00 af009000 7b008a00 a5008300
ffff8800941333c0 1727132701 S Bi:2:013:1 -115 16384 <
ffff8800941333c0 1727168642 C Bi:2:013:1 0 16384 = 6b26c926 48218e26 0126f826 ae240728 ce249827 5126c927 57264126 c524a925
ffff8800941333c0 1727168913 S Bi:2:013:1 -115 16384 <
ffff8800941333c0 1727221247 C Bi:2:013:1 0 16384 = f422ce24 1f234e25 1826b726 8a25f125 a2242a25 11279f25 0227de26 8a255a28
ffff8800941333c0 1727229719 S Bi:2:013:1 -115 12800 <
ffff8800941333c0 1727258915 C Bi:2:013:1 0 12800 = 1c23a325 ff23b925 8624f421 1f24c324 97241c23 0a240427 41249826 b125f924
ffff8800941333c0 1727267755 S Bi:2:013:1 -115 19968 <
ffff8800941333c0 1727322709 C Bi:2:013:1 0 19968 = 7823d821 7f213424 88244920 01232623 ad223f24 0923fb22 7a26e625 7e23d923
ffff8800941333c0 1727322997 S Bi:2:013:1 -115 16384 <
ffff8800941333c0 1727375527 C Bi:2:013:1 0 16384 = d900b000 17005500 6c008900 6c009200 93007000 9d004300 91008900 a000cc00
ffff8800941333c0 1727381885 S Bi:2:013:1 -115 16384 <
ffff8800941333c0 1727428114 C Bi:2:013:1 0 16384 = ac269926 69288c27 4c240628 9a25a525 3025da24 6a24dd28 2327f324 4427b026
ffff8800941333c0 1727433756 S Bi:2:013:1 -115 12800 <
ffff8800941333c0 1727467741 C Bi:2:013:1 0 12800 = cc28da25 1527dd26 be28a928 1128e528 82287429 fb27db27 d1298129 89270a28
ffff8800941333c0 1727471776 S Bi:2:013:1 -115 19968 <
ffff8800941333c0 1727533544 C Bi:2:013:1 0 19968 = b9261826 2623fa22 7e256626 ee25cc26 0225ba24 fa248124 d923ef23 5427ba25
ffff8800941333c0 1727539906 S Bi:2:013:1 -115 16384 <
ffff8800941333c0 1727576009 C Bi:2:013:1 0 16384 = 9d009e00 81008300 b700d000 a8005900 7a004e00 b3004f00 93003c00 88009000
ffff8800941333c0 1727584814 S Bi:2:013:1 -115 16384 <
ffff8800941333c0 1727628731 C Bi:2:013:1 0 16384 = a400df00 81008f00 9d00e900 83007200 83008300 85005e00 b000bd00 a0008300
ffff8800941333c0 1727629780 S Bi:2:013:1 -115 12800 <
ffff8800941333c0 1727674595 C Bi:2:013:1 0 12800 = 1123e623 01258723 ad231625 6a244223 58256725 b5232026 3324c525 ea243026
ffff8800941333c0 1727683841 S Bi:2:013:1 -115 19968 <
ffff8800941333c0 1727734010 C Bi:2:013:1 0 19968 = e628c428 9a267a25 9f27e926 16284628 45259a29 3228f129 1329ca27 98261c28
ffff8800941333c0 1727735787 S Bi:2:013:1 -115 16384 <
ffff8800941333c0 1727786808 C Bi:2:013:1 0 16384 = 5a241026 f022c824 55265825 f324c922 fb23ea24 7326b824 8c24ab23 6924c125
ffff8800941333c0 1727787829 S Bi:2:013:1 -115 16384 <
ffff8800941333c0 1727837680 C Bi:2:013:1 0 16384 = 85007c00 8000c000 b700ab00 5d00c000 7e009000 3a009d00 92008400 ac005800
ffff8800941333c0 1727839938 S Bi:2:013:1 -115 12800 <
ffff8800941333c0 1727875181 C Bi:2:013:1 0 12800 = a0007000 a7005a00 5a005d00 94007300 85006d00 4a00c100 cd00e500 9500c800
ffff8800941333c0 1727877775 S Bi:2:013:1 -115 19968 <
ffff8800941333c0 1727942895 C Bi:2:013:1 0 19968 = ea0bbb0a c6046c01 1201a700 af009900 8a008d00 6a00bc00 b300da00 9f005c00
ffff8800941333c0 1727945870 S Bi:2:013:1 -115 16384 <
ffff8800941333c0 1727995648 C Bi:2:013:1 0 16384 = d0040a03 55047306 7b086907 cc060a05 b704ff05 6308f307 9305d107 2b08ff07
ffff8800941333c0 1727997860 S Bi:2:013:1 -115 16384 <
ffff8800941333c0 1728048258 C Bi:2:013:1 0 16384 = 0301d100 a400ac00 b300a800 a900cb00 d600e300 e600bd00 d9008b00 b000d300
ffff8800941333c0 1728049834 S Bi:2:013:1 -115 12800 <
ffff8800941333c0 1728084070 C Bi:2:013:1 0 12800 = 7e00c100 69006200 c4006e00 89009600 ba005b00 c1008b00 be005000 df006d00
ffff8800941333c0 1728087782 S Bi:2:013:1 -115 19968 <
ffff8800941333c0 1728149795 C Bi:2:013:1 0 19968 = 66006a00 7e005600 6c008e00 64009900 d4006d00 9f008200 58006b00 76000101
ffff8800941333c0 1728155934 S Bi:2:013:1 -115 16384 <
ffff8800941333c0 1728202549 C Bi:2:013:1 0 16384 = 8c002f00 80009d00 b2006d00 73007800 96006800 94005b00 7c006900 97009500
ffff8800941333c0 1728207840 S Bi:2:013:1 -115 16384 <
ffff8800941333c0 1728255173 C Bi:2:013:1 0 16384 = 47008100 80007000 a900c900 71007a00 9f009000 84006f00 7400ba00 80009c00
ffff8800941333c0 1728259878 S Bi:2:013:1 -115 12800 <
ffff8800941333c0 1728294657 C Bi:2:013:1 0 12800 = a8008d00 98008c00 a1009800 5c00f500 7f008300 4b00a900 7c004500 c300bc00
ffff8800941333c0 1728297734 S Bi:2:013:1 -115 8704 <
ffff8800941333c0 1728329913 C Bi:2:013:1 0 8704 = 85008100 a900c500 84000000 e700a400 81008100 71008c00 5900bf00 9500ea00
ffff8800941333c0 1728335764 S Bi:2:013:1 -115 512 <
ffff8800941333c0 1728335865 C Bi:2:013:1 0 272 = 7600b000 6500ab00 87006d00 03004b00 8200bb00 da006000 60005d00 ba006c00
ffff8800941333c0 1728338796 S Ci:2:013:0 s c0 0c 0084 48c8 0001 1 <
ffff8800941333c0 1728339164 C Ci:2:013:0 0 1 = 03
ffff8800941333c0 1728341874 S Ci:2:013:0 s c0 0c 0084 48c8 0001 1 <
ffff8800941333c0 1728342116 C Ci:2:013:0 0 1 = 00
