ffff880146a5bb00 3016407907 S Ci:2:003:0 s 80 06 0100 0000 0012 18 <
ffff880146a5bb00 3016408733 C Ci:2:003:0 0 18 = 12010002 ffffff40 e3054201 02030000 0001
ffff880146a5bb00 3016408757 S Ci:2:003:0 s 80 06 0200 0000 0009 9 <
ffff880146a5bb00 3016409082 C Ci:2:003:0 0 9 = 09022700 010100c0 05
ffff880146a5bb00 3016409088 S Ci:2:003:0 s 80 06 0200 0000 0027 39 <
ffff880146a5bb00 3016409457 C Ci:2:003:0 0 39 = 09022700 010100c0 05090400 0003ffff ff000705 81020002 00070502 02000200
ffff880146a5bc80 3026427724 S Co:2:002:0 s 23 03 0004 0005 0000 0
ffff880146a5bc80 3026427802 C Co:2:002:0 0 0
ffff880106a7d2c0 3026442999 S Ci:2:002:0 s a3 00 0000 0005 0004 4 <
ffff880106a7d2c0 3026443052 C Ci:2:002:0 0 4 = 03051000
ffff8801447998c0 3026444680 C Ii:2:002:1 0:2048 2 = 2000
ffff8801447998c0 3026444684 S Ii:2:002:1 -115:2048 2 <
ffff8801462bbd40 3026498979 S Co:2:002:0 s 23 01 0014 0005 0000 0
ffff8801462bbd40 3026499056 C Co:2:002:0 0 0
ffff8801462bbd40 3026499068 S Ci:2:000:0 s 80 06 0100 0000 0040 64 <
ffff8801462bbd40 3026499927 C Ci:2:000:0 0 18 = 12010002 ffffff40 e3054201 02030000 0001
ffff8801462bbd40 3026499973 S Co:2:002:0 s 23 03 0004 0005 0000 0
ffff8801462bbd40 3026500052 C Co:2:002:0 0 0
ffff880106a7d2c0 3026514981 S Ci:2:002:0 s a3 00 0000 0005 0004 4 <
ffff880106a7d2c0 3026515053 C Ci:2:002:0 0 4 = 03051000
ffff880106a7de00 3026570986 S Co:2:002:0 s 23 01 0014 0005 0000 0
ffff880106a7de00 3026571057 C Co:2:002:0 0 0
ffff880106a7de00 3026571093 S Co:2:000:0 s 00 05 0003 0000 0000 0
ffff880106a7de00 3026571431 C Co:2:000:0 0 0
ffff880106a7d2c0 3026590994 S Ci:2:003:0 s 80 06 0100 0000 0012 18 <
ffff880106a7d2c0 3026591806 C Ci:2:003:0 0 18 = 12010002 ffffff40 e3054201 02030000 0001
ffff880106a7d2c0 3026591853 S Ci:2:003:0 s 80 06 0200 0000 0027 39 <
ffff880106a7d2c0 3026592181 C Ci:2:003:0 0 39 = 09022700 010100c0 05090400 0003ffff ff000705 81020002 00070502 02000200
ffff880106a7d2c0 3026592228 S Co:2:003:0 s 00 09 0001 0000 0000 0
ffff880106a7d2c0 3026592555 C Co:2:003:0 0 0
ffff880110aefe40 3027525244 S Ci:2:003:0 s 80 06 0100 0000 0040 64 <
ffff880110aefe40 3027526095 C Ci:2:003:0 0 18 = 12010002 ffffff40 e3054201 02030000 0001
ffff880110aefe40 3027774193 S Ci:2:003:0 s 80 06 0100 0000 0012 18 <
ffff880110aefe40 3027774977 C Ci:2:003:0 0 18 = 12010002 ffffff40 e3054201 02030000 0001
ffff880110aefe40 3027781519 S Ci:2:003:0 s 80 06 0200 0000 0009 9 <
ffff880110aefe40 3027781721 C Ci:2:003:0 0 9 = 09022700 010100c0 05
ffff880110aefe40 3027790950 S Ci:2:003:0 s 80 06 0200 0000 00ff 255 <
ffff880110aefe40 3027791347 C Ci:2:003:0 0 39 = 09022700 010100c0 05090400 0003ffff ff000705 81020002 00070502 02000200
ffff880110aefe40 3027803926 S Ci:2:003:0 s 80 06 0100 0000 0012 18 <
ffff880110aefe40 3027804724 C Ci:2:003:0 0 18 = 12010002 ffffff40 e3054201 02030000 0001
ffff880110aefe40 3027810170 S Ci:2:003:0 s 80 06 0200 0000 0009 9 <
ffff880110aefe40 3027810477 C Ci:2:003:0 0 9 = 09022700 010100c0 05
ffff880110aefe40 3027814946 S Ci:2:003:0 s 80 06 0200 0000 0027 39 <
ffff880110aefe40 3027815226 C Ci:2:003:0 0 39 = 09022700 010100c0 05090400 0003ffff ff000705 81020002 00070502 02000200
