ffff88030dd55900 1286042524 S Co:1:016:0 s 40 0c 0087 0008 0001 1 = 04
ffff88030dd55900 1286043716 C Co:1:016:0 0 1 >
ffff88030dd55900 1286047079 S Co:1:016:0 s 40 0c 0087 0893 0001 1 = 04
ffff88030dd55900 1286048138 C Co:1:016:0 0 1 >
ffff88030dd55900 1286050597 S Co:1:016:0 s 40 0c 0088 0893 0001 1 = ff
ffff88030dd55900 1286051078 C Co:1:016:0 0 1 >
ffff88030dd55900 1286053357 S Co:1:016:0 s 40 0c 0088 0893 0001 1 = aa
ffff88030dd55900 1286054078 C Co:1:016:0 0 1 >
ffff88030dd55900 1286056510 S Co:1:016:0 s 40 0c 0088 0893 0001 1 = 55
ffff88030dd55900 1286057051 C Co:1:016:0 0 1 >
ffff88030dd55900 1286059460 S Co:1:016:0 s 40 0c 0088 0893 0001 1 = 00
ffff88030dd55900 1286060037 C Co:1:016:0 0 1 >
ffff88030dd55900 1286062582 S Co:1:016:0 s 40 0c 0088 0893 0001 1 = ff
ffff88030dd55900 1286063021 C Co:1:016:0 0 1 >
ffff88030bd5e180 1286065299 S Co:1:016:0 s 40 0c 0088 0893 0001 1 = 87
ffff88030bd5e180 1286066004 C Co:1:016:0 0 1 >
ffff88030bd5e180 1286068613 S Co:1:016:0 s 40 0c 0088 0893 0001 1 = 78
ffff88030bd5e180 1286069819 C Co:1:016:0 0 1 >
ffff88030bd5e180 1286072157 S Co:1:016:0 s 40 0c 0088 0893 0001 1 = 30
ffff88030bd5e180 1286072810 C Co:1:016:0 0 1 >
ffff88030bd5e180 1286103212 S Co:1:016:0 s 40 0c 0087 0893 0001 1 = 05
ffff88030bd5e180 1286104171 C Co:1:016:0 0 1 >
ffff88030bd5e180 1286107487 S Co:1:016:0 s 40 0c 0087 0893 0001 1 = 04
ffff88030bd5e180 1286108644 C Co:1:016:0 0 1 >
ffff88030bd5e180 1286110831 S Co:1:016:0 s 40 0c 0088 0893 0001 1 = ff
ffff88030bd5e180 1286111550 C Co:1:016:0 0 1 >
ffff88030bd5e180 1286114877 S Co:1:016:0 s 40 0c 0087 0893 0001 1 = 04
ffff88030bd5e180 1286115284 C Co:1:016:0 0 1 >
ffff88030bd5e180 1286117681 S Co:1:016:0 s 40 0c 0088 0893 0001 1 = ff
ffff88030bd5e180 1286118270 C Co:1:016:0 0 1 >
ffff88030bd5e180 1286120733 S Co:1:016:0 s 40 0c 0088 0893 0001 1 = aa
ffff88030bd5e180 1286121257 C Co:1:016:0 0 1 >
ffff88030bd5e180 1286123618 S Co:1:016:0 s 40 0c 0088 0893 0001 1 = 55
ffff88030bd5e180 1286124244 C Co:1:016:0 0 1 >
ffff88030bd5e180 1286126667 S Co:1:016:0 s 40 0c 0088 0893 0001 1 = 00
ffff88030bd5e180 1286127311 C Co:1:016:0 0 1 >
ffff88030bd5e180 1286129669 S Co:1:016:0 s 40 0c 0088 0893 0001 1 = ff
ffff88030bd5e180 1286130288 C Co:1:016:0 0 1 >
ffff88030bd5e180 1286132527 S Co:1:016:0 s 40 0c 0088 0893 0001 1 = 87
ffff88030bd5e180 1286133204 C Co:1:016:0 0 1 >
ffff88030bd5e180 1286135721 S Co:1:016:0 s 40 0c 0088 0893 0001 1 = 78
ffff88030bd5e180 1286136269 C Co:1:016:0 0 1 >
ffff88030bd5e180 1286138593 S Co:1:016:0 s 40 0c 0088 0893 0001 1 = 30
ffff88030bd5e180 1286139245 C Co:1:016:0 0 1 >
ffff88030bd5e180 1286169499 S Co:1:016:0 s 40 0c 0087 0893 0001 1 = 05
ffff88030bd5e180 1286170607 C Co:1:016:0 0 1 >
ffff88030bd5e180 1286173740 S Co:1:016:0 s 40 0c 0087 0893 0001 1 = 04
ffff88030bd5e180 1286174267 C Co:1:016:0 0 1 >
ffff88030bd5e180 1286176472 S Co:1:016:0 s 40 0c 0088 0893 0001 1 = ff
ffff88030bd5e180 1286177253 C Co:1:016:0 0 1 >
ffff88030bd5e180 1286179499 S Co:1:016:0 s 40 0c 0088 0893 0001 1 = ff
ffff88030bd5e180 1286180251 C Co:1:016:0 0 1 >
ffff88030bd5e180 1286182474 S Co:1:016:0 s 40 0c 0088 0893 0001 1 = aa
ffff88030bd5e180 1286183235 C Co:1:016:0 0 1 >
ffff88030bd5e180 1286185457 S Co:1:016:0 s 40 0c 0088 0893 0001 1 = 55
ffff88030bd5e180 1286186221 C Co:1:016:0 0 1 >
ffff88030bd5e180 1286188522 S Co:1:016:0 s 40 0c 0088 0893 0001 1 = 00
ffff88030bd5e180 1286189274 C Co:1:016:0 0 1 >
ffff88030bd5e180 1286191448 S Co:1:016:0 s 40 0c 0088 0893 0001 1 = ff
ffff88030bd5e180 1286192250 C Co:1:016:0 0 1 >
ffff88030bd5e180 1286194417 S Co:1:016:0 s 40 0c 0088 0893 0001 1 = 87
ffff88030bd5e180 1286195239 C Co:1:016:0 0 1 >
ffff88030bd5e180 1286197402 S Co:1:016:0 s 40 0c 0088 0893 0001 1 = 78
ffff88030bd5e180 1286198224 C Co:1:016:0 0 1 >
ffff88030bd5e180 1286200387 S Co:1:016:0 s 40 0c 0088 0893 0001 1 = 00
ffff88030bd5e180 1286201265 C Co:1:016:0 0 1 >
ffff88030bd5e180 1286231465 S Co:1:016:0 s 40 0c 0087 0893 0001 1 = 05
ffff88030bd5e180 1286232520 C Co:1:016:0 0 1 >
ffff88030bd5e180 1286235744 S Co:1:016:0 s 40 0c 0087 0893 0001 1 = 04
ffff88030bd5e180 1286236239 C Co:1:016:0 0 1 >
ffff88030bd5e180 1286238408 S Co:1:016:0 s 40 0c 0088 0893 0001 1 = ff
ffff88030bd5e180 1286239237 C Co:1:016:0 0 1 >
ffff88030bd5e180 1286241484 S Co:1:016:0 s 40 0c 0088 9670 0001 1 = ff
ffff88030bd5e180 1286242215 C Co:1:016:0 0 1 >
ffff88030bd5e180 1286244412 S Co:1:016:0 s 40 0c 0088 9670 0001 1 = aa
ffff88030bd5e180 1286245208 C Co:1:016:0 0 1 >
ffff88030bd5e180 1286247505 S Co:1:016:0 s 40 0c 0088 9670 0001 1 = 55
ffff88030bd5e180 1286248280 C Co:1:016:0 0 1 >
ffff88030bd5e180 1286250492 S Co:1:016:0 s 40 0c 0088 9670 0001 1 = 00
ffff88030bd5e180 1286251253 C Co:1:016:0 0 1 >
ffff88030bd5e180 1286253518 S Co:1:016:0 s 40 0c 0088 9670 0001 1 = ff
ffff88030bd5e180 1286254231 C Co:1:016:0 0 1 >
ffff88030bd5e180 1286256443 S Co:1:016:0 s 40 0c 0088 9670 0001 1 = 87
ffff88030bd5e180 1286257321 C Co:1:016:0 0 1 >
ffff88030bd5e180 1286259548 S Co:1:016:0 s 40 0c 0088 9670 0001 1 = 78
ffff88030bd5e180 1286260216 C Co:1:016:0 0 1 >
ffff88030bd5e180 1286262443 S Co:1:016:0 s 40 0c 0088 9670 0001 1 = e0
ffff88030bd5e180 1286263131 C Co:1:016:0 0 1 >
ffff88030bd5e180 1286293552 S Co:1:016:0 s 40 0c 0087 9670 0001 1 = 05
ffff88030bd5e180 1286294490 C Co:1:016:0 0 1 >
ffff88030bd5e180 1286297871 S Co:1:016:0 s 40 0c 0087 9670 0001 1 = 04
ffff88030bd5e180 1286298965 C Co:1:016:0 0 1 >
ffff88030bd5e180 1286301374 S Co:1:016:0 s 40 0c 0088 9670 0001 1 = ff
ffff88030bd5e180 1286301942 C Co:1:016:0 0 1 >
ffff88030bd5e180 1286304338 S Co:1:016:0 s 40 0c 0085 0001 0001 1 = 12
ffff88030bd5e180 1286304929 C Co:1:016:0 0 1 >
ffff88030bd5e180 1286307343 S Co:1:016:0 s 40 0c 0085 0001 0001 1 = 00
ffff88030bd5e180 1286307917 C Co:1:016:0 0 1 >
ffff88030bd5e180 1286310409 S Co:1:016:0 s 40 0c 0085 0001 0001 1 = 00
ffff88030bd5e180 1286311000 C Co:1:016:0 0 1 >
ffff88030bd5e180 1286313364 S Co:1:016:0 s 40 0c 0085 0001 0001 1 = 00
ffff88030bd5e180 1286313960 C Co:1:016:0 0 1 >
ffff88030bd5e180 1286316290 S Co:1:016:0 s 40 0c 0085 0001 0001 1 = 84
ffff88030bd5e180 1286316959 C Co:1:016:0 0 1 >
ffff88030bd5e180 1286319315 S Co:1:016:0 s 40 0c 0085 0001 0001 1 = 00
ffff88030bd5e180 1286319942 C Co:1:016:0 0 1 >
ffff88030bd5e180 1286322232 S Ci:1:016:0 s c0 0c 0084 faf8 0001 1 <
ffff88030bd5e180 1286322805 C Ci:1:016:0 0 1 = 01
ffff88030bd5e180 1286325147 S Co:1:016:0 s 40 04 0082 00a4 0008 8 = 00000000 00840000
ffff88030bd5e180 1286325711 C Co:1:016:0 0 8 >
ffff88030bd5e180 1286325971 S Bi:1:016:1 -115 512 <
ffff88030bd5e180 1289326462 C Bi:1:016:1 -2 0
ffff88030bd5e180 1289326563 S Co:1:016:0 s 02 01 0000 0081 0000 0
ffff88030bd5e180 1289327713 C Co:1:016:0 0 0
